,Question,Answer
58,能否说明公司的院线扩张模式？,"公司与国内知名商业地产开发商、运营商建立了良好的合作关系，积极推动公司的全国布局，2016年新增影城超过100家。优质商业广场项目，可以保证影院获得足够良好的位置、规划、人群、消费氛围以及物业服务，公司与优秀商业地产开发商的良性互动合作为公司的跨区域拓展提供了强有力的支持，并为该等商业地产带来文化娱乐价值，为双方长期合作奠定了良好的基础。
标准化、可复制的投资建设模式是公司跨区域扩张能力的另一重要方面。公司拥有专门的影院建设团队，在影院项目投资建设的各个环节建立了一系列标准，包括对新建影院进行统一规划设计，工程物资和设备采购进行统一招投标，工程施工按照相关标准统一建设等，能严格保证公司旗下影院建设品质的一致性。
"
59,能否详细介绍一下公司非票房业务情况？,"2016年，公司成立万达传媒，并购时光网，布局游戏产业，大力拓展在广告传媒、电影整合营销、在线直播、衍生品、游戏产业等领域的业务，不断提升非票房收入，增强公司市场竞争力。此外，公司还同时启动网络院线、在线售票平台等方面建设工作，为公司持续发展奠定坚实基础。
2016年公司实现非票房收入39亿元，同比增长超过100%，非票房收入占营业收入比重达到35%，较2015年提升12个百分点，占比大幅提升，公司生态圈建设成效显著。
"
60,能否介绍去年董事、监事、高级管理人员变动及其原因？,公司去年共计有三位董事、监事或高级管理人员离任，分别为：1、叶宁，曾任公司董事，于2016年02月15日因个人原因辞去董事职务；2、许承宁，曾任公司副总裁、财务负责人，于2016年02月15日因工作变动原因不再担任公司副总裁、财务负责人职务；3、贾小鹏，曾任职工代表监事，于2016年08月28日因个人原因辞去职工代表监事职务。
61,请介绍公司为加强消费者服务采取的措施？,尊敬的投资者您好！公司秉承“一切以观众的观影体验、观影价值为核心追求”的服务经营理念，努力将服务文化贯彻到管理机制和团队建设中。公司始终将为顾客服务放在经营工作的第一位，推行院线服务于影院，影院管理团队服务于一线员工，一线员工服务于观众的服务理念。公司建立了培训和督导体系、现场追踪和监督体系、反馈调研和评价体系，实现营运服务品质闭环管理。为确保为观众提供高品质的观影服务，公司推行以“顾客满意度”为评价中心的管理绩效评价体系，通过增加神秘访客机制，结合第三方满意度调研，不断提高服务标准和质量。
62,请介绍公司对已并购企业的整合情况？,您好！2016年，公司在积极拓展新业务、加强业务创新的同时，对已并购企业实施了有效整合，最大限度发挥并购企业与公司既有业务之间的协同效应，促进了并购企业的快速扩张与发展，取得了良好的经济效益。其中澳洲Hoyts公司通过新建影城、影城改造等多种方式，实现净利润同比增长76%，市场占有率稳步提升；影时尚全面整合公司媒体资源，净利润同比增长52%，全年新增客户194个，相当于其过去7年累计客户的70%。
63,万达传媒和万达游戏，后面会有机会注入到万达院线的上市公司吗,您好，万达传媒为公司的全资子公司。游戏产业未来会会随着重组进入上市公司体内。谢谢。
64,请介绍公司去年的影院数量增长情况？,"尊敬的投资者您好！为加快公司发展，提升市场份额，2016年公司加快影城发展力度，全年新增影城超过100家，新增银幕同比提升40%。截至2016年12月31日，公司拥有影城401家，银幕3564块。
2016年，万达商业地产通过自建、合作等方式，加大万达广场开发力度，全年新建万达广场超过50个；同时，公司已与多家商业地产商签署战略合作协议，加快非万达广场发展数量，有力保障了公司终端的快速扩张。
谢谢！
"
65,公司如何看待行业发展对竞争格局的影响？,投资者您好！国内电影市场增速放缓促使院线行业开始出现分化，2016年行业出现大规模并购整合，并购数量、金额达历史新高。随着院线行业并购整合进程加快，将进一步提升行业集中度，强化行业龙头领军的局面。
66,能否简要介绍公司去年收购时光网的经营情况？,"尊敬的投资者您好，公司于2016年12月01日取得时光网100%股权，购买日至2016年12月31日，该公司营收为58,739,163.51元，净利润11,067,955.92元。"
67,请问公司目前拥有的影城中依附在万达商圈体系内的比例大概是多少？新增影城是否还是资产连接型，对于选址有什么要求？,投资者您好，公司租赁万达广场物业影城数量约在50%以上。公司下属影城主要为资产连接型，公司有较为完善的选址标准来进行决策。
68,公司非票收入的毛利率分别有怎样的展望？按广告，卖品，电影投资等等来分,公司会努力提高非票房收入占比，通过规模效应和资源整合降低相关成本，提高非票房收入毛利占比。
69,公司管理层如何定义万达院线的核心竞争力？,您好！公司借助国内电影市场蓬勃发展的契机，打造“万达院线”、“万达电影城”品牌，成为行业龙头并拥有较高的市场声誉。公司秉承可持续发展的科学经营理念，依托于快速的跨区域扩张能力、超强的连锁经营能力、持续的创新经营能力、领先的放映工艺技术、高品质的观影服务，构筑起公司的核心竞争力。谢谢。
70,贵公司的官网也是基本上不更新消息的，很多东西作为投资者很难了解公司的发展，是否能维护好官网的消息同步？,您好。公司将加强官网的维护，感谢您的建议。
71,请问万达院线和万达院线游戏是什么关系，万达院线游戏是万达院线子公司吗,您好，万达院线游戏目前未在上市公司体内。
72,Imax和Dolby未来的布局计划？,您好。公司与IMAX和杜比公司分别签署了战略合作协议，公司将按照协议计划推进与IMAX及杜比在下属影城的布局。谢谢。
73,前期看到万达院线改名万达电影公告，不知道有考虑过别的如万达娱乐等更名,您好，公司更名是考虑公司未来发展战略情况下做出的决定，目前并未有其他更名计划。
74,请问公司网络院线目前进展如何，计划什么时候上线？谢谢！,您好，网络院线工作在积极筹备中，前期工作较为复杂，预计将在年内推出，谢谢。
75,刘总好，年报中说今年计划新增100-150家影院，目前看到一季度只增加了4家影院，进度有些慢，请问今年是否能够完成计划？,您好。公司影院受商业地产建设周期影响，开业时间主要集中在下半年。公司已有详细的开业时间计划，确保公司完成年度开业目标。谢谢。
76,深交所互动易上回答投资者问题是否能每个星期答复一次？贵公司给人的感觉是从来不在乎投资者，上面的问题是N久都没人答复的？,谢谢您的建议，我们会尽快改进。
77,公司2017年的经营业绩目标是多少？,您好！公司将加快影院发展速度，通过新建、收购、合作等多种方式增加影城数量，进一步提高城市覆盖率和市场份额。同时，公司将继续打通上下游业务，实现全产业链发展。公司将不断完善电影生态圈，持续创新经营，将公司打造成为平台型、生态型的娱乐公司。谢谢。
78,万达影视去年中止注入院线。今年或后期会重新开启吗？,您好，公司不排除未来合适时机，基于股东利益最大化的原则，重新探讨与标的公司间的整合。
79,公司管理层如何看待市值管理？,尊敬的投资者您好，本公司致力于维护广大股东的权益和促进公司的长远发展，本公司管理层也十分重视公司的市值管理，但市值管理并非一蹴而就的工作，我们会慎重的根据公司的实际情况制定相关措施做好市值管理。同时，我们将会根据公司的发展战略及公司的实际情况制定切实可行的阶段发展目标。
80,大股东的减持计划有吗？,尊敬的投资者您好，公司已经在《2016年年度报告全文》“第五节重要事项”中披露了股东关于股份锁定的承诺以及股东持股意向及减持意向，本公司将会按照相关法律法规的要求履行信息披露义务，及时发布股东减持计划公告。
81,公司如何加强与投资者的沟通？,尊敬的投资者您好，2017年，本公司将继续严格按照国家相关法律法规，规范公司内部治理结构和履行信息披露义务。逐步建立和健全投资者沟通平台，规范公司与投资者关系的管理工作，加强公司与投资者和潜在投资者之间的沟通，增进投资者对公司的了解和认同，建立公司与投资者之间长期、稳定的良好关系，从而提升公司的美誉度、核心竞争能力和持续发展能力，以实现公司价值和股东权益的双赢。
82,别家公司都在交易者平台公布股东人数，为啥贵公司就把这个当做这么难回答的问题呢？,"截至2016年12月31日，股东人数为98,963人。"
83,看报表，万达院线的影院都是租赁的，非自有资产？是租赁万达广场自己的，还是和其他开发商合作？比例是多少？,您好。根据影视行业惯例，影院均为租赁取得，公司旗下影院有租赁万达广场物业，也有其他商业广场。公司租赁万达广场的影院数量占比在50%以上。
84,恭喜万达院线收盘创两年新低。,尊敬的投资者您好，股价波动受二级市场多种因素的影响，属于市场行为，无法准确预测，公司将努力提升经营业绩，优化投资者回报，不断增强公司长期价值投资的吸引力。
85,曾总裁你好，请问公司股价波动如此巨大，股民损失惨重，公司近期是否有针对性措施和方案。,尊敬的投资者您好，股价波动受二级市场多种因素的影响，属于市场行为，无法准确预测，公司将努力提升经营业绩，优化投资者回报，不断增强公司长期价值投资的吸引力。
86,公司管理层觉得贵公司现在这个价位有没有低估?我们还能不能持有了?,尊敬的投资者您好，股价波动受二级市场多种因素的影响，属于市场行为，无法准确预测，公司将努力提升经营业绩，优化投资者回报，不断增强公司长期价值投资的吸引力。
87,开始回答问题了吗？,已经开始。
88,万达作为电影产业中的龙头影院，为什么你们的股价跌跌不休呢？,尊敬的投资者您好，股价波动受二级市场多种因素的影响，属于市场行为，无法准确预测，公司将努力提升经营业绩，优化投资者回报，不断增强公司长期价值投资的吸引力。
89,关于公司股票股价一直跌跌不休，公司是否有什么计划呢 ？,尊敬的投资者您好，股价波动受二级市场多种因素的影响，属于市场行为，无法准确预测，公司将努力提升经营业绩，优化投资者回报，不断增强公司长期价值投资的吸引力。
90,贵公司市值不断缩水，贵公司一直强调自己是优秀上市公司，但从来没有市值管理？,尊敬的投资者您好，本公司致力于维护广大股东的权益和促进公司的长远发展，本公司管理层也十分重视公司的市值管理，但市值管理并非一蹴而就的工作，我们会慎重的根据公司的实际情况制定相关措施做好市值管理。同时，我们将会根据公司的发展战略及公司的实际情况制定切实可行的阶段发展目标。
91,请问公司准备什么时候推出网络院线？ 已经晚了半年了，是否应该给个准确的说法？,您好。网络院线前期工作量较大，预计将在年内推出，谢谢。
92,收购澳洲HOYTS后，公司具体有哪些举措使得澳洲院线的净利润大幅提升？2017年是否会有持续改善？,"通过影院改造，新建影城，创新管理方式以及优化债务结构等方面提高了澳洲院线净利水平，2017年公司将继续努力，提高澳洲院线盈利水平。谢谢！
"
93,今天市场传言影视娱乐类再融资、并购重组或全面叫停。请问公司今年在这方面计划是怎样的？该政策是否会影响公司的计划？,2017年，公司实现电影全产业链发展、不断完善电影生态圈的战略将继续推进，公司成为平台型、生态型的娱乐公司的战略方向不会改变。公司将继续按照既定目标推进产业整合，坚持内生式成长和外延式扩张并举的发展战略，不断推动公司持续发展。
94,网上院线本来计划是去年底建成，但至今没有公告成立？请问时候有具体安排？,您好。网络院线涉及工作量较大，前期准备工作较为复杂，为保证公司利益，公司稳步推进相关工作进度，预计年内推出。谢谢
95,请问公司是否有什么消息没有公布？为啥股票一直跌个不停，买进一年来一深套了，什么时候中止的资产注入会重启？谢谢,尊敬的投资者您好，公司一直按照深交所的要求对相关信息进行披露。对于中止的资产注入，公司不排除未来合适时机，基于股东利益最大化的原则，重新探讨与标的公司间的整合。
96,据说万达院线拿到了4%的山东影视的股权，是不是真的？为什么公司没有公告？,您好。该事项属实，但因未达到公司信息披露标准，因此未披露。谢谢。
97,16年管理费用率偏高的原因是什么？,管理费用较上年增长69.26%，主要系公司经营规模不断扩大所致。
98,请问王总，“其他”这一块的收入占比提高不少，能详细说明一下吗？,公司致力于打造电影生活生态圈，努力提高非票房收入，2016年除了广告收入大幅提高外，场地租赁、系统服务费、电影整合营销等方面也取得了较大增长。谢谢！
99,华谊今年的业绩有些差强人意，整个电影产业现在都已经在一个分水岭了，势必有些投资人会选择离开这个领域，作为股东，我希望公司能加快收购并购的步伐，加强院线的布局。毕竟现在的成本和难度相对会小些。还是期待在下一个周期里，公司在传媒领域的影响力。另外如果确实要改命万达电影。请注重IP 的价值,您好。感谢您的建议，中国电影市场一直保持稳定增长，万达院线上市后不断通过并购等方式加快公司发展，提升公司市场竞争力，公司未来仍将保持快速发展，努力打通产业上下游，建立电影生活生态圈。谢谢。
