,Question,Answer
0,各位管理层大家好，有几个问题想请教一下：1. 公司2017到19年预计每年新建多少影院？单影院屏幕数会维持在8-9屏吗？2. 租金和劳动成本占票房收入的比例预计会增加还是下降？3. 管理费用和销售费用占营业收入的比例会怎样变化？4. 未来3年的增长点是否依然是广告业务？预计17年会有多少增长？谢谢,您好，公司2017-2019年预计每年新增影城在100家以上。单影院银幕与现有规模基本持平。公司整体毛利率水平将保持稳定，广告业务仍会保持相对较快的增长速度。
1,公司在2016年非票房收入同比增幅大，有128.45%的幅度，商品销售与广告均有大幅增加。预计2017年非票收入的增长情况如何，占收入比是否会继续提高？,您好。公司2017年预计非票房收入仍将保持增长，进一步提升非票房收入占比。
2,去年四季度费用大增是特殊情况吗？,您好。公司新开业影城主要集中在四季度，相关费用较高，公司四季度并购了时光网，增加了相应的管理费用。依据公司的业务模式，四季度通常营销费用较高。
3,网络院线建设到底到什么程度了？还在研发，完成80%研发进度了，还是已经内部测试了？能不能有个具体数字，不要总是模糊不清的积极推进中这种含糊的话,您好，网络院线工作目前在积极推进中，预计将在年内推出。
4,请介绍公司2016年年度权益分配预案？,"您好。公司2016年度利润分配预案为：以现有公司总股本1,174,294,974股为基数，每10股派发现金股利2元（含税），合计派发现金股利234,858,994.80元（含税），不以资本公积金转增股本，不送红股。"
5,能否详细介绍一下公司非票房业务情况？,您好。2016年，公司成立万达传媒，并购时光网，布局游戏产业，大力拓展在广告传媒、电影整合营销、在线直播、衍生品、游戏产业等领域的业务，不断提升非票房收入，增强公司市场竞争力。此外，公司还同时启动网络院线、在线售票平台等方面建设工作。
6,感谢各位公司高管2小时的解疑答惑。谢谢你们。希望万达院线有美好的未来。,您好，感谢广大股东对公司的支持，公司将继续加快发展，完善电影生活生态圈布局，增加非票房收入，提升公司经营能力及市场竞争力。
7,请解释公司2016年财务费用增长的原因？,您好！公司2016年销售、管理及财务费用增长的原因分别为：1、销售费用较上年增长83.96%，主要系收购公司增加导致收入结构发生变化，销售费用占比提高；2、管理费用较上年增长69.26%，主要系公司经营规模不断扩大所致；3、财务费用较上年增长220.58%，主要系收购的 Hoyts 公司银行借款利息费用所致。
8,公司享有的税收优惠？,您好，公司按照国家相关相关政策，部分业务和下属影城享受增值税和所得税的税收优惠，详细信息请参见本公司于巨潮资讯网上刊登的《2016年年度报告》。
9,"希望网络院线能做好，未来移动端得发展也很重要。
有创新，有新意，但如果和现有得其它视频网站有重叠得业务也没事，如果能做的更好得话。
刚开始视频网站只有优酷土豆，算是统治力了，但后续又有了很多别的，百花齐放，各有所长，没有永远的王者，只有对服务、内容和创新得不断追求。
也就是，做得好，掀翻现有得也有可能，做不好，被掀翻。",您好，感谢您的建议，公司将尽快推出网络院线，为公司拓展新的业务领域。
10,最近线上电影发展较快，公司的线上院线从去年开始布置，最近很少听到消息，是否遇到相关政策阻碍？能否介绍下线上院线的项目进展？,您好，公司网络院线业务在积极推进过程中，预计将在年内推出。
11,请介绍公司对已并购企业的整合情况？,您好！2016年，公司在积极拓展新业务、加强业务创新的同时，对已并购企业实施了有效整合，最大限度发挥并购企业与公司既有业务之间的协同效应，促进了并购企业的快速扩张与发展，取得了良好的经济效益。其中澳洲Hoyts公司通过新建影城、影城改造等多种方式，实现净利润同比增长76%，市场占有率稳步提升；影时尚全面整合公司媒体资源，净利润同比增长52%，全年新增客户194个，相当于其过去7年累计客户的70%。
12,能否说明公司的院线扩张模式？,您好！公司与国内知名商业地产开发商、运营商建立了良好的合作关系，积极推动公司的全国布局，2016年新增影城超过100家。优质商业广场项目，可以保证影院获得足够良好的位置、规划、人群、消费氛围以及物业服务，公司与优秀商业地产开发商的良性互动合作为公司的跨区域拓展提供了强有力的支持，并为该等商业地产带来文化娱乐价值，为双方长期合作奠定了良好的基础。
13,大宗交易源源不断了，是否真的有什么消息是没有公布的？,您好，公司严格信息披露制度进行信息披露，没有应披露而未披露的信息，谢谢。
14,请问公司商誉80多亿，近期是否有减值风险？,公司一直关注收购公司的业务整合和经营情况，近期无减值风险。谢谢！
15,您好。请问:作为万达集团下万达置业回归A股后，是否会对万达院线有一定的影响。国家现在都是集团合并比如南北车。不知道万达院线以后是否会并入万达置业乃至万达集团整体上市。,您好。万达地产与公司属于不同行业，其上市不会对公司产生影响。
16,电影行业去年以来出现同比增速放缓甚至下滑趋势，请问公司将采取哪些措施应对这种局面？,公司借助国内电影市场蓬勃发展的契机，打造“万达院线”、“万达电影城”品牌，成为行业龙头并拥有较高的市场声誉。公司秉承可持续发展的科学经营理念，依托于快速的跨区域扩张能力、超强的连锁经营能力、持续的创新经营能力、领先的放映工艺技术、高品质的观影服务，构筑起公司的核心竞争力。公司将利用上述核心竞争力应对上述局面。
17,请问公司目前拥有的影城中依附在万达商圈体系内的比例大概是多少？新增影城是否还是资产连接型，对于选址有什么要求？,您好。公司租赁万达广场物业的影城数量在50%以上，公司旗下影城主要以资产连接性为主，有完善的选址标准来进行新建影城决策，谢谢。
18,能具体描述下39亿非票房收入和占比35%的组成吗？分产品收入算的话，除去放映收入不足这个数字，能详细解释一下吗？,非票房收入包含卖品收入、广告收入、阵地收入、系统服务费等收入。谢谢！ 
19,请问2017年公司有大收购计划吗？2017年预留收购的资金／capex大约是多少?,您好，请您关注公司公告。
20,2016年公司国内单银幕产出下降近30%，请问今年是否会继续下降？,您好。在2016年度中国电影市场增速放缓的情况下，单银幕产出有所下降，相信未来在电影市场回暖后，单银幕产出将保持稳定。
21,王总，收购澳洲院线后，公司做了哪些举措使得2016年澳洲净利水平大幅提升？2017年改善幅度如何？,通过影院改造，新建影城，创新管理方式以及优化债务结构等方面提高了澳洲院线净利水平，2017年公司将继续努力，提高澳洲院线盈利水平。谢谢！ 
22,请问以后万达院线是否会考虑员工持股计划？,您好，公司将会根据公司实际经营情况，在法律法规规定范围内，推出相关激励政策。
23,Hoyts 去年管理费用率是多少？,澳洲院线2016年管理费用总额为2.69亿元人民币。谢谢！
24,公司2017年归母净利率由14.82%下降至12.19%，主要原因是什么？,主要原因为2016年国内票房市场整体放缓，单银幕产出有所下降导致。谢谢！
25,2016年公司单银幕产出同比下降较多，今年是否依然会呈下降趋势？,您好。2016年受国内电影市场票房增速放缓影响，单银幕产出有所下降，相信未来随着电影市场的逐步回暖，单银幕产出将会保持稳定。
26,前期看到万达院线改名万达电影公告，不知道有考虑过别的如万达娱乐等更名,您好，更名与公司未来发展战略有关，目前暂无下一步更名计划。
27,电影院线行业整体处于增势放缓，甚至有下降趋势，请问贵公司将有什么新的利润增长点以支撑这么高的市值？,公司借助国内电影市场蓬勃发展的契机，打造“万达院线”、“万达电影城”品牌，成为行业龙头并拥有较高的市场声誉。公司秉承可持续发展的科学经营理念，依托于快速的跨区域扩张能力、超强的连锁经营能力、持续的创新经营能力、领先的放映工艺技术、高品质的观影服务，构筑起公司的核心竞争力。
28,万达集团是否有意向把美国、欧洲的影院注入到上市公司？,您好。公司不了解万达集团的相关战略规划。
29,大宗不断减持是否意味着公司成长性对大股东已经没有吸引力？,您好。公司大股东尚未到股票解禁期，不存在减持情况，谢谢。
30,目前的上市公司里面优秀的上市公司很多，不知道万达院线算不算优秀的上市公司，如果算为什么别的上市公司可以市值不缩水，唯独万达院线缩水一年半？,股价波动受二级市场多种因素的影响，属于市场行为，无法准确预测，公司将努力提升经营业绩，优化投资者回报，不断增强公司长期价值投资的吸引力。
31,能否简要介绍公司去年收购时光网的经营情况？,"公司于2016年12月01日取得时光网100%股权，购买日至2016年12月31日，该公司营收为58,739,163.51元，净利润11,067,955.92元。"
32,公司2017年业绩具体目标能透露下吗？,您好，公司2017年度业绩目标为保持业绩稳定增长。
33,请问今年是否重启万达影视并购流程？,不排除未来合适时机，基于股东利益最大化的原则，重新探讨与标的公司间的整合。
34,请问万达院线从万达影视注入中止后股票价格一路下跌。大宗交易减持不断。公司股价下跌幅度排进A股后20。不知道公司后期有什么对策。,股价波动受二级市场多种因素的影响，属于市场行为，无法准确预测，公司将努力提升经营业绩，优化投资者回报，不断增强公司长期价值投资的吸引力。
35,IMAX 和 Dolby 影厅的未来两三年内的计划？新建影院中更偏向于选择建哪种厅？,"万达电影院线股份有限公司（以下简称“公司”）于2016年1月27日与杜比实验室国际技术服务（北京）有限公司（以下简称“杜比公司”）签署了《有关Dolby Cinema™的主许可及服务协议》。公司与杜比公司将开展战略合作，即未来5年将在中国开设100家杜比影院（Dolby Cinema）。
万达电影院线股份有限公司（以下简称“公司”）于2016 年8 月 1日与IMAX中国（香港）有限公司、爱麦克斯（上海）多媒体技术有限公司（以下合称“IMAX公司”）就租赁IMAX影院系统和特定商标的许可签署协议。公司与IMAX公司约定，将在2022年12月31日前新增150家IMAX影院的开发和运营。"
36,请简要介绍下，公司单个影院项目从进场装修到开业运营，周期要多长时间，谢谢！,您好，从进场装修到影院开业，大概需要6个月时间左右。谢谢。
37,请问公司澳洲子公司2016年的财务状况如何？,"您好，2016年，公司子公司HG Holdco Pty Ltd.实现营收2,689,363,661.01元人民币，实现净利润243,449,806.59元人民币，截至2016年底总资产为5,720,571,162.46元人民币。谢谢。"
38,请问万达院线游戏什么时候计划装到上市公司？,视其运行情况，并请关注公司公告。
39,请介绍一下向张龙等发行股份购买资产并募集配套资金的募集资金使用情况？,"根据中国证券监督管理委员会《关于核准万达电影院线股份有限公司向张龙等发行股份购买资产并募集配套资金的批复》（证监许可[2015]2438号），公司于2015年12月21日向北京万达文化产业集团有限公司非公开发行人民币普通股A股29,443,544股，每股面值人民币1.00元，每股发行价格为人民币74.04元，募集资金总额人民币2,173,999,997.76元，扣除发行费用人民币7,620,294.97元，实际募集资金净额为人民币2,172,379,702.79元。
根据公司《发行股份及支付现金购买资产并募集配套资金暨关联交易预案》披露的募集资金用途，发行所募集资金计划用于收购慕威时尚股权的现金对价部分，影院建设和补充流动资金。该项目计划在2016年内完成，计划投资总额为218,000万元，其中募集资金投资额为218,000万元。截至2016年12月31日，公司已经累计使用公开发行募集资金162,926.63万元，募集资金专户累计利息收入净额985.56万元，尚未使用募集资金余额55,296.90万元；公司2016年12月31日募集资金专户余额合计为15,296.90万元，与尚未使用的募集资金余额的差异40,000万元，系因公司期末用闲置募集资金购买40,000万元银行保本理财产品所致。
详细数据，可参阅本公司在巨潮资讯网上刊登的《2016年年度报告》和《董事会关于2016年度募集资金年度存放与实际使用情况的专项报告》
"
40,公司享有哪些政府补助？,"公司享有的政府补助主要包括电影专项资金返还、财政扶持资金和数字机补贴款等，2016年，上述政府补助合计248,433,063.41元，具体信息请参见本公司于巨潮资讯网上刊登的《2016年年度报告》。"
41,请解释2016年公司资产构成重大变动的原因？,2016年公司资产构成重大变动及原因包括：1、货币资金较上年减少了42.62%，主要由于新建影城、收购影城、时光网及Propaganda GEM Ltd. 及偿还贷款所致；2、应收账款较上年增加了79.96%，主要原因为收入规模增大，且年底未到结算期所致；3、存货较上年增长了93.62%，主要原因为主要原因为（1）2016 年自建和收购影城数量不断增加（2）因收购增加时光网库存电影衍生品所致；4、固定资产较上年增长了31.86%，主要原因为新建影城、收购影城、时光网及Propaganda GEM Ltd.；5、在建工程较上年增长了89.38%，主要因为报告期收购时光网，其正在建设的系统平台导致公司在建工程有所增加；6、短期借款增加主要为报告期内新增借款。
42,请简要介绍公司与各类商业地产商的合作？,您好！2016年，万达商业地产通过自建、合作等方式，加大万达广场开发力度，全年新建万达广场超过50个；同时，公司已与多家商业地产商签署战略合作协议，加快非万达广场发展数量，有力保障了公司终端的快速扩张。谢谢
43,请解释公司2016年费用增长的原因？,"公司2016年销售、管理及财务费用增长的原因分别为：1、销售费用较上年增长83.96%，主要系收购公司增加导致收入结构发生变化，销售费用占比提高；2、管理费用较上年增长69.26%，主要系公司经营规模不断扩大所致；3、财务费用较上年增长220.58%，主要系收购的 Hoyts 公司银行借款利息费用所致。
谢谢！
"
44,公司如何看待行业发展对竞争格局的影响？,"国内电影市场增速放缓促使院线行业开始出现分化，2016年行业出现大规模并购整合，并购数量、金额达历史新高。随着院线行业并购整合进程加快，将进一步提升行业集中度，强化行业龙头领军的局面。
谢谢！
"
45,"对了，刚看到公司会员想起来了
万达电影得app和这么庞大得会员，是不是可以在这个app上有更多得潜力可挖？
实事求是得讲，买票得整体环节还不错。但其余的功能，如果以霸主级别得社交app来比较，真的差得超级多，无论是体验和功能还有看上去得感觉。
这么说是因为8000万会员，万达得体系和资金，可以说是霸主级别得了，但这个app目前购票之外得体验，还不行，配不上，真的可以发掘，或者自己做不好交给能做好得工作室做，没必要非得自己做。这不也是互利共赢和更加得灵活有创造力吗？",您好。感谢您的建议，公司正积极改进APP相关功能，预计将推出全新体验的6.0版本，为广大会员带来更好的消费体验。谢谢。
46,请简要介绍公司去年的主要市场占有率、市场地位、观影人次？,您好！报告期内，公司实现票房76亿元，同比增长20.5%，观影人次1.84亿人次，同比增长22%。其中，国内票房62亿元，观影人次1.64亿人次，境外票房14亿元，观影人次2020万人次，国内票房市场占有率13.6%，澳洲票房市场占有率20%。截止2016年底，公司共拥有影院401家、3564块银幕，其中国内影院348家，3127块银幕，境外影院53家，437块银幕。公司票房、观影人次、市场份额已连续八年位居国内首位。
47,请问建好一个影城大约需要多少资金，去年开了100家这个成本大约是多少？,公司建设一家影城成本约在2000-2500万人民币左右。谢谢！
48,您好。请问:作为万达集团下万达置业回归A股后，是否会对万达院线有一定的影响。国家现在都是集团合并比如南北车。不知道万达院线以后是否会并入万达置业乃至万达集团整体上市。,您好，公司目前暂无此计划，请关注公司进一步公告。
49,请问中国当前院线行业是否已经产能过剩？,您好，中国目前人均拥有银幕数量及人均观影频次仍较发达国家有较大差距，未来行业还有较大的发展空间。
50,（更正）请问曾总：万达集团内关联方提供的影院场地租赁佔公司所有场地租赁的比例是多少？未来如何控制租赁成本？,您好。公司租赁万达广场的影城数量约在50%以上，公司已与万达商业地产建立了长效租赁机制有明确的租赁标准，公司在非万达广场的发展中，严格控制租赁标准，确保公司整理的租赁水平保持在合理范围内。
51,根据公司2017年计划增加100家影院，照此速度是否会形成扩张增速过快，盲目扩大产能，在国内日趋激烈的竞争市场中，贵司是否考虑过通过提高服务质量和服务链条而提高盈利水平,您好。公司一方面通过快速扩张增加影城数量来增加市场份额，提升市场竞争力，另一方面，公司通过标准化的管理体系，保证公司下属影城有统一的服务标准，不断提升服务质量。
52,经营规模的扩大能详细介绍一下吗？,"尊敬的投资者您好！公司与国内知名商业地产开发商、运营商建立了良好的合作关系，积极推动公司的全国布局，2016年新增影城超过100家。优质商业广场项目，可以保证影院获得足够良好的位置、规划、人群、消费氛围以及物业服务，公司与优秀商业地产开发商的良性互动合作为公司的跨区域拓展提供了强有力的支持，并为该等商业地产带来文化娱乐价值，为双方长期合作奠定了良好的基础。
标准化、可复制的投资建设模式是公司跨区域扩张能力的另一重要方面。公司拥有专门的影院建设团队，在影院项目投资建设的各个环节建立了一系列标准，包括对新建影院进行统一规划设计，工程物资和设备采购进行统一招投标，工程施工按照相关标准统一建设等，能严格保证公司旗下影院建设品质的一致性。
"
53,请简要介绍公司目前会员情况？,2016年末公司会员突破8000万，是全球最大的电影放映终端会员体系。公司基于庞大的会员体系，通过大数据用户画像，精准触达目标客群，实施精准营销；通过为客户品牌主定制，创新娱乐营销范式，实施整合营销；通过深耕用户体验，创新消费场景，实施场景营销。公司通过会员创新、产品创新、整合创新、营销创新以及新业务创新等创新经营，不断提升会员价值。
54,请问领导如何看待中国电影票房的空间？目前是否接近天花板？另外，公司2016年国内单影院票房收入较15年大幅下降，请问怎么看？,"尊敬的投资者您好！国内银幕数量2016年底超越北美，位居全球首位，但从每万人拥有银幕数来看，距发达国家还有较大差距。同时，国内三四线城市银幕数量仍不能满足观众的观影需求，国内银幕数量仍有较大增长空间。2016年国内人均观影频次约为1次，远低于发达国家，未来增长潜力较大。随着人们对物质文化需求的不断提高，国内电影市场增长空间广阔。
2016年国内电影市场增速放缓，众多中小影院面临较强的竞争压力，国内院线行业出现分化，大规模整合将成为趋势。
国内电影行业主要公司纷纷进入或准备进入资本市场，使得电影行业与资本的结合日趋紧密，产业链整合、多元化发展将成为主流趋势，院线公司凭借稳定的现金流及强大的渠道优势，在行业整合过程中将占据优势地位。
中国已成为全球拥有银幕数量最多的国家，也是票房仅次于北美的第二大市场，中国市场越来越受到发达市场的重视。随着中国电影与国际制片公司的深度交流与合作，国产电影的质量将会逐步提升，进口分账片、批片、合拍片等形式的影片数量也有望进一步放开，促进电影市场的持续繁荣。
"
55,"""管理费用较上年增长69.26%，主要系公司经营规模不断扩大所致"" 这个主要是并购hytos还是国内的院线扩张占主要原因呢","尊敬的投资者您好！公司与国内知名商业地产开发商、运营商建立了良好的合作关系，积极推动公司的全国布局，2016年新增影城超过100家。优质商业广场项目，可以保证影院获得足够良好的位置、规划、人群、消费氛围以及物业服务，公司与优秀商业地产开发商的良性互动合作为公司的跨区域拓展提供了强有力的支持，并为该等商业地产带来文化娱乐价值，为双方长期合作奠定了良好的基础。
标准化、可复制的投资建设模式是公司跨区域扩张能力的另一重要方面。公司拥有专门的影院建设团队，在影院项目投资建设的各个环节建立了一系列标准，包括对新建影院进行统一规划设计，工程物资和设备采购进行统一招投标，工程施工按照相关标准统一建设等，能严格保证公司旗下影院建设品质的一致性。
"
56,万达院线这次改名和改规章的目的 是否就是要年内再次并购万达影业,您好，公司已形成电影放映、电影广告传媒、电影整合营销、电影衍生品销售，线上直播平台等多元化业务板块，非票房收入占比已超过营业收入的三分之一，公司着力打造的“电影生活生态圈”已基本形成，公司现有名称已不能完全体现公司业务现状，因此拟将名称改为万达影视。公司重大资产重组情况请关注公司公告，谢谢。
57,请问公司2017年具体发展目标？,"2017年，公司有如下发展计划：
（1）继续加大影城发展力度
2017年公司将继续加快发展速度，通过自建、并购等方式加大影城发展力度，新增影城目标100-150家，提高市场份额和城市覆盖率。
（2）不断完善电影生态圈建设
公司将继续完善电影生态圈建设，推进全产业链发展，推出网络院线，创新影院场景消费模式，布局游戏产业，不断完善万达电影生活生态圈。
（3）持续提升非票房收入
2017年，公司将持续创新经营，优化营销模式，整合广告资源，创新卖品及衍生品，推进整合营销，深入打造娱乐场景，不断提高非票房收入，保持收入、利润持续增长。
（4）不断提高放映品质
公司将加强与IMAX、杜比战略合作，继续推进4D影厅建设，大力推广“万达9号厅”、X-land自主品牌，不断提高下属影城放映品质，为观众带来最佳观影服务。
"
