,Question,Answer
0,既然说坏账的可能性特别小，那么湖北省高速公路联网收费管理委员会的500万都成坏账了，这个怎么说？,您好，湖北省高速公路联网收费管理委员会应收账款500万元，公司出具2016年年报时基于谨慎性原则考虑对其全额计提坏账准备，公司也在努力采取措施力争收回应收账款。
1,请保荐代表人和会计师关注，公司上市以来的应收账款管理特别差劲，而且应收账款余额巨大，坏账准备政策又比较保守，近几年内很可能在这一科目暴露巨大问题，从而造成公司业绩出现较大波动，为自己的执业前途考虑，请谨慎关注这一事项。,谢谢投资者对上市公司及本人的关注，我本人及保荐机构将继续履行对上市公司的持续督导义务，协助上市公司加强对应收账款的管理，力争确保应收账款不发生大额损失的风险。谢谢。
2,董秘您好公司在重组上有什么打算,您好！截至目前，公司没有重组的计划，不存在应披露而未披露的事项。谢谢！
3,公司上市1年多最大的变化是什么？管理层最大的感触是什么,您好，公司上市一年多最大的变化是从一个民营企业变成一个公众上市公司，公司的经营管理得到外部的有效监督和管理，作为一个公众公司治理结构更加规范、决策更加科学，公司在行业的竞争能力、品牌、人才吸引能力都得到有效提高，作为管理层的责任更加重大。
4,请问贵公司是否涉及生产制造，如何促进绿色环保？,我们的产品是自行组织生产的，均通过了环评检测，符合国家标准，而且我们的生产过程不涉及高污染排放工序，能够保证绿色环保。
5,请问公司都构建了哪些产业生态？,"您好！公司主要围绕路生态和车生态进行布局。
公司在路生态上，除了原有的动态称重、ETC、激光检测产品，开发了交通大数据平台、智能OBU、汽车电子标识等产品。投资了联邦车网，将业务扩展到ETC互联网终端用户。投资了易构软件，布局软件业务。
在车生态上，布局了车载激光雷达、V2X以及前装OBU等产品。
谢谢！"
6,公司会否考虑再收购一些公司或者扩展新的领域?,您好！公司将在新的业务领域，如汽车电子、自动驾驶、智能网联汽车等领域进行投资布局，但一定是结合公司的规模、战略以及标的的情况综合来考虑。谢谢！
7,机动车电子标识六项国家标准于2017年12月29日正式发布，请问贵公司在电子车牌领域的产品进展如何？,您好，公司已完成汽车电子标识基站产品的设计并通过了国标测试
8,请问公司2017年采取了哪些措施保护投资者利益？,您好！公司在2017年遵循上市公司信息披露的要求，对重大事项及时、准确的披露，在定期报告、财务报告中客观全面的披露公司各种情况；在互动易上及时回复投资者问题；积极与投资者沟通、交流。
9,请问贵公司有发展物联网技术吗？,您好，智能网联汽车、自动驾驶/无人驾驶、V2X、交通信息采集等本身就是物联网技术中的细分领域，也是物联网组成的重要部分。
10,请问贵公司主要客户群体是面向谁？,您好！公司产品系列较多，覆盖范围较广，客户群体包括公路的管理部门、高速公路运营公司、ETC运营单位或公司、银行、系统集成商等一系列的客户。谢谢！
11,公司研发费用增加主要是用在哪些方面了,您好，2017年研发费用主要在如下项目上： ETC新产品开发、 车联网新产品研发、 动态称重新产品开发、停车场新产品研发、 3D激光雷达新产品研发、激光检测新产品研发、国标汽车电子标识新产品开发。
12,公司去年短期借款8900万，为何财务费用为-210万？而公司在建工程较小，也不存在资本化的情况？公司的短期借款不需要支付利息吗？,您好，截至2017年12月31日止公司短期借款余额主要为2017年第三季度、第四季度陆续借入，2017年当年产生利息支出较少；同时公司利用自有闲置资金购买结构性存款、保本理财产生较多的利息收入。利息支出与利息收入、银行手续费用等相抵后形成财务费用-210.78万元。
13,请问贵公司激光检测业务未来能否保持持续增长？,您好，可以。
14,公司预计2018年一季度亏损1400万至1900万，请问2季报公司有信心扭亏吗,您好，有信心。
15,请问贵公司在业内的竞争对手都有哪些？,您好，在动态称重方面，公司竞争对手有山东德鲁泰、江西众加利；ETC方面，竞争对手有金溢科技；激光检测方面，主要竞争对手是国外厂商德国西克。
16,贵公司在无人驾驶方面布局主要体现在那些方面？,您好，目前我公司在无人驾驶方面布局主要在车载激光雷达、智能网联V2X通讯技术开展了深入研究
17,请问贵公司无人车激光雷达目前主要研发产品为多少线激光雷达？,车激光雷达目前主要研发产品为8线和32线
18,公司上市以来应收账款的增长速度远大于营业收入的增长速度，去年底应收账款接近五个亿，未来是否会存在收不回来的情形？,您好，公司主要面对各地公路管理部门、智能交通系统集成商等客户，客户会根据整体公路项目建设进度和地方政府的财政预算情况分期付款，从而导致整个与交通行业相关的企业应收账款余额相对较大；公司客户主要为各地公路管理部门、智能交通系统集成商、商业银行，资金实力和计划性较强，截至目前应收账款发生坏账的可能性较小。
19,公司的核心竞争力是什么？,"您好！公司的核心竞争力包括：
1、技术研发优势
公司坚持自主研发和创新，每年持续增加研发投入。近年来，公司研发团队不断扩大，报告期内净增加75人，学历均为硕士及以上。截至报告期末，公司有博士5人，硕士230人。
公司在动态称重、专用短程通信以及激光检测等领域都形成了自己的核心技术和专利。在ETC领域，公司积累了数据采集与处理技术、多车道自由流调度算法、OBU定位技术、射频与信号处理技术等核心技术；在动态称重领域，公司积累的核心技术为动态称重算法、动态称重传感技术、数据采集与处理技术、大数据软件平台等。
在激光雷达领域，公司开发了性能指标优异、可靠性高的多款单线激光雷达、8线车载激光雷达、32线车载激光雷达，可应用在自动驾驶、交通、物流、港口等多种场景；与中科院建立了前沿技术合作研发项目，探索下一代高性能低成本的激光雷达，目前项目已经开展一年，取得了积极成果。公司在激光雷达领域积累了激光动态扫描技术、扫描式激光车辆分型算法、激光回波信号处理技术、红外激光准直技术等核心技术。 
在V2X领域，公司以清华博士为核心，建立了成熟的V2X研发团队，是大唐电信首批LTE-V模组的合作方之一，推出了行业领先的LTE-V通信终端，集成了一套服务于主动安全、通行效率和信息服务的应用系统。作为工信部《LTE-V频率和兼容性试验》测试组核心单位之一，公司为测试工作提供了LTE-V终端和部分测试方案，是《基于长期演进技术（LTE）的车联网终端射频和性能规范》系列标准的主要起草单位之一，为国家V2X频谱划分起到积极推动作用。公司积极参与国家智能网联汽车示范区的建设，为重庆i-VISTA示范区提供了一套开放道路V2X示范运行系统，为长安大学CAVTest示范区提供了一套面向科研和教学的智能车路协同系统，该系统实现了与无人汽车的结合，为自动驾驶提供了包括信号灯相位状态、主动安全信息、道路信息等支持信息。公司与示范区、整车厂、检测机构、芯片模组厂商、运营商、科研机构开展了广泛且深度的合作，在行业内形成了一定的知名度与影响力，为未来V2X项目的推广应用奠定了坚实基础。
报告期内，公司通过了中国合格评定国家认可委员会的实验室CNAS认证。
公司申请和授权的专利持续增长，报告期内，新增19项发明专利，94项实用新型专利，5项外观专利，9项软件著作权。

2、营销网络优势
公司在智能交通领域深耕多年，多种产品及相应服务在广大客户中形成了较好的口碑和较高的认知度，有较高的客户黏度，这种积累将有助于未来新产品在智能交通领域的迅速推广。

3、服务优势
针对公司实施项目多，项目定制化程度高，服务项目分散等特点，公司设立了技术服务多级管理体系：在总部设立技术服务中心，在各区域设立了区域服务管理中心，在30个城市设立服务中心、服务站，由总部技术服务中心对全国的施工、服务项目进行统一协调和管理。

4、资质优势
公司拥有计算机信息系统集成企业二级资质、建筑企业资质、安全生产许可证，通过了ISO 9001质量管理体系认证、ISO/TS16949汽车件质量管理体系符合性认证、ISO 27001信息安全管理体系认证、CMMI_DEV ML3能力成熟度三级正式评估、CNAS实验室认证、QC080000有害物质管理体系认证、ISO 14001环境管理体系认证以及OHSAS 18001职业健康安全管理体系认证。

5、管理人才优势"
20,自上市后，公司的股价一路下跌，去年业绩下降幅度巨大，对投资者造成严重损失，你们觉得愧疚吗？,您好！公司上市之后大幅度的投入研发，在营业收入基本持平的情况下造成了业绩下滑，随着企业的产品升级和迭代及新产品的投入市场，我们相信上市公司未来会取得很好的成绩。因为业绩造成的股价下跌我们深表歉意，但是我们相信随着我们全体员工的努力，业绩会得到有效的增长，并得到资本市场的认可。
21,2017年度公司研发费用增幅较大，请否详细介绍下都用在了哪些具体项目上？,"您好，2017年研发费用主要在如下项目上： ETC新产品开发、 车联网新产品研发、 动态称重新产品开发、停车场新产品研发、 3D激光雷达新产品研发、激光检测新产品研发、国标汽车电子标识新产品开发。
"
22,公司上市后的募集资金应用都到位了吗，近期还会继续融资吗,"您好，截至2017年12月31日止募集资金累计使用19,467.79万元，占募集资金总额27,610.00万元的70.51%，截至2017年12月31日，公司尚未使用的募集资金为8,379.53万元（含存款利息收入），均存放于公司的募集资金专户。
关于继续融资事项，公司会根据经营情况及监管机构要求综合考虑及安排继续融资计划。谢谢！"
23,目前公司正在激光和无人驾驶领域研发迈进，请问市场前景如何？,您好！公司目前在激光和V2X领域投入大量人力、物力、财力，公司已研发出8线和32线车载激光雷达，2018年下半年有望推出市场。无人驾驶方面各国企业及研究机构均处于研究和发展的状态，激光雷达是无人驾驶领域最核心的信息采集部件，我们相信当无人驾驶时代来临，激光雷达在智能网联汽车上得到广泛应用，可达到千亿级的市场前景。
24,公司目前有哪些关联交易？对公司有哪些影响,您好！公司目前的主要关联交易为：上市公司控股股东租赁一座写字楼，租期三年，租金为一年不超过2400万元。
25,汽车电子车牌是否通过测试，什么时间能正式应用？,您好！公司的汽车电子车牌通过了公安部无锡所的测试，今年将参与全国各省市的电子车牌试点测试工作。电子车牌的国标已经发布。大规模商用化需等待公安部的计划。
26,请问如何看待ETC行业未来的发展趋势,您好！ETC行业的发展正向着电子标签智能化、应用场景多元化的方向发展。公司积极探索ETC新的领域，大力投入研发，在多地测试了货车ETC、多义路径识别、ETC车型识别防作弊等系统，受到了客户的好评；开发了智能OBU、ETC停车场等多个新产品；向多个整车厂、一级供应商推广前装ETC产品并进行了测试。
27,公司面临的最大经营风险是什么？如何降低风险对公司的影响？,"1、市场风险
公司业务的发展主要依赖于国家基础设施投资规模，特别是国家在交通基础设施行业的投资以及交通治理、信息化等方面的投入，公司当前产品的销售面对交通管理部门、道路运营公司、ETC运营单位、系统集成商，同时也面向银行、移动运营商、移动互联网公司等ETC合作方，未来客户群体还将变得更加多元化。如果行业发展速度放缓，或者客户预算计划推迟，或者采购产品价格下降，公司可能面临营业收入下降的风险。
针对上述风险，首先，公司将通过加强与客户的沟通，深入了解客户需求及行业趋势，推出符合客户要求的产品，使公司产品保持竞争优势；第二，公司将基于积累的技术，不断推出新产品形式，拓展新的业务领域，减少对现有客户的依赖程度；第三，逐步拓展海外市场，对国内市场进行补充。
2、成本及费用上升带来的业绩波动风险
公司所处智能交通行业增速较快，但也面临着诸多包括但不限于成本上涨、技术更新快等风险因素。另外，公司每年在研发、营销和服务网络上投入较大以保持竞争力，如果成本及费用增长超过收入增长速度，公司未来面临经营业绩波动的风险。
针对上述风险，公司将进一步规范产品开发业务流程，提高研发效率，降低产品成本，提升资产运营效率；另一方面，公司将加强财务管理，合理控制费用，保持公司业绩稳步发展。
3、应收账款回收风险
公司所处行业的主要客户为各地公路管理部门以及智能交通系统集成商，公司业务合同的执行期及结算周期一般较长，而工程款项的结算有一定条件，有可能存在客户延迟验收以及产生坏账的风险。公司应收账款较大，应收账款发生损失将对公司的财务状况和经营成果产生不利影响。
针对上述风险，一方面，公司从战略布局层面详细分析新产品、新领域的商业模式，包括分析其应收账款、资金周转速度和运营效率。另一方面，在内部管理方面，公司将进一步完善风险控制和制定政策约束，对销售人员进一步强化应收账款的考核指标；专门成立应收账款催收小组，加强对应收账款的跟踪、催收，降低公司应收账款总额和坏账风险。"
