,Question,Answer
0,数据业务扩张预计何时开始有收益，为公司成本增加有多少,在数据业务方面，公司一方面积极提升数据产品的内容和质量，另一方面加大市场营销力度，进一步扩大钢联数据的市场占有率。数据业务目前已经产生较好的经济效益。谢谢！
1,公司在经营活动中主要对哪些环节进行质量控制？,"公司经营活动过程中实行三段式风控，分为事前管控、事中跟踪反馈及事后监督三部分。事前管控包括供应商、物流仓储企业的资质审查，主要是围绕产量、政策、资金等；事中跟踪反馈包括物流、销售、合同执行过程等环节管控；事后监督主要包括货物质量监督，物流仓储单位走访及合同执行情况反馈等。
"
2,今年钢铁行业前景如何？,您好，钢铁行业是国家经济基础行业，随着国家供给侧改革的深入，一方面，有利于钢铁行业集中度提高，另一方面，钢铁电商在横向钢铁企业方面与纵向产业链方面的整合，能够有效引导行业提升生产标准和降低产能、增收创效，促进电商行业和钢铁实体企业健康、有序的良性互动发展。
3,对上海钢联太熟悉了，借这个机会提几个干货问题，请董事长也不要打官话，谢谢。1、欧浦智网年报详细披露了供应链金融业务情况，2016年上半年放贷5个亿，营收4000多万，利润2000多万，请问上海钢联今年金融业务营收多少？是供应链服务的55亿吗？公司放贷的资金成本应该在8个点，放贷利率应该在15-18%，利差能到10个点，请问是否恰当？,"2016年度，公司钢材交易服务业务实现营业收入4,109,081.15万元，较上年同期增长93.87%，其中供应链服务收入达55.54亿元。供应链服务收入规模的大小，主要取决于参与供应链服务的资金规模及周转次数，公司参与供应链服务的资金来源大部分为自有资金、小部分为银行借款等。而供应链服务业务的毛利，主要取决于行业市场环境（包括市场资金成本等）及公司提供的供应链服务的质量和水平。谢谢您对上海钢联的关注。"
4,请问公司铁矿石电商进展如何了？公司在这方面的构想如何，是以钢银模式为未来发展模式吗？谢谢！,您好，铁矿石目前主要是撮合交易，公司将根据业务发展和市场情况，择机推出不同业务模式。
5,供应链金融对于小微企业是一个非常好的资金来源，银行又无法顾及，只能由平台来做，钢银电商平台已经逐渐闭合，供应链金融可以发力了。看看卖煤炭的瑞茂通、卖房子的世联行，以及同行欧浦智网，供应链金融都是暴利而且是公司业务收入的重要来源，请公司尽快在风控可靠的前提下开展业务吧。,您好，感谢您一直以来对公司的关注和信任，公司管理层将根据公司规模和市场情况，稳健推进公司各项业务，谢谢。
6,第三个问题：最近看到农产品网站网址已经改为http://www.bankmineral.com/，和钢银平台一样，是否意味着马上第二个钢银会在铁矿石上成立？公司和南山铝业合作的铝平台以及和山煤国际合作的煤炭电商平台进展如何了？是否以后会有钢铁、铁矿石、煤炭、铝四个交易平台的成立？,您好，感谢您一直以来对公司的关注，公司围绕发展战略注重外延式和内生式的发展，凭借钢铁电商平台的成功经验，根据市场情况和公司发展规模，稳步推进其他平台的业务发展。公司和南山铝业的合作事项目前尚在推进中，谢谢。
7,第二个问题：大股东持股比例太低了，才20%多，去年定增并购中关村在线时，定增价记得就是今天的收盘价36元多？当时要是成功，郭江都在这个价格买了十几亿，那么大股东没有动心吗？郭江在慧聪网4块多时可是增持了几千万，看看人家的眼光和信心。,您好，感谢您一直以来对公司的关注，目前公司尚未接到大股东有关增持公司股票的计划。
8,公司17年盈利增长点在哪里,公司2017年盈利增长点：在信息资讯服务领域，公司进一步巩固在钢铁、矿石、煤焦为主体的黑色产业龙头地位，兼顾有色金属，能源化工，农产品等多元化产品领域的发展，促使信息服务业务收入稳步增长，同时做好增收节支工作；在交易服务业务领域，公司进一步扩大平台钢材交易市场份额，增强公司品牌影响力，从而扩大交易手续费规模，并以平台交易为基础，在风险可控的前提下，进一步扩大供应链服务业务规模，提升公司盈利能力。谢谢！
9,公司目前最大的竞争对手是谁，公司做为龙头企业相对于竞争对手最大的优势在哪里？公司在新的一年加工与物流成长如何？客户反馈如何？,您好，就钢铁电商业态而言，目前的格局是钢银电商、欧冶云商、找钢网等企业，钢银电商一直以来致力于做第三方交易平台；公司发挥资讯大数据服务优势，全面渗透交易、物流、仓储、金融等多个产业链，多维度的为客户提供个性化服务。谢谢。
10,你好，我发现年报中递延所得税资产明细里，可抵扣亏损有4.3亿，请问这是什么？请明示，谢谢！,是公司控股子公司钢银电商2015年度的经营亏损，未确认的递延所得税资产。
11,公司股价目前是否合理,股价波动是股市动态变化的反映，公司集中力量致力搞好资讯业务和交易业务，夯实公司的经营业绩。谢谢
12,交易中撮合交易公司是否为继续保留，此业务会否影响收费业务？公司如何看待撮合交易？,撮合交易的确不是钢银电商的主要业务模式和盈利模式，但是它在一定时期内还会是交易业务的重要组成部分，新的交易用户通常都是通过采用撮合交易的模式来尝试钢银电商的服务。2017年公司将继续保留撮合交易这个业务模式。 
13,随着国家不断地整合钢铁企业，未来公司会面对哪些挑战，又会有哪些措施来面对挑战？,钢铁企业整合有利于产业集中度的提高，上海钢联作为为钢铁行业服务的龙头企业，既会面临新的挑战，也会带来新的发展机遇，上海钢联“资讯交易”模式正契合国家整合钢铁产业、去产能增效益的发展战略。
14,公司除了钢铁交易外，是否会继续进行其它大宗商品的交易，有无门槛，发展计划为何？,公司目标建立大宗商品生态圈，除钢铁交易外，公司会陆续以不同形式参与其他大宗商品的交易，进入门槛以及发展时间取决于具体的商品品种以及业务模式。
15,贵公司大股东兴业投资及郭广昌先生，对公司经营好象没有参与，请问是否只是财务投资？,公司大股东兴业投资及郭广昌先生严格按照上市公司公司治理要求对上海钢联履行相关管理职责。大股东兴业投资及郭广昌先生重视上海钢联未来业务发展，并结合上海钢联的业务发展实际需求，给予上海钢联必要的支持。谢谢！
16,现在行业间的并购都比较频繁，你们今年有没有兼并收购计划？,您好，在未来的经营中，公司不排除将根据自身的规模、盈利能力及业务方向，寻求外延式发展的机会。公司重大事项均以公司公告为准，谢谢。
17,公司有没有哪些项目创新模式？," 1）产品创新：互联网钢铁等大宗商品资源整合，电子商务与传统产业相融合，海量真实交易数据构建了大宗商品现货交易指数加速在线交易、金融服务、仓储物流和数据转换的效率，降低交易成本。
 2）模式创新：钢银电商通过以交易平台为核心，形成钢铁生产企业、贸易企业、下游终端用户、仓储加工企业、物流企业、金融机构多方互动、相互监督的生态体系，使得信息流、物流、资金流三流效率提升并融合共通，构建自身的独特竞争优势。
3）营销创新：在大数据营销方面，以手机终端和钢联数据云终端两条产品线为抓手，在重点区域布局设点，聚焦金融行业深度挖掘用户，加大营销力度；在钢银电商平台营销方面，通过手机端产品开发、“云之翼”产品发布等方式进一步扩大钢银电商平台的品牌影响力。尤其是上海钢联产业大数据与钢银电商平台的无缝对接和相互赋能，进一步丰富了钢联产业大数据的内容，提高了市场信息的准确性及客户的决策效率。"
18,请问公司在没有开展电商服务以前，公司资讯业务每年有3000万左右的净利润，今年电商业务已经实现盈利，但是总的净利润却低于没有电商业务的净利润，是我们的数据业务出现了萎缩，还是盈利能力下降了，是为什么？谢谢！,2016年度公司信息服务业务收入及钢材交易服务业务收入同比均有较大幅度的增长，且双双实现盈利。为实现公司信息资讯服务业务的可持续发展，报告期公司加大对信息资讯服务业务的系统开发力度，特别是钢联数据云终端产品、APP移动端产品的开发，研发费用投入逐年增加；同时，公司在南昌设立分公司，积极拓展信息资讯相关服务业务，南昌分公司前期人员成本等支出金额相对较大，其产生效益会相对滞后；另外，随着公司新办公楼的投入使用，折旧等费用支出相应增加，从而在一定程度上影响了公司信息资讯服务业务净利润的增长。谢谢！
19,公司有无进军海外的计划，如果有，会以哪个方向进军？,您好，感谢您对公司的关注，公司重大对外投资情况均以公告为主，公司目前主要立足资讯和交易业务。
20,雄安新区的设立，对公司存在哪些机遇？,您好，雄安新区的设立是国家大事、千年大计，对国家、社会、各行业均有积极意义。
21,请问公司如何看待上市公司的并购和市值管理？,上市公司的市值管理有许多方面，重组并购是其中的一种手段；上海钢联会加快外延式发展和内生式成长，持续完善和丰富大宗商品的生态体系。谢谢
22,朱董及各位高管好!钢联子公司申请支付牌照进展如何？有没有收购其他支付牌照的考虑？,您好，关于第三方支付牌照申请工作，2016年度公司已通过央行指定第三方机构三年一次的检测及每年一次的年检，目前，第三方支付牌照的申请材料仍然是在央行受理中。
23,公司所处行业有没有周期性？,公司模式是--”资讯交易“，对资讯业务而言没有周期性，对交易业务而言，由于钢银电商是独立的第三方销售平台，无所谓周期性，当然在钢银电商平台上销售的钢材属于具有周期性钢铁行业，交易会受到一定影响。谢
24,上海钢联作为国内知名的钢铁电商，与BAT等互联网巨头有何合作关系呢？,您好，目前公司与BAT只存在小的业务关系，尚未有任何战略合作关系。
25,公司2017年一季度经营业绩如何？,您好，公司2017年一季度业绩预告，归属于上市公司股东净利润预计盈利：483.77 万元–604.71 万元。
26,今年以来，原材料都迎来涨价潮，对公司会有什么影响？,钢银电商的定位是第三方交易平台，立足为交易双方提供交易结算、供应链金融服务等。公司业务构成中绝大部分业务都不受钢材等价格波动的影响，无论原材料涨跌对公司利润等指标都不会有明显的影响。
27,公司是否在考虑开拓新的领域？取得初步进展没有？,您好，公司目前主要业务为资讯和交易业务。
28,公司每次投资项目的可行性报告是否有详细说明公告？,您好，公司会按照监管要求对相关须发布可行性报告的项目详细发布公告，谢谢。
29,公司有参与雄安新区建设的计划吗？,公司目前暂没有这方面的计划。谢谢
30,互联网销售钢联目前在钢铁总的销售量的占比如何？ 相对传统行业，互联网销售的优势在何？,"互联网销售钢铁目前在钢铁总的销售量的占比约15% ；
相对传统行业，互联网销售的优势体现在：1、信息及时；2、价格透明；3、交易效率高。谢谢"
31,钢联对今年的经营预期是怎样的？,您好，公司管理层对公司未来发展充满信心。
32,公司2017年的研发费将投入多少？,作为一家互联网电商平台公司，公司十分重视系统及技术的研发和投入，近年来，公司研发费用支出稳步增加。2016年公司研发费用投入3793.54万元，比上年增加48.60%，预计公司2017年研发费用投入金额相对也会较大。谢谢！
33,17年钢联现金分红吗？,您好，公司2017年度利润分配事项，请关注公司未来的相关公告，谢谢。
34,贵公司作为钢铁电商的龙头，对现在不到58亿的股票市值怎么看?公司管理层关心公司的市值吗？,"1、感谢你对公司的肯定。
2、股价波动是股市动态变化的反映，公司集中力量致力搞好资讯业务和交易业务，夯实公司的经营业绩。谢谢"
35,公司高管今年是否有增股的可能？,您好，公司目前尚未接到高管拟增持公司股票的消息。
36,近几年的固定资产，技术改造的投资效果如何，是否达到了预期的目标，不考虑市场因素，简单考虑毛利情况是否合理？,您好，公司不存在固定资产技术改造。
37,公司的供应链金融服务55亿，那么请问供应链服务的具体产品有哪些？谢谢！,钢银电商供应链服务产品主要有“帮你采”、“随你押”、“任你花”，谢谢！
38,钢联寄售成交量是否进入成长瓶颈期？ 您本人说10万吨/天左右是盈亏平衡点，公司将以保持业绩为主要目标还是烧钱竞争成交量为主要方向？类似打车与共享单车的先占市场再慢慢赚钱的思路,"钢铁贸易市场巨大，电商已经逐渐被上下游客户接受，从目前来看成交量上升态势良好，还远远没有到瓶颈期。
钢银电商定位是“平台服务”，早就脱离了烧钱换交易量的模式，这跟打车和共享单车等B2C电商有着本质的区别。在继续完善交易模式和风险控制的基础上，公司将继续维持交易量的增长。"
39,你好，我发现公司营业收入逐季上升，为什么每季度的净利润呈现无规律变化？,公司合并营业收入主要由信息服务业务收入和钢材交易服务业务收入组成，钢材交易服务业务收入又可以分为寄售服务业务收入和供应链服务收入两大类。不同业务模式的毛利率水平及其结算周期又有所不同，导致公司每季度净利润会有所波动。谢谢！
40,请问公司的净资产一年内增长了5倍多？谢谢！,您好，公司净资产增加主要是由于2016年度公司控股子公司钢银电商完成了定增、公司及钢银电商实施了股权激励。
41,公司营业收入410亿，而总交易金额大于公司的营业收入70亿，请问这是为什么？谢谢！,公司营业收入410亿为不含税收入；
42,您好！截至到2016年12月31日，“国家队”即中金、证金、汇金的持股比例有多大？,公司前十大股东持股比例详见公司年报。
43,钢联今年一季度的寄售交易量相对于去年环比四季度结果如何？去年毛利在千分之四，未来预估会提升至什么水平？,"钢联今年一季度的寄售交易量同比有较大增；由于春节假期原因,环比没有可比性。
公司正致力于在提高交易量的同时不断提升毛利率。"
44,中钢在线2016年营收28亿，净利1600万，交易260万吨。钢银电商营收410亿，净利1800万，寄售1800万吨，两公司都是B2B钢铁电商，利润率也差得太大了吧。公司有没有研究下人家是怎么赚钱的。,钢银电商秉承“平台服务”战略，为平台上下游客户提供钢材交易及供应链增值服务。目前公司的盈利模式主要是收取平台交易手续费、及供应链服务费用。钢银电商与中网在线在业务模式上存在较大差异，两者不具有可比性。谢谢！
