,Question,Answer
0,2017年公司业绩出现大幅度下滑，主要是因为公司处于转型时期，新增业务收入未达预期。那新增的业务指的是哪些业务？,公司为实现IP复用，打通线上线下业务，正努力发展文旅项目。目前已实现东方科幻谷的开园，但平阳、惠阳项目仍在推进中，还未能体现收入，实现盈利。
1,公司的两大业务看上去不太相关，请问公司这样布局的想法是什么？,公司2007年以“广陆数测“在深交所中小板上市，以生产销售量具量仪为主；2014年成功并购中辉乾坤公司，转型文化传媒文化行业，实现双主营比翼双飞，两轮驱动模式。
2,就现阶段公司股价，谈一谈公司市值管理？,公司董事会、管理层会专注于公司的经营管理、业务发展，我们认为只有公司的业务发展了、业绩上去了，公司的市值自然就上去了。我们始终坚持的理念是业绩是市值增长的基石
3,与传媒行业上市公司相比，大部分传媒公司实现了收入和利润的上升，但你们公司却出现大幅度下降，是否总结原因？,与传媒行业上市公司不能做简单的比较，公司目前实现的双主营业务；2017年公司业绩出现大幅度下滑，主要是因为公司处于转型时期，新增业务收入未达预期。
4,在vr等方面，公司的地位是什么，是否有自己的核心技术？曾经公告跟海南有个VR项目，后面没做了吗？,我公司参股的幻维科技公司是国内目前排名靠前的一家VR公司。水木动画公司与海南旅游局签订并完成了VR项目
5,谈一谈公司的外延式发展，有哪些有效的操作的工具？,公司2007年在深交所成功上市，以生产销售量具量仪为主要产业，2014年采取并购重组，以发行股票和现金收购的方式相继整合了乾坤时代、水木动画等公司，实现双主营业务。
6,万达之前也想做主题乐园，但是好像不是特别成功，请问公司对此怎么看？贵公司是否已经有了独特的策略，使自己的乐园能够脱颖而出？,万达公司是国内非常优秀的公司，您提出的万达做主题乐园为什么不特别成功，我公司不方便评价和回答。但是以科幻为主题的乐园，国内好像仅我公司贵阳双龙科幻谷独此一家，从试营业来看效果非常好，我公司今后将会继续坚持以科幻为主题，以及独特的投资合作模式再加上我们公司积累的内容资源、运营管理经验、方案规划设计优势向前发展
7,今年已经上的和未来将上的影视剧哪些跟公司有关？这些影片中公司主要做了什么？,公司在影视剧方面主要是体现在参与投资和后期发行上，公司也将通过专业人才对影视剧做出良好的投资选择，相信投资者未来会在银幕上看到公司的身影！
8,集装箱小镇、温州星际科幻谷烂尾了吗，工程停止的原因是什么？,集装箱小镇、温州星际科幻谷在各方积极的配合下，按照计划进度推进当中。
9,谈一谈公司2018年利润分配方案？,2018年公司将努力改善经营状况，突出主营业务，如能创造佳绩，必将回馈投资者！
10,《生命的假期》合同解除，就是这部影片未转让，依然在公司？公司准备拍摄这部影片？,"我们投资的合同以及转让的合同全部进行解除和终止。

谢谢，对我公司的一直关注！"
11,感谢彭敏董事长对我的回复，我以前对贵公司的信心不足，但现在由您这位海归美女掌舵，我对贵公司又充满了希望，现在的行业，大部分由年轻人掌握，因为她们的眼光看的比较远，对每个行业的调研很透彻，彭董可以看看其它行业，哪个对公司长远发展有利，公司可以收购，使公司转型，公司也要考虑赚钱吗，您手下还有很多员工跟着您吃饭呢，所以要学会创新，不赚钱的可以淘汰，引进能赚钱的项目，这样才能给所有股东回报。,我们会引进好的项目和资产只要对公司有利的事情我们都会努力去做，我们会坚持贯彻彭朋董事长提出的公司宗旨：为股东创造利润；为员工创造机会；为客户创造价值；为社会创造财富；
12,惠州150亿的项目进展如何了？公司曾经答复交易所该项目资金来源主要是产业基金，那么如果钱都是产业基金出，公司如何从中获得收益？,惠州惠阳项目正在积极推进之中。我们公司获益的主要方式包括但不限于：IP授权许可收费、方案规划设计收费、提供运营管理服务收益、股权收益等
13,公司现在的东方科幻谷建设到什么阶段了？有点期待。,东方科幻谷已于4.29日正式开园，欢迎亲至爽爽贵阳感受、体验！
14,科幻谷有8000万的收入，收入确认的条件在给交易所的《回复函》未看到有提及，如果提及，那么是哪一句说了，烦请复制过来。,"公司下属全资子公司水木动画有限公司（以下简称“水木动画”）依据播出进度确认了东方科幻谷项目的广告收入4,585.17万元，依据部分娱乐设施设计建造合同、宣传片拍摄制作合同，确认收入4,030.32万元。
经公司核查并与会计师沟通，截至2017年末，水木动画并未实际收悉东方科幻谷项目的广告收入的相关收款，同时相关娱乐设施设计建造合同项目的收入截止认定存在问题，该等交易未来经济利益流入存在不确定性，出于谨慎性不应当确认该等业务收入。因此应调减公司2017年度的收入8,615.49万元，调减成本246.71万元，对公司2017年度利润总额的影响为-8,368.78万元。"
15,与传媒行业上市公司相比，大部分传媒公司实现了收入和利润的上升，但你们公司却出现大幅度下降，是否总结原因？,传媒行业本来就是投入大、风险高、收益高的行业，作为刚步入传媒行业的新兵，业绩出现波动是正常的。我们公司一直在总结原因。
16,等东方科幻谷建成，公司是否能打破业内“五年”魔咒，拥有持续的吸引力？,现在东方科幻谷第一期工程已经完成并开园，第二期工程也将会开工建设，公司今后将会在主题公园的科幻内容、内涵、精细化运营、细致服务等方面加大力度，能否打破业内“五年”魔咒，我们有信心，请与我们一起见证奇迹吧
17,公司业绩大幅度下滑，是否说明公司转型是失败的，或者管理处战略错误,前期，由于公司初涉文化传媒行业，对业务处于熟悉的过程中，很多对外的投资也未体现收益，再加上内部管理未得到有效控制导致业绩大幅下滑。转型也是需要经过磨合才能走向成熟的。今年的大幅亏损，公司管理层对投资者表示诚挚的歉意，但并不代表公司转型失败。资本市场是以成败论英雄，但经营公司还是需要风物长宜放眼量。
18,公司毛利率在同行业中是什么样的水平？,"我们公司有生产制造企业、有文旅项目、有文化传媒板块、还有渠道板块等，所以未寻到与我们同类型的企业，所以未进行比较排名。谢谢
"
19,公司业绩大幅度下滑，公司是否有应对措施？感觉文旅产业见效慢，风险大，据报道目前85%的文旅项目都是亏损的，公司如何看待？,公司新的管理层将会采取创收、降低成本费用等系列措施保持公司稳步发展争取广大股民良好的业绩汇报。我们公司发展文旅项目的投资模式与其他公司的投资模式有所不同：我公司的投资模式是以自有IP授权、方案设计、品牌输出、运营管理进行投资，基础设施投资等重资产基本都是由当地政府负责投资。
20,公司未来是否会侧重某一业务？,公司根据现有业务的发展，会侧重于为公司快速增厚利润，带来现金流的业务。
21,除了现有业务，公司会再拓展新的业务领域吗？,公司根据目前经营现状，首先专注、夯实、大力发展现有业务。
22,16年年报下降的原因是《生命的假期》未回款，不在16年确认该项收入，预计收入4000万，该项收入在17年体现了吗，体现在报表的哪个项目？,关于该部影片，由于对方未付款，双方达成一致意见对原来签订的合同进行解除。谢谢
23,水木动画最近有出新的动画片吗？,水木动画公司根据其年度经营计划，积极创作新的动画作品。
24,公司的研发投入占营收比是多少？同比上年管理费用增加了多少？,请关注上市公司年报附注，谢谢
25,2017年公司跟科幻谷有8000万的收入，未达到收入确认的条件，2018年4月29日，科幻谷开业，但2018年半年报业绩预测仍然未包含该项收入，该项收入确认的条件到底是什么？,未达到收入确认条件的事项以及原因详见我们给交易所的《回复函》，以上事项待收入确认条件满足时，我公司将会计算包含在内。
26,公司的国外收入主要来自于文化传媒业务还是量仪量具业务？,主要是量仪量具业务。谢谢
27,贵阳科幻谷的资产在财务报表哪一项有显示？,贵阳科幻谷的资产属于当地贵阳政府的，在我们的报表上仅显示股权投资，不显示贵阳政府投资的资产。
28,永旭良辰出售合同约定1个月内支付价款，截至到年报，显示仍然未收到款，未收到款的原因，半年报业绩预测是否包含了该项转让收入？,转让永续良辰的股份是4月份股东大会通过的，约定收款期刚到，目前尚未收到股权转让款，公司正催促对方按照合同付款。半年报业绩预测未包含该项转让收入。
29,贵公司拟6000万元转让所持永旭良辰股权，是 公司没钱，需要出卖资产来维持公司运转。还是出售资产维持公司业绩,公司所作出的决策，都是根据您公司自身业务发展需要决策的，谢谢
30,请介绍和梳理公司2017年年报情况？公司2017年共接待机构投资者来访的频次？,公司2017年度接待投资者的调研记录已在公司2017年度报告中第四章经营情况讨论与分析部分进行详细披露。
31,公司是否还有继续朝医疗方向发展的计划，前期曾公告成立医疗公司，还成立吗？,感谢您对公司的关注，公司在寻求一条适合公司发展的道路，对战略也在不断修正。目前公司还是专注于发展文化传媒领域。
32,东方科幻谷是否盈利，多久才会公布一次？,东方科幻谷是否盈利，上市公司财务报告的披露是按照季度进行披露。
33,请问贵公司的贵州东方科幻谷的利益分配模式是怎样的？有没有前置管理收入分成？日均入流量达到何种数量才能大致维持盈亏平衡？最大的几个较为固定的开支项有哪些？金额多少？谢谢！,贵阳科幻谷主题园是由运营公司（水木动画51%，政府平台公司49%）来运营，依照股权占比进行利润分成；运营公司的成本主要是运营费用，即主题乐园的相关资产根据协议暂不由运营公司承担。
34,17年市场环境主要发生了哪些变化，影响到了公司经营？未来公司打算如何应对类似的变化情况？,2017年公司的重大重组定增项目的变化，以及主题乐园项目开园的延后等原因，导致公司经营目标无法达到预期；公司经营层针对目前的实际状况，开源节流，大力拓展公司经营业务。
35,公司处于少量货币资金的状态，收购资金全部需要来自银行贷款，公司是否有融资计划,公司将会根据公司资金实际情况和未来资金需求考虑进行融资
36,华桦传媒公司是否继续收购？一直未付款的原因是什么，只能依靠贷款收购吗，贷款迟迟不批是否是公司本身的原因？,公司一直与华桦公司及华桦公司的股东保持良好的沟通，同时公司融资部门同事正在积极筹措资金。
37,你好，我是贵公司的小股东，持股2年多了，损失惨重，我想问一下彭敏董事，您今年接手您父亲的公司，是不是准备大干一场，让公司变得越来越好，希望您能将在国外学到的知识，用在大力发展公司上，也好回报我们这些小股东，您对公司的发展，有什么想法吗，资产注入，或是继续收购资产，希望在您负责公司运作的同时，给我们散户投资者带来新的希望，预祝东方网络公司越来越好。,感谢多年不离不弃，我们也深刻反思，同时也积极面对困难和挑战，希望大家对我们重拾信心！
38,东方科幻谷收入和利润情况？最新进展情况是什么？,"东方科幻谷于4.29日正式开园，五一期间入园人数约27,000人，已超公司预期，但其收入和利润还需公司财务人员进行核算，公司将在定期报告中予以披露。谢谢！"
39,公司打算加大影视综艺板块的并购重组，会不会使管理费用持续增加？,不会增加管理费用，谢谢
40,很多投资者在公司第一个收购消息23元附近买入公司股票，一直跌倒现在，损失惨重，公司能给个说法吗？,自2014年以来，公司一直对发展文化传媒行业抱有梦想，也在不断地为实现梦想而努力。所以每一步收购都是为完善公司文化传媒生态链而做出的举动。理想很丰满，现实很骨感，我们在前进的路上跌倒了，但公司不会气馁，一定会鼓起勇气，继续前行！
41,请问公司股价跌倒现在，公司管理层有什么错失让公司经营业绩上升，回报广大投资者？,公司管理层根据董事会下达的年度目标，结合目前公司的经营情况，积极采取措施，确保公司经营的稳定、持续增长，以实现经营目标。
42,"请问贵公司去年两次收购不成功，造成公司股价大跌，给广大投资者带来巨大经济损失，给个合理的解释？
公司去年三季度公告盈利几千万，到四季度修正亏几千万，巨大的落差怎么解释？
去年12月份公司在负盈利还去高价收购一个三甲级医院，随后不到10天，一个公告宣布不收购，公司是不是做事太儿戏？还有公司是不是知道公司业绩不好，故意公布一些消息掩护机构出货？",公司的并购等投资活动均依照深交所的相关规定要求，及时进行了相关披露！
43,主题乐园前期投入大，维护成本也很高，而且在上海迪士尼、长隆等成熟乐园的围攻下，如何保证能盈利？,文旅主题乐园作为目前国内强大的市场环境，是这几年蓬勃发展的行业，我们自身拥有强大的IP资源和优秀的策划、运营团队。
44,公司业绩这么差，什么时候回ST,感谢对公司关注
45,公司什么时候会退市,请关注公司公告。
46,贵公司的股票为什么一直下跌？,感谢对公司关注。
47,谈一谈公司的核心的发展战略？相比同业竞品公司有何技术优劣？,"公司的核心的发展战略：“内容为王、渠道致胜、平台支撑、用户至上”
公司拥有线上及线下平台，拥有强大的IP资源。"
48,公司此次业绩修正（2017年度业绩快报）的原因是什么？对相关责任人员进行怎样问责？,请详见公司公告披露原因，谢谢
49,公司现金流的状况如何？能否谈谈公司财务杠杆？谈一谈公司2018年公司理财计划？,"公司现金流满足公司经营活动，至今公司没有涉及财务杠杆进行融资计划；2018年公司还没有理财的计划。谢谢
"
