,Question,Answer
58,京东方B市值为25亿人民币。B股市值很小但非常打击A股股价。京东方在2016年发行的100亿债券的利率是3.15%非常便宜。 京东方的ROE在10%左右，京东方B股市净率1.2倍。京东方发行30亿人民币债券收购京东方B在财务上是合算的。为什么不做呢。,"您好！非常感谢您的关注！
谢谢您的建议。我们会认真考虑。"
59,BOE北京5代线为什么不转移到土地相对便宜的周边地区，出让宝贵的北京土地？,"您好！非常感谢您的关注！
首先，BOE北京5代线折旧已经提完，随着高世代线产品下切，5代线再切传统产品是没有竞争力的。我们从三年前开始着手5代线产品转型，但转型并不是简单的把产线搬走，因为5代线设备还能发挥很大价值。如果搬迁，反而产生较高搬迁费用、产线调整费用等，不合算。5代线转型方向已经确定为向传感器相关器件转型，通过几年研发，取得了较好效果，目前传感器器件销售收入已经占有一定比例，数量也在不断扩充。我们计划用3-5年时间，将现有5代线全部产能转换成为传感器相关器件。"
60,根据此前的长期市值管理计划，公司是否有考虑推出新的一轮回购计划？,您好，公司会继续研讨包括股份回购在内的市值管理措施，请您关注公司公告。谢谢。
61,谢谢各位领导的回答。还有一个问题。公司是否有今年的盈利目标，比如先小赚100亿之类的小目标或者长期的大目标比如未来的两三年。,谢谢您的关心。每个公司都会有自己的盈利目标，我们一定会一如既往地全力以赴，努力工作，争取更好的盈利结果。
62,叔叔好，哈哈，目前公司的股价超级便宜，力挺叔叔,您好，谢谢您的支持。
63,成都OLED产线今年会量产吗？谢谢,"您好，感谢关注！
成都柔性AMOLED生产线已经在5月11日点亮投产，目前正进行爬坡，有望10月份实现量产。"
64,公司在说到产量的时候都是多少K能解释下什么意思吗,您好，一般产线产能表述为每月玻璃基板的投入量，例如成都6代柔性AMOLED产线设计产能48K/月，指每月玻璃基板投入量为48000片。谢谢。
65,请问成都OLED产线目前良率达到了多少？谢谢,"您好，谢谢您的关注！
成都柔性AMOLED生产线已经在5月11日点亮投产，目前正进行爬坡，有望10月份实现量产。"
66,目前电视不好卖，电视销量一直在萎缩。这样电视面板也会跟着萎缩，目前电视面板占公司营业额的多少？电视面板的市场定价主要依据什么？,谢谢您的提问。目前电视面板占公司整体营业额的近30%，电视面板定价的主要依据是市场的供需关系等影响因素。
67,保监会应该多久回复公司申请保险资质结果？效率太低了吧？,谢谢您的关心与理解！我们会加强沟通，争取尽快取尽快突破！
68,京东方股价上5元过分吗？,"您好！非常感谢您的关注！
我们会持续努力！就我个人的看法，公司的实际价值远高于5元/股。"
69,6、张总下午好，我想了解一下公司全面屏方面的布局。今年下半年手机行业最大的亮点就是全面屏了，请问公司的全面屏现在出货情况如何，能占到公司总出货量的多少？下半年是手机行业的旺季，到年底前全面屏的需求应该还会增长，年底的时候全面屏的出货量能达到公司手机面板总出货量的一半吗？主要是哪些客户呢？另外听说全面屏产品对面板生产线的产能消耗比较大，您能解释一下这是什么原因吗？,"谢谢您的关注！
京东方目前已具备当前市场需求的全面屏相关技术储备，包括全屏显示屏设计与模组工艺，已于7月份量产全面屏手机显示屏产品。
大部分全屏产品将搭配异形切割，对面板厂的屏幕设计、生产工艺及供应链管理有很高的要求。目前京东方在全面屏产品领域布局完善，
相对于16:9，18:9（全面屏）显示区域尺寸上涨，对于生产线，切割效率没有变化，保持在95%左右。但由于尺寸变大，将促进产能消耗。每1000万片18:9需求相对于16:9将多消耗8K G6基板产能。
"
70,现在不少人预计以后趋势是往OLED方面发展，而且韩国领先企业也在这么做，请问如果真的未来趋势这么走了，公司是否可以通过改造目前工厂来来生产OLED.这种改造相对于新建一个同等规模的共产能节约几成的建设成本？改造后良品率爬坡又大概要多久,谢谢您的提问。我们预计未来的显示市场趋势是TFT LCD和OLED等几种技术的产品长期共存，分别对应不同的应用市场。如果把TFT LCD工厂改造成OLED，会节省厂房建设、动力设备、前段驱动电路工艺设备等部分投资，改造后良率提升与新建厂不会有大的区别。
71,公司在显示领域是高清大尺寸液晶和柔性oled并进。注意到2季度以来，大尺寸电视面板出现较大下跌，一并考虑状况oled成都线的爬坡和年底10.5代线的投产，会否对今年下半年业绩造成较大冲击？公司采取了那些方法来应对这些冲击？,"您好！非常感谢您的关注！
在今年上半年的销售收入结构，移动类产品（手机、平板电脑、笔记本电脑）占据50%以上，IT类产品占15%，TV产品占30%，其他应用类产品5%。需要说明的是，随着公司福建8.5代线产量提升（主要是43寸产品），TV类产品销售比例会有所增加；同时，公司通过加大向应用性细分市场转型，将扩大应用产品比例。我们会依据整体市场变化，对主要产品结构和数量进行调整，以期达到最佳效率。"
72,能否请陈总为我们拆解一下公司出货的各种尺寸液晶面板的收入占比呢？电视类的、电脑的、手机的屏幕各占多少比例啊？现在手机和电脑类的屏幕价格在涨，电视屏幕在调整，公司的整体收入会往什么方向变化啊？请陈总给我们分析一下吧，谢谢！,"您好！非常感谢您的关注！
在今年上半年的销售收入结构，移动类产品（手机、平板电脑、笔记本电脑）占据50%以上，IT类产品占15%，TV产品占30%，其他应用类产品5%。需要说明的是，随着公司福建8.5代线产量提升（主要是43寸产品），TV类产品销售比例会有所增加；同时，公司通过加大向应用性细分市场转型，将扩大应用产品比例。我们会依据整体市场变化，对主要产品结构和数量进行调整，以期达到最佳效率。谢谢！"
73,2016年的业绩受汇率贬值影响，业绩波动很大，现在2017年汇率上升了，但是并没有成比例的出现业绩锦上添花。为什么？,您好！2017年上半年公司汇兑净损失由去年同期的6.45亿元降至1.8亿元，公司将继续密切关注外汇走势，进一步加强汇率风险管控，感谢您的关注！
74,这么多高管到现场千万别被五花八门问题砸懵了，给广大投资者一些干货吧！,您好，公司非常重视与投资者的交流，希望能够利用这样的机会，与投资者进行良好的沟通，希望大家多多提问建言，谢谢。
75,叔叔好，请问目前公司的智慧系统处于什么阶段,答：感谢提问！ 智慧系统事业要承担集团转型箭头的使命，目前还处于事业布局期，已初步搭建形成了人工智能和大数据研发平台，并形成了智造服务，智慧零售，智慧车联和智慧能源4个业务板块，目前在集团的营收占比已达到18%。我们会继续努力，谢谢！
76,您好！人民币的走强对公司的汇兑损失多大？？,您好！今年上半年公司汇兑损失净额为1.8亿元，去年同期损失为6.45亿元，谢谢!	
77,王董事长，您好，京东方的发展历程激动人心，令人震撼，希望早日成为伟大的企业。目前，中报看公司营收90%集中在显示屏行业，而过往经验来看，显示行业属于周期性行业。一旦面临行业景气度不好，容易陷入亏损。我建议：1、多开发一些面向终端消费者的下游的产品。2、加大对健康行业的投入力度。3、通过租赁、外包的方式，降低公司重资产的比例。4、增强与高端客户的合作，与比如苹果、华为等优质客户共同成长，把屏幕卖的贵一些。,谢谢您的建议！我们从2013年以来就积极实施公司转型战略，从一个单一的显示器件提供商向软硬融合、应用整合和服务化转型，开拓薄膜传感器件业务、发展智慧系统和健康服务业务事业，形成显示与传感业务、智慧系统业务、健康服务业务平衡发展的事业构架。进一步创新驱动发展，促进企业收入和利润长期稳定增长。我相信随着战略项目的逐步实施，我们的业务构架将更合理，收入利润将更稳定。
78,机构调研的多，为什么真真下手买的确不多，什么原因？一百万散户,您好，今年以来，公司股票整体表现优于大盘，机构投资者在其中起到了重要作用。我们会继续加强价值宣传，推介公司，提升市值表现，谢谢。
79,公司打算办理保险业务，迟迟不见踪影，请问主要卡在什么地方？是公司资质不满足要求吗？,您好！保险公司申请材料已上报保监会，等待保监会批复，目前正在全力推进中。
80,预计今年政府补助金额约为多少？,"您好！2017年上半年计入当期损益的政府补助金额约为3亿元，2017年下半年目前比较确定的政府补助为以前年度收到并通过递延收益结转的，金额约2亿元。谢谢您的关注！

"
81,未来手机屏和电视屏收入的占比是多少？毛利率分别是多少？,谢谢您的提问。现在我们的手机屏收入与电视屏基本相当，是我们显示与传感器件事业群中收入占比最大的两个业务。我们会根据市场需求及时调整产品结构来保证公司盈利能力的最大化。
82,要求董事会：强烈要求公司在市值管理方法尽快釆取措施，提高公司社会形象。,您好，感谢您的建议。我们会继续加强企业价值宣传，维护市值稳定，提升公司形象。谢谢。
83,两期股权回购计划已经完成，公司是否考虑过增持自家公司股票，毕竟作为上市公司持有自家股票的比例之低在全部上市企业中都是倒数,您好，根据相关规定，上市公司持有自家股票需要有明确的用途，烦请您再进一步明确问题，谢谢。
84,BOE北京5代线全部转型为传感器器件生产后，预计能提供多少营收及利润？,"您好！非常感谢您的关注！
BOE北京5代线全部转型为传感器器件生产后，我相信提供的收入和利润肯定会远高于现在北京5代线的水平。"
85,收购法国电子标签公司目前是否盈利？上半年盈利多少？盈利是否已经算在43亿之内？,感谢您的关注！您所提到收购的法国SES-imagotag公司目前还未完成交割。该公司目前是盈利的，但上半年尚未合并入BOE。谢谢！
86,京东方b成交量一直萎缩，总体也就9亿股，市值不到30亿人民币。公司对于京东方b的存在有什么打算？,"您好！非常感谢您的关注！
公司最近两年也在通过回购减少公司B股流通数量，我们也希望能够尽快解决B股问题。谢谢!"
87,现在B股市场完全是一潭死水，公司是否有考虑直接全额回购B股退出B股市场。关键现在B股价格又不高对于提高公司业绩相当有帮助，而且公司也完全有能力这么做解决历史遗留问题,"您好！非常感谢您的关注！
您的观点跟我们是一致的。事实上，公司最近两年也在通过回购减少公司B股流通数量，我们也希望能够尽快解决B股问题。谢谢！"
88,烦请能否解释一下本年上半年的资产减值损失中存货跌价准备计提12.09亿的合理性？我查看了近三年度贵公司此部分损失全年计提金额平均才约12亿元左右（2016年13.74亿、2015年13.62亿、2014年8.1亿），这原因导致贵公司上半年税前利润比以往年度上半年平均减少约6个亿，另外，我查了下历史上液晶面板降幅最大的年度大约在2015年下半年至2016年初，但是在这个时间内，贵公司都没计提这么大的存货跌价准备，为何今年上半年却计提这么多跌价准备？是因为价格下降还是另有其他原因？ 如若预计未来1-2年内面板价格上升，这部分存货跌价准备是不是还需转回来？另外，如若转回，对贵公司未来两年的业绩增长会有所贡献，简单测算此部分金额对贵公司净利润提升约10亿？各位领导，我的理解是否正确，谢谢回答,您好！首先非常感谢您对公司的持续关注，希望通过您的提问能促进我们管理水平的不断提升。资产减值是根据有关规定，结合行业及市场情况等的变化进行的相应处理，计提和冲回在政策要求上都非常严格，我们在处理上也是非常慎重的。近年来由于公司产业规模的不断扩大，各项资产也随着规模逐年增加，客户结构也更加多元化，存货、应收款总额等也随着产业规模的扩大较前几年有较大增长，资产减值也相应发生变化，因此对我们的管理提出了更高要求。公司将不断提升精益化管理水平，提高运营效率，降低风险，全力以赴为股东创造更多的价值。欢迎您有时间来公司指导，谢谢！
89,老王，我买公司股票被套5年没割肉，一直被你们的宣传打动。请问，我能赚钱吗？,谢谢您的支持！我们一定倍加努力！
90,请问张总，目前量产的全面屏规模是多大的出货量啊？主要的客户是哪些呢？,感谢您的关注！ 京东方目前已具备当前市场需求的全面屏相关技术储备，包括全屏显示屏设计与模组工艺，已于7月份量产全面屏手机显示屏产品。
91,我是京东方小股东长期持续买入股票从2元多一直买的拿了三年了，希望京东方股价步步高升。,谢谢您的支持！我们一定倍加努力！
92,请问 三季度预计效益如何，谢谢。,三季度市场价格预计会持续下降，尤其是中大尺寸面板，将对公司盈利形成压力。我们正努力调整产品结构，通过创新提升产品价值，争取使公司的效益不受影响。
93,公司是否考虑引入战略资本，比如华为之类的大公司做公司战略股东,"您好！非常感谢您的关注！
引入战略资本，改善公司股权构架，我们一直在考虑。谢谢！"
94,姚总好，最近在京东众筹上看到BOE一款新的画屏产品，请问这款产品有什么特点，未来还会有其他产品推出么？,"答：衷心感谢您的关注！BOE画屏是我们针对数字化艺术展示这一细分市场的创新产品，试图打造一个开放的平面艺术分享和交易平台，让追求生活品味的用户能够随时随地欣赏艺术作品。我们是做显示出身的，做这件事是希望能改变上千年来人们在纸上作画、看画的习惯。简单说，我们的理念一是“艺术是用来给大众欣赏的，而不仅是给少数人压箱底的”；二是“让大家把艺术馆搬回家，让艺术活起来“。
具体到硬件端，我们的核心理念是要更像纸而不是电子屏幕。主要特点有：1）极致色彩还原，色阶细腻真实，极致呈现原作效果；2）采用无损伽马技术，无色彩丢失；3）专业定制屏，不反光，不伤眼 ；4）节能省电环保。
BOE画屏于去年年底推出后，市场反响很好，并获得了CES年度显示产品创新应用奖。同时我们也与中央美术学院、“青年艺术100”以及众多艺术馆和艺术推广机构展开了合作。今年我们推出了系列化产品：MINI版和PLUS版，分别主打家用和商用市场。前天开始众筹预售的是BOE画屏MINI版，众筹周期30天，仅用了两天就已完成了60%的目标。
国家已将数字创意和数字展示产业列入国家战略性新兴产业，力图把该产业打造成产值超10万亿级的新支柱产业。BOE画屏推出后，得到了文化部等国家部委的高度认可和支持。任重道远，我们会继续努力！还请继续关注！"
95,感谢王东升董事长、感谢BOE人！加油！,谢谢您的关心！我们一定倍加努力！
96,请董秘协助了解，成都OLED产品良率现在到什么程度了？何时能够量产？何时会就OLED屏出货事宜与苹果进行定货谈判？谢谢！,您好，公司成都柔性AMOLED产线进展顺利，正在全力加速推进量产，有望于10月份实现量产。谢谢。
97,还没收回成本就发现如CRT显示器被LCD取代一样，被OLED取代了。到时怎么办？虽然现在OLED大尺寸还有技术缺陷。技术发展这么快。5年之后呢？是不是现在武汉的生产线刚建好就报废。,"公司新产线的投建是以市场需求为导向的。建设新生产线，会进一步扩大京东方在TFT-LCD产业中的市场份额，使产品覆盖范围更加完善，对客户和市场需求做出快速反应，适时调整产线产品结构，将进一步提升我国高端显示产品的全球竞争地位。
公司积极布局LTPS、AMOLED、Oxide、柔性显示等新型半导体显示技术。成都第6代LTPS /AMOLED生产线投产后，京东方在中小尺寸高端显示技术的竞争力将进一步提升。同时京东方还积极拓展工控、医疗、白电、车载、穿戴、ESL、拼接、IWB、电子标牌等高速增长的新应用市场，以满足未来多元化的市场需求。
LCD和OLED在产品上定位不同，LCD将主要聚焦在高性能、大尺寸产品，OLED主要定位在移动、可穿戴领域产品。从市场需求来看，目前无需担心产能过剩。随着新互联网时代的发展、消费者消费观念的转变和TFT技术的不断进步，传统显示需求及新型显示需求均有良好的成长空间。
"
98,请问王董事长，十年磨一剑不快也光，京东方看着越来越大，股价咋不见长进，难道公司对市值管理没兴趣吗？这个股价不符合公司形象啊,谢谢您的关心！今年以来我们的股价整体是往上走的，跑赢大盘。我们会进一步加强市值管理和宣传，促进市值稳定向上。请大家放心。
99,给投资者更多回报最直接最有效就是提升股价，比什么回购、分红都有效！,"您好！非常感谢您的关注！
公司也非常重视市值管理，我们在业绩提升、分红、回购的同时，也会加强公司市值管理，加大市场宣传力度，让投资者，特别是更多机构投资者能在公司股东构成中占据较高位置。"
