,Question,Answer
0,公司是否会进军新的细分市场和领域，以及扩大市场占有率？如果会，请问新的领域现在占公司营业收入比重是多少？未来打算提升到多少？多长时间能实现？,公司致力于规道交通领域，公司将结合整合RPS的业务，引进RPS的先进技术和产品，扩大公司在国内的产品线。同时，通过RPS把凯发的产品推向欧洲市场。
1,公司现有产品最近价格是否稳定，最近公司产品出货量怎样？上游的企业是否大量备货？,"您好，公司产品主要应用于高速铁路和城市轨道交通牵引供电行业，属非标准化的定制产品，因此，较难比较不同项目、不同型号的产品价格。公司采用“以销定产”的生产模式，根据客户需求进行订单式生产，因此上游原材料的采购备货和产品生产发货情况主要依据客户项目的实际需求。目前，公司整体生产经营平稳。
非常感谢您的关注！"
2,自从微博出现后，对于舆情的关注和扩散在一定程度上都有所放大，关于舆情的监控，公司有些什么样的手段？而在应对负面舆情的时候，又有什么样的应急措施？,"公司密切关注包括微博在内的舆情，对负面的消息，及时了解真实情况，根据反应的严重程度，通过澄清公告、邀请记者采访等形式，恢复投资者对公司的信息。
谢谢！

"
3,请问ＢＤ03和ＢＤ04这二个标段金额是多少？因为已经公示结束了？能否告知。,您好。您所说的两个标段未达到披露要求，不便披露，敬请原谅。非常感谢您的关注。
4,公司如何规避各种风险，如产品质量、资金、管理等，减少各种负面事件？,公司自成立以来，守法规范经营，公司不断建立健全内控管理制度，在制度层面防控风险。公司通过了质量管理体系、环境健康管理体系等认证，自成立至今，不存在因产品质量等的造成的负面影响。公司自成立以来，产品质量过硬，在北京地铁15号线、广州地铁项目等多次获得业主的表彰。感谢您的关注。
5,请问：公司产品的技术含量如何？专利多吗？行业垄断地位如何？ 那些项目能给公司带来利润增长点？预计是否能保持3年的增长？,"您好，公司主要产品高度集中了计算机技术、通信技术、网络技术、电力电子技术、供变电技术、继电保护技术、自动化技术等，对技术开发和升级的要求较高。公司经过多年的技术研发和积累，已经申请并获授予了40余项国内专利。随着公司不断发展壮大，公司在轨道交通装备领域已经具有较高的市场知名度和市场占有率，成为轨道交通装备领域的领先厂商之一。公司主要从事高速铁路和城市轨道交通牵引供电相关业务，整体业务规模将随着国内和国际市场相关行业的投资规模而化。
非常感谢您的关注！
"
6,虽说股价波动是市场行为，但是，还是希望公司在提振股价、提升股东信心方面有所作为，不知公司有何想法举措？,公司致力于提升业绩，加强与投资者沟通交流以提升投资者的信心
7,去年的市场行情并不好，物价又涨，今年公司在市场开拓方面有什么计划？能否详细谈谈？,"您好。国内轨道交通的持续快速发展为公司发展提供了广阔的前景。
截止2016年12月31日，公司（及控股子公司）在执行合同共计约19.09亿元。随着公司重大资产购买实施完成，标的公司纳入公司合并报表范围，公司主要财务指标均大幅增长。在市场营销方面，国内业务将力保在国铁电气化铁路及高速铁路细分市场的领先地位，大力拓展城市轨道交通各城市相关业务；在海外方面，力保RPS在德国电气化铁路市场领先地位，同时加大东欧及北欧国家电气化铁路市场开拓。根据目前掌握的市场信息初步统计，2017年公司境内外新增订单和销售收入均将呈现稳步增长的势态。
非常感谢您的关注！"
8,做为高管你对公司的股价有何看法？股价的上扬能体现上市公司的潜质和气魄！希望管理层关心一下自己公司的股价！以提振二级市场的股东对公司的信心！！！谢谢,"公司的股价应该是公司经营业绩和实力的反映，但是受到股市诸多影响很大。我们相信在公司坚持不懈地致力提高业绩，加强与投资者交流，一定会提振二级市场的股东对公司的信心。谢谢！



"
9,"公司采取了具体怎样的应对措施,在同业中不断做大做强?","您好。2017年，公司将借助资本市场，积极推进再融资工作。
凯发电气在收购德国RPS后，为更好的发挥本次收购带来的协同效应，公司需要及时建设并实施符合行业趋势的产业项目以适应不断发展变化的产业环境，保持行业领先地位。一方面拟将RPS先进的固体绝缘开关柜、接触网关键零部件等产品、技术及施工能力等引进、吸收、转化为可满足国内轨道交通建设所亟需的高端装备和服务能力，并与凯发电气现有的轨道交通自动化优势产品契合，形成轨道交通一二次设备技术互通、产品联动、客户资源共享的业务规划和战略布局；另一方面，拟进一步提升德国RPS现有的轨道交通接触网业务水平和作业能力，以保证其与未来德国联邦铁路接触网建设投资大幅增长相匹配、巩固RPS在德国轨道交通接触网领域的领先地位，并增强RPS开拓德国境外“一带一路”沿线国家轨道交通接触网市场的能力、更好地服务国家“一带一路”战略规划的实施和凯发电气发展战略的实现。
通过再融资的实施，公司可以在充实资本实力的同时，加快推进技术引进和产品创新步伐，巩固和提升公司的行业地位和核心竞争力，进一步提升公司营运能力和盈利水平，为公司发展提供新的动力。
      初步完成国际化布局、搭建技术与产品转化平台
随着2016年度完成对RPS重大资产收购，公司将充分利用RPS国际业务的开拓，初步完成国际化布局。借助RPS在欧洲的丰富工程业绩以及品牌影响力，结合国家“一带一路”战略和“中国装备制造业走出去”政策，公司将搭建有效的技术与产品转化平台，加快引进新技术、新产品，同时将公司成熟和先进的产品与技术推向海外，公司将统筹利用境内外两种资源、两个市场，拓展国内和国际业务。
       公司承担巴基斯坦拉合尔轨道交通橙线项目PSCADA系统，实现了海外项目“零”的突破。该项工程是国家“一带一路”战略框架下中巴经济走廊首个签约的基础设施项目，也是巴基斯坦第一条城市轨道交通项目。该项目的成功取得是公司实施海外发展战略，深耕细作目标市场所取得的阶段性成果，对于公司在后续国际市场开发与经营必将产生巨大推动作用。
       2017年公司将与RPS共同搭建跨境研发和设计平台，共享资源，加快产品与技术互相转化，形成轨道交通一二次设备技术互通、产品联动、客户资源共享的业务规划和战略布局，实现与RPS战略协同发展，进一步增强公司竞争力。
       截止2016年12月31日，公司（及控股子公司）在执行合同共计约19.09亿元。随着公司重大资产购买实施完成，标的公司纳入公司合并报表范围，公司主要财务指标均大幅增长。在市场营销方面，国内业务将力保在国铁电气化铁路及高速铁路细分市场的领先地位，大力拓展城市轨道交通各城市相关业务；在海外方面，力保RPS在德国电气化铁路市场领先地位，同时加大东欧及北欧国家电气化铁路市场开拓。根据目前掌握的市场信息初步统计，2017年公司境内外新增订单和销售收入均将呈现稳步增长的势态。
       公司将不断引进各层次人才、吸取国外先进的管理经验、向重视制度设计、机制完善转化、完善公司管理体系，适应公司国际化发展的需求。
非常感谢您的关注。"
10,请问公司在财务结构上有什么不足，打算采取哪些举措。,您好，随着公司经营业务的快速发展和境外市场的不断开拓，公司整体营运资金有所短缺、资本实力尚显不足，在财务结构上反映出资产负债率相对偏高。目前，公司已通过实际控制人股权质押担保融资以及加强应收账款催收等方式补充营运资金，后续公司将通过再融资（已披露）等方式进一步补充营运资金、完善财务结构，谢谢。
11,在企业文化方面，公司有什么特色吗？,您好。凯发电气是一个年轻的公司，是一个年轻人的团体。在这个团体里，聚集了一批具有创业精神而又脚踏实地的年轻人，他们以年轻人特有的朝气和热情，将认知、意愿、诉求和理念融汇其中，蕴育出独特的企业文化和共同信奉的价值观：“追求卓越，创造品牌，质量第一，用户至上”。非常感谢您的关注！
12,公司及管理层是否鼓励员工长期持股？会不会任由员工和大小非减持？,公司鼓励员工长期持股，员工减持必须遵守相关法律法规。谢谢！
13,公司管理层应该用实际行动树立诚信！股市，社会对责任诚信的渴望，远远胜过了任何广告效应！全国3000千万股民都会记得你们。我会继续持有公司股票，希望持有一家受人尊敬的上市公司！,"管理层以诚实守信、勤勉尽责经营公司，以期不辜负广大投资者的期望。感谢您的公司的信任。

"
14,"公司的持续良性发展是投资者投资信心的有力保证,愿公司的发展能为投资者带来良好的回报!请问公司领导对今年有信心吗？",您好！非常感谢您的关注，也非常感谢对公司的建议！我们非常认同您的价值观，公司会继续努力深耕轨道交通领域，促使公司持续健康的发展。以诚信的原则服务于客户回报股东。非常感谢您的关注！
15,请问公司上一季生产经营状况如何？与去年同期相比如何呢？,"2017年一季度，公司实现营业收入25,115.91万元，营业利润亏损3,692.38万元，归属于上市公司股东的净利润亏损3,666.62万元。受公司所在行业特点、气候和传统节日春节等因素影响，每年第一季度收入规模相对较小，占全年收入的比例较低，而费用在全年均匀发生，造成一季度亏损。2017年一季度公司亏损较去年同期增加3,180.94万元，主要原因包括两方面：一是公司收购的三家公司与凯发电气均属于同一行业，受季节性因素影响一季度通常处于亏损状态，2017年一季度其合计亏损额为1,612.41万元，相应影响了公司合并报表的净利润水平；二是除上述3家收购公司外的原有境内公司2017年一季度的销售收入比上年同期下降2,152.86万元，同时，公司当期流动资金贷款和置换3家标的公司原有保函的担保导致财务费用增加，使得一季度亏损较去年同期增加约1,568.53万元。"
16,希望贵公司能借中国在今后一段时间大力发展轨道交通的机遇，努力把公司做大做强，掌握先进技术，等把中国的轨道交通搞完了，再去其他国家搞！,您好，感谢您的关注。公司经过近二十年的发展，在国内轨道交通装备领域已经具有较高的市场知名度和市场占有率，成为国内轨道交通装备领域的领先厂商之一。在后续发展中，公司一方面将把握国内轨道交通市场快速发展的契机，继续做大做强原有业务，提高市场占有率；另一方面，公司将立足于轨道交通行业并结合自身技术积累和市场优势，热烈响应国家“一带一路”和《中国制造2025》战略规划，积极推进轨道交通优势产品和先进技术的“走出去”和“引进来”，以进一步提升公司的整体竞争实力和盈利能力，回馈公司股东，谢谢。
17,你好，请问贵司目前产品的销售趋势如何？今年的销售目标是多少？公司有没有一个具体可行的持续增长计划？,"您好。根据公司披露的在执行合同金额持续增长，表明公司的产品销售持续向好。
随着公司重大资产购买实施完成，标的公司纳入公司合并报表范围，公司主要财务指标均大幅增长。在市场营销方面，国内业务将力保在国铁电气化铁路及高速铁路细分市场的领先地位，大力拓展城市轨道交通各城市相关业务；在海外方面，力保RPS在德国电气化铁路市场领先地位，同时加大东欧及北欧国家电气化铁路市场开拓。根据目前掌握的市场信息初步统计，2017年公司境内外新增订单和销售收入均将呈现稳步增长的势态。
非常感谢您的关注！"
18,"这几年社会道德严重滑坡,不讲诚信，为了个人利益突破道德底线的行为屡屡发生，你作为企业高管如何看待？",作为公司的董事长，本人及公司其他董事、监事高级管理人员诚信经营，不存在违法违规的行为，同时作为上市公司，我们切实履行社会责任，提升员工薪酬、进行社会捐赠等，以实际行动共同营造诚信社会。感谢您的关注。
19,公司今年有没有新产品和新业务拓展？对城镇一体化带来大发展机遇，公司有没有具体的发展计划？,您好！公司将紧抓轨道交通发展的机遇，一方面拓展市场，另一方面加大新产品的开发及产业化，以提升公司的竞争力。产业化具体项目请您关注公司募集资金公告。非常感谢您的关注！
20,做大、做好市值管理是每个公司成长的必然追求，公司是如何进行市值管理的？,公司股价与公司业绩和股市的波动相关，公司致力于业务的持续增长，以效益回馈投资者。
21,请问贵公司为何一方面拟通过增发筹钱来扩大生产，却同时还有大笔的闲置资金去买理财产品？这是否自相矛盾？,您好，公司在一季度收到部分已完工项目的回款，同时，公司为解决后续流动资金需求一次性申请了1.5亿元借款（公司部分股东提供股权质押融资担保），目前，根据资金使用计划近期尚有少量闲置资金，公司为充分发挥资金使用效率，保障股东利益最大化，拟使用部分闲置资金购买短期银行保本理财产品。谢谢您的关注。
22,能否告知一下新年第一季度的情况怎么样?,您好！公司已在4月26日发布2017年一季度报告，请您到巨潮资讯网查询！非常感谢您的关注！
23,"去年有机构投资者去公司做调研吗,都是哪些？我们这些中小投资者在哪里能看到机构投资者的调研情况？",2016年度，公司共接待了8次投资者的调研活动，调研结束后均在巨潮资讯网上发布具体情况。公司2016年年度报告中也有汇总，敬请参见公司于巨潮资讯网上发布的年报第四节之十报告期内接待调研、沟通、采访等活动登记表。感谢您的关注！
24,希望公司在适当的时侯推出激励计划来聚集和挽留人才，保持公司的竞争力！,公司今年已推出限制性股票激励计划，目前授予工作正在进行中。感谢您对公司的关注。
25,请问公司有闲钱去购买理财产品，为什么还要增发圈钱呢？公司应该不差价的。2017年至今天已经中标了很多项目，问董秘，从来不正面回答，如果是已经中标的，明确回答也不是信息披露违规的。,您好，公司在一季度收到部分已完工项目的回款，同时，公司为解决后续流动资金需求一次性申请了1.5亿元借款（公司部分股东提供股权质押融资担保），目前，根据资金使用计划近期尚有少量闲置资金，公司为充分发挥资金使用效率，保障股东利益最大化，拟使用部分闲置资金购买短期银行保本理财产品。谢谢您的关注。
26,根据各地官网及中铁电气化路局及各路局的公告，2017年至今，已经中标了很多项目，初步测算有近6亿元了吧？但公司是不是为了增发，故意隐而不报呢？要做有诚信、有品质的上司公司。,您好！首先感谢您对公司的关注。也谢谢您的美好愿望，2017年至今根据各地官网及中铁电气化路局及各路局的公告，公司确已中标很多项目，但未达到披露要求。谢谢！
27,一直指望公司会推出高送转方案，不知道今年是否有希望，什么时候能出预告？,公司分红预案已披露，请查阅相关公告。
28,希望公司在本专业领域专注于做强做大做实，提升公司的行业地位，给投资者以回报！,您好！非常感谢您的关注，希望您多提宝贵意见！谢谢！
29,公司未来发展前景如何?对目前这个行业的前途看好吗？,"    您好！公司对行业看好，而且将继续坚持在轨道交通行业拓展公司的业务范围。
    截至2015年底，全国铁路营业里程达到12.1万公里，居世界第二位，其中高速铁路运营里程已超过1.9万公里，居世界第一位，占世界高速铁路总里程的60%以上；高速铁路在铁路运营里程中的占比逐年提升，已达15.70%。“十二五”期间，特别是2013年铁路管理体制改革实施后，铁路建设投资力度加大，建设效率提高，路网规模和质量显著提升。2013至2015年年均投产新线7,661公里，2014年和2015年连续两年固定资产投资完成额均超过8,000亿元，2013至2015年年均投产新线7,661公里。根据最新出台的《中长期铁路网规划》，预计到2020年，一批重大标志性项目建成投产，铁路路网规模将达到15万公里，其中高速铁路3万公里，“十三五”期间高速铁路运营里程复合增速约为10%。
    在城市轨道方面，国内城市轨道系统通车线路和投资总额近年来均呈现快速增长趋势。截至2015年末，全国共有26个城市开通城市轨道系统，线路共计116条，运营线路总长度达3,618公里，同比增长14%。其中，地铁和轻轨运营里程达2,891公里，占比近80%。根据中国城市轨道交通协会出版的《城市轨道交通2015年度统计和分析报告》相关信息，十三五期间，我国规划建设城市轨道交通的城市将达到80座，已批准立项的40多座。城市轨道交通将建成运营线路超过3,000km，至十三五末全国城市轨道交通运营里程将达6,000km以上，轨道交通投资总额将达1.7-2万亿元。
    在城际铁路方面，国内城际铁路网络进入建设高峰期。截至2015年末，全国城际铁路运营里程达3,212公里，“十二五”期间复合增速达64%。根据国家发展改革委和交通运输部于2015年11月发布的《城镇化地区综合交通网规划》，预计到2020年，城际铁路运营里程将达到3.6万公里（含利用路网铁路），覆盖98%的节点城市和近60%的县（市）。
非常感谢您的关注！"
30,公司募投项目现在有效益发吗？效益如何？,您好！公司本次募集资金项目募投期为两年，两年后形成产能逐步达到收益，有关公司募投项目情况请您关注公司相关公告情况！非常感谢您的关注！
31,请问公司有无通过发行公司债券等形式进行募资的计划？有无设立并购基金收购标的的计划？,"公司暂无设立并购基金收购标的的计划。
公司研究各种可行的融资方式，公司债券也是公司考虑的融资方式之一。
谢谢！"
32,"京通铁路朝阳地至通辽段、四平至齐齐哈尔铁路郑家屯至榆树屯站、通辽至让湖路铁路电气化改造工程，叶柏寿至赤峰铁路扩能改造工程安全监控系统、接触网开关控制站、综合自动化系统招标编号:STJW2017-022）招标评标结果公示”的通知，内容如下：标段
排序
 中标候选人
BD-03
 1
 天津凯发电气股份有限公司
 
2
 长园深瑞继保自动化有限公司
 
3
 南京南瑞继保工程技",您好！公司在招标方公布中标公示期满后，经过合同谈判签订供货合同。公司将根据合同金额是否满足披露要求来予以及时披露。非常感谢您的关注！
33,"http://www.lntb.gov.cn/Article_Show.asp?ArticleID=788137,官方已经公布中标公示，公司还想进一步否认吗？",感谢您的公司的关注。公司在招标方公布中标公示期满后，经过合同谈判后，签订供货合同。公司根据合同金额，判断是否披露。未达到披露要求的，公司不再予以披露。
