,Question,Answer
0,公司现阶段发展过程中有何不足？面临的最大挑战是什么？如果新客户在磨合期放弃与公司合作，公司有无应对措施？,公司现阶段面临的较大挑战是行业最终客户需求波动以及技术升级换代的风险。针对这些挑战，公司将努力扩大现有产品的市场份额，持续增加新的产品种类，同时加强电信和数据通信两个市场的开拓。密切跟踪行业技术发展趋势，在研发投入上重点向新产品、新技术倾斜，同时积极寻求与行业领先者紧密合作的机会，确保公司及时推出适应市场需求的新产品。
1,公司及管理层是否鼓励员工长期持股？会不会任由员工和大小非减持？,公司及管理层鼓励员工长期持股，与公司共同成长。
2,公司现有产品最近价格是否稳定，最近公司产品出货量怎样？上游的企业是否大量备货？,公司近期产品价格没有大幅波动，产品出货正常稳定。为保证生产持续稳定，公司对部分原材料进行了备货。
3,做大、做好市值管理是每个公司成长的必然追求，公司是如何进行市值管理的？,您好！一方面做大做强公司业务是市值管理的基础，另一方面公司将继续做好信息披露工作，根据交易所等监管部门的要求，及时将发生的重大事项向广大投资者披露，准确向市场传达公司的经营情况。
4,"公司采取了具体怎样的应对措施,在同业中不断做大做强?","公司在业务经营方面主要做好以下几方面：
1、重点拓展PLC、MEMS和高速有源三大技术平台，研发更多新产品，实现新产品产业化。
2、开拓和服务好优质客户，提供优质产品和良好服务，增强市场地位。
3、加快实施募投项目，扩大主要产品产能，满足客户订单增长需求。"
5,"这几年社会道德严重滑坡,不讲诚信，为了个人利益突破道德底线的行为屡屡发生，你作为企业高管如何看待？",作为上市高管，首先要把股东及董事会的受托责任放在第一位，诚信勤勉，以职业态度和工作作风对待工作职责。同时，作为高管需要支持和配合公司建立完善的公司治理和内部控制体系，从制度上防范侵害公司和股东利益的行为发生。
6,公司管理层应该用实际行动树立诚信！股市，社会对责任诚信的渴望，远远胜过了任何广告效应！全国3000千万股民都会记得你们。我会继续持有公司股票，希望持有一家受人尊敬的上市公司！,您好！感谢您对公司的支持，我们会努力的。
7,你如何看待同行业其他公司的经营情况？在同行业竞争中，公司排名第几？你认为公司业绩增长的主要优势或障碍在哪里？,您好！这几年中国光通信市场得到了很大的发展，给光器件公司提供了难得的发展机遇。各个同行业公司之间互相合作也互相竞争是一种健康的生态，能够共同把市场这块蛋糕做大。
8,希望公司在适当的时侯推出激励计划来聚集和挽留人才，保持公司的竞争力！,感谢您的关注与支持。公司将在未来合适时机推出长期激励政策，进一步完善员工考核激励体系。
9,公司今年有没有新产品和新业务拓展？对城镇一体化带来大发展机遇，公司有没有具体的发展计划？,"公司今年将继续投入光有源器件业务，扩大产能，增加型号品类。同时继续研发光无源器件，增加产品型号品类，增强市场地位。
工业和信息化部出台的《信息通信行业发展规划（2016-2020年）》提出“全面构建新一代国家信息通信基础设施”，“到2020年，‘宽带中国’战略各项目标全面实现，基本建成高速、移动、安全、泛在的新一代信息基础设施，初步形成网络化、智能化、服务化、协同化的现代互联网产业体系”。规划提出“推动高速光纤宽带网络跨越发展。基本完成老旧小区光网改造，实现城镇地区光网覆盖，提供1000兆比特每秒以上接入服务能力，大中城市家庭用户带宽实现100兆比特每秒以上灵活选择。基本实现行政村光纤通达，有条件地区提供100兆比特每秒以上接入服务能力，半数以上农村家庭用户带宽实现50兆比特每秒以上灵活选择。推进超高速、大容量光传输技术应用，升级骨干传输网，提升高速传送、灵活调度和智能适配能力。”这一规划是与城镇一体化趋势相关的。公司的主要产品应用于与此相关的光纤到户市场和波分复用市场。"
10,在企业文化方面，公司有什么特色吗？,您好！公司提倡诚信做人，踏实做事，关注细节，鼓励员工与公司共同成长。
11,公司是否会进军新的细分市场和领域，以及扩大市场占有率？如果会，请问新的领域现在占公司营业收入比重是多少？未来打算提升到多少？多长时间能实现？,公司自2015年下半年进入光有源器件领域，开始生产销售ROSA（光接收组件）产品。2016年公司光有源器件实现销售收入4283万元，占公司营业收入的13.49%。预计今年光有源器件销售收入占比将继续提升。
12,今年人工费用是否还会出现阶段性上涨？,预计今年人工费用会继续上涨。员工薪酬增加有利于提升员工个人福利。公司将通过技术工艺改进和管理方法改善来提升内部效率，抵消人工费用上涨的影响。
13,去年的市场行情并不好，物价又涨，今年公司在市场开拓方面有什么计划？能否详细谈谈？,您好！公司在巩固现有的电信市场地位的同时，积极开拓数据通信市场，确保公司业绩持续增长。
14,"国家要求实行经济节约型政策,公司具体是怎么做的?",作为研发制造型企业，公司自成立之初就形成节约成本的企业文化和工作作风，在全业务链上努力降低生产成本、提升效率、节约费用支出，为客户、为股东创造更多价值。例如，公司在嘉兴厂房楼顶安装了太阳能电池板，实现部分用电自供。
15,"公司的持续良性发展是投资者投资信心的有力保证,愿公司的发展能为投资者带来良好的回报!请问公司领导对今年有信心吗？",您好！感谢您的关注与支持。当然有信心！我们会持续关注行业和市场发展趋势，努力提升公司业绩。
16,请问公司上一季生产经营状况如何？与去年同期相比如何呢？,公司2017年一季度实现营业收入8838.80万元，比上年同期增长12.09%；归属于母公司股东净利润2011.57万元，比上年同期增长18.50%。
17,你好，请问贵司目前产品的销售趋势如何？今年的销售目标是多少？公司有没有一个具体可行的持续增长计划？,您好！公司将努力保持业绩持续、稳定增长，加强电信和数通两个市场的开拓，紧跟行业技术发展趋势，确保及时推出适应市场需求的新产品。
18,一直指望公司会推出高送转方案，不知道今年是否有希望，什么时候能出预告？,2017年4月12日公告的公司第三届董事会第十七次会议决议审议通过的2016年度公司利润分配预案，以2016年末总股本为基数，向全体股东每股派发现金红利0.2元（含税）。此预案将在2016年度股东大会上审议。
19,"去年有机构投资者去公司做调研吗,都是哪些？我们这些中小投资者在哪里能看到机构投资者的调研情况？",您好！机构投资者于去年11月8日到公司进行过现场调研，调研的基本情况可在巨潮资讯网查阅。
20,公司的规模优势具体会体现在哪些方面？公司的品牌如何管理？互相间的市场是否有重合以及竞争关系？如何增强各品牌间的凝聚力？,"公司PLC光分路器和DWDM器件产品在细分产品市场的占有率居前列，形成了较好的规模优势。公司正在发展ROSA等新产品，扩大产能，增加在客户的占有率，努力实现规模优势。
公司的产品属于工业品，客户是通信设备商和通信运营商。公司的品牌管理重点在于向客户提供高质量产品及快速、高效的客户服务，展现企业团队素质和态度，形成良好口碑和声誉。"
21,能否告知一下新年第一季度的情况怎么样?,您好！一季度公司实现营业收入8838.8万元，比上年同期增长12.09%；归属于母公司股东净利润2011.57万元，比上年同期增长18.50%。
22,公司是2016年10月12日上市的，主营业务是什么？,"公司的主营业务是光通信领域集成光电子器件的研发、生产和销售。公司专注于集成光电子器件的后端封装，为电信传输及接入网和数据通信提供光无源和有源器件。
公司主要产品包括光无源器件和光有源器件两大类。
光无源器件指不进行光电转换的器件。目前公司的光无源器件有用于光纤到户的PLC光分路器、用于骨干网、城域网密集波分复用（DWDM）的阵列波导光栅（AWG）和可调光功率波分复用器（VMUX）、用于功率衰减的PLC可调光衰减器（VOA）和MEMS可调光衰减器、光器件广泛使用的中间品光纤阵列等。
光有源器件指进行光电转换的器件。目前公司的光有源器件主要有用于数据通信光收发模块的40G和100G的光接收组件（ROSA）。"
23,叔叔好，中信证券之前有哪些公司完成上市工作？,感谢对中信证券的关注，中信证券作为国内领先的投资银行，已经协助各行业多家公司完成IPO上市，后续中信证券将继续秉承认真负责的态度，履行保荐机构对于发行上市工作的相关职责，为中国资本市场的发展保驾护航。
24,朱总可否介绍一下公司TOSA产品的研发进展，其他新产品是否有新的进展？,您好！我们会持续开发升级现有产品，适时推出适合市场需求的新产品。
25,公司未来发展前景如何?对目前这个行业的前途看好吗？,"公司主要产品均应用于光纤通信网络，所处细分行业为光电子器件行业，处于光通信产业链的上游。
随着移动互联网、网络视频、云计算、物联网等业务的蓬勃发展，网络数据流量持续爆发式增长，驱动高速大容量光传输网络、大型数据中心与无线网络市场快速发展。2016年全球电信运营商固定资产投资下降，但其中光网络设备投资较上年增加。同时，全球大型数据中心建设继续保持高速发展。在电信网络和数据中心两方面需求驱动下，2016年全球光器件市场保持较好增长，全球市场规模大约在80亿美元左右。根据LightCounting预测，2017到2020年全球光器件市场年均复合增长率将达到10%。
公司看好所处行业未来发展前景，将努力做好业务经营，借助行业发展趋势，实现较快速度成长。"
26,公司如何规避各种风险，如产品质量、资金、管理等，减少各种负面事件？,您好！公司将密切跟踪行业技术发展趋势，在研发投入上重点向新产品新技术倾斜，同时推进电信和数通两个市场。内部通过工艺改进和精细管理，提高效率和降低成本。
27,请问公司在光器件上目前的市占率状况是？,我们的光分路器和DWDM产品在全球市场份额中占据前列。
28,公司募投项目现在有效益发吗？效益如何？,公司募投项目已经开始产生效益。具体项目的效益情况请参见2016年报第四节之五、5、募集资金使用情况，以及2017年一季度报第三节之五、募集资金使用情况对照表。
29,希望公司在本专业领域专注于做强做大做实，提升公司的行业地位，给投资者以回报！,感谢关注和支持。我们会继续努力，瞄准国际领先技术，回报广大投资者。
