,Question,Answer
0,请问公司拟进入的什么新的细分领域吗？这一领域与公司现有业务的相关性？,"您好。
有关公司的业务发展规划详见公司2016年年度报告。
谢谢。"
1,未来几年， 公司如何定位， 哪些市场更适合公司产品的长远发展？,"您好。
有关公司未来发展规划见前面回复，或查阅公司2016年年度报告。
公司目前产品主要应用于建筑施工、装修装饰、建材加工等领域，具有广阔的市场。
谢谢。"
2,要实现公司的发展目标，请问信心来自哪里。,"您好。
信心来自董事会、管理层、全体员工的共同努力，以及广大投资者、公司客户的大力支持！
谢谢。"
3,公司高级管理人员的考评及激励情况怎样，有没有股权激励制度？,"您好。
公司董事会下设薪酬与考核委员会，负责制定、审查公司董事及高级管理人员的薪酬政策与方案，制定公司董事及高级管理人员的考核标准并进行考核。公司能够按照《薪酬与考核委员会工作细则》、《董事、监事薪酬管理制度》、《高级管理人员薪酬管理制度》等规定，公开、透明地对董事和经理人员进行绩效评价。公司严格按照《公司法》、《公司章程》等有关规定，聘任经理人员，并与经理人员签订聘任合同，明确双方的权利和义务。公司建立了经理人员薪酬与公司绩效和个人业绩相联系的激励机制，经理人员能够按照《公司法》、《公司章程》以及《总经理工作细则》等相关规定履行职责。
谢谢。"
4,公司目前主要的研发方面是什么？,"您好。
请您查阅2016年年度报告“第四节 经营情况讨论与分析—二、主营业务分析、4研发投入”中的相关内容。
谢谢。"
5,请问开完股东会后，如果送股通过几日内会送股？,您好，根据《上市公司股东大会规则》第四十四条 对顶股东大会通过有关派现、送股或资本公积转增 股本提案的，公司应当在股东大会结束后 2 个月内实施具体方案。公司2016年度利润分配方案详见公司2016年年度报告，该事项还须经股东大会审议通过方可实施。谢谢！
6,公司的发展战略是什么， 是否公司未来发展的主打方向？  以前没怎么听到这方面的动向， 能否详细讲解一下主要是面对哪些品种和市场？ 谢谢！,"公司未来将围绕五金工具、轨道交通装备、涂附磨具三大产业，创新经营模式，夯实基础管理，将公司打造成为盈利能力突出、核心优势明显、扎实稳健的集团化跨国经营企业。
一是继续提高现有工具制造业务经营水平，拓宽产品线，延伸产业链，在优化产品结构同时，向五金工具流通领域延伸，提升五金工具板块的盈利能力；二是推进高速列车制动闸片的产业化，建设轨道交通制动装置材料工程实验室，开展投资并购合作，加快打造轨道交通装备业务板块，形成公司重要的收入和利润增长极；三是以与常州市金牛研磨材料公司的重组为起点，切入涂附磨具行业，并以金牛公司为主体，在内生增长的同时，开展外延并购合作，将金牛公司打造成涂附磨具行业的旗舰型企业。
谢谢。"
7,公司截止至今的产品有多少个种类？,"您好。
目前已经形成产销的产品有金刚石工具、合金工具、电动工具，金刚石工具中有金刚石圆锯片、金刚石薄壁工程钻头、磨盘等，合金工具主要是木工锯片等，电动工具有钻机等产品。
谢谢。"
8,公司未来五年的目标是多少？能够实现吗？,"您好。
公司未来将围绕五金工具、轨道交通装备、涂附磨具三大产业，创新经营模式，夯实基础管理，将公司打造成为盈利能力突出、核心优势明显、扎实稳健的集团化跨国经营企业。
一是继续提高现有工具制造业务经营水平，拓宽产品线，延伸产业链，在优化产品结构同时，向五金工具流通领域延伸，提升五金工具板块的盈利能力；二是推进高速列车制动闸片的产业化，建设轨道交通制动装置材料工程实验室，开展投资并购合作，加快打造轨道交通装备业务板块，形成公司重要的收入和利润增长极；三是以与常州市金牛研磨材料公司的重组为起点，切入涂附磨具行业，并以金牛公司为主体，在内生增长的同时，开展外延并购合作，将金牛公司打造成涂附磨具行业的旗舰型企业。
谢谢。"
9,请问老总公司今年净利润同比增长多少？而管理费用去用比去年同期的增长了多少呢？,您好！2017年预算净利润同比增长100.89%，管理费用同比增长9.15%。谢谢！
10,请问2017年全年预计销售目标是多少亿元？实现净利润的目标是多少亿元？,"您好。
2017年公司总体经营目标是实现营业收入51,278.55万元，实现归属于母公司股东的净利润2,508.01万元，较2016年度分别增长19.26%和100.89%。
谢谢。"
11,公司2016年管理费用较上年同期相比如何，原因是什么？2017年会下降吗？,您好！2016年管理费用与上年基本持平，由于公司加强了费用管控，在多项费用上均有所下降，但是，由于公司投入办公设备设施、高铁刹车片等产品的研发费用，导致公司折旧费、研发费有所增长，两年的管理费用持平。2017年的管理费用会有所上升。谢谢！
12,新投资的项目今年能否为公司贡献利润？如有利润贡献，公司预计能实现多少利润？,"您好。
不知您具体指什么项目，请查阅公司2016年年报。
谢谢。"
13,请问公司目前的研发机构有哪些？公司未来产品的研发与创新将如何进行？,"您好。
公司企业技术中心是省级企业技术中心，未来将继续加强研发中心建设，突破思维定式，开阔眼界，打破产品范围禁锢，一方面果断淘汰现有产品中生命周期已近尾声的品种，另一方面对于技术新颖、发展趋势好、盈利前景好的产品，要敢于尝试，拓宽产品线，以产品研发推动公司向高端工具制造挺进。
谢谢。"
14,公司的前5大客户是哪些？,您好，公司前五大客户情况详见公司《2016年年度报告》第四节经营情况讨论与分析，二、主营业务分析，（8）主要销售客户和主要供应商情况。谢谢！
15,能简单的介绍下新项目的情况吗？,"您好。
不知您的是什么项目？请您查阅公司年报披露的相关情况。
谢谢。"
16,公司截至目前为止都有哪些子公司和参股公司？,"您好。
公司目前在美国、加拿大、泰国、中国上海等地设有多家子公司，详细情况请查阅公司“2016年年度报告第四节经营情况讨论与分析—七、主要控股、参股公司分析”。
谢谢。"
17,公司是否会计划多元化发展？,"您好。
未来三年，博深公司将围绕五金工具、轨道交通装备、涂附磨具三大产业，创新经营模式，夯实基础管理，将公司打造成为盈利能力突出、核心优势明显、扎实稳健的集团化跨国经营企业。
详细情况请查阅公司2016年年度报告“第四节经营情况讨论与分析——九、公司未来发展展望”中披露的内容。
谢谢。"
18,公司去年主打产品的销量是多少？,"您好。
请查阅公司2016年年报“第四节 经营情况与分析—二、主营业务分析—2、收入与成本”中披露的相关内容。
谢谢。"
19,公司募投项目，预期如何？是否谨慎？,"您好，公司近年来没有使用募集资金投资项目。
谢谢。"
20,请问公司的分配预案达到承诺的分红比例吗？,"您好。
公司《2015-2017年股东回报规划》规定：在年度盈利且累计未分配利润大于零的情况下，且满足公司正常生产经营的资金需求且足额预留法定公积金后，如无重大投资计划或重大现金支出计划等事项，公司将采取现金方式分配股利，以现金方式分配的利润应不低于当年实现的可分配利润的10%，且最近三年以现金方式累计分配的利润不少于最近三年实现的年均可分配利润的30%；具体以现金方式分配的利润比例由董事会根据公司盈利水平和经营发展计划提出，报股东大会批准。
公司2016年度的利润分配预案是以现有总股本33813万股为基准每10股分配现金股利0.3元，占合并报表中归属于上市公司普通股股东的净利润的比率为81.25%。符合相关规定。
谢谢。"
21,请问老总， 2016年存货是多少，存货增加的内容是哪些？,您 好！2016年末存货为14430万元，原材料金额略有增长，存货总额在减少。谢谢！
22,下午好，请问叔叔，公司什么时候复牌？,"您好。公司正在全力加快本次重大资产重组工作的推动，每五个工作日发布一次进展公告，公司预计将在4月9日前复牌。
谢谢。"
23,请问今年预计主要产品的销售目标是多少？净利润是多少？,您 好！公司2017年预计营业收入为51279万元，净利润2508万元。谢谢！
24,公司的前5名供应商是什么，与公司存不存在关联关系？,您 好！前五名供应商中有两名有关联关系，一名供应商为公司参股的公司，一名供应商与公司聘请的独立董事为同一人，具体情况请查阅公司2017年年报。谢谢！
25,张叔叔好，公司的主营业务是什么？什么时候上市的？,您 好！公司的主营业务是生产销售人造金刚石及制品、粉末冶金制品、电动工具及配件以及相关技术服务。公司是在2009年8月份上市的。谢谢！
26,2017年公司是否考虑对高管实行股权激励，如果有的话大概什么时候实行？,"您好。
公司目前没有相关计划。
谢谢。"
27,公司截止目前的股东总人数是多少？,"您好，截至2017年2月末，公司股东人数为18,581人。
谢谢。"
28,公司今年的财务费用会有多少？,您 好！根据公司的发展规划和预计的汇率变动，2017年财务费用预算为1118万元。谢谢！
29,公司在税收方面有没有相关的优惠政策？具体税率是多少？,您 好！公司享受减按15%的所得税税率、研发费加计50%扣除的所得税优惠政策。谢谢！
30,请问：公司已经投产的募投项目及超募项目，2017年是否可以完全投产并且贡献效益？这部分的折旧和费用对利润影响大吗？谢谢,您好。公司最近五年内没有募集资金。谢谢。
31,公司预计2017年业绩较去年同期是上升还是下降？若上升，则增幅是多少？,"您好！公司预计2017年实现归属于母公司股东的净利润2,450万元，比上年增长164.37%。谢谢！"
32,请问公司有无通过发行公司债券等形式进行募资的计划？有无设立并购基金收购标的的计划？,"您好。
公司暂无发行公司债券计划。将来根据公司经营及投资需要决定是否以发行债券或股票募集资金。
公司目前没有设立并购基金的计划。公司如有上述事项将及时披露相关信息。
谢谢。"
