,Question,Answer
0,谈一谈2018年的公司的利润分配政策？,公司已经披露了2017年度利润分配方案及制定了未来三年分红政策。2018年，董事会将根据公司实际发展情况并结合股东诉求，制定相应的利润分配方案，谢谢。
1,贵公司董事配偶窗口期增持公司股票，是误操作还是公司有未披露的事项？,董事配偶因误操作违反了窗口期禁止买卖股票的规定，公司已要求相关人员进一步加强学习，以遵守相关规定。 
2,公司如何看待电桩和光伏产业的发展的？,国家鼓励发展新能源产业，未来随着新能源汽车数量的增加，充电桩有非常大的市场需求，我们坚定看好充电桩和光伏行业，谢谢。
3,公司投建光伏电站项目，是否会造成公司现金流紧张？,投资者您好，光伏电站项目从开发到建设，具有投资金额大的特点。对此，公司会通过多种途径的融资途径来解决光伏项目的资金需求。
4,请问现在公司的股东人数是多少？,最近一期股东人数可关注刚刚发布的一季报里面披露的股东人数，谢谢。
5,谈一谈公司市值管理？近期公司暂未收到股东增持计划？,公司在市值管理这一块，我想主要在做好公司业绩的基础上，能够通过内生和外延的方式做大公司市值；截止目前暂未收到股东增持计划。
6,新能源汽车补贴“退坡”，对公司业绩有没有影响？,补贴退坡对行业发展有暂时的影响，但随着国家陆续出台政策支持，我们对行业未来发展有信心。
7,谈一谈公司的核心的发展战略？相比同业竞品公司有何技术优劣？,公司将从单一的制造向制造加服务转型，以电力成套设备为基础，大力发展充电桩、光伏发电、智能配电等；公司在大功率快充领域有了一定的技术基础，并实施了相关案例。
