,Question,Answer
0,公司对同行竞争对手有怎样的考量？你们的成本、管理、市场等优势体现在哪些方面？,您好。公司一直以来注重自身核心竞争力的打造，目前公司核心竞争优势主要体现在：1、全球化的采购及营销网络。2、持续增长的优质客户群。3、全产业链运营及最高标准的质量管理体系。4、强大的产品研发能力以及技术储备和转换能力。谢谢您的关注与支持。
1,作为一个投资者，在资本市场下行期很看好公司的发展，水产工业化规模养殖是大势所趋，希望公司越做越好，在李忠总的带领下一步一个脚印，早日实现5年目标，成为世界一流的水产企业!!!,您好，谢谢您的支持！我们也会齐心协力，抓住市场发展机遇，充分发挥公司优势，大力提高公司盈利能力，提升公司内在投资价值，谢谢！
2,请问公司今年是否有对外扩张的打算？今年公司在市场开拓方面有什么计划？能否详细谈谈？谢谢,"您好
一、先回答您关于对外扩张的问题：
我们一直在市场上找寻符合公司战略规划，和公司现有业务有较深协同，收购价格合理，且财务表现不错的标的。但由于目前海外资产价格处于历史高点，我们处于传统行业，标的的财务表现往往比较平稳，没有过高的增长率，无法支撑较高的出售价格，但我们不会放弃，好的并购需要多一些耐心，我们会一直围绕公司战略方向找寻合适的标的。
二、公司在市场开拓方面的规划，以内销业务来说，今年主要计划是继续完善国内营销体系，优化渠道，强化研发驱动，实现内销业务翻番。具体就是：大力开拓餐饮市场，做好连锁餐饮、团餐、乡厨等各种餐饮模式的销售服务，充分发挥市场部策划营销的功能，集中力量和资源，精耕、深耕核心市场。以品牌为导向，加强电商、商超、专卖店、礼品等直接面对C端的市场营销，提升客户服务质量，增强客户紧密度和忠诚度，塑造良好的品牌形象。加大食品创新投入，加强研发与营销市场部的密切配合，充分利用上海和湛江本部两大研发平台，构建丰富的终端化、高值化品系，树立行业产品壁垒，拓宽产品毛利空间。谢谢！"
3,虽然说公司的股价由二级市场决定，但股价是公司经营的一个表象，请问管理层对回报投资者持有怎样的态度？,您好！感谢您对我司的关注！作为公司的管理团队，我们认为最重要的是夯实管理基础、提升管理水平、抓住市场机遇、积极拓展市场、提升公司业绩和内在价值，以创造更优良的业绩回报广大投资者！同时积极做好信息披露，让公司价值得到认同。谢谢提问。
4,公司目前有哪些在建项目？建设进度如何？还需要多少资金？,公司目前在建项目主要有两个，一个是公司搬迁新工厂建设项目，一个是工厂化养殖建设项目。新工厂建设项目已经正式开始现场施工，工厂化养殖项目已经完成第1期投入。公司资金需求会根据项目进度情况安排，具体详见公司披露的定期报告及临时报告。谢谢！
5,公司募集资金投向项目进展如何，是否顺利?预计多久可以收回投资?,您好。谢谢您的关注与支持。公司募集资金使用情况请查阅4月26日披露的《2016年度报告》。
6,贵公司是否会考虑实施股票期权等规范股权激励方式，惠及更多员工？,您好。谢谢您的关注与支持。公司一直以来都非常重视员工激励，包括股票期权和限制性股票等方式。2017年1月份推出了限制性股票方案，目前已完成授予登记。未来不排除继续实施多形式激励方式。谢谢。
7,公司是否具备长期投资的价值？你是怎么看的？ 如果有机会，你会增持吗？,您好，公司具备：全球化的采购及营销网络、持续增长的优质客户群、全产业链运营及最高标准的质量管理体系、强大的产品研发能力以及技术储备和转换能力等核心竞争力，业务发展也比较迅速（具体可参考2016年年报和2017年一季度季报），管理层对公司发展非常有信心。公司高管基本都参与了公司本次的限制性股票激励计划，这也从侧面回答了您“如果有机会，是否会增持”的问题，谢谢！
8,请问公司以后每年会用什么形式回馈股东？,您好。谢谢您对国联水产的关注与支持。我们认为公司最重要的是夯实管理基础、抓住市场机遇、积极拓展市场，以创造更优良的业绩回报广大投资者！
9,目前公司享有的国家优惠政策有哪些？,公司目前享受的国家优惠政策主要集中在2方面，一方面是税收优惠政策，一方面是国家财政针对农业领域科研项目的补贴政策，具体详见公司财务报表附注中有关税收优惠政策和收到补贴情况的说明。谢谢！
10,对虾工业化养殖项目进展如何？盈利情况怎么样？有没有遇到问题？,您好，公司2016年已在南三基地（湛江）建设完成第一期项目，并在2016年末第一次投苗，目前第一造（次）已完成收虾，项目进展达到预期。养殖板块的盈利情况请参考公司一季报和关注公司半年报。项目进行过程中，当然会遇到挑战，比如在设备、管理、设计、饲料配方等多个环节都有提升空间，我们一直在做持续性优化和改进，谢谢！
11,请问具体联系证券代表的电话是多少？,您好。公司证券部咨询电话0759-2533778。欢迎来电交流。谢谢您的关注与支持。
12,公司领导怎么看现在公司的股价，对我们小散有什么忠告？谢谢,您好，感谢您对国联水产的关注与支持！ 二级市场的股价波动受市场等多方因素影响，目前公司经营一切正常，公司管理层将本着勤勉尽责的工作态度，一如既往的做好各项工作，以创造更优良的业绩回报广大投资者！
13,请问公司股票上市时期价格多少，现在多少，还具有投资价值吗？,您好，感谢您对国联水产的关注与支持！ 二级市场的股价波动受市场等多方因素影响，目前公司经营一切正常，公司管理层将本着勤勉尽责的工作态度，一如既往的做好各项工作，以创造更优良的业绩回报广大投资者。
14,"请问董事长,关于公司最新项目进展如何？达到预期了吗？",您好，您是否指的是公司的工厂化养殖项目？公司2016年已在南三基地（湛江）建设完成第一期项目，并在2016年末第一次投苗，目前第一造（次）已完成收虾，项目进度达到预期，谢谢！
15,公司的负债比率有多少？,截至2017年3月31日公司的资产负债率42%。谢谢！
16,公司是否在考虑开拓新的领域？取得初步进展没有？,您好，谢谢您的关注与支持，公司暂时没有考虑开拓新的领域，公司未来仍将聚焦主业，继续推进对产业链关键环节的布局。
17,近几年的固定资产，技术改造的投资效果如何，是否达到了预期的目标，不考虑市场因素，简单考虑毛利情况是否合理呀。,由于近几年宏观经济处于下行趋势，公司对待固定资产投资态度谨慎，最近几年没有进行重大固定资产投资，2016年第4季度才开始工厂化养殖项目投资，公司新工厂搬迁项目也于2017年开始动工。谢谢！
18,请站在独立董事的角度 评价一下这家公司。您的专业态度对我很重要！,您好。目前公司处于转型升级关键时期，公司原来是橄榄型的业务结构，即在前端养殖资源方面和后端的销售渠道布局相对较弱，而中间的加工环节布局较重。未来，公司将加大两端的布局，同时优化中间加工环节：在上游一方面大力发展工厂化养殖，另一方面在全球获取优质的水产资源；在下游加强国内外B端的订单型渠道和商超等KA渠道拓展；中间加工环节强化产品研发，为餐饮企业提供工厂化的食材加工。个人对公司转型升级充满信心。谢谢。
19,将来公司的下属公司会有上市的打算吗?,您好，公司控股/并表的公司已属于上市公司合并报表范围内，公司参股公司中暂还没有符合上市条件的公司，谢谢！
20,公司未来3年发展前景如何?,"您好。谢谢您的关注与支持。经过近年来的逐步摸索和优化，公司于2016年制定了集团未来五年的战略规划，确立了“成为全球最具有影响力的海洋食品企业”的宏伟愿景。根据这一目标，公司未来将致力于向“全产业链”、“全球化”的“优质水产蛋白及餐饮食品解决方案提供商”转型，以 “创新”、“运营”、“资本”作为公司发展的三大核心竞争力，为消费者提供新鲜、健康、安全的海洋食材，实现“为人类提供健康的海洋食品”这一使命。
（1）“全产业链”的产业布局。养殖环节，未来五年公司将以工厂化养殖为上游核心，带动种苗、饲料协同发展，有针对性布局发展动保业务；以资源为导向发掘捕捞业务机会；加工环节，公司战略重心向深加工转移，提高加工的智能化水平，持续降低人工成本并提高生产效率；销售环节，公司未来五年将B端客户，特别是餐饮渠道客户作为未来公司的核心客户群，同时积极拓展电商等优质流通渠道，打造公司在C端终端市场的品牌影响力。
（2）“全球化”的区域布局。一方面，公司未来将深耕中美两大核心市场，完善主流市场的营销网络布局。另一方面，公司将继续通过投资合作、设立区域办事处等多种方式完善东南亚和南美供应链体系，确保原料端稳定、高效、低成本的供应。
（3）“解决方案提供商”的商业模式。未来公司将整合公司内外部产业链生态，为前述优质客户提供包涵水产供应链管理、菜品研发、餐饮配送、中央厨房等多项增值服务，实现由加工贸易商向解决方案提供者的转型。
（4）“创新”、“运营”、“资本”作为公司发展的核心竞争力。为实现上述布局，公司将以产品创新、技术创新、模式创新和管理创新作为公司发展的核心驱动力；打造全球领先的水产养殖、加工运营管理能力；通过产融结合，通过资本运作迅速获取关键资源和能力。
"
21,对虾养殖业务进展如何？盈利情况如何？有没有大规模异地复制的可能性？,您好，公司2016年已在南三基地（湛江）建设完成第一期项目，并在2016年末第一次投苗，目前第一造（次）已完成收虾；养殖板块的盈利情况请参考公司一季报和关注公司半年报；该项目具备可复制的优势，公司也在做异地复制布局，谢谢。
22,作为一家上市公司，为了更有利于与投资者交流，能不能在公司网站上设置交流互动功能？,您好。谢谢您的建议，我们会提交相关部门完善。另外，巨潮资讯网的互动易平台也是正规的交流平台，如有相关建议和咨询，也可通过该平台交流。
23,公司现在负债总额是多少？每年负债的利息是多少？谢谢。,公司截至2017年3月31日负债总额约13.5亿，每年支付利息费用约3000万元。具体详见公司历年公告的财务报表。谢谢！
24,请问公司目前产能多少？,公司产能主要受在职普工人数影响。2016年公司产能约4万吨，2017年公司加大了普工招聘力度，同时引进部分自动化设备，预计产能将增加80%左右达到7万吨。感谢您对公司公司的关心和支持！
25,最近公司财务状况如何？,您好。公司2016年度和2017年第一季度报告的经营情况和相关财务数据具体情况请查阅4月26日披露的《2016年度报告》和《2017年第一季度报告》。谢谢您的关注与支持。
26,业绩说明会本来应该是恳谈会，将企业目前的处境，面临的困难，预计的风险和相应应措施清晰告诉股东。,"您好，感谢您对公司的关注！
目前公司面临的主要困难在于： (1)随着经营规模的进一步发展扩大，将对现有的管理体系、管理人员提出更高的要求。如公司管理水平不能随公司业务规模的扩大而提高，将可能会影响公司既定计划与目标的实现。（2）公司是劳动力密集型企业，“民工荒”使公司面临着水产加工人员尤其是熟练工人招聘困难和用工成本增加的压力，谢谢！"
27,请问独立董事，您的履职情况如何，是否能真正保护了中小股东利益？,您好。谢谢您对国联水产的关注与支持。本人任职期间，认真履行了独立董事的职责，恪尽职守，勤勉尽责。详细情况请查阅4月26日披露的《述职报告》，谢谢。
28,近一年来，贵公司高管考虑增持吗？,公司刚刚公布实施限制性股票激励方案，其中部分为公司高管认购。目前没有新的高管增持计划。谢谢！
29,新三板的扩容，带来了新的投资机会，你们公司在这方面有什么打算吗？,我们一直在市场上找寻符合公司战略规划，和公司现有业务有较深协同，且财务表现不错的标的，新三板也是我们的项目来源。我们会根据公司的战略规划，在新三板中找寻符合公司战略、业务表现较好、出售价格合理的项目，谢谢！
30,公司每次投资项目的可行性报告是否有详细说明公告？,您好。谢谢您对国联水产的关注与支持。公司重大投资项目有相关的可行性研究报告，请查阅相关公告。
31,请描述一下公司未来的发展前景，谢谢！,"您好，我想您的问题是和公司战略相关的，如下为您解释下公司的战略：公司于2016年制定了集团未来五年的战略规划，确立了“成为全球最具有影响力的海洋食品企业”的宏伟愿景。根据这一目标，公司未来将致力于向“全产业链”、“全球化”的“优质水产蛋白及餐饮食品解决方案提供商”转型，以 “创新”、“运营”、“资本”作为公司发展的三大核心竞争力，为消费者提供新鲜、健康、安全的海洋食材，实现“为人类提供健康的海洋食品”这一使命。
（1）“全产业链”的产业布局。养殖环节，未来五年公司将以工厂化养殖为上游核心，带动种苗、饲料协同发展，有针对性布局发展动保业务；以资源为导向发掘捕捞业务机会；加工环节，公司战略重心向深加工转移，提高加工的智能化水平，持续降低人工成本并提高生产效率；销售环节，公司未来五年将B端客户，特别是餐饮渠道客户作为未来公司的核心客户群，同时积极拓展电商等优质流通渠道，打造公司在C端终端市场的品牌影响力。
（2）“全球化”的区域布局。一方面，公司未来将深耕中美两大核心市场，完善主流市场的营销网络布局。另一方面，公司将继续通过投资合作、设立区域办事处等多种方式完善东南亚和南美供应链体系，确保原料端稳定、高效、低成本的供应。
（3）“解决方案提供商”的商业模式。未来公司将整合公司内外部产业链生态，为前述优质客户提供包涵水产供应链管理、菜品研发、餐饮配送、中央厨房等多项增值服务，实现由加工贸易商向解决方案提供者的转型。
（4）“创新”、“运营”、“资本”作为公司发展的核心竞争力。为实现上述布局，公司将以产品创新、技术创新、模式创新和管理创新作为公司发展的核心驱动力；打造全球领先的水产养殖、加工运营管理能力；通过产融结合，通过资本运作迅速获取关键资源和能力。
谢谢。"
32,现在行业间的并购都比较频繁，你们今年有没有兼并收购计划？,我们一直在市场上找寻符合公司战略规划，和公司现有业务有较深协同，且财务表现不错的标的。但比较遗憾，目前国内外资产价格较高，我们处于传统行业，标的的财务表现往往比较平稳，没有过高的增长率，无法支撑较高的出售价格，但我们不会放弃，好的并购需要多一些耐心，我们会一直围绕公司战略方向找寻合适的标的。
33,请问公司有无通过发行公司债券等形式进行募资的计划？有无设立并购基金收购标的的计划？,您好，感谢您对国联水产的关注与支持！公司2016年12月13日第三届董事会第十二次会议审议通过了《关于公司符合公开发行公司债券条件的议案》，债券的总额不超过人民币 6亿元（含6亿元）。目前在发行申请过程中。另外，公司积极围绕主营业务及战略发展方向寻找投并购标的，如标的合适，不排除通过设立投资并购基金等合适的方式参与。
34,公司会不会做医疗业务？公司未来经营战略是怎么样的？,"您好。谢谢您对公司的关注。经过近年来的逐步摸索和优化，公司于2016年制定了集团未来五年的战略规划，确立了“成为全球最具有影响力的海洋食品企业”的宏伟愿景。根据这一目标，公司未来将致力于向“全产业链”、“全球化”的“优质水产蛋白及餐饮食品解决方案提供商”转型，以 “创新”、“运营”、“资本”作为公司发展的三大核心竞争力，为消费者提供新鲜、健康、安全的海洋食材，实现“为人类提供健康的海洋食品”这一使命。
（1）“全产业链”的产业布局。养殖环节，未来五年公司将以工厂化养殖为上游核心，带动种苗、饲料协同发展，有针对性布局发展动保业务；以资源为导向发掘捕捞业务机会；加工环节，公司战略重心向深加工转移，提高加工的智能化水平，持续降低人工成本并提高生产效率；销售环节，公司未来五年将B端客户，特别是餐饮渠道客户作为未来公司的核心客户群，同时积极拓展电商等优质流通渠道，打造公司在C端终端市场的品牌影响力。
（2）“全球化”的区域布局。一方面，公司未来将深耕中美两大核心市场，完善主流市场的营销网络布局。另一方面，公司将继续通过投资合作、设立区域办事处等多种方式完善东南亚和南美供应链体系，确保原料端稳定、高效、低成本的供应。
（3）“解决方案提供商”的商业模式。未来公司将整合公司内外部产业链生态，为前述优质客户提供包涵水产供应链管理、菜品研发、餐饮配送、中央厨房等多项增值服务，实现由加工贸易商向解决方案提供者的转型。
（4）“创新”、“运营”、“资本”作为公司发展的核心竞争力。为实现上述布局，公司将以产品创新、技术创新、模式创新和管理创新作为公司发展的核心驱动力；打造全球领先的水产养殖、加工运营管理能力；通过产融结合，通过资本运作迅速获取关键资源和能力。
"
35,公司竞争优势在哪？,您好。目前公司核心竞争优势主要体现在：1、全球化的采购及营销网络。2、持续增长的优质客户群。3、全产业链运营及最高标准的质量管理体系。4、强大的产品研发能力以及技术储备和转换能力。谢谢。
36,你家在顺丰优选上面搞得不错啊，搞活动时价格也不贵。湛江的同学介绍的，好吃又健康，多宣传宣传，应该能卖的很多火的。,谢谢您的支持与鼓励，公司也意识到了这点，已加大了电商推广力度，我们会继续努力做的更好。
37,《关于加大改革创新力度加快农业现代化建设的若干意见》里面有说：“深入推进农业结构调整，推进水产健康养殖”，我想这些都是公司很好的机会，完全与公司工厂化养殖一致，非常看好公司这个项目。,谢谢您的支持和建议。公司会好好把握机会，充分发挥公司优势，做好工厂化养殖项目。
