,Question,Answer
0,智能机器人处于黄金十年，公司可以通过内涵发展和外延收购，打造机器人业务成为公司第二大利润来源。请问目前高层这方面有何具体谋划？,多谢您的建议
1,公司2018年经营目标收入要实现多少？同比增长多少？,尽最大努力！
2,公司海外业务发展如何，产品在全球领域的销售情况如何？,公司泵类产品主要以出口为主，出口业务约占总销售的70%左右
3,请问财务总监：从报道中看到公司很多基建项目即将投入使用，公司将如何应对推销带来的影响？,基建项目会逐步投入使用，因此不会集中转固
4,"骑龙山项目计划用于洗涤循环泵项目和纯电动汽车核心部件项目,计划进入投产要什么时候？洗涤循环泵项目是公司的成熟产品，计划什么时候可以投产，估计前期产量会达到一个什么水平，目前地尔高新区的地方较少，是否已导致产能不能满足订单？纯电动核心项目永磁电机是否有车厂已进行测试试用？",您好，洗涤循环泵目前部分产能在原有厂区，骑龙山新产能计划在年底投入使用。纯电动汽车驱动电机已有部分意向客户正在进行测试中。感谢关注!
5,电机和充电模块是新能源汽车的核心，好像公司都有涉及，请问公司:是不是真的在弯道超车布局?抑或有并购做强的决心?,您好！公司一直围绕纯电动汽车配套产品开展研发工作，目前主要针对驱动电机及其伺服控制系统、充电桩和汽车循环水泵等部件，各项研发工作、样品试制与测试工作正在按计划逐步推进。充电系列产品已经开展市场销售及运营探索并小量交货，微充产品正在与部分车企进行对接沟通，探讨合作空间。此外公司继续调研考察合适的配套产品标的。
6,公司的毛利率水平在同行业中是一个什么样的水平？是否有向上提升的空间？,我们正在努力
7,公司的马桶和新能源汽车都布局了一段时间了，为何马桶的销售还是这么惨淡？新能源汽车致电公司的时候，证券部门的工作人员说也目前还没有什么签订合同的重要客户。公司号称是黑科技，但是为何这几块看上去很不错的行业几年时间并没有太大的进展？公司对这两块今年有什么目标吗？谢谢,公司研发的水疗马桶区别与普通的智能马桶，它具有直肠清洁的保健功能。水疗马桶的市场定位为高端人群，这几年我们一直在尝试通过酒店合作以及特定人群团体的合作模式进行推广，做为市场铺垫。今年将加大推广力度，以提高销售业绩及赢利能力。新能源汽车核心部件方面，前几年都是研发投入期，自2017年底开始，部分产品进入到市场推广销售阶段，由于汽车行业的特性，对接需要有一定周期。公司在这两块业务，特别是新能源核心部件业务方面，进度良好。感谢关注。
8,请问贵公司是否对产品的毛利率是否满意？毛利率和净利润之间的比例是否是正常范围内？可否有新技术的研发？,毛利率和净利润都在公司预料的范围内。愿意研发投入是公司一直的风格。
9,在提升产品净利润方面，公司的规划是？,你好，公司主要通过扩大销售规模改善收入水平，通过产品结构调整，进而调整利润结构
10,公司一般通过什么方式拓展销售渠道？,您好，对于公司主营业务产品(泵类产品)，公司是采取大客户战略的，持续深挖，提高市占率，而对于水疗马桶产品，因其是终端消费品，销售模式必须要相应调整，目前公司组建了专门的团队，并不断开发经销商代理商，共同携手开拓市场空间，谢谢！
11,请问贵公司目前的订单结构是怎样的？近几年有什么变化？为什么？,水泵都是厂家的直接订单，近年稳定并增长。公司会加大洗碗机洗涤泵的定向开发对接。
12,"苏州尔宝应收账款19,320,814.21元，虽已87.06%计提坏账损失，但催收情况怎么样？是否大部分确实已经无法收回？",公司一直非常重视应收账款管理，关于苏州尔宝，公司一直在努力与当地法院沟通协调。
13,请问管理面如何评判目前国内外经济发展形势？,您好！面对复杂严峻的经济形势，在公司董事会的领导下，公司管理层带领全体员工，围绕年度经营计划，认真落实人才储备、成本管控、计划管理、质量管理、流程优化、新项目开发等方面各项工作。公司市场拓展工作和各项研发工作有序进行，企业核心竞争力和行业地位得到了进一步提升。谢谢！
14,请教财务总监：公司未来将如何应对毛利率持续下降的情形？,毛利率波动也是正常的。技术的独创性让公司在水泵和水疗马桶上均有一定的定价权。公司会加大新产业上拓展。
15,请介绍一下贵公司2017年业绩,"公司共实现营业收入77,809.86万元，较上年同期增长2.62%；实现营业利润18,537.24万元，较上年同期下降15.58%，归属于上市公司股东的净利润为16,074.09万元，较上年同期下降16.09% "
16,公司布局的都是风口的新兴产业，但是这几年无论是马桶还是洗碗机，新能源汽车，同川机器人，巨优新材都并没有给公司销售和利润带来什么增长，想问一下石总，未来1-2年，在公司目标中，能带动公司规模和利润增长的主要在哪方面？能不能给投资者来点这方面的干货？,新兴产业表明公司选择的发展方向是具备发展空间的，但是尊长业务开展需要积累，我们有信心做好，也希望投资者多一点耐心
17,同川科技作为一个创业公司的发展目标是什么，发展前景如何？,"您好，同川科技是由一群有梦想的专业技术年轻人组成，他们的梦想是：做中国最优秀的工业机器人！（优秀主要是指：高质量、高性价比、高安全、易用）。
同川科技根据自身在自动化控制方面的优势，选择工业机器人及智能装备产业进行深入研究和市场化，同时针对工业机器人核心技术加大研发力度。谢谢！"
18,请问，公司主要的产品方向是哪些？,公司力争发展成为全球领先的家用电器排水泵供应商，同时开拓以洗碗机用洗涤循环泵、家庭水务系统和水疗马桶为主的与家用电器排水泵密切相关的新兴市场，成为节能、健康、环保家用电器的领导者和实践者。此外，公司还以智能制造领域、纯电动汽车领域为发展目标，着力研制工业机器人产品和纯电动汽车用核心部件产品，为公司未来发展拓展更为广阔的空间。
19,"公司通过高新技术企业重新认定对公司有哪些方面的利好？
haiyou, 财政部第四批项目库存的推出，预计对贵公司的订单量有多大的影响？",您好！公司通过高新技术企业重新认定对公司一是税收优惠，直接影响公司净利润；二是体现公司高技术水平，有利于开发高端客户及高端产品。公司没有项目入选财政部第四批政府和社会资本合作示范项目，谢谢！
20,如何看待今年国内行业形势，预计公司将会迎来怎样的挑战？,从大的环境来说，很多企业日子不太好过啊。我们还好，多年的研发投入和技术积累使公司能超越红眼拼杀。我们这儿不能说风景独好，但不错了。
21,期待己久的冰疗马桶，据说可以治疗痔疮吗？是否真的，什么时候公开发售？,你好，冰洗马桶的特色功能之一是为了治疗痔疮，目前该产品正在进行临床测试
22,有报道说公司布局新能源整车是讲故事的可能性很大，公司如何看待这个问题？从公司股价角度看，公司得不到资本市场的认同，那么新能源汽车项目有取消的可能吗？,我们不讲故事，我们只认真做事
23,石总能不能介绍一下公司对于目前在建的两个新厂房的规划情况？看公司公众号，一个是同川机器人相关的，一个是没有具体说是排水泵还是新能源汽车，公司未来对这几块的战略布局到底是怎样的，谢谢,您好! 公司两个新园区，龙溪园区为机器人相关园区，骑龙山园区为家用电器洗涤泵和新能源汽车核心部件生产。感谢关注!
24,公司在新的一年里有什么生产经营方面的战略布局和规划？,"1、提高公司经营目标完成率，严格控制未完成项目数，并纳入2018年度绩效考核。进一步提高和细化绩效考核工作，加强人员动态管理工作。 
2、通过排水泵生产过程自动化改造继续提升公司的产品品质，健全质保控制程序，追求产品品质的零缺陷，提高产品的品牌知名度和美誉度，进一步加强供应商质量管控工作。同时，继续提高新型高效一体排水泵产品的推广工作，加快提升市场份额和市场影响力，通过不断自主技术创新进一步提升公司的核心竞争力、保持公司的持续增长性。
3、充分利用现有客户资源进一步提高洗碗机洗涤循环泵的市场份额，加强配合客户洗碗机产品开发工作；针对水疗马桶进一步加大体验式营销模式的推广力度，通过更进一步的招商工作增加经销商/代理商渠道数量，利用多种营销手段大力提高水疗马桶的销售业绩；借助工业机器人产品系列的不断丰富，针对不同工业应用领域加大市场销售力度；构建充电桩、微充桩、车用循环泵、纯电动汽车驱动电机系列产品的营销渠道，落实相关认证工作，争取市场突破。 
4、继续加大研发投入，争取在新型电机类产品、功能型水疗马桶、工业机器人新产品、纯电动汽车核心部件等方面继续取得突破；进一步完善知识产权管理体系。
5、继续加大引进专业人才的力度，继续加强培养后备人员工作，同时加大培训考核力度。 
6、建立健全公司治理体系，积极探索适合公司的市值管理模式，提升投资者关系管理水平。
7、公司将积极寻找国内外合作机会，寻求与公司发展战略相互补的合作伙伴。"
25,公司现阶段发展过程中有何不足？面临的最大挑战是什么？,您好，公司的发展，离不开人才，我们希望有更优秀的人才加入公司，参与到公司的发展中来。现在的世界瞬息万变，我们需要紧跟世界的脚步，研发出市场适销对路的产品，参与市场竞争。
26,请问公司出口的排水泵用美元还是用人民币结算？汇率对公司的影响多大？？,出口主要以美元结算，汇率对公司的业绩有些影响，但公司有对冲手段，且公司在出口市场上因技术的独创性有相当的定价权。
27,2018年公司会进行大收购或兼并上下游企业来做大做强公司吗？,并购是企业做大做强的手段之一，公司会在合适的时机考虑如何实施
28,公司如何建立自己推广销售网络？每年公司的公关和广告费用大概是多少？,你好，公司建设销售网络会根据不同的产品、市场来采取不同的策略
29,请问贵公司在研究新能源汽车电机方面有何优势，往后是否会通过并购方式扩大这方面业务的规模？,您好，并购是上市公司发展的重要手段之一，如果机会和项目合适，符合公司发展目标与要求，公司会考虑并购。谢谢！
30,员工流动性大吗？如何留住人才？,你好，公司员工流动性在可控范围内
31,请问公司不是一家汽配公司，那么公司的纯电动配件项目的优势在哪里？配套哪些大型汽车工厂？主要生产什么部件？市场销售基于什么？技术和成本优势来自于哪里？公司发展该项目的出发点是什么？,您好，新能源汽车市场具有非常广阔的发展前景，公司借助在电机领域深耕多年积累的经验，启动纯电动汽车核心部件的开发工作，希望能够在未来为公司发展提供新动力，谢谢！
32,请教财务总监：公司自2017年至今一直受汇率的影响较大，请问人民币兑美元升值具体影响哪些财务指标？公司会采取何种方式规避这一风险？,"一是美元汇率变化会影响美元销售收入折算成人民币销售收入的金额，从而影响毛利率水平，二是美元资产折算成人民币会有汇兑损益。
公司会通过出口定价与汇率挂钩、控制外汇资产敞口的方式控制外汇风险"
33,财政部第四批项目库存的推出，预计对贵公司的订单量有多大的影响？,您好。公司没有项目入选财政部第四批政府和社会资本合作示范项目，谢谢！
34,公司对目前二级市场股价如何看待?能否反映贵公司的现有价值?,您好，公司除了家用电器排水泵外，这几年还努力发展包括智能马桶、机器人、纯电动汽车核心部件等方面，这些方面都是国内大力提倡的行业，前景好。值得长期关注。我们努力把企业做好做大，股份也会随着公司的业绩增长体现它的价值。
35,公司销售体系从大客户战略，到面向终端客户，面临着巨大挑战。公司如何推动这种转型？销售人才跟得上吗？,对于公司主营业务产品(泵类产品)，公司是采取大客户战略的，持续深挖，提高市占率，而对于水疗马桶产品，因其是终端消费品，销售模式必须要相应调整，目前公司组建了专门的团队，并不断开发经销商代理商，共同携手开拓市场空间
36,排水泵和洗涤泵什么区别？洗碗机都需要？,排水泵在洗衣机和洗碗机中均有应用，主要实现排水功能；洗涤循环泵是洗碗机专用泵，主要实现机器洗涤用水的循环及冲洗功能
37,公司如何规避各种风险，如产品质量、资金、管理等？,公司的人才来源多元华，有民企、外企、国企，对风险管理有一套独特的体系，公司在2017年获得GE和美的集团0ppm奖，就是这套体系有效运作的结果。
38,请问公司的主要合作客户分布在哪些行业？能否举例几家合作商？,公司业务领域比较广，家用电器方面，目前惠而浦、伊莱克斯、三星、西门子、GE、海尔、美的等家电龙头企业均为公司客户。
39,请问公司用人机制如何？要留住人才，是否考虑推出股权激励机制？,公司会予以考虑
40,公司有招聘管理或技术人才的计划吗？,公司招聘管理或技术人才工作中由董事长牵头，由专门的计划、部门来落实。
41,请问董秘，公司经营范围中包含“节能设备和贮能设备”，请问公司的节能设备有哪些？目前市场销售和占有情况如何？公司的储能设备有哪些？目前的市场销售情况和占有情况如何？？,经营范围是指国家允许企业生产和经营的商品类别、品种及服务项目，反映企业业务活动的内容和生产经营方向，是企业业务活动范围的法律界限，体现企业民事权利能力和行为能力的核心内容。目前公司还没销售节能设备和贮能设备。
42,请问公司的新能源汽车这块目前到底发展到了什么阶段？有给什么公司做配套吗？公司是电控电机充电桩都做吗？,您好，公司纯电动汽车核心部件项目包括充电系列产品（直、交流充电桩和微充产品，初步量产阶段）、汽车电机（研发、测试阶段）、车用循环泵（初步量产阶段）。目前正在各汽车主机厂进行技术对接，谢谢！
43,公司持续加大对目标市场的走访及深度开发，注重海外市场建设，未来是否有海外投资的计划？,不排除这种可能性
44,公司如何应对人力成本上升的风险？,您好！公司会通过社会招聘及内部培养选拔引进包括专业研发、市场营销及公司管理等各方面的国内外专业人才，并通过招聘知名院校的硕士、本科毕业生，加强后续人才梯队的储备。同时，公司进一步通过充实培训内容、改进培训形式、提升培训水平，以经营目标为核心，继续推行“以技术工人替代普通工人”和“从普通管理人员提升为专家级别管理人员”制度，促进员工技能、业务水平、知识面以及部门管理绩效的提升。
45,请问公司在市场方面的开拓有什么计划？,您好！智能水疗马桶产品的体验式销售模式持续推进，经销商/代理商开发数量持续增加，建立合作关系的五星级酒店、医院、美容中心数量持续增长，后续公司仍将继续加大各区域代理商的开发力度，加强酒店、医院、医疗器械、电视购物、电商、会所或高端养老院等渠道推广经验的利用效率；同川科技的冲压机器人产品及配套解决方案服务取得持续增长，核心部件产品市场推广工作继续进行，针对工业机器人核心部件（机器人本体、伺服电机、运动控制系统）的研发和产业化工作继续稳步推进，协作机器人产品的样机研发和宣传工作也按计划展开。公司一直围绕纯电动汽车核心部件产品（驱动电机及其伺服控制系统、充电桩系列产品和车用循环泵）开展研发工作，各项研发工作、样品试制与测试工作正在按计划逐步推进，充电桩系列产品要开展市场销售及运营探索并小量交货，微充桩产品、驱动电机及车用循环泵等产品会与部分用户进行送样、对接沟通，探讨合作空间。
46,有报道说公司布局新能源整车是讲故事的可能性很大，公司如何看待这个问题？从公司股价角度看，公司得不到资本市场的认同，那么新能源汽车项目有取消的可能吗？,公司布局新能源汽车产业是公司长远发展布局，提升整体竞争力的战略，公司自成立至今，相信投资者没有听到任何公司炒作的声音，公司一直秉承务实的态度，脚踏实地，用业绩呈现给投资者。新能源汽车项目正在按计划实施中。谢谢！
47,建议公司选择有影响力且适合的媒体播出地尔智能马桶的广告，提升产品知名度，满足高端消费需求的信息通道！请问一下，如果在偏远地区想要购买水疗马桶产品，公司能提供上门安装服务吗？,感谢您的建议! 无论你在国内哪里，不管是偏远山区还是繁华都市，我们都提供上门安装，我们希望能为您提供最优质的服务。
48,请问董事会秘书，公司在目前涉及的行业与产品领域有哪些优势，对于潜在竞争者是否具有行业与技术壁垒？,你好，公司对技术研发和产品开发非常重视并且了丰富的经验，一项好的技术或者一件好的产品要具备长久的生命力，必须要拥有适度的技术壁垒。
49,2017年，公司主营产品对公司的收入与利润分别有什么影响？,2017年，公司的收入和利润主要还是水泵提供的，新产业相信在2018年下办年以后开始发力。
50,请问董事长，公司在新能源汽车行业的定位和具体业务的内容是怎样的？公司在电机的竞争对手主要有哪些？,汉宇公司一直以做“世界名牌北后的名牌”为定位方向，在新能源汽车行业，我们也致力研发具有市场竞争力和创新的产品，包括充电桩、汽车电机等产品。由于汽车电机是电动汽车的核心，国内外竞争对手不少，我们相信通过我们的努力，以高效率、轻量化的产品来参与市场竞争。
51,请问贵公司的产品主要是工业用品还是家庭用品，能否介绍下公司的产品,您好！公司的主营业务是高效节能家用电器排水泵的研发、生产和销售，家用电器排水泵主要应用于滚筒洗衣机、洗碗机、搅拌式洗衣机、冷凝式干衣机以及部分波轮洗衣机产品，实现排水或循环水的功能。全资子公司地尔健康积极地通过酒店、医院、美容、养老等渠道，利用体验式营销模式不断拓展水疗马桶的销售渠道，水疗马桶是电子智能座便器与肠道水疗仪的结合，是用户在家庭里可以非接触式灌洗直肠和清洁肛部的医疗器械，适用于清除人体肠道中的宿便，可与洗剂或生理盐水配套用于外阴、肛门的清洗或烘干。 控股子公司同川科技陆续推出三轴、四轴和五轴冲压机械手产品并组建销售渠道。此类产品适用于家电、3C和汽车等行业工厂冲压自动化生产线，能以工业机器人代替生产过程中大量重复和危险的人工操作，具有高稳定性、耐用性好、性价比优势明显等特点。 参股子公司优巨新材专门从事先进特种工程塑料聚芳醚砜开发、生产、销售及应用化服务。Paryls®聚芳醚砜材料是优巨新材独立开发、拥有自主知识产权的先进技术产品，包含PPSU、PES、PSU三种材料，均包含高中低粘度规格牌号，形成9大核心牌号产品，产品性价比优势明显，对国际知名品牌产品具有较强的替代能力，已在亚太及欧美市场建立了代理商网络并全面启动产品销售推广工作。
52,公司有哪些税收优惠？,母公司和部分子公司是高新技术企业，享受15%优惠所得税。
53,你好你好，想请问公司近两年分红是否合理？是否对投资者不尊重？是否维护了投资者的利益？,你想怎么分？可以提出建议来，我们会尊重股东的意见。
54,房地产调控对公司产品销售影响如何？,你好，房地产调控目前未对产品销售造成影响。
55,请问公司获得过哪些重要的奖励和技术专利吗？近期有什么技术突破，将给公司带来什么影响？,您好！截至2017年12月31日，公司已拥有专利278项，其中境内发明专利42项、境外发明专利6项；公司已拥有境内注册商标174项，境外注册商标46项。公司主要技术创新点包括铝漆包线代替铜漆包线技术及线圈塑封技术、叶轮启动机构技术和水冷技术，该等技术创新均已获得专利。公司具备持续强有力的研发能力与技术配套优势，能够在客户开发新产品阶段即切入参与配套研发工作，掌握市场先机。公司为国家重点扶持的高新技术企业，并被认定为广东省省级企业技术中心和广东省工程技术研究中心。 
56,公司的PE是否处于一个比较偏高的估值？,这个还真不好说，市场估值会波动，每个人也会有不同的估值看法。
57,同业竞争者众多，公司的独特竞争优势是什么？,您好！公司的主营业务是高效节能家用电器排水泵的研发、生产和销售，公司立足于家用电器排水泵这一细分行业，持续提升生产能力、生产效率和产品品质，并继续加大研发投入力度，不断扩展核心专利技术的应用领域，进一步提升公司在该领域的市场占有率。目前，惠而浦、伊莱克斯、三星、西门子、GE、海尔、美的等家电龙头企业均为公司客户，未来公司产品的市场占有率仍将继续提升。
58,预计今年公司投入研发产品有哪些？研发费用占比是多少？,问题重复了，烦请查阅
59,您好，想问去年公司的营收有所增加，但利润反而明显下降，是什么原因造成的？,非经常性收益下降、研发投入加大。
60,请问石董，贵公司控股的同川科技在网络上还能时常了解点儿情况，但关于参股的优巨新材，去年已顺利扩产，，好像参股时还有盈利对赌吧？是否已实现？能不能简单介绍下目前优巨新材的销售情况？,你好，优巨新材是一家极具发展潜力的公司，目前优巨正在努力开拓市场空间，争取尽早将产能转化为业绩。
61,除去政府补贴，请问贵公司的实际净利润是多少？,政府补贴对净利润的贡献是300多万元。净利润年报里有详细分析。
62,请问公司是否有比较长远的发展计划？,您好！司力争稳定全球领先的家用电器排水泵供应商地位，同时开拓以洗碗机用洗涤循环泵、水疗马桶为主的与家用电器排水泵密切相关的新兴市场，成为节能、健康、环保家用电器的领导者和实践者。此外，公司还以智能制造领域、纯电动汽车领域为发展目标，着力研制工业机器人产品和纯电动汽车核心部件产品，为公司未来发展拓展更为广阔的空间。未来，公司将以国家加快培育和发展战略性新兴产业政策为导向，抓住国家将节能环保和高端制造业列为“十三五”期间重点发展的战略性新兴产业的有利契机，在现有业务基础上，坚持自主创新，进一步加强对核心技术的研发投入，持续提高公司核心竞争力，将公司打造成为 “黑科技”代表性企业。
