,Question,Answer
63,在人才培养方面，公司接下来的计划是？,您好！专业和高端人才是保持公司持续不断的创新能力和独一无二的竞争实力的关键。公司通过社会招聘及内部培养选拔引进包括专业研发、市场营销及公司管理等各方面的国内外专业人才，并通过招聘知名院校的硕士、本科毕业生，加强后续人才梯队的储备。同时，公司进一步通过充实培训内容、改进培训形式、提升培训水平，以经营目标为核心，继续推行“以技术工人替代普通工人”和“从普通管理人员提升为专家级别管理人员”制度，促进员工技能、业务水平、知识面以及部门管理绩效的提升。
64,请问董事长：公司在人工智能方面是否有布局？,公司早布局了机器人及智能制造项目，而人工智能是未来的方向，我们将持续关注，并结合公司业务的实际情况做决定。感谢您的建议!
65,您好 公司外延并购方面有无潜在目标，今年在并购方面是否会有实质性动作？,您好，相关情况请持续关注公司公告
66,如何看待公司2017年的经营及业绩情况？,我觉得在主营业务上很好了，新业务的拓展上公司会再加把劲。
67,公司研发人员情况？去年的研发投入是多少？,"截至2017年，公司拥有专职研发人员183人，占公司员工总数11.23%；另外，拥有工程技术人员160人，占公司员工总数9.82%，公司共投入研发费用4,000.82万元，占营业收入的5.14%，谢谢！"
68,公司二级市场走势如此低迷，请问，公司是否有什么利空？,您好！公司目前生产经营一切正常、各项新业务也按照相关计划逐步推进。公司将继续严格执行董事会制定的战略发展方向，加快推进相关业务领域的投资布局和业务拓展，谋求企业快速发展。
69,还有一个问题，请问公司送股和分红的具体时间，谢谢。,你好，一般情况权益分配实施会在股东大会审议通过之后2个月内完成，公司目前仍在等待年度股东大会的召开，具体的分配实施时间请关注公司披露的“实施公告”。
70,江门市致力于新能源汽车配套之城，公司开发新能源汽车配件是否是根据政府战略导向做出的决策，在政策上是否得到政府的扶持，能否获得区域优势？,新能源汽车配套是公司前几年就确定下来的战略布局，目前正在逐步的实施和实现，我们也一直在关注国家及江门市政府的战略导向，争取得到政府的更大支持，为区域做出应有的贡献。
71,目前铝价格走势如何？对公司业绩有何影响？,最近大宗原材料价格波幅不算很大，公司的成本已经稳住了，影响不大
72,公司有没有发展新业务，最新的利润增长点在哪里？,同类问题已经答复，烦请查阅。
73,新客户的推广工作，今年有什么新方向吗？,我们努力开拓市场，在家用电器泵方面，国内洗碗机市场的爆发为公司的排水泵提供了进一步发展的契机。另外，我们在新能源充电桩、机器人、水疗马桶方面加大推广力度。谢谢关注。
74,请问独董，你觉得公司2017年的内部控制工作做得怎样？,您好，公司的组织架构和内部控制措施对企业管理各个过程、各个环节的控制发挥了较好的作用，保证了公司各项业务活动健康稳定的运行。2017年，公司按照《企业内部控制基本规范》及相关规范在所有重大事项方面保持了与财务报表相关的有效内部控制。公司《2017年度内部控制自我评价报告》客观地反映了公司内部控制的真实情况，不存在明显薄弱环节和重大缺陷，随着公司未来经营发展的需要，公司将根据所处的环境，不断更新和完善内部控制制度，以保证内部控制制度的执行力度和公司业务活动的有效进行。谢谢！
75,请问公司同业竞争对手都有哪些？公司现在有没有新的利润增长点？或新的盈利模式来增加收益呢？,您好，公司未来的新增长点包括洗碗机模块－洗涤循环泵、大健康模块－水疗马桶系列产品、智能制造模块－工业机器人、协作机器人及集成解决方案、新能源模块－纯电动汽车核心部件产品。
76,公司产品销售价格与同行业的国际品牌相比，具有多少优势？,公司的水泵全球市场占有率第一，价格与国际品牌相当。但公司产品的质量更好些。公司的水疗马桶为全球首创。
77,伺服电机，运动控制，已经电源管理BMS，每一个产品能做好，都能在该行业内撑起一片天地，请问贵公司的人力资源可以支撑目前这么多产品吗？,你好，专业和高端人才是保持公司持续不断的创新能力和独一无二的竞争实力的关键。公司一直通过高校招收、院校培养、社会招聘及内部培养选拔引进专业研发、市场销售及公司管理等各方面的专业人才，加强后续人才梯度的储备。谢谢！
78,今年以来的订单情况怎么样？,您好，目前公司订单情况良好。
79,近期是否有筹划涉及金融领域的重大资产购买？,你好，此问题无法明确答复，敬请原谅。
80,请问公司高管对目前年薪是否满意？请问公司高管的收入确定的依据是什么？公司员工的晋升渠道怎么样？,公司薪酬制度是以外部竞争性、内部公平性为原则，基于市场水平确定基本薪酬、基于个人能力确定岗位薪酬、基于个人绩效确定激励薪酬，并适合公司文化需要的薪酬政策。
81,公司今年有无开发新产品的计划？,公司每年都有开发新产品的计划，新产品分两类：一类是在原有产品基础上进行全新的设计创新，一类是进行新品类的产品开发。这两方面我们都有涉及。感谢关注!
82,石总您好，我非常看好汉宇这家企业及未来的发展前景，可是贵公司的高端水疗马桶定位太高，不能像洗碗机一样深入普通百姓家，既然能制造高端产品，为什么不推出普通老百姓能接受的智能马桶呢？,多谢你的认可与鼓励，公司会持续推出不同系列的产品，为消费者提供更多的选择空间。
83,公司获得过哪些重要的奖励和技术专利吗？近期公司有什么技术突破，将给公司带来什么影响？,您好！截至2017年12月31日，公司已拥有专利278项，其中境内发明专利42项、境外发明专利6项；公司已拥有境内注册商标174项，境外注册商标46项。公司主要技术创新点包括铝漆包线代替铜漆包线技术及线圈塑封技术、叶轮启动机构技术和水冷技术，该等技术创新均已获得专利。公司具备持续强有力的研发能力与技术配套优势，能够在客户开发新产品阶段即切入参与配套研发工作，掌握市场先机。 公司为国家重点扶持的高新技术企业，并被认定为广东省省级企业技术中心和广东省工程技术研究中心。 
84,"地尔汉宇2017年净利润1.61亿元,同比下降16.09%，请问主要原因是什么？公司在新的一年里有什么生产经营方面的战略布局和规划？",从账目上看，公司合并17年业绩是下降的。深入来看，下降的因素主要是：非经常性收益下降和在新产业上的投入加大。主营业务依然强劲。在新的一年和未来年份，相信公司在新能源汽车核心部件、水疗马桶、机器人产业将会逐渐发力。
85,预计今年会推出哪些新产品?,你好，今年的新产品包括：专为水槽洗碗机设计的洗涤循环泵，新能源充电桩系列产品，还有协作机器人，新型号的水疗马桶等。感谢关注。
86,请问公司有专人负责投资者关系管理吗？近期有机构去调研吗？,你好，公司证券部有专人负责投资者关系管理。近期由于处于定期报告披露期，所以未过多接受机构调研。
87,公司的汽车零件可以为新能源汽车配套吗？,公司开发的纯电动汽车核心部件正是为新能源汽车配套的，感谢关注!
88,请问公司产品有出口吗？都出口到哪些国家？中美贸易战对公司有什么影响？,你好，公司以出口业务为主，出口业务约占公司销售额的70%左右。
89,请问您说的公司纯电动汽车核心部件项目是指充电桩项目还是汽车哪个具体零部件？该项目进展如何？什么时候投入量产？谢谢！,你好，纯电动汽车核心部件包括充电桩、汽车电机、汽车循环泵等产品。充电系列产品已经开展市场销售及运营探索并小量交货，微充产品正在与部分车企进行对接沟通，探讨合作空间。而汽车电机和循环泵产品正处于与汽车主机厂对接阶段，进展情况正常。感谢关注!
90,出口毛利率还有进一步提升的空间么？,让我们一起期待吧。但我们更希望把量做上去。
91,今年将对哪个产品进行重点推广？,公司今年将重点推广的产品包括：洗碗机洗涤泵，水疗马桶，新能源充电桩，机器人等产品，以促进公司的销售增加。
92,公司一季度的经营情况如何？,主营业务稳定，新业务在推进。但正如公司一季度业绩预降，人民币汇率上升和研发投入加大对公司业绩带来了暂时性影响。太阳也有量度变化。
93,请问董事长，公司上市后股本扩张，是否预示着未来发展与股本扩张能够一致？董事长对公司未来怎么看，是不是会存在业绩爆发的突破点,你好，我们期望是一致的，我对公司很有信心，公司目前正在拓展的新业务都具有非常大的发展空间，我们正在努力。
94,水疗马桶是否价格太高，这样受众人群是否只有极小的一部分,公司的水疗马桶主要针对高端人群，随着国内消费者的消费能力逐年提高，消费对健康的重视程序越来越高，受众人群将逐步扩大。我们也将加大推广力度，以促进产品的销售。
95,董事长要我们多关注公司新产品的市场拓展进度，但是这需要公司多通过各种媒体信息披露出来，我在长沙黄花机场贵宾厅看到安装了地尔智能马桶，也注意到贵州某景区安装了地尔的智能马桶，但是这些消息都未在公司网站上有体现，所以公司自己应该多发布这些信息，投资者才能关注到。,你好，我们接受你的批评，后续会要求相关部门改进，谢谢！
96,再融资政策收紧有无影响公司的资本运作？,到目前为止，影响不大，公司目前有很好的现金流和现金储备，能够支出公司当前项目发展，如有合适的并购项目，再融资政策不会成为障碍。
97,公司近期接受机构调研的情况如何？哪些方面是调研方最感兴趣的？,你好，近期因为一直处于定期报告集中披露的阶段，公司未过多接受现场调研，已接受调研的内容均已经披露在互动平台之中，烦请查阅。
98,请问公司网站上看到已经有大功率的伺服电机样品，请问，该伺服电机目前推广情况如何？有应用到第三方厂家吗（非本公司产品）？,您好！目前伺服电机还没批量推向市场，敬请持续关注。
99,请问董事长，不知道董事长知道否，地尔汉宇日成交量徘徊在1千万元左右，已经彻底被市场边缘化，董事长对从怎么看，如何进行市值管理？,公司一直努力做好生产经营，积极努力提高产品的盈利能力、行业地位，拓展产品的市场空间，并在机器人、新能源汽车核心部件方面全力研发新产品并逐步投放市场，以提高公司的营业收入及利润空间。相信通过我们的努力，将会得到投资者的认可。
