,Question,Answer
0,请问：公司产品的技术含量如何？专利多吗？行业垄断地位如何？ 那些项目能给公司带来利润增长点？预计是否能保持3年的增长？,您好，公司依托国家级实验室技术平台，分别与高等院校、科研院所进行交流合作，并将高科技薄膜产品作为公司技术研发的重点领域予以支持。公司目前获得专利46项，其中包含1项国际专利。公司CPP膜、BOPET膜、电容膜等产品均处于行业领先地位。项目未来存在不可预测性，具体以实际业绩为准，请您关注公司定期报告。谢谢！
1,公司未来3年发展前景如何?,您好。公司将充分利用公司现有的行业经验和客户资源，纵向积极延伸产业链条，横向努力拓展业务范围，以高起点，高附加值和高市场占有率为目标，建设新项目和开发新产品，培育公司新的业绩增长点和新的发展动力，不断丰富公司产品类型，持续完善公司产品结构，提升公司市场竞争力和可持续发展能力。谢谢！
2,在企业文化方面，公司有什么特色吗？,您好。公司坚持以人为本，把人才战略作为企业发展的重点，充分尊重和维护员工的个人权益，切实关注员工健康、安全和满意度，重视人才培养，实现员工与企业的共同成长，不断将企业的发展成果惠及全体员工，构建和谐稳定的劳资关系。谢谢！
3,"同行业内有哪些主要竞争对手？公司采取了什么样的应对措施,在保持稳定增长的前提下不断做大做强?","您好。公司主要是一些薄膜制造的同行业竞争对手，比如CPP行业，在华东主要同行是宁波瑞成、张家港宗亮、他们主要是几条国产线，而我司是四条进口线，利用进口线高质量和高产能的优势，我们加大创新产品的差异化开发。
BOPET则行业比较大，同行如宿迁彩塑、绍兴无名、宁波杜邦、常州钟恒等。 我们还是要注重创新差异化的新产品开发，逐步建立自己的竞争优势。谢谢！"
4,你好，请问贵司目前产品的销售趋势如何？今年的销售目标是多少？公司有没有一个具体可行的持续增长计划？,您好。随着传统薄膜市场的逐步回暖，公司薄膜产品销售呈上升趋势。一般薄膜行业会有一定周期性，未来销售尚存在不确定性，请关注公司定期报告。谢谢！
5,在给用户提供增值服务方面，公司做了哪些工作以增强对原有客户的锁定、新客户的拓展？,"您好。公司主要在产品技术创新、产异化产品、定制化服务、交货速度等为客户创造服务价值。
公司再既有大客户通过双方加强高层沟通，达成战略协作关系，紧密的维护客户关系。 同时对新客户的开拓也加大力度，强化销售团队建设，制定销售激励计划等。谢谢！"
6,"公司采取了具体怎样的应对措施,在同业中不断做大做强?",您好。在持续、稳健发展公司现有业务，巩固CPP膜、BOPET膜行业领先地位，提升传统塑料薄膜的盈利能力，进一步落实公司发展根基的基础上，深入研发传统薄膜向高附加值差异化产品的延伸，推进公司新能源新材料领域及游戏产业的双轮驱动。谢谢！
7,行业有没有周期性？,您好。一般薄膜行业会有一定周期性，但也根据市场情况及各生产企业上下游等产能情况，会综合起作用，周期规律会存在一些变化。谢谢！
8,做大、做好市值管理是每个公司成长的必然追求，公司是如何进行市值管理的？,您好。资本市场出现大起大落，给公司的资本运营和市值管理带来很大的困难和不确定性，但公司依然遵循改善公司经营业绩为本，优化和扩大上市公司资产质量为重，同时不断提升公司各方面治理水平的市值管理策略和实现路径。具体举措：1、改善基本面创造价值；2、提升公司投资者关系管理水平，消除价值扰动；3、运用周期经营价值。谢谢！
9,请问公司公司的核心竞争力是什么？,您好，公司的核心竞争力为产业链优势、研发优势、品牌和质量优势、生产设备优势、管理团队优势、地理区位优势，具体请参见2016年年度报告中第三节公司业务概要中的核心竞争力分析，谢谢！
10,公司生产经营的季节性如何?哪个季节是旺季?,您好。公司生产薄膜产品，主要用于食品包装，所以与节假日食品消费需求旺季相关，一般比国家节假日提前1-2个月是我们包装薄膜的旺季。 一般在每年的 5月份， 7-10月份都是传统的旺季时间。谢谢！
11,希望公司在本专业领域专注于做强做大做实，提升公司的行业地位，给投资者以回报！,您好。公司从成立至今，专注主业，靠着“一张薄膜打天下”，公司定会在主业上做大做强做实，巩固传统薄膜行业领先地位，提升传统薄膜的盈利能力。谢谢！
12,公司在税收方面有没有相关的优惠政策？具体税率是多少？,您好。(1)出口货物增值税实行“免、抵、退”税政策，退税率分别为5%、12%、13%。(2)本公司被认定为高新技术企业(证书编号：GR201433001055)，自2014年1月1日至2016年12月31日期间享受国家高新技术企业15%的企业所得税税率。(3)本公司子公司上海游唐公司于2013年10月10日被认定为软件企业，自获利年度起，第一年和第二年免征企业所得税，第三年至第五年按照25%的法定税率减半征收企业所得税。上海游唐公司2014年为首次获利年度，2016年可享受按照25%的法定税率减半征收企业所得税的优惠政策。(4)本公司子公司上海科奂公司于2016年8月25日被认定为软件企业，自获利年度起，第一年和第二年免征企业所得税，第三年至第五年按照25%的法定税率减半征收企业所得税。上海科奂公司2016年为首次获利年度，2016年可享受免征企业所得税的优惠政策。谢谢！
13,请问公司的分配预案达到承诺的分红比例吗？,您好。公司制定利润分配方案时，应以母公司报表中可供分配利润为依据。同时，为避免出现超分配的情形，公司应以合并报表、母公司报表中可供分配利润孰低的原则来确定具体的分配方案。公司合并报表中可供分配利润为负数，根据公司章程规定，公司2016年度不用进行现金分红。谢谢！
14,新三板的扩容，带来了新的投资机会，你们公司在这方面有什么打算吗？,您好。机遇与风险并存。公司将根据实际情况并整合现有资源予以综合考虑。谢谢！
15,"请问董事长,关于公司最新项目进展如何？达到预期了吗？",您好。近几年全球经济低迷，中国经济进入增速放缓后的可持续增长轨道，实体经济仍面临较大压力。公司传统产品下游需求量持续下降，价格竞争更加激烈，同时公司多个募投项目处于建设期或刚投产，尚未产生明显效益。谢谢！
16,请问公司目前的研发机构有哪些？公司未来产品的研发与创新将如何进行？,您好。公司利用现有国家级锂电池隔膜研究院优势，充分利用高等院校、科研院所的合作，继续加大产品的技术创新与研发力度，不断优化生产工艺，创新研发模式，提高产品的技术含量和附加值，提升产品的竞争力。公司未来将重在差异化发展，推动低端产品向高附加值特种膜延伸。谢谢！
17,请问公司会进入新的细分领域吗？这一领域与公司现有业务的相关性？,您好。随着市场竞争的日趋激烈，公司会根据实际情况考虑是否进入新的细分领域，且如考虑肯定会和现有业务相关联。谢谢！
18,请问独立董事，您的履职情况如何，是否能真正保护了中小股东利益？,您好。本人履职报告已于2017年4月27日在巨潮资讯网上披露。本人在2016年度诚信、勤勉、尽责、忠实履行职务，按要求积极出席2016年度的相关会议，认真审议董事会各项议案，并对公司相关事项发表独立意见，充分发挥了独立董事及各专业委员会委员的作用，切实维护公司和股东特别是社会公众股股东的利益。谢谢！
19,请问公司以后每年会用什么形式回馈股东？,您好。公司根据相关法律法规及公司章程规定，结合公司实际情况，制定了《未来三年（2015-2017年度）股东分红回报规划》，并严格按照有关利润分配的条款落实现金分红政策，利润分配决策程序透明、清晰。谢谢！
20,请问2017年全年预计销售目标是多少？实现净利润的目标是多少？,您好。2017年度经营情况尚存在诸多不确定因素，公司管理层将尽最大努力，积极调整经营策略，全力降本增效，大力开发高附加值差异化产品，巩固市场份额。谢谢！
21,公司有没有股权激励计划？,您好。公司目前暂未考虑实施股权激励。如符合条件及公司实际情况，公司会予以后续考虑。谢谢！
