,Question,Answer
0,领导下午好！我想请公司介绍一下目前公司“纽仕兰”产品的现状？,尊敬的投资者您好！目前，公司“纽仕兰”品牌乳品依托产自新西兰原生态牧场的优势，通过线上电商自营、联营、电视购物以及线下入住小区、超市等多种方式推广产品，继而提高产品知名度抢占市场份额。遵循“与平台共成长”的营销战略，以用户体验为先，扎根社区、拓展社群、扩大用户，不断加强产品推广及品牌建设与维护，目前公司的乳制品品种有纯牛奶、成年奶粉、中老年奶粉，公司将根据发展战略逐步推出新品种。谢谢！
1,公司战略定位是“全球资源，中国市场”，请问这是否意味着公司未来还将继续加大对海外资产的收购？未来的收购方面主要哪方面？,尊敬的投资者，您好！公司目前的定位是通过全球资源来满足中国农业及食品市场需求，力求通过并购重组的方式获取具有独特资源禀赋的优质农业及食品行业上游资源，以满足国内市场需求。目前公司已并购巴西Fiagril、新西兰克拉法牧场等海外资源，未来公司还将继续通过寻求优质的海外资源，为公司战略提供支持，谢谢！
2,请问公司参与的海外重组会遇到哪些风险？,尊敬的投资者您好，海外并购风险包括五个方面：第一，在投资过程中对标的资产尽职调查不充足，对产品市场、前景、需求判断不准确产生的投资损失。第二，日常运营中的管理风险，包括因管理工作人员疏忽或内部控制不当带来的并购项目运作或管理风险。第三，国家宏观调控政策变化风险。譬如，国家未来对境外农业产业投资政策发生变化，可能会对公司海外并购项目运营产生障碍。第四，跨境并购整合风险，其中包括文化差异、人才和客户的流失、员工排斥等因素导致并购交易无法达到预期收益。第五，跨境并购审批风险，海外并购交易受各国法律、政治及经济环境等因素的影响，存在跨境审批困难、耗时较长等诸多不确定性因素，继而可能对投资时间、成本与费用等产生不利影响。谢谢！
3,请问公司有无通过发行公司债券等形式进行募资的计划？有无设立并购基金收购标的的计划？,尊敬的投资者您好！公司去年已通过公司发行债券的计划，现正在进行中。关于并购基金收购的计划请见相关公告。谢谢！
4,目前公司定位于农业，那么公司是以什么样的标准来寻找海外的优秀的农业资产？,尊敬的投资者您好！公司立足国际农业，在新西兰、巴西、澳大利亚等国家寻求符合公司“大农业、大食品、大健康”战略发展方向的优质农业资源项目，力求通过并购重组的方式，迅速获取具有独特资源禀赋的优质农业上游资源，以为国人的健康消费、快乐生活提供物美价廉的农产品和绿色健康消费品为目的来寻找合适的收购标的。譬如去年公司并购标的Fiagril公司所在地区麻省是巴西最大的大豆及玉米种植省份，产量约占巴西总产量的34%，其中大豆产量约占全球总产量的9%、排名全球第四位，且Fiagril公司为巴西最大的大豆、玉米贸易平台和农业生产资料经销商平台之一。同时新西兰被称为“世界上最后一片净土”，是世界黄金奶源的代名词，传承毛利文化的纽仕兰牧场只有1.2万公顷，因其不足1%所以珍稀罕至，出产的牛奶是“黄金奶源中的黄金奶源”。谢谢！
5,公司截止至今的产品有多少个种类？,"
在2016年年度报告第四节第二点中有披露。"
6,公司有没有股权激励计划？,尊敬的投资者您好！公司目前正处于业务转型期，同时高管也在换届选举过程中，暂无股权激励计划，谢谢！
7,公司去年主打产品的销量是多少？,在2016年度报告第四节第二点中对此有详细披露。
8,公司生猪业务占主营业务收入比例近几年逐渐降低，请问公司在生猪业务方面未来有什么打算？是否会剥离生猪业务？,尊敬的投资者您好！公司逐步从畜牧业转型至农业，随着公司战略方向的改变，公司在主营业务投入方面也做出调整，近几年公司逐渐增加大宗商品贸易及乳制品占比，降低生猪业务占比正表明公司战略调整已取得一定成效。而对于生猪业务，公司已与江苏银河面粉有限公司签订协议，由江苏银河对公司生猪业务进行管理，并由其承担损益，而公司每年则收取固定收益款，未来公司将加快寻找更具发展潜力或比较优势的适养区域，适时推进优质生猪养殖产业的发展，谢谢！
9,公司是否会计划多元化发展？,尊敬的投资资您好！依据公司发展战略，公司将始终围绕农业、食品两大核心主业，运用“产业加金融，投资加并购”的策略整合国内外相关资源，做大做强核心主业，力争为投资者提供良好的投资收益，谢谢！
10,公司预计2017年业绩较去年同期是上升还是下降？若上升，则增幅是多少？,"
公司2017年度业绩较2016年度肯定会有所上升。"
11,公司截至目前为止都有哪些子公司和参股公司？,请见2016年年度报告，有详细披露。参见第四节经营情况讨论与分析，第七点主要控股参股公司分析，谢谢！
12,公司去年财务费用和管理费用怎样？同财务费用相比呢？今年有没有折旧？请问管理费用今年会能稳定吗？,"
公司2016年度财务费用和管理费用在年报中有详细披露；2017年有折旧费用发生；随着2017年业务规模的扩大，管理费用会有一定幅度的增加。"
13,请问公司会进入新的细分领域吗？这一领域与公司现有业务的相关性？,尊敬的投资者您好！根据公司的发展战略，我们将始终聚焦于食品和农业两大核心主业，通过投资加并购，产业加金融，不断地做强做大。谢谢！
14,请问公司目前的研发机构有哪些？公司未来产品的研发与创新将如何进行？,我们已经拥有了涉及粮食、奶牛、肉羊的研发部门或团队，我们将根据业务发展的需要继续增加相关产业的研发力量。
15,请问老总， 2016年存货是多少，存货增加的内容是哪些？,"
2016年存货金额为552,777,648.08元，具体增加的内容在2016年年度报告中有详细披露。"
16,请问开完股东会后，如果送股通过几日内会送股？,目前公司暂未考虑送股事项，谢谢！
17,能简单的介绍下新项目的情况吗？,尊敬的投资者，您好！公司目前正积极推进重组事项，相关信息会根据监管要求进行披露，届时请关注公司相关公告，谢谢！
18,请问公司明年净利润能做到多少？,"
预计会比2016年度净利润有一定幅度的增长。"
19,公司今年有新投资的项目吗？如果有，当年能否为公司贡献利润？如有利润贡献，公司预计能实现多少利润？,尊敬的投资者，您好！公司目前处于停牌状态，涉及重大资产重组，届时请关注公司的公开的信息披露。谢谢！
20,请问老总公司今年净利润同比增长多少？,"
预计今年净利润同比会有一定幅度的增长。"
21,在做项目之前是否对项目进行严谨的可行性研究？,"尊敬的投资者，您好!公司在选择项目时会充分考虑该事项是否与公司战略相符,同时还会对该事项的盈利及定价的多方面进行严谨的分析并符合国家相关规定后,经过公司管理层、董事会严格筛选并经过充分讨论后决定是否实行，谢谢!"
22,请问净利润的增长率和销售收入增长同步吗？,"
不同步，销售收入增长率通常会高于净利润增长率。"
23,公司目前面临的最大问题是什么？,尊敬的投资者您好！公司目前所遇到的问题主要为：第一、经营业绩的改善提高。第二、重大并购项目协同实现和业绩提升。谢谢！
24,截至目前，公司的同比销售额有增长吗？,"
截至2017年第一季度末，公司销售额同比有增长。具体详见公司已披露的2017年一季报。"
25,公司的前5大客户是哪些？,"
公司前5大客户在2016年年度报告中已进行了披露。"
26,公司的前5名供应商是什么，与公司存不存在关联关系？,"
公司前五名供应商在2016年度报告中已有披露，与公司不存在关联关系。"
27,公司的发展战略是什么， 和公司现有的主营业态一致吗？  能否详细讲解一下？ 谢谢！,"同时随着中国农业“供给侧”改革的持续深入，未来对于先进农业技术与优质农业企业的需求也将不断增长，由此形成的供应缺口将会形成巨大的市场发展空间。公司加快了全球农业优质资源的并购与整合，公司将充分利用我国推行“一带一路”战略的重要机遇和鼓励对外投资的优良政策环境，以多种并购渠道，全面布局全球优质资源与中国市场的顺利对接，目前，公司在巴西及新西兰的并购项目已初战告捷，继2016年7月29日公司完成巴西重大资产购买的交割实施手续后，2016年11月17日完成了收购安源乳业100%股权的转让程序，这标志着公司已初步实现了第一阶段战略发展目标。
2017年，公司将继续围绕“产业加金融，投资加并购”的发展战略，认真落实现有业务（即乳制品、养殖和贸易业务）2017年度经营目标，积极推进公司产品的品牌建设，改善产品结构，并在此基础上稳步推进国内外优质农业资源的并购业务、金融业务以及食品分销平台的构建；加强公司各项管理制度的内控梳理及完善，有效提升各项管理机制和风险控制机制；推行“以人为本”的经营管理理念，适时推出切实可行的股权激励计划(方案)，建立健全公司长期、有效的激励机制和约束机制，以提高团队凝聚力和战斗力。
未来，在夯实现有传统产业的基础上，适当采取金融手段，提高公司发展空间，通过投资并购等方式，开拓公司发展新道路，为公司国际化的发展奠定坚实的基础。公司将以全球资源对接中国市场，通过分销将国外的优势资源对接国内渠道，形成自己的全球集成、采购平台和承载全球资源的国内多层次、多渠道的分销网络，并构建大康从田园到餐桌的产业链闭环，为国民提供安全优质食品，满足日益增长的中高端消费升级需求。"
28,公司今年的财务费用会有多少？,"
财务费用主要包括利息收入、利息支出、汇兑损失、汇兑收益。随着2017年度公司对外收购兼并业务的发展，公司将会利用融资手段筹措一部分资金，从而会导致利息支出的上升。另外，收购也会降低一定的自有资金，这样的话，利息收入也会有所减少。至于汇兑损失、汇兑收益主要来于自巴西海外子公司的业务，其与国家整体的经济状况、汇率管理有关，但企业会通过采取一定的对冲工具以降低汇率波动带来的汇兑损失。"
29,2017年公司是否考虑对高管实行股权激励，如果有的话大概什么时候实行？,尊敬的投资者您好！公司目前正处于战略转型中，公司高管正处于换届选举中，目前暂无股权激励计划，谢谢！
30,公司截止目前的股东总人数是多少？,尊敬的投资者您好！截止2016年12月31日，普通股股东人数125021人，2017年3月31日，普通股股东人数为122073人，谢谢！
31,公司在税收方面有没有相关的优惠政策？具体税率是多少？,"
税收优惠政策主要来自于政府各级主管部门发布的税务方面的政策，我公司会根据其中所列的申报条件积极向主管税务部门进行税收优惠申报。"
