,Question,Answer
0,您好！公司最近公告称，将成立产业基金并作为合伙人投资不超过万亿元，但公司年报显示公司现有货币资金仅有1.1亿多元，尚需分红派现。请问公司如何解决这个资金缺口？,"尊敬的投资者您好，感谢您的提问。公司拟出资设立全资投资公司，投资公司拟发起设立产业并购基金。该并购基金总规模不超过20亿元，公司作为有限合伙人拟认缴出资不超过5亿元，公司可以根据需要通过多种融资渠道解决该资金缺口。谢谢！
"
1,贵公司是否会考虑实施股票期权等规范股权激励方式，惠及更多员工？,尊敬的投资者您好！上市公司实施股权激励计划，需要在行业趋势、企业发展、人员使用等诸多方面共同配合方能成就。作为一种有效的激励方式，我公司不排除在条件具备情况下推行新的股权激励方案。谢谢。
2,董事长，既然收购互联网行业企业不是借壳，那为何要把所有主业剥离给新设的子公司？公司未来是否将主业重心转至互联网？,尊敬的投资者您好，感谢您的提问！公司将绝缘子业务划拨子公司，其目的是为优化公司组织架构，提高公司经营管理效率，提升公司的市场竞争能力。未来，伴随公司战略的逐步实施，不排除双主业和多主业共同发展。谢谢。
3,公司有没有哪些项目创新模式？,尊敬的投资者您好！公司目前的经营模式属于传统制造业。目前收购的资产属于互联网和相关服务行业，本次重大资产重组的相关各方仍在就该重大资产重组的相关事项进行进一步磋商，最终方案尚未确定，敬请关注公司后续公告。谢谢！
4,您好！公司2016年董事会工作报告中提到，2017年公司在做好现有主业的基础上，还将寻求符合公司战略发展的项目，寻找公司转型发展的机会。请您谈一谈2017年公司转型发展的一些思路，谢谢！,尊敬的投资者您好！ 公司目前停牌收购的资产涉及互联网和相关服务行业。因此公司在发展好主业的同时，会向互联网和相关服务行业发展。本次重大资产重组的相关各方仍在就该重大资产重组的相关事项进行进一步磋商，最终方案尚未确定。请关注公司后续公告。谢谢！
5,能介绍一下公司现在各大区域的销售和占有率等基本情况吗?,尊敬的投资者您好！国内市场领域，公司特高压瓷绝缘子市场占有率保持稳定；国际市场领域，各目标市场占有率有升有降，情况不同。谢谢。
6,公司领导怎么看现在公司的股价，对我们小散有什么忠告？谢谢,尊敬的投资者您好，感谢您的提问！上市公司股票价格是市场情绪和企业经营的综合反映。从企业角度看，要保持守法经营，创造收益来回馈股东、回馈社会；对于投资者和散户，我建议不要跟风逐流，保持理性投资。谢谢。
7,目前公司享有的国家优惠政策有哪些？,尊敬的投资者您好，感谢您的提问。公司为国家高新技术企业，享有相关税收优惠政策。谢谢！
8,如果公司进行定增，那大股东及高管们会考虑参与、进行增持吗？,尊敬的投资者您好！公司目前尚未制定定增计划，因此没有考虑相关问题。谢谢1
9,董事长，标的资产是不是知名互联网和相关服务行业？算不算借壳上市？谢谢,尊敬的投资者您好，感谢您的提问！本次重大资产重组标的对象为互联网行业企业，不构成借壳上市。谢谢。
10,公司目前有哪些在建项目？建设进度如何？还需要多少资金？,尊敬的投资者您好！近几年，公司进行的固定资产投资，技术改造投资基本达到预期目标，目前公司没有重大在建项目。谢谢！
11,公司如何进行投资者关系管理，如何规划进行投资者回报的？,投资者您好！公司建立了较为健全的内控规则并据此开展工作，决策事项均能履行必要审议程序并对外披露，这为建立好的投资者关系创造了条件；另外，公司对信息披露、风险事项均能有效把握，在企业合规运营的同时能顾及中小股东合法利益，没有发生损害中小股东利益的情形；最后，公司曾发布公告披露股东回报计划，请您留意。谢谢。
12,公司停牌前非理性的两个跌停，公司是否对于后期复牌有维稳计划或股东是否有增持计划？,尊敬的投资者您好！ 敬请关注公司后期公告，谢谢!
13,请问公司以后每年会用什么形式回馈股东？,尊敬的投资者您好，感谢您的提问。公司将根据《公司章程》及《未来三年（2015-2017 年）股东回报规划 》，综合考虑投资者的合理投资回报和公司的可持续发展，在保证公司正常经营发展的前提下，建立公司持续、稳定及积极的分红政策。谢谢！
14,虽然说公司的股价由二级市场决定，但股价是公司经营的一个表象，请问管理层对回报投资者持有怎样的态度？,尊敬投资者您好，感谢您的提问。影响二级市场股价波动的因素较多，投资者对公司股价的期望我们充分理解，我们认为只有不断提升公司的全面竞争力，提高公司稳定及可持续的盈利能力，才会体现公司的投资价值。谢谢。
15,公司是否在考虑开拓新的领域？取得初步进展没有？,尊敬的投资者您好！目前进行时，后续进展请关注公司发布的重大资产重组停牌进展的公告，谢谢！
16,雄安新区的设立，对公司存在哪些机遇？,尊敬的投资者您好！就目前情况，暂无法确定雄安新区的设立是否会给公司带来机遇。谢谢。
17,公司的前三大客户是哪些公司？,  尊敬的投资者您好，感谢您的提问。公司的主要客户为国家电网及南方电网及下属各电力公司，对于重大项目中标情况，公司已按照相关规定进行了披露，具体信息涉及公司商业秘密，不便公开披露，请您理解。谢谢！
18,请问贵公司重组的具体事宜什么时候公布，什么时候复盘, 尊敬的投资者您好！具体事宜请关注公司发布的重大资产重组停牌进展的公告，谢谢！
19,公司在经营活动中主要对哪些环节进行质量控制？,尊敬的投资者您好！公司产品的生产制造周期较长，为保证质量，实际工作中，从原料入厂、包括过程制造，到成品性能，均进行严格的检验检测和质量控制，以确保产品质量。谢谢。
20,年报显示，公司近年来现金流都偏紧，请问2017年有新的再融资计划吗, 尊敬的投资者您好，感谢您的提问。目前公司经营状况良好，2017年公司将会根据总体发展规划及经营状况需要适时进行融资。谢谢!
21,贵司今年中标或参与了哪些政府项目？,尊敬的投资者您好！2017年初，公司参与国家电网公司“昌吉-古泉”特高压项目竞标，获得订单近3亿元，这是公司近期较大的中标项目。谢谢。
22,今年以来，原材料都迎来涨价潮，对公司会有什么影响？,投资者您好!公司使用的原材料在年初时迎来了不同幅度的调整，对公司的利润会造成一定的影响，针对原材料涨价情况，公司会采取各种措施降低公司运营成本。谢谢！
23,你好，请问贵司目前产品的销售趋势如何？今年的销售目标是多少？,尊敬的投资者您好！就目前状况看，公司的销售态势较好，但也存在着政策调整、汇率变化等潜在风险，需要企业积极筹备，有所应对。另说明，公司销售预期会在业绩预告中予以披露，请您留意，谢谢。
24,公司2016年度的业务经营情况符合公司预期吗？,"  尊敬的投资者您好，感谢您的提问。2016年公司实现营业收入75,282.86万元，涨幅23.64%；归属于上市公司股东的净利润9,416.75万元，涨幅155.00%；2016年末，公司资产总额为139,585.93万元，较年初增长2.11%；归属于上市公司股东的净资产84,782.82万元,较年初增长12.57%。较好地完成公司年初制定的业绩目标。谢谢！"
25,请问公司如何看待上市公司的并购和市值管理？,尊敬的投资者您好，感谢您的提问。健康经营是市值管理的基础，公司坚信唯有把生产经营做好，才能持续稳定的为股东创造价值，这是我们的基本理念。谢谢。
26,公司每次投资项目的可行性报告是否有详细说明公告？,尊敬的投资者您好！公司实施的对外投资项目会进行可行性分析，并根据项目规模等重要因素，依据外部法律法规及本公司内控要求进行审议和披露。谢谢
27,公司现在负债总额是多少？每年负债的利息是多少？谢谢。,尊敬投资者您好，感谢您的提问。公司负债总额以及负债利息请详见公司2016年度审计报告。谢谢。
28,公司2017年一季度经营业绩如何？,尊敬投资者您好，感谢您的提问。公司2017年一季度业绩预计归属于上市公司股东的净利润区间为2800万元~3800万元，变动幅度：28.33%~74.16%。谢谢。
29,现在行业间的并购都比较频繁，你们今年有没有兼并收购计划？,尊敬的投资者您好！公司目前正在筹划重大资产重组，相关事宜已经在法定媒体披露，请您留意。谢谢。
30,公司所处行业有没有周期性？,尊敬的投资者您好！公司产品是应用于输电线路工程建设的重要部件，所在行业的景气程度与国家电力电网建设规模呈正相关关系，这就是本行业的周期性。谢谢
31,请问大连电瓷停牌那么久，重大资产收购的进展如何了？标地是否可以透露？,投资者您好！本次重大资产重组的相关各方仍在就该重大资产重组的相关事项进行进一步磋商，最终方案尚未确定。请关注每五个交易日公司披露的本次重大资产重组事项的进展公告。谢谢！
32,近几年的固定资产，技术改造的投资效果如何，是否达到了预期的目标，不考虑市场因素，简单考虑毛利情况是否合理？,尊敬的投资者您好！近几年，公司进行的固定资产投资，技术改造投资是企业稳定运营的重要基础，基本达到预期目标；另外，公司毛利率情况合理反映了企业的经营现状。谢谢。
33,请问公司有无通过发行公司债券等形式进行募资的计划？有无设立并购基金收购标的的计划？,尊敬的投资者您好，感谢您的提问。截止目前，公司尚无发行公司债券进行募资的计划。关于设立并购基金的进展情况，请留意公司后续公告。谢谢！
34,您好！截至到2016年12月31日，“国家队”即中金、证金、汇金的持股比例有多大？,"投资者您好！截至到2016年12月31日，中央汇金资产管理有限责任公司持有公司股份2,721,600股，占比1.34%。谢谢关注。"
