,Question,Answer
0,管理团队有信心把市值做到200亿吗？大概几年能实现，关键是自己掌握核心技术，向华为好好学习吧,我们会努力做好公司，相信未来更美好
1,天奇的新经理可以的，股价大跌 叫别人换个公司 呵呵了 大家不用提问了 散了散了 没前途的领导层，公司也没前途了,二个字纠结的人：回答股份下跌是暂时的，公司有信心，不相信；让其重新选择，又如此一说，横竖不舒服！
2,说实话，到这个点你们的领导都走了准备回家过周末，只有独立懂事还在硬撑呢，这也看得出一个公司的负责态度,您好！目前嘉宾都在线，正在回答投资者的问题。
3,说实话这个交流没有得到多少信息，业绩说明会根本就没说业绩，对于学生考试考差了还知道努力和去补自己的弱项，这个交流会看不出来，都是空谈,我们在认真的回答你们提出的每个问题
4,我看到好多仓库有机器人搬运工分发货物，贵公司能做这样的产品吗？或者扫地的机器人也行啊,仓储业务的发展，刚才在回答问题中也提到，因业务发展不及预期，团队将进行大的调整！
5,请问总经理，你觉得公司股价在12.7元左右是严重低估吗,个人认为：目前公司股价已严重偏离公司投资价值！
6,公司好不好和公司的老大关系很大，就看新的老总能力了，是骡子是马会见分晓的,我们团队，包括新同仁、老同事，会一直努力，不辜负大家的期望！
7,你这心胸就足以说明天奇为什么不行了 叫别人换个公司  我也呵呵了  大家换吧  不用发言了  这公司就是天下之一大奇葩 简称天奇,礼貌用语，文明发言，谢谢
8,公司有打算改名  天奇智能吗？ 三丰智能与公司主营业务几乎一样，营业收入只有公司的1/8，可市值差不多是公司的2倍,公司目前没有更名的计划！谢谢！
9,董秘小姐，大盘现在3170多点，公司的股价却创了2638以来的新低，你说天奇这是受大盘影响？这样真的好吗？,成熟的投资者应该有合理的判断，抱怨不会使你的钱袋子增加。与其这样，你不如换个你认为有价值的公司进行投资！
10,公司生产风电的铸件和风叶毛利太低了，有计划做整机吗？和大力发展民用光伏屋顶电站为中国环境做贡献.,对不起，风电行业目前已不是公司发展的方向，公司目前不会再在该行业增加投资。目前已投的风电产业，也会在合适的时机下进行整合调整！
11,也对  炒股是我们自己的事  怪不得公司 谢谢您的耐心回答,感谢您的关注和支持！
12,徐总，我是002009的小小小股东，但是跟踪贵司有几年了，我有点想法，希望公司领导能看到：1）担忧公司没有优势的情况下，进去太阳能领域；2）非常担心没有在智能仓储/物流等方面的研发、投入等等，导致没有核心竞争力；,谢谢您对天奇的厚爱，天奇引入了专业的新能源集成团队介入光伏电站设计总承包，智能仓储设备公司已经加强对团队与其它投入。
13,有操盘手已经透风了  四月底前打到10块,自已判断，钱是你的！
14,跌了倒无所谓 我已经拿着天奇股票一年多了 但是你这业绩盈利 再这样跌 是不是庄家操纵呢 我们小散是确实看好天奇前景,公司基本面没有问题，股价下跌我们认为是暂时性的，相信公司的前景会给你们合理回报的！
15,公司风电和燃汽轮机主要是做铸件吗？客户有GE吗？,公司生产的风电产品主要为轮毂、底座、轴承座、行星架、输入/输出箱体等，为铸件产品。公司成功开发并批量生产的有0.85MW、1.25MW、1.5MW、2.0MW、2.4MW、2.5MW、3MW、3.6MW、5MW和6MW的风电铸件。主要客户为GE、VESTAS、MHI、GEMESA、ALSTOM、Repower等世界知名风机制造商。
16,公司有计划发展人工智能物流系统吗？,公司一直计划发展智能物流，但进程并未达到预期，目前正在对团队及思路进行调整。谢谢！
17,面对股价下跌，众多公司纷纷推出增持方案，贵公司有没有增持方案或者二期员工持股？还有没有减持计划了？,抱歉，公司董事会尚无此类计划，但我相信目前的股价下跌是暂时性的，历史会验证这些的。
18,股价四月底前到10块  您觉得合适嘛,我如果能预知股价，我就是先知了，可惜我不是！
19,我是汽车零部件行业从业人员，从现有订单来看我所在的工厂4、5月份的订单堪忧，大幅减少；能否通报一下，2017年目前为止贵司拿到的订单是不是比2016/2015少了很多？,公司汽车自动化业务今年的整体情况还是保持稳定，从目前的情况来说，订单情况还是乐观的，许多项目信息正在跟踪过程中。谢谢！
20,既然搞这个业绩说明会 那就拿出点干货和诚意,您好！公司诚意满满！
21,公司打算改名为   天奇智能吗？,公司目前没有该计划，公司不是靠改名捕眼球的。
22,公司预计什么时候汽车拆解会迎来爆发期呢？,第二批黄标车强制报废政策又会带来该行业新的一轮的增长，该周期过后，自然的报废车增长量基本可以衔接上！
23,我感觉公司就没有明确的发展思路，感觉就像是游击战，没有自己的核心竞争力，赶快痛定思痛吧，换年轻人来当好船长,您好！公司的管理团队有深厚的行业背景，有丰富的行业经验。
24,"汽车物流已经进入了瓶颈期，公司这方面怎么看,会有别的外延式发展吗",您好！公司目前的主要发展方向是自动化业务和循环经济产业，公司正在进行自动化产业的转型升级及循环经济产业的布局工作。
25,公司在汽车拆解及循环产业的布局，通过年报看占公司营收比重仍然较低，今年会有比较大的提高吗,公司已经加大投入，今年预计会有较大提高
26,回答问题能真诚点吗？说实话亏了这么多钱真的很难受，能让我们看到一点希望吗？公司有没雄心壮志，通过什么来大幅盈利，很多好的公司都是保持每年30%的增长率，能否在工业自动化，人工智能等领悟好好发展呢，做中国汽车拆解的龙头,你的心情我能理解！亏钱总是难受的！公司将不辜负你们的期望，继续努力做好公司！
27,公司以后以发展循环经济为主业吗？,您好！循环经济产业是公司未来发展的主要方向之一！
28,我感觉贵公司的证券部门不合格，先是因为报表时间这种低级错误导致董事长被通告，然后在互动平台上从不回答我们小股东关心的公司经营情况，再就是职工持股计划不知道是不是贵公司证券部门搞的，既坑了职工，又害我们小股东站岗，现在新老总上台，建议对这个部门进行整改。另外希望公司不要再介入新能源。最后想问一下，对于亏损严重的风能资产如何处理？,公司坚持业务择优发展的原则。今年公司将进一步加大对落后产业、多余产能的优胜劣汰力度，对“产品无法适应市场”的企业实行关停并转，逐步转化、分流非核心业务和不赢利的公司，减轻资金负担。
29,徐总，请问员工持股亏了那么多，有补救措施吗，员工持股如果盈利的话会极大提高大家的积极性，有利于公司的发展，反之亦然,员工持股计划尚未到解禁期，目前谈盈亏都是纸面的，再说我们认为目前的股份下跌是暂时性的，公司经营层并不担心。
30,不是说不能跌 股票涨跌很正常  关键是你这业绩利好 盈利而且还分红了还在跌跌不休那就百思不得其解了,股票涨跌不是公司能控制的，公司也是分析个中原因，公司能确定的是基本面没有发生变化！谢谢！
31,公司对未来的信心是建立在股价一直下跌割小散的羊毛的基础上嘛？,您好！公司对未来的信心建立在开拓创新和脚踏实地的基础上！
32,今年在二手车拆解有没有新的并购？这是大家看好你的主要原因哦,汽车拆解今年的工作仍在三大方面：平台建设、渠道建设、基地建设上！谢谢！
33,关键是业绩利好的情况下还在9连跌  这个就一句对未来有信心说得过去嘛 ？业绩亏损，股价跌那正常 盈利还跌 正常嘛？,二级市场股价受很多方面影响，现在的股价有几个跟业绩匹配的。
34,股价低迷，贵公司有什么挫伤吗，作为公司的领导，可以增持吗，哪怕象征性的也行啊，你们倒好，还违规减持,这是哪跟哪的事情呀，减持已是去年的事情了，跟现在的股价下跌没有半毛钱关系。公司认为现在的股价下跌是暂时性的，再说目前是整个大盘的影响，跌的更厉害的大有在！
35,公司员工持股是16.88吗？这不是坑自己人吗？公司的员工收入在无锡处于什么水平？,员工持股计划尚未到解禁期，目前谈盈亏都是纸面的，再说我们认为目前的股份下跌是暂时性的，公司经营层并不担心。
36,网上讲你们员工持股是个套路 您怎么看？,网上说法很多，不值得多解读！走好自已的路！
37,现在证监会引导价值投资，天奇跌成这样，说明公司是没有价值的，这么多年市值也不变化，说明发展太差，连机构来调查的都没有了,政策引导，市场就真这么做了吗？目前的股价下跌只是暂时性的，公司对未来还是很有信心的！
38,下周一季度报了，亏损很多吗？不然估价会这样,我公司一季报将在4月26日公告，敬请关注！谢谢！
39,徐总，请问员工持股亏了那么多，有补救措施吗，员工持股如果盈利的话会极大提高大家的积极性，有利于公司的发展，反之亦然,目前谈员工持股计划盈亏都是帐面数，尚未到解禁期！
40,多元化发展和专注做大做强主业一直是企业发展的两个选择，不足徐总如何看待,企业应该以做大利润回报股东为目标，必须要突出原有稳定业务与利润的主业，发展新业务也要有重点。
41,前几年死掉了很多光伏企业，为什么公司还要进军这个行业呢？把机器人发展好才是王道,我们目前从事的主要是分布式光伏屋面电站的EPC项目建设，对于自已的屋面及一些有良好收益的项目，我们也作部份投资，以期获得稳定的收益。
42,16年业绩还是盈利 这连续跌成这样  你们是业绩造假嘛？不符合投机也好投资也罢的任何逻辑啊,考虑问题应该符合客观大环境，近期公司股价的走势跟大环境还是吻合的！
43,16年业绩还是盈利 这连续跌成这样 你们是业绩造假嘛？不符合投机也好投资也罢的任何逻辑啊,考虑问题应该符合客观大环境，近期公司股价的走势跟大环境还是吻合的！
44,徐总您好，基于价值投资，我看好公司未来。请问在传统领域之外的布局进展如何，特别是汽车拆解，处于行业的什么位置，未来目标怎么样，谢谢,公司在汽车拆解业务有稳步布局，今年湖北力帝的拆解设备的销售状况良好，近期公司也启动了光伏电站集成等新能源业务。
45,网络购物很火爆，为什么不在仓储方面加快发展，对接京东和淘宝的自动化仓库呢？,本公司在物流自动化方面已作了一些布局，但业绩没有达到预期，目前正在对团队进行大的调整。！
46,最想知道公司的雄心和发展目标，以及会有什么举措,抱歉，未对外公告的事项不方便说，你懂的！总体来说，公司管理层对未来很有信心，股价的下跌是暂时性的！
47,公司市值10多年没变化，说明管理层的发展意识欠缺，起码也应该100亿以上。公司盈利能力差，分红太少,谢谢你的鼓励，我们也在努力。在如此大环境影响下保持实体业绩的稳定，个人以为已不容易。每年拿出不低于当年净利润的15%作为给投资者的回报已经不低了！
48,徐总，您好，您是从海润光伏来到天奇。请问您的到来会不会使天奇涉及光伏行业呢？,上市公司介入光伏行业的具体业务情况看公告，我还在十一科技从事了设计与项目管理工作二十年，个人工作履历对天奇后续的工作肯定有帮助。
49,我怀疑我买到了假股票，从18跌倒现在，亏了几十万，谁受得了,说不定是黎明前的黑暗呢，坚持！
50,作为无锡人，我真的很失望，自己从事自动化行业，选择理性投资基本面不错的天奇股份，可惜股价天天创新低，难道公司不打算做点补救的措施吗？,谢谢你的关注，投资股票有投机和投资二种，如果你是短线操作，确实目前股价下跌给你带来了损失，我很抱歉！但如果是长线操作，我相信会让你得到该得的收益的！耐心，公司基本面没有发生变化！
51,天奇股价创了几年的新低了，不知道高管注意到了没，公司各方面正常吗,谢谢，已经关注到，公司生产经营正常，最近股价持续下跌跟大盘有关系，不过市场不是有句至理名言嘛：机会是跌出来的！公司基本面没有问题是硬道理！
52,互动平台从1月份到3月份的问题都没回答，董秘小姐还好吗？,"谢谢您的关心,互动平台处于正常状态，可能你没有及时关注到！"
