,Question,Answer
0,目前公司享有的国家优惠政策有哪些？,感谢您对公司的关注！目前，公司享有西部大开发企业所得税优惠政策、新能源汽车地方补贴等优惠政策。
1,如若公司股价在走下坡路的情况下，是否会推出高股价股权激励计划？,您好！公司会结合目前面临的竞争形势以及转型创新的实际需要，研究并制定符合企业发展的激励与考核制度。谢谢您的关注！
2,近年来，频频发生高管在解禁期前放出利好消息，如高分红等炒高股价，解禁期后又出现业绩亏损等其它负面消息，更有甚者，有的公司早在解禁期前一两年就策划好了这些方案。试问一下，你们公司的高管股解禁期是什么时候？,感谢您对公司的关注! 我公司已不存在高管股解禁的情况。
3,公司是否具备长期投资的价值？你是怎么看的？ 如果有机会，你会增持吗？,您好！公司经过10多年的发展，已经形成了富有自身特色的企业文化，制定了一主三翼的发展规划，拥有一支勤勉奋进的管理团队，我们坚信公司的未来发展会越来越好！谢谢！
4,交流会本来应该是恳谈会，将企业目前的处境，面临的困难，预计的风险和相应应措施清晰告诉股东。,感谢您对公司的关注！具体详见公司2016年度报告中“第四节 经营情况讨论与分析”。
5,现在行业间的并购都比较频繁，导致上市公司并购的成本提高，你们今年有没有兼并收购计划？,您好！并购扩张是公司实现战略发展目标的主要手段。谢谢！
6,贵公司是否会考虑实施股票期权等规范股权激励方式，惠及更多员工？,您好！公司会根据公司的经营情况制定符合企业发展的激励与考核制度，以达到员工与公司共同成长的目的。谢谢您的关注和建议！
7,贵公司员工一个月能挣多少？,感谢您对公司的关注！公司是道路运输行业的上市公司，相比于非上市的道路运输行业公司在员工保障方面当然有比较大优势。
8,独立董事对公司的内部控制有怎样的意见呢？, 感谢您对公司的关注！作为公司的独立董事，我们认为：公司已经建立了比较完善的内部控制体系，各项内部控制制度符合相关法律、法规、规范性文件的要求。公司内部控制制度能够得到有效执行，能够合理保证内部控制目标的实现。
9,目前主要产品的生产成本是多少, 您好，公司2016年度主要产品有客运业务和站务业务，客运的营业成本是71945.42万元，站务的营业成本是8024.22万元。谢谢！
10,募投项目资金使用情况如何？,感谢您对公司的关注！公司募集资金已于2015年度使用完毕，具体详见公司在巨潮资讯网上公告的相关内容。
11,作为上市公司，募集资金投资项目实施有风险吗？对经营业绩有影响吗？,感谢您对公司的关注！公司募集资金已于2015年度使用完毕，具体详见公司在巨潮资讯网上公告的相关内容。
12,公司募集资金投向项目进展如何，是否顺利?预计多久可以收回投资?,感谢您对公司的关注！公司募集资金已于2015年度使用完毕，详见相关报告。
13,贵公司的生产有无污染现象，安全和环保情况是如何做的？,您好！公司的主营业务为道路客运，营运车辆均符合国家环保标准，也欢迎您出行采用公共交通，为环保出一份力。
14,公司是否在考虑开拓新的领域？取得初步进展没有？,您好！针对当前公司面临的竞争形势并结合公司实际，公司董事会制定了一主三翼的战略发展规划，一方面继续巩固现有客运主业，同时沿着客运主业努力拓展相关物流、旅游等相关多元化产业。目前在新业务拓展、特别是在运游结合方面已初见成效。谢谢！
15,在持续督导中，是否发现需要投资者特别关注的重大事项或风险？,感谢您对公司的关注！具体详见公司在巨潮资讯网公告的《中国银河证券股份有限公司关于公司重大资产购买之持续督导报告》。
16,你好，公司今年的盈利能力有所改善了吗？制定了什么目标，实现概率有多大？,你好，公司2017年预计实现营业收入14.60亿元，预计实现净利润1.70亿元。公司管理层将恪尽职守，勤勉尽责，努力完成年度目标。谢谢你的关心！
17,公司未来3年发展前景如何?,感谢您对公司的关注！在目前国内公路客运行业下行的趋势下，公司未来将继续巩固公路客运主业，在现有业务领域深耕细作，通过外延并购进一步扩大市场规模，提高公司在客运行业的竞争力和影响力，争做国内客运产业的整合者。
18,公司的负债比率有多少？,你好！截止2016年12月31日，公司的资产负债率为60.89%，谢谢对公司的关注。
19,董秘您好，请问公司对未来城市公交的盈利能力有什么看法？共享单车的普及对公司的净利润有何影响？未来公司是否会转型，转型的方向及赢利点在哪里？谢谢。,您好！谢谢您对公司的关注以及在新形势竞争态势的分析。城市公交作为解决城区大众出行的公共交通工具，目前主要还是依靠财政支持维持正常经营或获取利润；富临运业的核心竞争力主要在于城际间的出行服务能力，共享单车运用场景是在城区，因此对我们的影响并不大；另外客观来讲，公司目前面临的经营压力很大，主要还是高铁的开行和私家车的增加，因此结合公司实际，董事会制定了一主三翼的发展规划，并在认真践行，详见公司2016年年报相关内容。谢谢！
20,请问公司4月末股东人数是多少，谢谢,您好！截止4月28日，公司的股东人数为1.7万余人。
21,请站在独立董事的角度 评价一下这家公司。您的专业态度对我很重要！,感谢您对公司的关注！本人作为公司的独立董事，勤勉尽责，忠实履行职责，定期对公司经营治理情况进行认真询问、讨论，并进行独立判断。本人认为公司严格按照有关法律法规要求，建立和完善了公司各项内部控制制度，不断完善了法人治理结构，保障了董事会、股东大会决策的科学性和合法性，不断提高了公司治理水平。
22,最近公司财务状况如何？,您好，谢谢对公司的关注，财务状况请详见公司定期报告相关内容，谢谢！
23,"同行业内有哪些主要竞争对手？面对国内和国际品牌的冲击,公司的品牌战略指导思想是什么?公司采取了什么样的应对措施,在保持稳定增长的前提下不断做大做强?",您好！公司在行业内的主要竞争对手是省内的大型客运企业，比如成都运输总公司、四川省运输公司成都公司等。针对公司目前面临的市场竞争，公司结合实际情况制定了“一主三翼”的发展战略，并已在经营管理中践行，具体内容详见公司2016年年报相关内容。谢谢！
24,请问公司有无通过发行公司债券等形式进行募资的计划？有无设立并购基金收购标的的计划？,您好！公司会根据对外投资以及项目资金需求制订融资方案；在对外拓展方面，也会充分运用资本市场的手段和工具以降低投资风险、提高并购效率，其中包括但不限于设立并购基金等方式。谢谢！
25,作为一家上市公司，为了更有利于与投资者交流，能不能在公司网站上设置交流互动功能？,您好！我们的官网上已经设置了留言反馈功能，欢迎咨询相关问题，我们也将及时回复投资者的留言。
26,虽然说公司的股价由二级市场决定，但股价是公司经营的一个表象，请问管理层对回报投资者的态度？,您好！非常赞同您的看法和意见。长期以来，公司管理层严格按照证监会以及公司章程的相关规定制定并实施现金分配政策，并在保护中小投资者权益方面始终坚持公平、公正的基本原则，以树立良好的公司形象。谢谢！
27,近几年的固定资产，技术改造的投资效果如何，是否达到了预期的目标，不考虑市场因素，简单考虑毛利情况是否合理呀。,您好！公司在投资以及技术改造等方面均建立了完整、系统的管理制度以及项目投后评价机制，并严格执行。具体项目情况请详见公司定期报告相关内容。谢谢！
28,股价升等于做免费广告，有助于公司产品销量升、业绩升，形成良性循环。建议公司配合将股价做上去。,谢谢您的建议！
29,近一年来，贵公司高管考虑增持吗？,您好，若近期公司有高管增持计划，我们将按相关法律法规及时履行披露义务，敬请关注。
30,请问独立董事，您的履职情况如何，是否能真正保护了中小股东利益？,您好！作为公司的独立董事，勤勉履职、保护中小投资者权益是我们的责任所在，过去、现在、今后我们都将如此！也请各位投资者监督。谢谢！
