,Question,Answer
0,现在有许多公司，有的大股东利用其大股东地位拒绝分红，对一些分红决议不通过，影响公司股东分红，请问一下咱们公司有什么办法防止此类事情发生，因为2/3表决权，大股东完全会通过其优势地位影响分红，那么咱公司如何保证分红的实施。保证中小股东利益，请认真负责回答，不要用套话回答，请认真正面回答,投资者您好！公司会积极与股东沟通，每个议案都会经过董事会认真审议后提交股东大会审议。感谢您的关注！
1,请问一下，现在记名股东其名下股东，有几成是限售股，还有就是，很多上市公司在年报出了以后，在几日之后又公布修改更正年度报告，贵公司此次年报公布后，会不会也会更正?,尊敬的投资者您好，股东的相关信息请您查阅定期报告，如果有相关年报更正，我们会及时发布更正公告，感谢您的关注！
2,最近几期的股东会会议记录，有没有留存供给股东查阅?,投资者您好！公司按照相关规定保存了相关会议的资料。感谢您的关注！
3,有没有信心，在几年之内超越茅台?,投资者您好！股价是受到二级市场多重因素影响所致，我们会继续专注于提升公司生产运营、产品推广、研发创新、市值管理等各方面能力，以稳健的业绩增长和合理的投资者回报提振股价和市场形象，维护公众股东信心。感谢您的关注！
4,多数上市药企都有较大发展，振东上市八年多了，公司业绩始终没有起色（康远除外），是何原因造成的？,投资者您好！经营业绩受到多重因素影响所致，公司会继续提升公司生产运营、产品推广、研发创新等各方面的经营能力，以稳健的业绩汇报投资者。感谢您的关注！
5,公司2017年年报略低于预期，请问主要原因是什么？,尊敬的投资者您好，公司年报是经审计后出具的报告，与公司的预期存在一定差异，公司以后将会加强预期数据的准确性，感谢您的关注！
6,请问目前公司业绩受哪方面影响较大？公司有什么应对计划？,尊敬的投资者您好，公司在经营过程中会面临到国家政策、新药研发、并购管理、人力资源等相关风险，公司会积极加强管理，控制风险影响；感谢您的关注！
7,近几年，基本上没有机构到公司调研，公司在与机构的交流互动上是否欠缺？原是何因造成这一现状？,投资者您好！公司将积极加强与机构投资者的交流，增强市值管理。感谢您的关注！
8,4月12日召开国务院常务会议，决定对进口抗癌药实施零关税并鼓励创新药进口。请问这个决定对公司业绩有没冲击？,投资者您好！公司正在深入研究相关政策，并进行相关分析，公司具体政策实施将报相关领导层审议后实施。感谢您的关注！
9,请问，＂岩舒＂这个产品有多少家企业在生产，贵公司的岩舒有什么优势或特色？,尊敬的投资者您好，岩舒是公司的独家专利产品，岩舒在研发上具有独特优势，感谢您的关注！
10,公司今年有研发什么新药吗？,投资者您好！公司的研发项目正在按照计划推进，如果有最新的研发项目，我们将及时进行披露。感谢您的关注！ 
11,近段时间，新版医保目录、两票制等政策密集实施，请问公司是否面临药品销售的压力？,投资者您好！面对严峻的行业形势，公司是以自营销售模式为主，政策调整会对公司有一定影响。感谢您的关注！
12,董秘您好，请问您对目前二级市场股价如何看待？能否反映贵公司的现有价值？对于散户来说股价上涨才是硬道理。,投资者您好！股价受诸多因素影响，从公司层面来讲，公司一直在执着于提升企业硬实力，维护股东权益。感谢您的关注！
13,我国钙制剂终端市场规模是否还有进一走增长空间？,投资者您好！钙制剂有进一步增长的空间，二胎政策的放开导致婴幼儿市场迅猛增加；老龄化人口增加导致中老年人市场的增加；保健意识的增强导致国人需求逐步增加。市场前景广阔，发展潜力大。感谢您的关注！
14,子公司生产和销售劣药被罚59万元，振东制药3个月都没有信披，请问是否构成信披违规？,投资者您好！公司按照规定发布了相关的澄清公告及进展公告，公司将继续加强信息披露，及时发布相关信息。感谢您的关注！
15,请问大股东频繁的质押股票是什么原因？不能增发股票解决融资风险吗？,投资者您好！大股东根据自身资金需求进行融资。感谢您的关注！
16,公司积极扩展产业链，进行外延并购，子公司数量大幅增加，如何控制管理风险？,投资者您好！公司并购后保持管理层不变，经营策略不变，经营模式不变，通过企业文化、管理模式的融合，达到1+1>2的并购效果。感谢您的关注！
17,贵公司除了主业外有没有想过拓展到其它领域？,尊敬的投资者您好，我公司主要是围绕制药的相关的领域进行经营拓展，感谢您的关注！
18,脂质体A项目，公告显示目前进入临床阶段，何时能进入量产销售？,投资者您好！公司的研发项目正在按照计划推进，如果有最新的研发进展，我们将及时进行披露。感谢您的关注！
19,请问，郎迪 钙产品系列对于其他厂家，有什么优势或特点?,尊敬的投资者您好，康远制药的碳酸钙D3类产品含有充足合理的钙元素和维生素D3，充分促进钙的吸收和骨形成，可有效增强肌体免疫力，预防各种疾病的发生。同时，由于采用了超微粉碎技术，产品口感细腻，片剂可咀嚼可含服，独家产品配方中增加甘露醇，服用后可避免便秘，而且还有颗粒剂，适用于儿童、妊娠和哺乳期妇女、更年期妇女、中老年人等各类人群。感谢您的关注！
20,贵公司都有哪些抗癌药，能否具体介绍下？,投资者您好！公司拥有18个抗肿瘤药物，主要有复方苦参注射液、扶正固本颗粒、消癌平片、西黄丸、比卡鲁胺胶囊、注射用香菇多糖、注射用盐酸尼莫司汀、紫杉醇注射液、注射用培美曲塞二钠、注射用异环磷酰胺、注射用亚叶酸钙、注射用硫酸长春新碱、注射用硝卡芥、羟基脲胶囊、高三尖杉酯碱氯化钠注射液、羟基脲片、氟尿嘧啶氯化钠注射液、羟喜树碱注射液、感谢您的关注！
21,公司能否开一个大型的投资者线下交流会，请董事长或者总经理讲下今年的规划和战略，给投资者一些信心。,投资者您好！感谢您的建议，公司会考虑在适当的时机召开交流会。感谢您的关注！
22,公司这几年收入在增长，但净利率走低，导致利润增长很微小。请问能说一下成本大幅增长、低净利率的原因吗？,"投资者您好！公司根据国家政策的变化和实际情况，进行了营销模式的调整和产品结构的变化，导致相应的经营指标有所变化；感谢您的关注！
"
23,公司中药种植，今年预期收成如何？,尊敬的投资者您好！公司种植的中药材品种多，将根据不同的品种成熟期，适时采收。感谢您的关注！
24,请问董秘公司目前有多少应收账款？坏账又有多少？如何规避这一风险？,投资者您好！公司的经营情况请您详见公司发布的定期报告。公司将通过完善信用管理政策，明确各主管业务应收账款的具体负责人，严格执行信用管控体系，控制应收账款的账龄，缩短应收账款周转天数，提高资金周转效率。感谢您的关注！
25,董秘您好，贵司董监高人员李勋减持318万股出于什么目的？李勋减持完后还持股多少？,投资者您好！李勋先生是公司持股5%以上股东，减持属于股东个人行为，详细情况请您关注公司发布的相关公告。感谢您的关注！
26,2018第一季度，销售费用同比增加2.2亿，而销售额基本与去年持平，是何原因造成的？,投资者您好！公司根据国家、行业政策，营销模式进行相应的调整，真实的反应了公司的经营情况。感谢您的关注！
27,公司2017年研发投入1.56亿元，今年是否还会增加？,尊敬的投资者你好，公司会根据研发实际情况按项目进度进行投资，谢谢您的关注！
28,2017年第四季度，销幅售费用异常增加到6亿，是何原因？是否投入了巨额广告费用？,尊敬的投资者你好，公司根据国家、行业政策，营销模式进行相应的调整，真实的反应了公司的经营情况，不存在大额广告费用投入。感谢您的关注！
29,请问大股东频繁的质押股票是什么原因？,投资者您好！大股东根据自身资金需求进行融资。感谢您的关注！
