,Question,Answer
0,从你经验判断，今年的需求同比去年是增加还是减少，幅度有多少,您好，按正常情况下，每年有一定的自然增长量。谢谢。
1,2017年报及今年一季报均显示应收账款同比增长率远大于营业收入同比增长率，年报及最新季报仅解释应收账款增加主要系报告期内销售收入增加所致，似乎不合理？另外去年及第一季度，经营活动现金流净额/净利润，销售商品劳务收到的现金/营业收入，这两个比率均比之前数年有较大幅度的下降，近来公司是否存在客户欠款风险较高，回款困难的问题？,您好，主要是由于营业额增长以及信用账期变动的原因。公司目前应收账款未发生信用违约的情况。谢谢。
2,请问胡总，作为公司董事长，您觉得，当前新和成发展最大的最大的瓶颈是什么？以及最大的风险点是什么？又有何对策？,您好，公司将不断引进高端人才，加强安全环保生产管理，确保公司稳定发展，谢谢。
3,维生素是刚性需求，并且国外国内均有规定添加量，现在是随采随用，但为什么1季度销量会下降呢？可否这样理解：因为价格高和去年库存在所以一季度销量少了，当这些库存消化了，二、三季度下游也逐步接受价以后，会加倍采购va（反正用量是确定的，开始少采购意味着未来要多采购），可以这样理解吗？恳请胡总解惑！,您好，下游需求不变的情况下应该是这样的。谢谢。
4,国外维生素生产企业设备都使用了50年以上了，新和成的生产成本与其比什么优势和劣势?,您好，公司使用生产设备相对比较稳定，谢谢！
5,胡老师您好。今天新和成股票收盘价35块9毛9。请给个建议，这个价可以投资吗？,您好，公司发展稳定，股市有风险，投资需谨慎，谢谢。
6,山东新和成维生素公司今年有什么项目试生产？具体产品是什么？,您好，今年尚在工程建设中。谢谢。
7,公司管理如何保障研发团队的稳定性和研发的效率,您好，公司的企业文化与有效的激励机制是保持研发团队稳定性和研发效率的重要因素，谢谢。
8,请问胡老师，山东新和成维生素公司2*2万吨营养品项目，是什么产品？,您好，公司经营范围以化学药品原料药(不含许可产品)、食品添加剂、饲料添加剂为主，谢谢！ 
9,请教ppa项目的具体进展如何，该项目投产后主打的下游应用会有哪些？上个月正威国际王文银和鲁西集团张金成都曾前往特材公司考察，想知道新和成新材料的核心竞争力是什么？,您好，公司PPA项目处于中试阶段，投产后主打的下游应用主要用于汽车零部件、电子电器等。新材料核心竞争力主要是多年积累的化工合成技术和装备技术。谢谢！
10,公司有没有考虑国外建厂来回避贸易纠纷?,您好，公司将根据业务发展及市场需求选择在适当的时期在国外建厂投资。谢谢。
11,关注到上个月正威国际王文银和鲁西集团张金成先后前往特材公司考察，感觉新和成新材料的实力还挺不容小觑啊，想知道吸引他们前往考察的具体是哪些方面？,您好，新材料是国家重点支持项目，公司在新材料业务方面已积累一定的基础，项目正在稳步发展，谢谢。
12,公司有无进入营养保健品市场的打算?,您好，公司目前暂未打算，谢谢！
13,您好，公司生产的pps分为纤维级、注塑级及其他品种，每个品种的价格区间较大，想了解下在pps建产时对于不同产品有没有比例规划？具体比例是多少？,您好，公司视市场需求情况适时调整产品投入情况。谢谢。
14,胡老师您好，18年香精香料涨了，预计今年的产值能有多少？,您好，今年香精香料业务将比去年有稳步增长，谢谢。
15,您好，目前公司营养品板块中，D3，生物素和VH的产能是多少，未来3年内有扩产计划吗？,您好，公司D3产能1000吨，VH产能150吨，未来是否扩产根据市场情况而定，谢谢！
16,公司如何应对汇率波动,您好，公司通过套期保值、变更结算方式等方法积极应对汇率波动。谢谢。
17,面对公司规模不断增大，管理与之是否配套?公司有什么方案?,您好，公司将不断完善管理体系促进企业发展，谢谢。
18,胡总，您好，目前Basf路德维希工厂复产顺利，根据信息披露，都在按部就班按时推进，最近已经有柠檬醛开始生产。对Basf复产后，全球的VA、VE竞争局面您有何判断？包括产品价格上涨下降还是随行就市、是否有机会再此次事故中争夺相关产品的占有率？谢谢。,您好，竞争力主要在于产品质量、成本，谢谢！
19,公司在2018年有何新的业绩增长点？,您好，今年主要以香料与营养品板块业务为主，谢谢。
20,公司一季报中的汇兑损失一亿元。在这方面，公司有没有规划，防范这方面的进一步损失？,您好，公司通过套期保值等金融工具减少汇兑损失。谢谢。
21,柠檬醛到VA需要几周能生产出来?,您好，属公司机密，不便回答，谢谢！
22,"请问胡老师
   我们在高端水溶性维生素e上有布局吗？",您好，公司有水溶性维生素E，谢谢。
23,中国是人口大国，公司开发一些终端营养产品。不知公司有无收购营养品制造公司的打算,您好，公司目前暂无计划，谢谢。
24,公司最近va报价1700元，市场成交900-1000左右，欧洲va1000报价跌至125-150欧元/公斤，公司如何展望巴斯夫（预计5-6月复产）复产后的va市场情况？,您好，市场情况有一定的不确定性，届时公司将视市场的反映情况调整销售策略。谢谢。
25,作为维生素的世界龙头和柠檬醛自产公司，根据生产工艺，从技术上您认为BASF柠檬醛放量，大概率需要到什么时候？,您好，请关注BASF公司的相关公告，谢谢。
26,请问胡老师，我们的柠檬醛，产能是多少？,您好，目前公司柠檬醛系列年产能为8000吨，谢谢。
27,一期员工股什么时候全部卖出?二期什么时候发行?,您好！一期员工股将于7月底到期，二期请届时关注公司公告，谢谢！
28,公司实际控制人今年有没有增持公司股票的计划,您好，请届时关注公司公告，谢谢。
29,注意到贵公司16、17的年报都提到了将关注收购兼并的机会，请问公司对于并购对象的选择有哪些方面的考量，看好国内还是国外的公司，是否圈定了意向范围？谢谢,您好，公司业务的扩张主要是从相关性、协同性等方面进行考量的，谢谢。
30,请问胡总，公司2020年1330计划，1000亿市值，300亿销售收入，30亿利润。是基于什么判断，给出公司33倍市盈率预期的？,您好，公司将努力创造效益，积极回报股东，谢谢。
31,公司如何应对政策变动的风险？,您好，对政策变动公司有相应的风险应对机制。谢谢。
32,您好，可以具体介绍下香精香料板块的主要产品产能和价格情况吗？,您好，公司香精香料板块主要为芳樟醇系列和柠檬醛系列，芳樟醇系列产品产能10000吨，柠檬醛系列8000吨，芳樟醇系列产品价格比较稳定，柠檬醛以自用为主，谢谢！
33,公司目前发明专利有多少?,您好，目前公司已授权的发明专利有2百多项。谢谢。
34,石董，您好！按您的答复，5万吨蛋氨酸项目目前还未达产么？何时能满负荷？谢谢！,您好，目前一期5万吨已基本达产。谢谢。
35,投资市场上大部分人把NHU作为强周期公司看待，请您对VA和VE产品价格中长期走势做个展望？以及如何确保未来2年的千亿市值的达成,您好，VA和VE产品市场总体需求比较稳定，正常情况下价格也会趋于稳定，谢谢。
36,现在国内VA市面上基本都是新和成的货了，为什么?国外的情况怎么样?,您好，公司VA产品国内排第一，全球前三，谢谢！
37,公司如何应对原材料价格上涨对公司业绩的影响,您好，公司内部不断挖潜，通过工艺、装备创新、提升管理能力降低成本，谢谢！
38,石董，您好！请问贵司1季度PPS项目营业收入和利润是多少？谢谢！,您好，一期产能只有5000吨，目前占营业收入的比重较小。谢谢。
39,公司为什么要发展蛋氨酸？,您好，详见公司披露的该项目的可行性分析报告，谢谢。
40,柠檬醛价格上涨对公司的产品有什么影响？,您好，柠檬醛以自用为主，谢谢！
41,石董，您好！请问贵司1季度 蛋氨酸项目营业收入和利润是多少？谢谢！,您好，目前生产销售正常，但目前对公司总体利润的影响不大。谢谢。
42,公司维生素都是现款现货提交，为何一季度.应收账款较年初增加53.30%，增加应收款主要是什么产品的？,您好，公司维生素产品交易方式主要以信用为主，应收账款增加主要系销售收入增加引起的，谢谢！
43,董秘您好，今年一季度va、ve销售量比去年同期有所下降。是处于何种判断或者销售策略，提高VA50万报价至1700元/kg,您好，是基于市场需求的考虑。谢谢。
44,按照二季度是va销售高峰，胡总预计二季度va会放量吗？如果放量会超越去年同期水平吗？,您好，具体要看市场情况，如果放量的话，会超越去年同期水平。谢谢！
45,PPS目前的市场情况如何？新材料这块有何战略规划？,您好，PPS市场长期前景看好，谢谢。
46,董事长：你好！贵公司产品一季度产品销量有所下降，你们会采取什么措施提高产品销售。,您好，公司今年一季度销售额比去年一季度是大幅增长的，谢谢。
47,你好，请问山东维生素公司，具体项目产品是什么？,您好，公司经营范围以化学药品原料药(不含许可产品)、食品添加剂、饲料添加剂为主，谢谢！
48,公司新材料未来发展方向和优势？,您好，公司在化学合成研发上优势。谢谢。
49,"胡老师您好   
我去过山东基地，pg项目现在已经着手建设了吗？",您好，山东基地目前主要是以香精香料及蛋氨酸项目为主，谢谢。
50,关于今年一季度va、ve销售量比去年同期都减少了吗？,您好，销量有所下降。谢谢。
51,请问，新和成历史上最大的单体投资项目，投资47个亿的山东维生素公司的营养品醋酸酯，指的是什么产品？何时公告？,您好，山东维生素公司目前没有该项目，谢谢。
52,公司未来有什么重大发展战略吗,您好，公司重点发展的业务板块是营养品、香精香料、原料药、新材料，公司致力于发展成为国际著名的精细化工大型跨国企业，谢谢。
53,公司如何看待新项目投产进度不及预期的风险？,您好，公司努力在项目预期建设期内完成投产。谢谢。
54,请介绍一下公司一季度的业绩情况。,您好，详见公司公告 ，谢谢！
55,今年有没有什么新的品种投产上市?,您好，有的，如香料、营养品。谢谢。
56,请问公司的香精香料的老产品，扩产了吗？销量如何，价格如何？,您好！公司香料香精未扩产，销售形势良好，谢谢！
57,浙江的金盾事件，与股份公司、集团公司、下属公司有无资金往来?,您好，没有。谢谢。
58,您好，请问下黑龙江的项目大概在哪年可以投产，做出业绩贡献,您好，黑龙江项目今年开始投入，预计建设期二年。谢谢。
59,公司对海外市场的拓展情况请介绍一下,您好，公司在保持现有海外市场份额的基础上积极拓展海外业务。谢谢。
60,公司最近va报价1700元，市场成交900-1000左右，欧洲va1000报价跌至125-150欧元/公斤，公司如何展望巴斯夫（预计5-6月复产）复产后的va市场情况？公司怎么看国内和欧洲va库存？下游是否可以通过减少使用量来应对va的高价？减少用量是否可以长期持续？,您好，下游产品的饲料配方要按国家标准执行，不能任意变更。谢谢。
61,你好胡老师:请问山东新和成维生素公司，投资47个亿新和成历史上最大的单体项目，营养品醋酸酯，是什么产品？何时公告？,您好，山东新和成维生素公司目前没有投资47个亿的单体项目，谢谢。
62,公司如何看待蛋氨酸的竞争格局？,您好，产品的竞争是永远存在的，主要看各企业的竞争力情况而定。谢谢。
63,公司如何看待VA、VE价格大幅回落的情况？,您好，目前我公司产品报价没变，产品价格受市场波动也是正常。谢谢。
64,请问，胡董，在下游比较低迷和维生素历史高位的情况下，怎么看待今年维生素的销售情况，请分别就va、ve，vevd3谈谈情况以及公司采取的对策，谢谢！,您好，维生素的需求量是存在的，公司将根据具体的市场情况，采取积极的应对措施，谢谢。
65,公司一季度业绩大幅增长的原因是什么？,您好，主要是由于VA产品价格大幅上涨造成的。谢谢。
66,公司如何看待今年柠檬醛的价格波动趋势？,您好，柠檬醛价格根据市场变化而定，谢谢！
67,公司的二期蛋氨酸项目19年能有多少产能投放?,您好，公司将根据工程建设情况努力争取在19年投产。谢谢。
68,请问胡总，公司一期员工持股计划已经完成了，公司还会开启二期员工持股计划吗？,您好，有一期肯定会有二期，请关注公司公告，谢谢!
69,印度PRIVI的大火，对香精市场有什么影响，请PRIVI和NHU的产品和客户重合度的两个角度解答一下，谢谢,您好，会对香精市场有一定的影响。公司个别下游产品有少量的重合。谢谢。
70,请问胡总，对欧洲VA报价降低到150欧元左右怎么看？为何与国内价格，以及新和成最新报价差那么多。而且国外的VA价格是VA1000的报价。,您好，公司产品目前未降价，谢谢！
71,"您好，请问下贵公司VE和VA, 2018.2019和2020年产能情况，具体为多少t？",您好！公司VE50%目前年产能40000吨，VA50万10000吨，谢谢！
72,"首先代表所有关心公司的投资者,对管理层,特别是董事长和董秘的辛劳诚挚感谢。看过公司管理层问答和这几年的年报。想问下:今年和明年这2年,公司有哪些新的产能和项目投产,具体点,谢谢。",您好，谢谢您对我公司的关心与支持。近二年公司蛋氨酸、香精香料、生物发酵、新材料等都会有新的产品投入、产出。谢谢。
73,请问贵公司产品出口国外区域在那些国家？美国贸易战会有影响么？另贵司的蛋氨酸项目扩产项目何时达产？现在建设到那步了？,您好！公司产品主要出口欧洲、美国、东南亚等国家。美国贸易战对公司出口份额没有影响。公司25万吨蛋氨酸项目正在建设中，预计2021年建成。谢谢！
74,公司蛋氨酸项目进展的怎么样了？,您好！蛋氨酸项目根据项目进度实施，谢谢！
75,国家环保政策趋严，对公司的业务有何影响？公司是如何应对的,您好，公司一直以来高度重视环保工作，长期来说对环保规范的公司是利好的。谢谢。
76,面对用户目前的随用随买，未来公司的销售策略是坚持挺价，还是降价报量？,您好！公司销售以利润最大化为策略。谢谢！
77,请问pps项目试产已经有一段时间了（超过一年），该项目有望在今年几月投产呢？投产的话，预计会对今年利润有影响吗？,您好，目前还在试产期，预计会在下半年投产，达产后会贡献利润。谢谢。
78,一季度存货达到18亿，比历史平均水平高很多，产生原因是维生素产能按照100%开足，销售情况未能如愿导致的库存增加？,您好，主要是由于一季度产品销量有所下降导致的。
79,胡董事长您好！贵司产品有60%以上出口，请问出口的客户具体在那些国家？美国贸易战对贵司产品出口份额会有影响么？另外，贵司去年定增扩产的蛋氨酸项目，目前建设到哪步了，预计何时投产、达产？谢谢！,您好！公司产品主要出口欧洲、美国、东南亚等国家。美国贸易战对公司出口份额没有影响。公司25万吨蛋氨酸项目正在建设中，预计2021年建成。谢谢！
80,请问公司的25万吨蛋氨酸项目的投资进度。麦芽酚项目今年以来的经营和利润情况。,您好！公司25万吨蛋氨酸基项目和麦芽酚项目正在建设中。谢谢！
