,Question,Answer
0,国内哪些地区是公司的优势市场？,公司先进基础材料的市场主要集中在长三角、珠三角等主要消费集散地，高端装备和军工新材料没有明显的区域特征。谢谢！
1,请分析下2018国际铜价的预期走势及国内市场的趋势。,"您好。
公司是一个实体制造企业，更加关注的是市场供求、客户需求，国际铜价走势受宏观经济、国际贸易等很多因素影响，走势很难预测。公司一直采取长期战略客户合作、上下游客户订单对锁和期货套期保值等方式，回避铜价波动风险。
国内市场方面，我们的看法是，铜基材料一直具备刚性需求和稳定增长空间，而且随着新能源等新兴应用领域快速发展，对铜基材料的需求还会进一步扩大。国内经过近几年的充分竞争和供给侧改革，供求格局明显改善，发展态势良性，龙头企业在盈利和发展上都会有更多机会。
谢谢。"
2,13.请问公司2018年一季度实现净利润1.02亿元，为什么扣非净利润只有0.49亿元？,"尊敬的投资者，您好！
    公司扣非净利润减少主要是由于公司下属楚江再生无为分公司属于再生循环企业，其业务具有特殊性，政策因素造成了公司经营利润减少和政府补助上升，详细情况如下：
    楚江再生无为分公司属于再生资源回收循环利用行业，主营业务为向个人投售者收购废杂铜。再生行业的共同特点是向个人投售者采购时无法获得进项发票，但向材料产品生产企业销售时要开具增值税发票，需按照销售额全额缴纳增值税，税负率非常高。再生循环企业所在地方政府为支持再生资源利用企业的经营和发展，成立专项政府扶持奖励基金，并依据再生资源企业经营合规性、经营规模和贡献程度，给予一定的政府基金扶持。再生行业企业以政府扶持奖励政策为基础，制定废旧物资收购价格，参与市场竞争，扩大采购渠道，获得预期业绩。
    2018年一季度，楚江再生无为分公司实现营业毛利-2695万元，虽有地方财政扶持资金奖励进行补偿，但依据会计准则规定地方财政奖励资金按照政府补助项目计入了非经常性损益，由此减少了扣非后净利润2021万元。      本公司铜基金属材料生产企业废杂铜原料采购渠道有两种：一是直接向外部产废、拆解或再生回收企业采购，二是向内部楚江再生采购。采购价格均按照市场定价，内外部采购价格基本一致。 一季度，公司铜基金属材料生产企业累计实现营业利润9438万元，净利润7821万元，较上年同期增长24%。向外部企业采购废杂铜和向楚江再生采购废杂铜对铜基金属材料生产企业营业利润不产生差异影响。
    综上所述，从公司所属的铜基材料制造企业来看，营业利润均随其产品的规模和附加值上升而稳健上升，扣除再生无为分公司政策影响因素，2017年公司铜基金属材料生产制造年度营业利润为 33794万元，2018年一季度铜基金属材料生产制造营业利润为9438万元，继续保持增长。谢谢！"
3,顶立科技2017年业绩承诺完成情况？,"答：尊敬的投资者，您好！感谢您对本公司的关注！
根据公司与顶立科技原股东签订的《发行股份及支付现金购买资产之框架协议书》、《补充协议书》和《业绩补偿协议书》，业绩承诺方承诺2015年顶立科技实现的净利润不低于4,000万元，2016年顶立科技实现的净利润不低于5,000万元，2017年顶立科技实现的净利润不低于6,000万元。顶立科技2017年度经审计的净利润为7,329.35万元，按照业绩承诺口径（按变更前的固定资产折旧年限）及扣除募集资金产生的收益后计算的净利润为6,270.29万元，净利润完成比率104.50%，达到业绩承诺。谢谢！
"
4,请介绍一下公司2017年产品产销情况。,"尊敬的投资者，您好！感谢您对本公司的关注！
    2017年度产量情况：公司年度实现金属材料产品总产量44.65万吨，较上年增长6.72%。其中：高精度铜合金板带产品产量16.84万吨，较上年增长10.38%，占国内市场份额的9.65%，稳居全国第一位，与第二位差距进一步拉大，并进入全球前三位；精密铜合金线材产品销量3.58万吨，增长5.62%；铜导体材料产品产量7.78万吨，增长11.09%；特种钢材产品产量16.45万吨，增加1.62%。
高端热工装备及新材料产量实现132台套。
    2017年销售情况：年度实现金属材料产品总销量44.61万吨，较上年增长6.75%。其中：高精度铜合金板带产品销量16.72万吨，增长9.87%；精密铜合金线材产品销量3.61万吨，增长5.32%；铜导体材料产品销量7.80万吨，增长11.37%；特种钢材产品销量16.48万吨，增加2.12%。高端热工装备及新材料实现销售收入2.04亿元，较上年增长35.90%。
谢谢！
"
5,公司有取得最新的行业认证资质吗？,"您好。
公司是国家三级保密单位，2017年获得资质证书。
顶立科技2017年7月获得武器装备承制许可证，目前军工四证齐全，具备了更好的进军军工和军民融合资质条件。
谢谢！"
6,热工装备及特种复合材料项目进展咋样了？什么时候能量产？,"尊敬的投资者，您好！
公司“智能热工装备及特种复合材料产业化项目”2017年按计划投入资金1,711.02万元，占该项目预计总投入金额的5.21%。公司正积极按照项目投资计划推进项目建设工作。
谢谢！"
7,请问公司有美国进口材料吗？,"尊敬的投资者，您好！
公司两大主业为先进铜基材料和高端热工装备及新材料，年营业收入110.44亿元，年度消耗原材料成本98.32亿元，原材料主要在国内采购，少量来自包括美国在内的国外进口。
谢谢！"
8,公司2016年非公开发行募资6亿用于布局顶立科技的新材料领域，截至目前募投项目进展如何？2018年能顺利投产吗？,"您好。
公司两个新材料项目，包括锂电负极材料项目和特种复合材料项目，均立足顶立装备和工艺技术优势，将采取新建和并购相结合的方式推进，为更有效用好募集资金，发挥更好的经济效益，公司在2017年做了大量的方案优化和项目储备工作，2018年将坚定目标、加速实施，实施方式和实施内容若有变化，公司将及时履行决策程序，及时披露信息。
谢谢！"
9,请问公司碳纤维相对于同行业，竞争优势是什么？,"您好。
公司全资子公司顶立科技是国内最大的碳复合材料热工装备制造和技术服务企业。为航天工业长期提供装备和技术服务，同时也是我国内最大的光伏企业隆基股份的装备和技术供应商。公司在碳碳复合材料和碳陶复合材料方面有装备和工艺优势。而碳纤维是碳碳、碳陶复合材料产品的基础原材料之一，是上下游合作关系。国内碳纤维原丝企业发展迅猛，产能很大，为碳碳复合材料提供更大的发展舞台，而碳碳复合材料国内尚在起步阶段，是替代粉末冶金和石墨材料的新一代材料，碳碳刹车盘广泛用于飞机刹车、高铁刹车和赛车刹车，大量需要进口，具备很大的市场空间。公司复合材料产业化项目将充分利用国内原来供应条件，利用自身优势，高起点建设，在军民应用领域实现进口替代。
谢谢！"
10,您认为公司股价目前是否被低估？,根据中证指数有限2018年5月7日的统计数据，有色金属冶炼及压延加工业的滚动市盈率为37.53倍，而公司最新滚动市盈率为19.55倍，远低于行业平均水平。
11,控股股东质押是自身融资需求还公司的融资需求？,"尊敬的投资者，您好！
控股股东安徽楚江投资集团有限公司将其所持有的本公司部分股份进行质押是自身融资需求。
谢谢！"
12,请问公司有军工订单吗？占比是多少？,尊敬的投资者，您好！军工订单及占比涉军数据属于保密信息不便透露，请您谅解。感谢您对本公司的关注，谢谢！
13,请问公司每年碳纤维研发费用是多少？,"尊敬的投资者，您好！
公司一直致力于通过技术研发来提高企业核心竞争力，2017年度，公司研制开发碳/碳复合材料、陶瓷基复合材料制备所需新型智能热工装备、高纯石墨、3D打印材料等，多项产品技术达到国际先进水平，年度研发投入金额22,404.36万元。
谢谢您的关注！"
14,湖南顶立科技与湖南理工学院的研究进展如何？,尊敬的投资者，您好！公司全资子公司顶立科技与湖南理工学院联合共建湖南理工学院航空技术与材料研究中心，开展围绕航空发动机技术、特种焊技术及材料、先进热工装备研发制造、先进的表面强化材料、金属 3D 打印材料、碳及碳化硅先进复合材料等方面的理论研究和技术开发。目前公司的碳及碳化硅先进复合材料、金属 3D 打印材料、特种焊技术及材料、先进的表面强化材料等材料或制品已小批量生产，且部分产品已在航天、军工、医疗等多个领域得到客户应用。感谢您对本公司的关注，谢谢！
15,请问影响公司发展的行业不利因素有哪些？,"尊敬的投资者，您好！感谢您对本公司的关注！
材料工业是国民经济的基础产业，新材料产业属于战略性新兴产业及高成长性行业，虽然竞争格局出现良性的变化，但受到宏观政策、市场需求影响，仍存在以下风险。
（1）宏观经济政策变化及经济增长放缓的风险
公司金属基础材料制造与销售业务，与宏观经济运行情况密切相关，固定资产投资规模、汽车、房地产市场消费等因素对公司发展有一定的影响。
应对措施：提高企业内生力，扩大市场占有率和竞争力，始终保持企业良性运行和领先优势，每一次经济增长放缓，对于行业龙头企业既是风险、更是机遇。
（2）原材料价格波动的风险
公司生产经营所需的原材料主要为铜、钢、锌等金属，上述原材料价格受国内国际大宗商品期货价格、市场需求等多方面因素影响，若价格在短期内大幅下跌，公司的客户可能延迟采购货物，公司存货将可能面临跌价损失风险。
应对措施：实行以销定产，扩大战略客户长期订单占比，充分利用销售合同对锁、套期保值等方式来覆盖现货敞口，对冲原材料价格波动的风险。
（3）市场竞争风险
行业集中度低，低端市场竞争激烈，公司虽然产品主流主要在高端市场，但随着高端产品产能的进一步释放，高端产品竞争也会日趋激烈。
应对措施：坚持最优供应商战略，一流的产品和一流性价比产品参与市场竞争，同等质量价格最优、同等价格质量最优。
（4）技术研发风险
公司瞄准的都是高端产品、尖端技术，研发难度系数大，可能存在研发短期不能见效甚至失败的风险。
应对措施：加强与科研院所、军工单位的合作，注重技术引进，实行协作开发，提高成功率，分散风险。
（5）人才流失的风险
由于材料的生产工艺复杂、技术难度高，需要形成持续的技术创新能力，才能保证企业在激烈的市场竞争中立于不败之地。而核心技术人员是企业持续技术创新能力的基本保障，在产品开发、生产工艺创新中起着关键作用。但随着市场对这类专业人才的需求日益迫切，人才流动性将不可避免。
应对措施：营造具有吸引力的事业发展平台，提供富有竞争力的薪酬政策，吸引人才；建立具有公平性、激励性的考核机制，让能干的、肯干的优秀人才脱颖而出，获得高额回报；加大员工持股、股权激励的推行力度，建立长效激励机制。
（6）应收账款出现坏账的风险
公司产品品种多、销量大、销售金额高、客户分散，部分客户采取先发货后收款的结算方式，存在单笔应收账款无法收回的风险。
应对措施：以高端优质的产品占据营销主动权，用产品的重要性和不可替代性从根本上降低应收账款出现坏账的风险；同时加强客户信用管理，做好客户资信评定，制定合理的信用政策，将应收账款的回笼与销售人员的激励机制相结合，从内部管理上降低出现坏账的风险。
谢谢！"
16,2018年公司还有看中那些优质标的吗？公司的发展方向一直很明确，支持公司，希望对投资标的好好考察。,谢谢你的建议。公司的战略定位是成为“铜带行业领导者，军民融合主力军”，坚持双主业发展，一手抓铜基主业发展，一手抓新兴产业培育。坚持稳中求进、专业化发展道路，加快产品升级和并购重组步伐，推动行业整合，顶立科技坚持走高端路线，服务于军工和航天，加快新材料产业化进程。目前公司储备的优质标的较多，对投资标的考察也是全方位，总体原则是能够给股东带来回报。谢谢！
17,中美贸易战对公司经营有影响吗？,答：尊敬的投资者，您好！感谢您对本公司的关注！公司主业包括金属基础材料加工和高端热工装备及新材料研发两大业务板块。其中金属基础材料产品主要客户为国内电力电子、五金电器、汽车、机械、LED和轨道交通等生产厂商。高端热工装备主要客户为国内碳及碳化硅基复合材料、高温复合材料、陶瓷基复合材料、高端真空热处理、粉末冶金等制造企业，国外客户的销售收入占公司销售总收入比重很小。目前公司生产经营稳定，业务经营状况良好。所以，美国政府发布针对中国产品新贸易政策对公司业务没有影响。谢谢！
18,鑫海铜业2017年盈利多少现在能查到吗？如果标的方成功上市，公司后期后追加投资的可能吗？,"尊敬的投资者，您好！感谢您对本公司的关注！
鑫海铜业2017年实现净利润3,488.80万元(未经审计）.
根据公司四届董事会第二十九次会议审议通过的《关于公司收购资产的议案》，公司以自有资金人民币 3,000.00 万元，收购汤优钢先生持有鑫海铜业 12.5%的股权。同时，公司以自有资金对鑫海铜业增资人民币3,000.00 万元，认购鑫海铜业新增注册资本人民币 1,225.00 万元，剩余投资款 1,775.00 万元全部计入鑫海铜业资本公积金。本次股权转让及增资完成后，公司将持有鑫海铜业 22.22%的股权。
本次交易完成后，公司将与鑫海铜业共享技术和管理经验，在研发、制造、管理、人才、资本等方面实现优势互补，提升产业协同效应。有利于公司充分发挥在先进铜基材料研发与制造行业的优势，全面拓展新能源和新能源汽车铜导体材料领域，有利于公司业务的发展和产业核心竞争力的增强，加快公司产业整合进度，进一步做大做强先进铜基材料业务板块，巩固和扩大行业领先地位，推动公司持续发展。
谢谢！



"
19,顶立科技2017年对公司的业绩贡献多少？公司当下在民用市场的占有率有多大？,"答：尊敬的投资者，您好！感谢您对本公司的关注！
2017年度，顶立科技实现营收20,412.79万元，实现净利润7,329.35万元，本年度公司先进铜基材料和高端热工装备及新材料二大主业业绩均取得显著增长。
谢谢！"
20,为什么到现在锂电池材料项目还未开展？,您好，公司锂电池负极材料项目尚未有大的资金支出，但公司对该项目的推进一直在进行，为了提高项目在国内的综合竞争力，缩短项目进入市场后的验证周期，公司在优化项目实施方式、实施地点和实施内容方面做了很多工作，请关注我们后期的信息披露和定期报告。谢谢您的关注。
21,请问公司目前股东人数是多少？,"截目一季度末，公司股东总人数为44,885。谢谢！"
22,近期中国芯火热，请问公司有次打算或布局吗？,"您好。
楚江新材不是一个蹭热点的公司，但是由于我们长期专注实业，专注高端装备和技术，尤其是顶立科技一直走在国内碳材料和粉末冶金材料的技术前沿，所以总能在新的技术应用领域作出贡献。您所说的芯片，顶立科技就是由于高纯石墨技术和装备优势，成为中国第三代半导体研发一条龙项目的主要成员单位，承担碳化硅半导体晶体基础材料-碳材料的研发。目前已经取得积极进展，该一条龙项目研发成功后，公司将成为第三代半导体材料的主要基础材料供应商，为中国芯做贡献。
谢谢！"
23,请简要介绍一下公司2017年的经营情况。,"答：尊敬的投资者，您好！感谢您对本公司的关注！
2017年是公司经营全面突破的一年，也是全面推动战略发展的一年。在国家深化供给侧改革，利废政策调整以及淘汰落后产能倒逼国内制造业转型升级的大背景下，公司上下齐心协力，一方面紧抓自身优势与市场机遇结合，另一方面持续推动企业的内在基础改善、盈利模式优化，不仅规模效益再创历史新高，而且明确了未来五年的战略发展路径，关键项目正加快实施。
本报告期内，公司实现营业收入110.44亿元，比去年同期增加39.47%，利润总额4.37亿元，比去年同期增长90.66%，实现归属于母公司净利润3.61亿元，比去年同期增长92.44%。
谢谢！
"
