,Question,Answer
0,与华星的技术协议到期后与华星有没有后续的合作,感谢您的提问，请您关注后续公告。谢谢。
1,王总，您好，请教几个问题。1、 公司发布了最新的限制性股票激励方案，请问方案中的业绩目标是如何制定的？2017和2018年实现的难度大不大？   2、 公司一季报的业绩中如果剔除新收购并表、剔除出售富祥股份的投资收益，最终的营收和净利润分别增长多少？     3、 剩余的富祥股份是否会在今年全部出售？还是会留一部分到2018年？     4、  索非布韦于3月15日在中国提交上市申请获得承办受理，您预计今年和明年是否会对公司相关业务产生实质性贡献？,感谢您的提问。公司以往业绩水平为基础，并结合公司对于宏观环境和自身所处发展阶段的判断作出适当调整，同时兼顾本计划的激励作用，综合上述因素制定了业绩指标。是否减持富祥股份公司将视市场情况决定。我们也在密切关注索非布韦在中国的进展，预期会利好于公司。谢谢。
2,贵司在2016年完成收购浙江手心100%股权和佛山手心90%股权，预计这部分资产对2017年的经营和业绩会产生哪些影响？,"感谢您的提问。通过收购两家手心，公司不仅快速实现了原料药、制剂的市场突破，初步构建了从中间体、原料药到制剂的医药垂直一体化产业链。更重要的是，浙江手心与佛山手心在原料药、制剂领域的成熟管理经验、管理体系及市场渠道，也将加快公司制剂国际化项目的推进，加速公司自有产品从中间体到原料药、制剂贯通的进程。 同时，公司与中国医化、香港手心、范伟荣和胡沛兴签署了《盈利补偿协议》， 根据该协议，中国医化和香港手心共同承诺浙江手心和佛山手心（佛山手心按照 90%计算，）2016 年度至 2018 年度经审计的承诺盈利数合计不低于人民币 22,480 万元。谢谢！"
3,公司领导怎么看现在公司的股价，对我们小散有什么忠告？谢谢,感谢您的提问。我们对公司未来发展满怀信心。谢谢。
4,目前公司享有的国家优惠政策有哪些？,感谢您的提问。公司为国家级高新技术企业，享受国家关于高新技术企业的相关优惠政策。谢谢。
5,公司2016年度的业务经营情况符合公司预期吗？,"感谢您的提问。2016年公司实现销售收入 1,748,536,267.61元，同比增长13.39%；实现归属于母公司所有者的净利润 277,018,947.34元，同比增长92.02%。同时，为了公司未来的长期持续发展，公司仍然坚持立足含氟精细化工，围绕主业进行全面投入，虽然由此带来相应的管理费用增加，以及下半年假期调整因素导致收入增速放缓，为公司报告期内主营业务收入与利润带来不利影响，但公司在产能保障、战略布局及创新潜力方面都有了更扎实的根基，公司内生增长与外延扩张双路并举，战略布局继续有序铺开，为未来长期成长奠定了更加坚实的基础。谢谢。"
6,如果公司进行定增，那大股东及高管们会考虑参与、进行增持吗？,感谢您的提问。公司如进行定增，会在相关公告中披露认购对象的情况。谢谢。
7,公司如何进行投资者关系管理，如何规划进行投资者回报的？,感谢您的提问，公司会全力推进战略布局，实现内生增长与外延扩张双路并举，从而以良好的业绩回报投资者。谢谢。
8,公司的前三大客户是哪些公司？,感谢您的提问。公司在2016年年度报告里披露了前三大客户情况，相关财务数据请参见公司定期报告。谢谢。
9,王总关于3年12亿的业绩承诺含卖富祥的非经营性损益么，还有业绩考核设计的合理么？,感谢您的提问！公司将严格履行该项承诺。出售富祥股份可以获得一定的投资收益，有利于提高公司整体资产的使用效率，有利于公司加大对主营业务投入和战略布局的推进，有利于实现股东利益最大化。谢谢！
10,能介绍一下公司现在各大区域的销售和占有率等基本情况吗?,感谢您的提问。公司在2016年年度报告里披露了公司各大区域的销售等基本情况，详见巨潮资讯网（http://www.cninfo.com.cn）。谢谢。
11,贵公司是否会考虑实施股票期权等规范股权激励方式，惠及更多员工？,感谢您的提问和建议，公司始终致力于让员工和企业共同成长发展。谢谢。
12,公司目前有哪些在建项目？建设进度如何？还需要多少资金？,感谢您的提问。公司在2016年年度报告里披露了在建项目的具体情况，详见巨潮资讯网（http://www.cninfo.com.cn）。谢谢。
13,请问公司以后每年会用什么形式回馈股东？,感谢您的提问，公司已经制定并公告了了2015-2017三年回报规划，您可至巨潮资讯网查询。谢谢。
14,虽然说公司的股价由二级市场决定，但股价是公司经营的一个表象，请问管理层对回报投资者持有怎样的态度？,感谢您的提问。股价是一个多方博弈的结果，取决于多重变量。公司致力于做好扎实的经营管理，以良好的业绩回报投资者。谢谢。
15,王叔叔好，公司去年的业绩情况？公司有宣传片吗？,"感谢您的提问。2016年公司实现销售收入 1,748,536,267.61元，同比增长13.39%；实现归属于母公司所有者的净利润 277,018,947.34元，同比增长92.02%。 公司已披露2016年年度报告，详见巨潮资讯网（http://www.cninfo.com.cn）。谢谢！"
16,请问公司如何看待上市公司的并购和市值管理？,"感谢您的提问。利用资本平台实现快速发展是上市公司特有优势。公司会继续围绕主业布局，积极发挥公司的资本市场平台优势，实现内生增长与外延发展双路并举，从而加快公司发展壮大的步伐。谢谢。
"
17,公司2017年一季度经营业绩如何？,"感谢您的提问。2017年一季度公司实现营业收入52,682.55万元，同比增长26.43%。归属于上市公司股东净利润16,429,27万元，同比增长330.69%。公司已披露2017年第一季度报告，详见巨潮资讯网（http://www.cninfo.com.cn）。谢谢。"
18,公司有没有哪些项目创新模式？,"感谢您的提问。氟化工被誉为黄金产业，在医药、农药、平板显示、新能源、汽车、电子、环保及航空航天等领域均有广泛应用，做为氟苯精细化工领域的领先企业，公司始终强调创新在发展中的引领作用，通过不断创新来持续丰富和优化公司的产品结构。公司大量的研发投入也获得丰厚的回报。2016年，新申请发明专利7项，获得授权21项。截至2016年，公司累计申请发
明专利62项，其中42项已授权。同时公司在2016年共完成新产品开发40项，中试25项，技改19项。谢谢。
"
19,公司是否在考虑开拓新的领域？取得初步进展没有？,感谢您的提问。公司将继续加大在研发领域的设施投入和团队建设，加大与高校、科研院所的产学研互动，构建更强大的创新平台，继续沿着由专利制造向创新制造的发展道路逐步探索，聚焦现有优势产品进行横纵向、深度化、系列化开发；针对平板显示、新能源等领域进行前瞻性开发，不断优化和丰富公司产品结构，强化公司在含氟精细化工领域的核心竞争力与市场话语权。谢谢。
20,您好！截至到2016年12月31日，“国家队”即中金、证金、汇金的持股比例有多大？,感谢您的提问，公司在2016年年报中披露了股东数据，您可参阅。谢谢。
21,你好，请问贵司目前产品的销售趋势如何？今年的销售目标是多少？,感谢您的提问，公司目前市场开拓情况良好。谢谢。
22,公司现在负债总额是多少？每年负债的利息是多少？谢谢。,感谢您的提问。公司已披露2016年年度报告，详见巨潮资讯网（http://www.cninfo.com.cn）。谢谢。
23,政府加强对药品生产和流通市场的监管和调控，对贵司存在哪些挑战和机遇呢？,感谢您的提问。医药既是一个广阔的市场，也是一个事关大众生命健康的国计民生行业，市场越规范，对生产者要求越高，应该说是好事，能够淘汰落后产能，让质量、管理更优秀的企业有更好的发展空间，这也是我们发展的机会和努力的目标。谢谢。
24,今年以来，原材料都迎来涨价潮，对公司会有什么影响？,感谢您的提问。公司所需的原材料市场供应较为充足，一般会对某种原材料采取通过和几家供应商分散采购，以及批量采购等方式，同时针对价格波动，公司也会进行一些战略性采购来化解涨价风险。总体来看，原材料波动对公司影响不大。谢谢。
25,现在行业间的并购都比较频繁，你们今年有没有兼并收购计划？,感谢您的提问。公司将一如既往围绕主业布局，并充分利用资本平台，实现内生和外延增长双路并举。谢谢。
26,公司在经营活动中主要对哪些环节进行质量控制？,感谢您的提问！公司凭借所构建的综合性生产平台，能够提供多系列门类齐全的产品，产品质量具有较高的稳定性，有利于现有客户对所需的各类产品进行集中定购，同时齐全的产品结构也有利于吸引新客户的采购。谢谢！
27,公司所处行业有没有周期性？,感谢您的提问，公司主营业务为氟苯精细化工，并由此向下游延伸。公司面对的市场主要包括医药、农药、平板显示及新能源锂电行业，其市场需求比较稳定，不存在大的周期波动。谢谢。
28,公司每次投资项目的可行性报告是否有详细说明公告？,感谢您的提问，关于投资项目的可行性研究报告公告，您可到巨潮资讯网查询。谢谢。
29,近几年的固定资产，技术改造的投资效果如何，是否达到了预期的目标，不考虑市场因素，简单考虑毛利情况是否合理？,感谢您的提问。公司近来年在提升产能、完善生产体系以及技术创新、研发等方面做了大量投入，这些投入对于提升公司的市场竞争力和长远发展潜力都具有重要作用。谢谢。
30,雄安新区的设立，对公司存在哪些机遇？,感谢您分享的信息。公司目前专注于氟苯精细化工，并在浙江、江苏、山东及重庆、福建设有生产基地。谢谢。
31,叔叔好，公司的主营业务和上市时间介绍一下,永太科技于2009年12月上市，公司是行业内产品链最完善、产能最大的苯系列氟精细化学品的生产商之一，主要经营医药、农药、电子化学品及新能源锂电材料业务，主要为国际巨头相关企业提供定制生产、研发和技术服务。 医药化学品产品主要有心血管类药物、糖尿病类药物、精神类药物、抗感染类药物及抗病毒类等医药的含氟中间体；农药化学品产品主要有含氟类除草剂、杀菌剂、杀虫剂中间体的生产和销售，以及农药原药和制剂的批发零售；电子化学品产品主要有含氟单晶中间体、单晶及平板显示彩色滤光膜材料（ CF光刻胶）等；新能源锂电材料主要有六氟磷酸锂、双氟磺酰亚胺锂。
