,Question,Answer
0,公司去年财务费用和管理费用怎样？同财务费用相比呢？今年有没有折旧？请问管理费用今年会能稳定吗？,"您好！公司2016年管理费用、财务费用分别是230,512,955.62元、-8,207,248.64元，较2015年略有下降，2017年有折旧，预计管理费用为23051.3万元。
                          谢谢！
"
1,公司对同行竞争对手有怎样的考量？你们的成本、管理、市场等优势体现在哪些方面？,您好！公司所在的线缆行业竞争日趋激烈，公司经常对标行业伙伴，分析行业内企业的年报资料和重点数据，并通过理论交流、行业会议、实地考察等多种方式学习先进企业做法。公司在成本管理方面主要采取划小核算单元并进行市场化考核、信息化采集和使用数据等方式保持成本竞争力；在市场方面，也采取了有效措施，保证公司在高压、超高压等传统优势领域的领导水平以及在海缆、特高压导线等重点发展产品领域的竞争能力；另外，公司具备资金、技术、管理等方面的多重优势，发展前景较好。谢谢！
2,近几年的固定资产，技术改造的投资效果如何，是否达到了预期的目标，不考虑市场因素，简单考虑毛利情况是否合理呀。,你好！公司每年按照根据实际在新产品领域、降低劳动强度、提高劳动效率方面，提出年度投资计划和技术改造项目，公司对审核确定的项目进行固定资产和技改的投入，目前各项进展按照计划进度进行。谢谢！
3,请问公司氢能项目进展如何，合适能注入上市公司,目前公司控股股东投资的氢能项目进展顺利，合适时我们会考虑将其注入上市公司中，谢谢！
4,请问公司现有员工！管理层，各是多少人？谢谢！,请关注公司2016年年度报告中的公司员工情况，谢谢！
5,公司是否在考虑开拓新的领域？取得初步进展没有？,你好！公司暂时没有开拓新的业务领域，如有，我们会按照相关要求及时披露。谢谢！
6,请问独立董事，您的履职情况如何，是否能真正保护了中小股东利益？,你好！本人严格按照《公司法》、《关于在上市公司建立独立董事的指导意见》等法律规章和《公司章程》、《公司独立董事工作制度》等规定，勤勉、尽责、忠实履行职责，积极出席相关会议，认真审议董事会各项议案，对公司相关事项发表独立意见，发挥独立董事的独立作用，维护了公司整体的利益，保护了全体股东尤其是中小股东的合法权益。
7,公司目前有哪些在建项目？建设进度如何？还需要多少资金？,请关注2016年年度报告，谢谢！
8,虽然说公司的股价由二级市场决定，但股价是公司经营的一个表象，请问管理层对回报投资者持有怎样的态度？,您好！股价问题历来受投资者关注，提问较多。我们认为：股票价格一定程度上反映公司的投资价值，但股价同时受公司的经营状况、整体经济形势等多种因素共同影响，并与投资者的投资理念、市场成熟度、可供选择的投资渠道等因素有关。投资者选择个别公司股票即是对公司的恳定和认可，公司对全体投资者持感谢态度并深感责任重大，公司应当在经济下行和竞争加剧的新常态形势下砥砺前行，积极作为，全力提升公司业绩，以此为基础，回报全体投资者。非常感谢！
9,请站在独立董事的角度 评价一下这家公司。您的专业态度对我很重要！,非常感谢！谢谢关注！公司是一家集电缆及附件系统、状态检测系统、输变电工程总包三个板块于一体，研发生产经营的技术密集型企业集团，国家高新技术企业，全国守合同重信用企业，中国电缆行业领军企业。
10,请问公司今年是否有对外扩张的打算？今年公司在市场开拓方面有什么计划？能否详细谈谈？谢谢,公司暂时未有对外扩张打算，请及时关注公司公告。在市场开拓方面，公司除立足国内市场满足国内市场需求外，积极开拓国际市场业务，目前已经在多个国家实现供货业绩。谢谢！
11,建议公司中标项目后及时公告，同时公司应大比例分红，让我们这些股东降低持股成本,谢谢您的建议！
12,请问公司以后每年会用什么形式回馈股东？,您好！公司经营层应始终致力于持续提高公司的治理水平和盈利能力，提升公司价值，在此基础上，积极履行企业社会责任，在保障公司长远发展能力的基础上以现金分红等多种形式回馈全体股东。谢谢！
13,公司领导怎么看现在公司的股价，对我们小散有什么忠告？谢谢,您好！股票价格一定程度上反映公司的投资价值，但股价同时受公司的经营状况、整体经济形势等多种因素共同影响，并与投资者的投资理念、市场成熟度、可供选择的投资渠道等因素有关。个人建议投资者加强对产业的研究和对个别公司报告的解读，坚持价值投资理念，减少短期行为。谢谢！
14,公司是否具备长期投资的价值？你是怎么看的？ 如果有机会，你会增持吗？,影响股票价格的因素有很多，股票价格不仅取决于公司的经营状况，同时还会受到利率、汇率、宏观经济、通货膨胀和国家有关策等因素的影响，并与投资者的心理预期、二级市场的供求关系等因素息息相关，因此股票价格与公司价值之间没有必然的联系。我们将做好本职工作，做大做强公司主营业务，为股东带来丰厚回报。我们对公司有信心，谢谢！
15,目前公司享有的国家优惠政策有哪些？,您好！公司目前享受高新技术企业、研发费用加计扣除等相关优惠政策，此外还承担国家和地方项目获得政策扶持。谢谢！
16,贵公司是否会考虑实施股票期权等规范股权激励方式，惠及更多员工？,我们会考虑的，谢谢您的建议！
17,公司的负债比率有多少？,您好！公司2016年末及2017年第一季度末的资产负债率分别为31.03%和29.75%，处于行业较低水平，短期偿债能力良好。谢谢！
18,请问公司股票上市时期价格多少，现在多少，还具有投资价值吗？,影响股票价格的因素有很多，股票价格不仅取决于公司的经营状况，同时还会受到利率、汇率、宏观经济、通货膨胀和国家有关策等因素的影响，并与投资者的心理预期、二级市场的供求关系等因素息息相关，因此股票价格与公司价值之间没有必然的联系。我们将做好本职工作，做大做强公司主营业务，为股东带来丰厚回报。我们对公司有信心，谢谢！
19,公司如何吸引人才，如何留住人才？,公司注重人才管理，因岗定薪，实行技术系列、岗薪系列、定额系列三大薪酬体系，绩效考核作为提升薪酬体系的软性手段和工作促进方法。为员工提供稳定而具有竞争力的薪酬，公司适时调整薪酬管理办法，以充分调动员工的积极性和创造性，不断提高员工的满意度。谢谢！
20,公司未来3年发展前景如何?,您好！公司未来3年将继续按照“聚焦电缆主业、发展高端产品”的战略，培育成套产品和服务。同时，适度利用公司资金优势提高整体资产回报水平，公司未来发展前景较好。谢谢！
21,请问具体联系证券代表的电话是多少？,办公电话88817759，谢谢！
22,员工持股，所谓的解禁应该是个伪命题？只要你没有离开公司你就一直持有公司的股份，你走了，新人进来了，他也将持有你转让的股份，即然是员工持股，没有董事会表决也不可随意出售？请问彭懂我可以这样理解吗？,"公司依据《公司法》、《证券法》等有关法律、行政法规、规章、规范性文件和《公司章程》的规定，制定员工持股计划。设立员工持股计划的意义在于：
1、实现股东、公司和员工利益的一致，维护股东权益，为股东带来持续的回报；
2、为进一步完善公司治理结构，健全公司长期、有效的激励约束机制；
3、倡导公司与员工共同持续发展的理念，有效调动员工的积极性，吸引和保留优秀管理人才和业务骨干，兼顾公司长期利益和近期利益，更灵活地吸引各种人才，促进公司持续、健康的发展。
谢谢！"
23,公司现在负债总额是多少？每年负债的利息是多少？谢谢。,您好！公司2016年末及2017年第一季度末的负债总额分别为20亿和19.1亿，资产负债率分别为31.03%和29.75%，近两年很少使用银行借款，2016年未产生银行借款及利息，公司2017年3月末银行借款余额为1.6亿元，为短期流动资金贷款，负债利息处于较低水平。谢谢！
24,作为一家上市公司，为了更有利于与投资者交流，能不能在公司网站上设置交流互动功能？,公司在网站上专门设立投资者关系功能，谁是欢迎投资者交流，谢谢！
25,将来公司的下属公司会有上市的打算吗?,公司的下属公司如达到上市的各项要求，公司适时会研究考虑的，谢谢！
26,最近公司财务状况如何？,您好！公司2016年末总资产为64.37亿元，较去年同期略有增长，主要原因是公司盈利的增加以及稳健的财务结构。公司2016年末资产负债率水平为31.03%，处于同行业较低水平，公司财务政策稳健，债务风险较低。公司目前资产结构合理，资产质量良好，具备良好的资金实力，整体的财务和经营状况较好。谢谢提问！
27,听说电缆市场竞争激烈，公司面对这样的情况有什么措施？,"面对电缆市场竞争激烈，我们主要采取如下措施：
1、科学管理，增强员工凝聚力
2、以技术创新为引领，强化产品研发，加强产品质量控制
3、整合优势资源，提高公司竞争力
4、加强公司人才队伍建设和培养
5、信息化建设、提升管理效用。
6、加强市场营销管理。
7、适时寻求兼并重组机会，通过资本运作，实现企业稳健增长。
谢谢！"
28,电缆行业的整体竞争格局如何？,我国电线电缆行业总体上产能过剩，中小企业众多、行业集中度低、中低端产品竞争激烈、科技研发投入少等缺陷，阻碍了行业的健康发展。价格竞争仍是“十三五”期间的主要市场竞争方式，行业进入洗牌期，分化重组促进行业结构优化，效率提高，行业集中度将进一步提高，市场资源向品牌集中，逐步推动竞争迈向产品质量、综合配套、服务体验等更高层次。面对激烈的市场竞争，电缆行业生产厂家应通过各种方式降低成本，控制固定支出，加强新技术开发，电线电缆行业中技术力量强、产品质量好的企业将在未来竞争中处于有利地位。谢谢！
29,公司每次投资项目的可行性报告是否有详细说明公告？,公司每次投资项目，公司投资部都会制定详细的可行性报告，如达到披露要求，公司会及时将项目情况履行审批程序并按要求披露。谢谢！
30,业绩说明会本来应该是恳谈会，将企业目前的处境，面临的困难，预计的风险和相应应措施清晰告诉股东。,您好！感谢您的参与和提问！公司2016年度经营的整体情况在公司年报中已经进行比较全面、准确的说明和披露，业绩说明会中主要针对投资者关心的问题进行深入交流，欢迎您及其他投资者踊跃提出具体的问题进行交流。谢谢！
31,请描述一下公司未来的发展前景，谢谢！,未来公司将依照聚焦电缆主业、发展高端产品，培育成套和服务，实现规模效益，适时兼并扩张的发展战略，实现使公司达到“国内第一、世界知名”的电线电缆产业的发展目标。以此为指导确定2017年的目标和工作思路。谢谢！
32,现在行业间的并购都比较频繁，你们今年有没有兼并收购计划？,兼并收购一直是公司开展资本运作的重要手段，如有我们会及时披露的，请关注，谢谢！
33,公司在技术创新方面有哪些创新？,2016年g公司进行500kV超高压交流海底电缆系统的研究、220kV超高压大截面三芯海底电缆研究、500kV超高压电缆附件预鉴定研究、新加坡400kV超高压交联电缆研究等重大项目；开展了220kV高压电缆料的国产化中试；开展了特种电缆材料的基础研究；完成了220kV及以下超高压海底电缆、132kV电缆附件、机车车辆电缆、动态电缆等市场应用推广，联合中国海洋大学、青岛迪玛尔公司、中国石油大学联合开展了水下动态电缆、脐带缆及相关配套附件的分析设计、软件开发、性能测试、产品制造等。完成“钢芯高导电率铝绞线”、“1250大截面钢芯铝绞线”等产品的鉴定，产品技术水平达到国际先进水平，参与GB1179“圆线同心绞架空导线”等四个标准的起草制定工作；建立健全了国家高压、超高压电缆技术研新中心的运行机制，并有效稳定运行。 公司一直坚持科技创新为企业可持续发展源动力的理念，坚持自主创新并注重科研成果转化。公司拥有国家级企业技术中心、国家超高压电缆工程技术研发中心和博士后科研工作站。表明公司研发和综合技术水平在国内处于领先地位。谢谢!
34,近一年来，贵公司高管考虑增持吗？,暂时没有计划。请随时关注公司公告，谢谢！
35,请问贵公司对当前股价有什么看法，股价为什么在两年内不停的下跌，公司有没有什么措施来保障股东的权益。公司主营业务是不是在下滑,您好！感谢您对公司的关心。2016年，公司实现营业收入41.38亿元，较去年同期下降0.72%，营业收入略有降低，但波动较小，主要是受市场竞争、公司产销政策和产品结构的综合影响，公司盈利能力在市场竞争日趋加大的情况下仍保持较好的水平。股价受公司的经营状况、整体经济形势等多种因素的共同影响，并与投资者的心理预期、二级市场的供求关系等因素有关。公司一直致力于提高综合经营效率，争取为全体股东提供更好的回报。谢谢！
36,公司在一带一路方面有什么计划？未来市场如何布局？,公司成立专门的一带一路项目部，并先后在中国水利水电第八工程局、广东省电力设计研究院、中国电力技术装备有限公司、华东电力设计院、葛洲坝国际工程有限公司、中国天辰工程有限公司召开了七次技术交流会，通过面对面的技术交流，和客户有了更为深入的交流，一带一路项目部投标中标的项目有：喀麦隆曼维莱水电站送出系统铝合金导线项目，巴基斯坦塔尔煤电项目，越南永新电厂中低压电缆项目，孟加拉国诺瓦布甘杰重油电站中低压电缆项目，巴基斯坦Tenaga海上风电海底电缆项目等。谢谢！
37,公司员工持股计划什么jiejin?,公司第一期员工持股计划2017年7月20日解禁。谢谢！
38,请问公司有无通过发行公司债券等形式进行募资的计划？有无设立并购基金收购标的的计划？,暂时没有，如有我们会及时披露的，谢谢！
