,Question,Answer
0,公司自从上市以来，业绩连连下滑，而水处理行业正处在发展的大好时期，这里面深层次的原因，请问董事会认真研究过吗？有什么对策吗？这个困难是暂时的，暂时是多久？我们相信公司太久了，而公司给我们带来的是沉痛的损失,您好！2018年，公司会紧密围绕市场需求，加大产品、工艺及装备的开发力度，提升技术支撑能力，突出特点、结合优点、发挥主流技术及强势技术，构建新的盈利模式。谢谢！
1,"范总：您好。图木舒克市纺织工业园区污染水处理厂PPP项目,按合同约定，去年底就应该完工，工期推迟的责任在谁？现在完成进度达到多少?这对公司未来业绩有一定的影响，公司应该及时批露相关信息，看人家铁汉生态都有公告。请一一回复，谢谢！！",您好！新的政策对该项目有一定的影响，项目尚未完工，感谢您的关注。谢谢！ 
2,公司所处行业市场变化很大，公司有计划多元化发展吗？,您好！公司未来不排除多元化发展。感谢您的关注，谢谢！
3,公司获得过哪些重要的奖励和技术专利吗？近期公司有什么技术突破，将给公司带来什么影响？,您好！公司的奖励和技术专利情况请参阅公司在巨潮资讯网披露的定期报告，近期公司的技术情况请关注后续公司的定期报告，谢谢！ 
4,辛苦董事长了，最后一个问题，董事长可以预期一下咱们作为膜处理行业有多大的发展空间？国外产品的市场份额以及公司目前占的市场份额？公司是否有将水处理膜技术延伸到其他行业，比如盐湖提锂、化学提纯等等行业呢？,您好！公司致力于膜法水处理行业四十余载，今后公司依然会在此行业深耕细作。未来公司不排除膜技术延伸到其他行业。感谢您的关注，谢谢！
5,请问今年内公司有并购重组或者资产注入计划吗？有没有投资新建厂等计划？,您好！请关注公司公告，感谢您的关注，谢谢！
6,请问公司的主要合作客户分布在哪些行业？能否举例几家合作商？,"您好!公司的主要合作客户分布在市政污水,医药,钢铁行业等行业，谢谢关注！"
7,是否有针对核心员工的股权激励计划？,您好！公司会结合自身的实际情况，适时考虑相关工作，谢谢！
8,请问公司高管对目前年薪是否满意？请问公司高管的收入确定的依据是什么？公司员工的晋升渠道怎么样？,您好！公司薪酬依据公平性、竞争性、激励性、经济性和合法性的原则，遵循“为岗位价值付薪，为业绩贡献付薪和为个人能力付薪”的薪酬支付理念，同时考虑企业当前及未来发展对人才的需求，对员工薪酬进行核定。感谢您的关注，谢谢！
9,公司有没有通过并购打通上下游的计划？,感谢您的关注！
10,公司公告称：开展了膜技术与水环境治理平台建设，为国家水环境治理战略以及天津市海绵城市建设、黑臭水体治理提供技术支持。目前情况如何？,您好！借助公司构建的膜技术与水环境治理平台，公司正积极推进相关的研发工作。感谢您的关注！
11,目前公司工程类新增订单量是多少？,您好！请关注后续2018年1季度公告，谢谢！
12,目前公司有哪些新研发投入的产品和项目？运营情况如何？,您好！公司研发项目及其进展情况请参阅公司在巨潮资讯网披露的定期报告，谢谢！
13,请简要介绍下公司的商业模式和盈利模式，公司现金流情况如何？,您好！请查看公司的定期报告，感谢您的关注，谢谢！
14,18年1季度亏损的主要原因：2018年一季度研发支出较上年同期增加及本期发生的银行财务费用增加，可否简单介绍一下？,您好！请关注公司后续即将披露的定期报告，谢谢！
15,请问贵公司目前的订单结构是怎样的？近几年有什么变化？为什么？,您好！订单结构详情请关注年度报告，近几年签订的BOT项目合同有所增加，谢谢关注！
16,公司17年销售费用大幅增加的原因是什么？销售费用增加没有带来营业额的同比增长呢,您好！请参阅公司的定期报告。营业收入受多种因素影响，不一定与销售费用同向变动，谢谢！
17,乡镇分散式一体化污水处理技术运用在哪些地区和项目中？运营情况如何？,您好！乡镇分散式一体化污水处理技术运行在天津等郊县地区，运营情况良好！感谢您的关注，谢谢!
18,请问公司现在是否面临经营困难？将会在经营上做何种调整？,污水处理市场前景很好，经营困难只是暂时的，谢谢关注！
19,今年公司特许经营类订单量是多少？,您好！请关注公司后续披露的公告，谢谢！
20,董事长先生，您好，公司在研发这一块有什么发展方向吗,您好！公司的研发项目及其进展请参阅公司披露的定期报告，谢谢！
21,预计第二季度公司经营业绩情况如何？,您好！届时请关注公司半年度报告。感谢您的关注，谢谢！
22,公司管理层都存在减持公司股票的情况，这是说明管理层不看好公司发展前期吗？,您好！公司会努力经营，提升业绩，谢谢！
23,公司接下来的经营思路怎样？跟中核新能源股份有限公司的合作推进情况咋样了,您好！公司会努力经营，提升业绩。公司与中核新能源已合作成立项目公司，并正共同承建相关项目，谢谢！
24,公司如何建立自己推广销售网络？每年公司的公关和广告费用大概是多少？,您好！公司会整合内外资源，积极开拓市场。具体的销售费用请参阅公司定期报告，谢谢！
25,请介绍一下公司的核心业务及业绩做好的业务板块？该核心产品的市场占有率情况如何？同行业内最有竞争力的对手是哪些？能否举例说明下谢谢！,您好！请参阅公司在巨潮资讯网披露的定期报告，谢谢！
26,目前公司有哪些并购项目？进展情况如何？,您好！请关注公司后续公告，谢谢！
27,范总经理，您好，公司在黑臭水体研发上面的投入大吗？公司在河北环雄安区域拿项目情况如何？,您好！公司会积极关注相关信息，并结合公司的规划，积极推进相关工作。感谢您的关注！
28,目前公司有开发哪些新的客户？,您好！公司会积极开拓市场，重要的客户信息请关注公司公告，谢谢！
29,1.51亿无极县改造项目运营情况如何？预计今年该项目营收占比是多少？,您好！公司的重大项目信息请关注公司后续公告，谢谢！
30,2017年，公司主营产品对公司的收入与利润分别有什么影响？,请关注我公司2017年度报告，感谢！
31,17年所有相关环保企业业绩均出现不同比例的增长，而公司不仅营业额同比下降且出现了亏损情况，请问董事长有什么看法？是公司的产品没有竞争力吗？,您好！公司产品具有较强的竞争力，公司正积极整合资源、努力经营。感谢您的关注！
32,津膜科技2018年一季度净利润预亏200万元至260万元，请问主要原因是什么？公司2018年会对产品结构做相应的调整吗？,请关注我公司2018年1季度业绩预告，感谢您的关注！
33,贵公司的技术世界领先，规模不断扩大，国家政策又大力支持，你们没有发展不好的理由，您们应该有足够的自信，建设领导层增持股票！谢谢！,"您好！感谢您的关注，谢谢！
"
34,公司的膜技术为公司创造多少利润？,请关注公司年报，感谢！
