,Question,Answer
0,公司去年主打产品的销量是多少？,您好，去年相关产品情况请参阅公司2016年年报，谢谢。
1,能简单的介绍下新项目的情况吗？,您好！公司拟通过非公开发行股票募集资金3.5亿元，用于视频图像信息大数据及深度智能分析系统产业化技术改造项目、综合安保社会化运营平台及公共安全智能终端产业化技术改造项目、监狱大数据信息综合管理平台技术改造项目的建设，从而进一步完善公司在业务和创新等方面的布局，该非公开发行股票事项已于2016年9月28日获得中国证监会审核通过，待取得证监会的正式核准文件后，公司将择机启动股票发行和项目建设工作。谢谢您的提问！
2,最近安全监控的上市公司比如海康威视还有大华股份走势都很强势，几乎都创历史新高，而公司一直在底部调整，请问公司是否觉得二级市场有低估公司的投资价值？,您好，股票二级市场价格波动受多方面因素影响，有自身运行机制和原理，请广大投资者注意投资风险。公司管理层将不断加强内部管理、努力提升业绩，以期更好的回报广大投资者。谢谢。
3,你们公司与同属安全监控的行业海康威视与大华股份走势可是天壤之别，公司对股价貌似一定都不重视，请问为什么？,您好，股票二级市场价格波动受多方面因素影响，有自身运行机制和原理，请广大投资者注意投资风险。公司管理层将不断加强内部管理、努力提升业绩，以期更好的回报广大投资者。谢谢。
4,公司是否会计划多元化发展？,您好，公司全面推进以智慧管理平台为切入点，以云计算、云存储、大数据、人工智能等各种创新技术为基础的金融安防业务，并积极推进智慧城市、智慧监狱、智慧水利、智慧口岸、智能建筑及智能消防等行业安全业务，实现公司多行业并行发展以及行业内部全方位的市场覆盖。谢谢。
5,请问公司目前的研发机构有哪些？公司未来产品的研发与创新将如何进行？,您好！公司经过多年的开拓和积累，拥有专业的研发体系和稳定的核心团队。公司坚持以市场为导向，结合行业发展趋势及客户新需求，持续加大创新投入，加快云计算、大数据、人工智能等各种创新技术的发展融合，为客户提供定制化、专业化和个性化的服务，为公司的业务转型升级提供强大的技术和产品支撑。谢谢您的提问！
6,公司募投项目，预期如何？是否谨慎？,"您好，公司已在巨潮资讯网发布募集资金存放和实际使用情况专项报告,募投项目资金详细使用情况请参考此报告，谢谢您的提问。 "
7,请问公司的分配预案达到承诺的分红比例吗？,您好，公司严格按照公司章程的相关规定进行分红，谢谢。
8,公司未来五年的目标是多少？能够实现吗？,"您好！公司2016年年度报告中对公司未来发展情况有详细描述，具体内容请参见2016年年度报告第四节“经营情况讨论与分析”之九“公司未来发展的展望”。谢谢您的提问！
"
9,公司截止至今的产品有多少个种类？,您好，公司目前主要有安防系统和安防设备两类产品。谢谢。
10,请问开完股东会后，如果送股通过几日内会送股？,您好，相关权益分派方案将于年度股东大会审议通过后两个月内实施，谢谢您的关注！
11,公司截至目前为止都有哪些子公司和参股公司？,您好，具体内容详见公司2017年3月31日披露于巨潮资讯网的2016年年度报告中“第五节 重要事项”之“公司子公司重大事项”的相关表述，谢谢。
12,新投资的项目今年能否为公司贡献利润？如有利润贡献，公司预计能实现多少利润？,您好！请关注公司相关定期报告，谢谢您的提问！
13,请问老总公司今年净利润同比增长多少？而管理费用去用比去年同期的增长了多少呢？,您好！公司2016年归属于上市公司股东的净利润比去年同期增长32.29%，管理费用较去年同期增长48.61%，谢谢您的提问！
14,公司的发展战略是什么， 是否公司未来发展的主打方向？  以前没怎么听到这方面的动向， 能否详细讲解一下主要是面对哪些品种和市场？ 谢谢！,您好，公司将以创新为引擎，以智能硬件、智慧管理平台软件为基础，以高品质服务为保障，完整构建物联网在各行业应用的生态体系，实现物联网产品、物联网服务双翼齐飞。一方面公司将继续拓展传统的金融安防市场，另一方面将积极开拓包括智慧城市、智慧监狱、智慧水利、智慧口岸、智能建筑、智能消防等在内的其他行业，成为智慧和安全新世界的构筑者。谢谢！
15,请问今年预计主要产品的销售目标是多少？净利润是多少？,您好！请关注公司披露的相关定期报告，谢谢您的提问！
16,请问老总， 2016年存货是多少，存货增加的内容是哪些？,您好，具体内容请关注公司于2017年3月31日披露在巨潮资讯网的2016年年度报告中存货的相关表述，谢谢。
17,公司2016年管理费用较上年同期相比如何，原因是什么？2017年会下降吗？,您好，2016年管理费用较上年同期增长主要是科技研发费用，职工薪酬、折旧费、中介服务费、差旅费、办公费、员工股权激励摊销费用增加所致。谢谢。
18,要实现公司的发展目标，请问信心来自哪里。,您好！公司在金融安防整体解决方案能力、技术与研发、行业经验及品牌、金融安防综合资质以及营销及服务网络方面均有着自己的独特优势，我们相信，只要方向对了，路就不怕远，谢谢您的提问！
19,请问2017年全年预计销售目标是多少亿元？实现净利润的目标是多少亿元？,您好，请关注公司的定期报告，谢谢您的提问。
20,公司的前5名供应商是什么，与公司存不存在关联关系？,您好，具体内容请关注公司于2017年3月31日披露在巨潮资讯网的2016年年度报告中“第四章 经营情况讨论与分析“之”主要销售客户和主要供应商情况“。谢谢。
21,公司的前5大客户是哪些？,您好，具体内容请关注公司于2017年3月31日披露在巨潮资讯网的2016年年度报告中“第四章 经营情况讨论与分析“之”主要销售客户和主要供应商情况“。谢谢。
22,2017年公司是否考虑对高管实行股权激励，如果有的话大概什么时候实行？,您好！如公司有相关安排，将会严格依照相关规则进行信息披露，请关注公司相关公告，谢谢！
23,未来几年， 公司如何定位， 哪些市场更适合公司产品的长远发展？,您好，公司将以创新为引擎，以智能硬件、智慧管理平台软件为基础，以高品质服务为保障，完整构建物联网在各行业应用的生态体系，实现物联网产品、物联网服务双翼齐飞。一方面公司将继续拓展传统的金融安防市场，另一方面将积极开拓包括智慧城市、智慧监狱、智慧水利、智慧口岸、智能建筑、智能消防等在内的其他行业，成为智慧和安全新世界的构筑者。谢谢。
24,请问公司拟进入的什么新的细分领域吗？这一领域与公司现有业务的相关性？,您好！根据公司2017年的经营计划，2017年公司继续贯彻“提升金融安防的市场占有率，深入挖掘客户的各类应用需求，积极构建行业安防整体解决方案”的发展策略，全面推进以智慧管理平台为切入点，以云计算、云存储、大数据、人工智能等各种创新技术为基础的金融安防业务，并积极推进智慧城市、智慧监狱、智慧水利、智慧口岸、智能建筑及智能消防等行业安全业务，实现公司多行业并行发展以及行业内部全方位的市场覆盖。谢谢！
25,公司目前主要的研发方面是什么？,您好，公司坚持以市场为导向，结合行业发展趋势及客户新需求，持续创新投入，加快云计算、大数据、人工智能等各种创新技术的发展融合，为客户提供定制化、专业化和个性化的服务，为公司的业务转型升级提供强大的技术和产品支撑。谢谢。
26,请问：公司已经投产的募投项目及超募项目，2017年是否可以完全投产并且贡献效益？这部分的折旧和费用对利润影响大吗？谢谢,"您好，公司已在巨潮资讯网发布募集资金存放和实际使用情况专项报告,募投项目资金详细使用情况请参考此报告，谢谢您的提问。"
27,公司高级管理人员的考评及激励情况怎样，有没有股权激励制度？,您好，公司高管人员的薪酬与考核以公司经济效益及工作目标为出发点，根据公司年度经营计划和高级管理人员分管工作的职责，初步建立并实施了高级管理人员的薪酬与公司业绩挂钩的绩效考核与激励约束机制，公司高级管理人员实行固定薪酬和年终绩效考核相结合的薪酬制度。每年年终由董事会薪酬与考核委员会进行综合考核，最终以考核结果确定高级管理人员的年度薪酬水平。
28,公司今年的财务费用会有多少？,您好，相关问题请关注公司的定期报告，谢谢。
29,公司预计2017年业绩较去年同期是上升还是下降？若上升，则增幅是多少？,您好~公司将严格按照相关规则的要求在中国证监会指定的创业板信息披露媒体巨潮资讯网上披露相关业绩预告和快报，请您关注公司相关公告，谢谢！
30,公司截止目前的股东总人数是多少？,"您好，截止2016年12月31日公司的股东人数是15,933户。谢谢您的提问。"
31,公司在税收方面有没有相关的优惠政策？具体税率是多少？,您好，2014年10月10日，我司获得广东省科学技术厅、广东省财政厅、广东省国税局和广东省地税局颁发的编号为GR201444001013的《高新技术企业证书》，2014-2016年度减按15%的税率计缴企业所得税。具体内容可见2016年年度报告，谢谢您的提问。
32,请问公司有无通过发行债券等形式进行募资的计划？有无设立并购基金收购标的的计划？,    目前没收到公司管理层关于这方面的相关计划，具体请关注公司的公告，谢谢。
