,Question,Answer
0,在企业文化方面，公司有什么特色吗？,您好！R&T，Reliable and Trustworthy，可靠的产品、可信赖的团队。公司秉承“以人为本，持续改善”的经营理念，致力于节约全球水资源和提升人民生活水平，为客户提供优质的产品和服务，注重公司、员工、股东价值的共同实现。
1,请问公司里是否有专人负责回答全景网投资者关系互动平台里股民的问题？股民的问题是否会传到公司的高层？,您好！公司证券事务部有专人负责回答互动易中股民的问题，会将问题进行记录，传达给高层。
2,希望公司在适当的时侯推出激励计划来聚集和挽留人才，保持公司的竞争力！,您好！感谢您的建议和关注，会将建议传达给董事会。
3,公司现阶段发展过程中有何不足？面临的最大挑战是什么？如果新客户在磨合期放弃与公司合作，公司有无应对措施？,您好，公司现阶段的发展依然较为稳健，目前不存在较大的风险挑战。公司始终依靠产品取信于客户，如果有新的合作客户，经过良好的沟通合作，相信会形成融洽的产品配套合作关系。
4,去年公司经营遇到的最大困难是什么?今年有望改善吗？,您好！公司去年经营未遇到太大的困难，在各方面运营较为稳健，生产经营情况良好。
5,做大、做好市值管理是每个公司成长的必然追求，公司是如何进行市值管理的？,您好：公司专注精力于主营业务。我们认为：公司的价值，始终在于做强做大主营业务。
6,"国家要求实行经济节约型政策,公司具体是怎么做的?",您好：公司生产的节水型产品组件产品，严格按照国家标准生产，符合国家、行业的节水标准要求。
7,你如何看待同行业其他公司的经营情况？在同行业竞争中，公司排名第几？你认为公司业绩增长的主要优势或障碍在哪里？,您好：当前全球中高端节水型冲水组件行业的发展较为成熟与稳定。在同行业中，公司的销售排名较为靠前。公司的业绩增长，除依靠既有冲水组件产品外，隐藏式水箱、智能盖板等产品的销量的提升亦能带来新的增长点。
8,新三板的扩容，带来了新的投资机会，你们公司在这方面有什么打算吗？,您好，关于公司有无对外投资的问题，敬请关注公司在证监会指定媒体发布的公告。
9,请问公司今年是否有对外扩张的打算？今年公司在市场开拓方面有什么计划？能否详细谈谈？谢谢,您好，关于重大信息方面的问题，敬请您具体留意公司在证监会指定媒体发布的信息披露公告！
10,你好，请问贵司目前产品的销售趋势如何？今年的销售目标是多少？公司有没有一个具体可行的持续增长计划？,公司将继续致力于节约水资源卫浴配件产品的研究和开发，同时通过创新开发智能化产品，让人们享受水带来的快乐和生活品质的提升。不断拓展全球范围的市场份额，促使公司在行业领域的竞争力和全球行业地位得到全面提升，力争将公司发展成为节水型卫浴配件行业的领军企业。 2017年销售目标增长10%，公司中长期发展规划请关注公司相关的信息披露。谢谢！
11,请站在独立董事的角度评价一下这家公司。您的专业态度对我很重要！,谢谢您的提问！瑞尔特是一家经营比较稳健、管理比较规范的企业，这些年来一直集中精力做大做强主业。
12,公司今年有新投资的项目吗？如果有，当年能否为公司贡献利润？如有利润贡献，公司预计能实现多少利润？,谢谢您的关注，敬请留意公司发布的信息披露公告。
13,公司是否会考虑开拓新的领域？,您好，公司会根据自身的发展实际，并结合卫浴市场的发展状况，来考虑是否开辟新产品领域。
14,请描述一下公司未来的发展前景，谢谢！,未来，公司将继续致力于节约水资源卫浴配件产品的研究和开发，同时通过创新开发智能化产品，让人们享受水带来的快乐和生活品质的提升。不断拓展全球范围的市场份额，促使公司在行业领域的竞争力和全球行业地位得到全面提升，力争将公司发展成为节水型卫浴配件行业的领军企业。
15,截至目前，公司的同比销售额有增长吗？,您好，截至一季度的销售相比去年同期的增长额，请关注明天发布的一季报！谢谢
16,请介绍一下公司所处行业和主要产品？,公司目前所处的行业，为卫浴配件行业。瑞尔特的主要产品包括：节水型冲水组件、隐藏式水箱、静音缓降盖板、智能盖板等。
17,公司生产经营的季节性如何?哪个季节是旺季?,您好！公司所处行业没有淡旺季。谢谢！
18,公司未来3年发展前景如何?,未来三年，公司将继续致力于节约水资源卫浴配件产品的研究和开发，同时通过创新开发智能化产品，让人们享受水带来的快乐和生活品质的提升。不断拓展全球范围的市场份额，促使公司在行业领域的竞争力和全球行业地位得到全面提升，力争将公司发展成为节水型卫浴配件行业的领军企业。
19,请问2017年全年预计销售目标是多少？实现净利润的目标是多少？,公司2017年度预计销售收入增长10%，由于工程塑料波动较大，净利目标不低于上年同期。
20,请问公司的分配预案达到承诺的分红比例吗？,公司的本次利润分配预案考虑了广大投资者的利益，同时，该方案严格遵循了证监会《上市公司监管指引第3号——上市公司现金分红》的规定、《公司章程》的要求。
21,能简单的介绍下新项目的情况吗？,"1、公司新建年产1,120万套卫浴配件生产基地项目2016年新增产量为488万套。由于国内以及境外市场经济增长放缓等原因，导致目前新项目产能未及时消化；2016年产能利用率为43.57%。2、阳明路卫浴配件生产基地改扩建项目处在建设期，尚未产生效益。"
22,2017年公司是否考虑对高管实行股权激励，如果有的话大概什么时候实行？,谢谢您的宝贵建议，我会将您的建议反馈给公司董事会。
23,公司截至目前为止都有哪些子公司和参股公司？,您好，公司目前仅有一家全资子公司：厦门派夫特卫浴科技有限公司。
24,公司的前5名供应商是什么，与公司存不存在关联关系？,您好，公司的前5名供应商提供的原材料品质较优良。前5名供应商与公司之间不存在关联关系。
25,请问公司目前的研发机构有哪些？公司未来产品的研发与创新将如何进行？,公司目前有个研发中心。公司将继续加强产品的研发与创新，研发出适销对路，紧跟时代的产品。
26,公司在税收方面有没有相关的优惠政策？具体税率是多少？,"公司符合高新技术企业的税收优惠政策，目前享受按15%的税率缴纳企业所得税。
"
27,公司产品的技术含量如何？专利多吗？,公司产品具备较高的技术含量，公司自成立以来一直注重研发体系的建设和完善，已具备强大的产品研发和设计能力。公司目前拥有近500项专利权。
28,陈叔叔好，公司于2016年3月8日上市，冲水组件是什么？,投资者您好：冲水组件是指：用于操纵或辅助冲洗水箱完成冲洗动作的配件组，包含进水阀、排水阀和其他必要附件，“冲水组件”也称为“水箱配件”
29,除了在巨潮网上查看公司公告，还可以在哪里了解公司的日常经营情况？,您好，巨潮资讯网和证券四大报是公司的法定信息披露媒体，敬请关注。您还可以留意公司网站、微信公众号，了解公司的经营信息。
30,公司的发展战略是什么， 和公司现有的主营业态一致吗？  能否详细讲解一下？ 谢谢！,"         2017年度，公司将继续巩固和加强在节水型卫浴配件产品制造领域的市场地位以及公司和世界知名卫浴品牌重要战略合作伙伴关系。加强研发和自动化设备投入，提升规模效应与技术水平，提高生产效率，并将立足优势产品，扩大差异化竞争优势，在巩固和发展冲水组件市场的基础上，进一步加大对静音缓降盖板、隐藏式水箱、智能化产品的市场开拓力度，提升公司卫浴配件产品的国内外市场份额。
      公司将继续致力于节约水资源卫浴配件产品的研究和开发，同时通过创新开发智能化产品，让人们享受水带来的快乐和生活品质的提升。采取以市场为基础，以技术为支撑，以服务为核心的服务营销战略，通过加大研发设计和制造技术的提升、规模化生产等方式，为客户提供优质的产品和服务，巩固和强化公司在技术、生产、市场等领域的核心竞争优势。不断拓展全球范围的市场份额，促使公司在行业领域的竞争力和全球行业地位得到全面提升，力争将公司发展成为节水型卫浴配件行业的领军企业。"
