,Question,Answer
0,请问如今国内教育事业环境背景如何？公司在此领域将如何布局的？乐博教育有哪些竞争优势？,公司认为，中高考改革和消费升级将推动教育需求演进，国家政策导向清晰，唯分数录取、忽视学生全面发展的局面必然改变。随着消费结构从生存型向发展型转变，家庭消费动机不再只满足刚需，消费者对品质与个性诉求增长，愿意为高品质、个性化的产品支付溢价。素质教育面临新的生机和广阔前景，公司坚定布局素质教育产业。公司在报告期间，完成乐博重组，投资韩国乐博和芥末堆。未来，公司将借助资本工具积极整合教育产业优质资产，将盛通打造为素质教育和STEM教育的综合服务提供商。截至目前，乐博教育在25个省及直辖市，拥有83家直营店和150家加盟店，基本覆盖全国一线、二线城市，涉及大部分省会城市。乐博教育是国内素质教育领域实现全国异地规模化扩张的少数培训机构之一，拥有高效的标准化运营和服务体系。乐博教育创始人来自于新东方等国内知名教育培训机构，拥有多年的教育培训行业销售和管理经验。通过重大资产重组，上市公司不仅实现了与乐博教育团队和资产的有机融合，而且在教育培训资产证券化方面积累了丰富的经验，将进一步推动公司积极利用资本工具实现在教育培训领域的快速、稳健的扩张。
1,请问2016年标的公司乐博教育业绩承诺实现情况怎么样,报告期内，公司发行股份及支付现金43，000万元购买北京乐博乐博教育科技有限公司100%股权。该收购事项于2016年11月23日，获得中国证监会核准通过，并于2017年1月11日完成交割。实现了公司在教育培训产业的首发布局。乐博教育2016年实现收入1.51亿元，扣非后归属于母公司所有者的净利润2623.47万元，超额完成业绩承诺。
2,请问公司全资子公司北京盛通知行教育科技有限公司和已经收购的乐博教育是否存在业务冲突的问题？还是会展开新的业务？所面向的目标客户群仍然是K12领域吗？,新成立的子公司与乐博教育不存在业务冲突，新公司将以K12素质教育开展教育服务及教育投资业务。
3,请问公司的薪酬政策涉及哪些方面？,为充分调动员工的积极性、创造性，规范公司薪酬管理，促进公司健康持续发展，公司根据国家有关劳动人事管理和分配政策和公司经营理念，针对不同部门，实行多元化的激励措施。1）公司建立了独立核算的事业部制绩效管理系统，实现了以业绩为导向的绩效工资制，通过KPI经营指标有效分解及完成情况评定各层级员工业绩，并通过实时、月度、季度、年度等多频次、多维度的发放方式，有效与员工薪酬挂钩，引导和激励员工追求更高的工作绩效。2）根据国家及北京市政策指引，同时结合公司经营情况、物价及生活水平波动等因素，公司将“创建国际一流盛通，提高员工幸福生活”作为愿景，适时调整薪酬政策，确保薪酬分配制度更加规范、公平、合理、有效，一方面通过股权激励的方式，让更多有作为的员工分享公司成长的财富，另一方面关注基层员工的收入，提升保障性。
4,请问，公司在报告期内有哪些主要的投资活动？,您好，公司在报告期间投资了投资韩国乐博和芥末堆。全资子公司香港盛通于2016年8月29日增资参股韩国乐博，持有韩国乐博18%的股权。韩国乐博公司具有丰富的机器人研发和课程开发经验，其产品在韩国教育用机器人市场占有率超过50%。2016年11月11日，公司参股的颉墨科技是中国专注于教育产业信息挖掘与传递的行业内资讯服务媒体平台，通过“芥末堆看教育”(微信公众号)、芥末堆官网（www.jiemodui.com）以及芥末堆的APP（芥末堆看教育）发布相应的行业消息、进行专业评析及判断来提供教育行业领域的信息推广服务，为业内各方提供深度价值信息，为中国教育行业的企业管理者提供发展和决策参考。
5,公司2016年的研发投入是多少，取得了哪些成果？,感谢您对公司的关注。2016年，公司研发投入为1222.64万元，比2015年增长了近30%。公司启动实施的“出版服务云平台项目”是依托公司在出版产业链长期积累的行业资源，以连接出版机构、印刷企业、发行企业及相关电商企业、物流企业、营销渠道为重要目标，利用移动互联网、大数据、工业信息化等技术，旨在打造贯穿出版行业整个产业链条的云服务平台。项目完成后，将进一步提高公司在出版行业的竞争力，同时提高公司及其他出版印刷企业的运营效率，将过去单纯的竞争关系建立为合作伙伴关系，更好的服务于出版机构，同时由于产能及客户产品的增加，对于推进未来部分出版物生产过程中的标准化，提供生产过程中的自动化有着较高的促进能力。
6,请问目前公司的战略方向是什么？,您好，公司发展战略为依托在出版文化领域的行业地位、客户基础和核心资源，打造教育、出版文化综合服务生态圈。公司发展注重内涵增长与外延扩张并重。内涵增长致力利用移动互联、云计算和工业信息化技术，聚合需求、优化产能，不断延展服务链条，提升出版综合服务能力；外延扩张聚焦教育行业，借助资本工具积极整合教育产业优质资产。
7,请问，如今国内出版综合服务事业环境背景如何？公司在出版服务产业上有何新的发展目标？,投资者您好，感谢您对公司的关注。根据国家新闻出版广电总局发布的《2015年新闻出版产业分析报告》数据显示，2015年全国出版、印刷和发行服务实现营业收入21，655.9亿元，同比增长8.5%。印刷复制业营业收入达到12，245.52亿元，同比增长4.3%。印刷复制业营业收入占新闻出版产业总营收的56.55%，仍然是新闻出版领域的核心产业，为新闻出版业的稳定发展奠定了坚实的基础。根据国家新闻出版广电总局发布的《2015年印刷企业年度核验情况汇总表》数据显示，2015年我国印刷业从业人员数量从339.4万人减少到317.6万人，人均印刷产值由上年32.0万元提升到35.4万元。骨干企业的产值已占全国的54.1%，利润占全国的65.7%，对外加工贸易额占全国的63.9%。印刷产业门槛和集中度不断提升，规模企业和品牌企业将获得更大的发展空间和优势。公司将继续推进出版服务云平台项目实施，优化京津冀区域产能布局，打造环首都出版服务产业链，推动京沪业务协同，实现华北、华东区域就近生产、就近仓储、就近配送。同时，延展出版服务产业链，以印刷服务为基础，围绕现有客户和行业资源，拓展创意设计服务、数字生产业务、供应链管理服务、渠道服务等多项服务链条，打造出版服务生态。
8,请问同行业内竞争情况以及公司采取了什么样的应对措施，在保持稳定增长的前提下不断做大做强？,投资者您好，感谢您对公司的关注。出版物印刷行业具有较强的区域性特征，公司所处的“京、津环渤海”地区为巨大的纸质传媒消费市场，同时也集中了全国约40%的出版社、1/3的杂志社，先进的印刷设备、精湛的印刷工艺、高效率的生产能力、专业化的服务是印刷行业的竞争要素。公司拥有国际先进的商业印刷设备、严整的印刷工艺流程和精细化管理体系，设备配套能力处于国际领先水平，具备全年全天候连续生产能力。同时，为不断增强公司的盈利能力和可持续发展实力，实现公司业务的相关多元化布局和发展，公司将发展战略确定为依托在出版文化领域的行业地位、客户基础和核心资源，打造教育、出版文化综合服务生态圈。公司发展注重内涵增长与外延扩张并重。内涵增长致力利用移动互联、云计算和工业信息化技术，聚合需求、优化产能，不断延展服务链条，提升出版综合服务能力；外延扩张聚焦教育行业，借助资本工具积极整合教育产业优质资产。
9,请问公司认为自身的核心竞争力是什么？,您好，公司核心竞争力部分，请参见公司刊登在巨潮资讯网的2016年度报告第三节。
10,能介绍一下公司现在各大区域的销售和占有率等基本情况吗?,您好，感谢您对公司的关注，公司主要客户为国内大型出版单位，包括人民社、人教社、外研社、北师大出版社、新华社、团中央少儿总社等大型出版单位，其中北京地区贡献了约80%的销售收入。谢谢。
11,公司未来发展前景如何?对目前这个行业的前途看好吗？,您好，我们对于出版服务和素质教育两个产业充满信心，公司将坚定在这两个行业的深化布局。
12,2017年，公司在教育行业有什么新的规划布局吗？,"您好！公司2017年在教育行业的规划主要有几下3点：
1、尽一步实现和乐博乐博融合和协同。集中上市公司优势资源支持乐博教育快速发展； 
2.以乐博教育为核心，持续布局科学素质产业；
3.坚定深化素质教育产业布局，充分利用资本工具，不断壮大公司教育产业布局。"
13,请问公司今年是否有对外扩张的打算？今年公司在市场开拓方面有什么计划？能否详细谈谈？谢谢,公司一直本着积极的发展策略，内涵增长与外延扩张并重。今年的外延扩张将会继续聚焦教育行业，借助资本工具积极整合教育产业优质资产。
14,请问公司目前产能多少？,您好，感谢您对公司的关注，目前公司的生产产能在350万纸令左右。谢谢
15,公司如何规避各种风险，如产品质量、资金、管理等，减少各种负面事件？,您好，公司严格按照相关法律法规规范运作，并按实际情况制定了相应的内控管理制度，在产品质量方面有管理体系监督，在资金方面公司自募集资金到账以来，经过保荐机构对公司核查，没有发生募集资金被挪用的情况。
16,我对贵公司是长期投资的，请问预计今年上半年会盈利多少？,"您好，感谢您对公司的关注，2017年1-6月归属上市公司股东的净利润与上年同期相比预计增长幅度在60—80%，区间在2264.37万元至2830.46万元。谢谢。
"
17,公司对提振2017年业绩有何规划？,您好，关于公司2017年度主要工作，我公司2017年4月26日在巨潮网发布了2016年年报，在年报中有详细披露，请查阅。
18,公司如何看待当前股价趋势以及市盈率水平的合理性？,您好，股价是以公司内在价值为基础，同时受二级市场众多因素影响决定。且公司重视市值管理，重视股东价值的体现。管理层将一如既往地努力提升公司经营业绩，提升公司内在价值，从而为股东持续创造回报。2016年，公司营业收入同比增长20.28%，归属于上市公司股东的净利润同比增长86.98%。未来，业绩的增长，市场估值的理性回归，是公司的目标，也是对投资者的保护。
19,在给用户提供增值服务方面，公司做了哪些工作以增强对原有客户的锁定、新客户的拓展？,尊敬的投资人，感谢您对公司的关注。公司是国内领先的出版印刷综合管理服务供应商，主要为国内外大型出版机构、商业客户等提供综合性、全方位、一体化的综合印刷管理服务解决方案。目前公司在客户服务方面公司启动实施“出版服务云平台项目”，该项目依托公司在出版产业链长期积累的行业资源，以连接出版机构、印刷企业、发行企业、物流企业、营销渠道等为重要目标，利用移动互联网、工业信息化等技术，旨在打造贯穿出版行业整个产业链条的云服务平台，在挖掘和聚合出版机构图书产品印制需求和变化趋势的基础上，整合不同地区、不同类型印刷企业的生产能力，利用数字化技术进行统一生产调度和质量监控，进行标准化生产，满足出版机构的生产需求，帮助其有效简化图书生产流程，提高工作效率，降低生产成本。谢谢
20,您好，请问公司预计2017年业绩如何？,您好，根据《中小板企业信息披露业务备忘录》规定，公司应在第一季度报告、半年度报告和第三季度报告中披露对年初至下一报告期末的业绩预告。2017年度业绩业绩将在2017年第三季度报告中披露，请关注。
21,请问，公司的股权激励，对公司转型有帮助吗？后续公司进行更多资本运作时，是否会继续延续股权激励和员工持股等计划推进？,公司此前发布公告拟实施股权激励计划，意在和员工共同分享企业成长带来收益，使公司上下一心谋求发展。乐博教育于2017年初并入上市公司体内，本次股权激励将大幅加强乐博教育员工与上市公司的利益协同性（274名激励对象中，乐博教育员工占235名），或将为公司未来发展，尤其是教育业务板块注入长期增长的动力。未来公司将持续推进相关的激励政策
22,请问公司，2016年乐博教育的经营情况如何？,您好，乐博2016年度业绩超额完成，详细内容可参见公司登载在巨潮资讯网的关于北京乐博乐博教育科技有限公司业绩完成情况的说明。
23,请问，公司净利润的增长率和销售收入增长同步吗？,您好，感谢您对公司的关注。报告期内，公司实现营业收入8.43亿元，同比增长20.28%；实现归属于上市公司股东的净利润3649.90万元，同比增长86.98%。
24,目前公司享有的国家优惠政策有哪些？,您好，公司享有的国家优惠政策已经在公司2016年年报中详细披露，请您查看2016年年报获取相关信息，谢谢
25,近一年来，贵公司高管考虑增持吗？,您好，目前暂无计划，未来如有增持方面的计划，将按照相关规定进行披露
26,请问老总公司今年净利润同比增长多少？,您好，2016年度净利润同比增长86.98%。
