,Question,Answer
0,贵司与爱立信的合作在2017年会有哪些突破？,"您好，报告期内，公司持续推进战略新客户爱立信的供应商认证，2016年底至2017年初，公司成功中标2017-2019 年度瑞典爱立信户外机柜项目，共计4类7项产品。公司产品得到行业知名公司的认可，提升了公司的国际知名度和品牌影响力，有力促进了公司海外业务的高效拓展。
    截至目前，关于爱立信项目，公司已完成部分产品的试样工作，并通过爱立信的审核，公司正在组织力量对公司的生产运营、品质管控、市场对接、产品交付等内部体系进行调整和完善，以应对大批量、高质量、高效率的产品交付需求，谢谢。"
1,公司是否在考虑开拓新的领域？取得初步进展没有？,"你好！
公司将积极利用上市公司平台，积极布局资源，初步构建行业研究与投资管理团队，完善投资决策流程和风险控制。依托客户、公司级专家顾问、行业组织、投资机构、中介机构等渠道，尝试开展物联网、数据中心、5G、智慧家庭等领域研究分析及投资布局，在聚焦主业内生增长的同时，适度推进业务延伸型、资源互补型等具有协同效应的外延式增长。"
2,能介绍一下公司现在各大区域的销售和占有率等基本情况吗?,"你好！
公司主要客户为国内三大通信运营商及铁塔公司，包括中国移动、中国联通、中国电信及铁塔公司，产品销售范围覆盖全国主要省市地区，其中华北地区、华南地区、西南地区贡献了70%的销售收入。"
3,你好，请问贵司目前产品的销售趋势如何？今年的销售目标是多少？,"您好！公司主营的ODN产品、无线接入产品、传输网物理连接设备在FTTX光纤宽带网络、3G/4G无线网络、传输网等通信网络中得到广泛应用。公司主要客户为我国三大通信运营商及其合资设立的铁塔公司，基于其自身业务发展需求，其资本支出存在一定的波动，其投资方向、投资结构及重点、投资方式等处于不断变化中，从而影响公司相关业务市场规模。公司对三大运营商及铁塔公司的收入均通过招投标方式产生，中标结果对公司业绩亦具有较大影响。同时，招投标定价和定制化选配的业务特点，使得产品价格受具体招投标竞争情况影响较大。 
中长期看，通信行业呈现以下发展趋势：（1）全球FTTX接入网技术的应用普及，4G网络的快速部署，5G网络的试点推进，传输网的持续扩容，将带来全球IP数据流量的持续增长和网络扩容，推动全球信息化网络加快发展；（2）在我国政府政策大力支持下，我国三大运营商仍将保持规模化的网络建设；（3）移动互联网、云计算、大数据、物联网、视频直播、IPTV等网络新技术、新应用的应接不暇，将不断催生消费及工业级互联网用户旺盛的网络需求，促进通信网络发展演进。下游投资和需求发展共同推动通信网络物理连接设备行业发展。
短期看，根据各通信运营商年报中披露的2017年资本开支计划，中国移动、中国电信继续稳中略降，分别较上年下降6%和8.1%，中国联通继续较大幅度缩减资本开支，较上年下降38%，公司下游市场规模短期将继续出现波动。但同时，运营商资本开支的结构也在优化调整，积极拓展新业务。中国移动在建设数据中心、大数据平台、IT资源池、CDN等方面的资本开支不降反升，中国电信也要在新兴业务上增加资本开支，孕育了新的业务机会。公司将据此科学制定经营计划，合理制定销售目标。
"
4,目前公司享有的国家优惠政策有哪些？,你好！公司主要享受的优惠政策包含税收优惠和政府补助：税收优惠主要有（1）高新技术企业15%企业所得税优惠；（2）符合规定的研发费用享受“加计扣除”的优惠 。政府补助主要有（1）《深圳市人力资源和社会保障局深圳市财政委员会关于做好失业保险支持企业稳定岗位有关工作的通知》稳岗补贴；（2）《深圳市知识产权专项资金管理办法》和《光明新区知识产权专项资金管理与奖励办法》专利及知识产权补贴；（3）《深圳市光明新区经济发展专项资金管理办法及配套实施细则》研发投入补贴。
5,公司2016年度的业务经营情况符合公司预期吗？,"您好！2016年公司所处行业发生较大变化，主要运营商投资均不同程度下滑。针对行业和市场变化，公司管理层及时调整经营思路，经营策略上重点跟踪中国移动、中国电信的光纤宽带网络建设和铁塔公司的无线网络建设，积极研发推出具有高附加值的产品，高效拓展战略新客户爱立信，扎实推进营销系统变革与能力提升，并严格控制低价值订单的招投标策略，内部积极推进精细化管理和成本控制，取得了一定的成效。
    报告期内，公司总体经营情况保持正常。2016年全年，公司实现营业收入70,833.69万元，较上年同期下降7.62%；营业成本46,082.13万元，较上年同期下降10.11% ；毛利率34.94%，较上年同期提升1.79%；销售费用9,457.35万元，较上年同期下降11.16%；实现营业利润7024.23万元，较上年同期增长0.54%；实现利润总额7,170.11万元，较上年同期下降0.25%；归属于上市公司股东净利润6,182.39万元，较上年同期下降1.61%。2016年度公司研发投入2,766.09万元，较上年同期增长9.41%，经营活动产生的现金流量净额1,918.49万元，较上年同期增长134.16%。
"
6,贵公司是否会考虑实施股票期权等规范股权激励方式，惠及更多员工？,公司将综合考虑公司经营状况、预期发展、员工意愿、资本市场现状等因素，在合适的时机考虑实施股票期权、员工持股计划等适宜的股权激励方式，激励骨干员工与公司共同成长，实现共赢。
7,公司如何进行投资者关系管理，如何规划进行投资者回报的？,"您好！公司投资者关系工作涵盖信息披露与信息沟通、筹备会议、接待投资者、公共关系、网络管理、重大事件处理等多项工作，公司董事会办公室将充分利用公司公告、股东大会、公司网站、各种推介会、广告、媒体、报刊和其他宣传资料、一对一沟通、邮寄资料、电话咨询、邮件回复、现场参观、媒体采访与报道、路演等多种途径有效推进投资者关系管理。
公司将积极响应监管层号召，充分考虑对投资者的回报，同时兼顾公司的长远利益、全体股东的整体利益及公司的可持续发展来合理规划公司的利润分配。"
8,虽然说公司的股价由二级市场决定，但股价是公司经营的一个表象，请问管理层对回报投资者持有怎样的态度？,您好，公司致力于不断提升经营业绩，推动业务长期持续发展，促进公司整体价值的不断提升，从而提高股东所持有公司权益的价值；同时，公司未来将采取现金、股票或现金与股票结合的方式，回馈投资者，谢谢。
9,公司的前三大客户是哪些公司？,公司主要客户为中国移动、中国联通、中国电信三大通信运营商及铁塔公司。
10,如果公司进行定增，那大股东及高管们会考虑参与、进行增持吗？,您好。按照证监会的最新要求：上市公司申请增发、配股、非公开发行股票的，本次发行董事会决议日距离前次募集资金到位日原则上不得少于18个月。前次募集资金包括首发、增发、配股、非公开发行股票。上市公司发行可转债、优先股和创业板小额快速融资，不适用本条规定。因此公司未来如进行再融资，将严格按照相关法律法规进行相关操作。谢谢。
11,陈叔叔好，公司的主营业务是什么？,您好， 公司是一家通信网络基础设施解决方案提供商，专注于为通信运营商、ICT设备商和网络集成商提供FTTX接入网、无线接入网和传输网中通信网络物理连接设备、应用解决方案和技术服务。通信网络物理连接设备为通信网络领域中通信主设备之间、通信主设备与线缆之间、线缆之间的数据通信提供传输媒介。公司主营的ODN产品、无线接入产品、传输网物理连接设备在FTTX光纤宽带网络、3G/4G无线网络、传输网等通信网络中得到广泛应用。
12,请问公司以后每年会用什么形式回馈股东？, 您好！公司将积极响应监管层号召，充分考虑对投资者的回报，同时兼顾公司的长远利益、全体股东的整体利益及公司的可持续发展来合理规划公司的利润分配。公司利润分配方式可以为现金或股票，现金方式优先于股票方式。
13,公司领导怎么看现在公司的股价，对我们小散有什么忠告？谢谢,您好，股票价格的波动受多种因素影响，既有公司经营业绩、发展战略等内部因素，也有宏观经济环境、股票市场流动性等外部因素，我们着力于不断提升经营业绩，推动业务长期持续发展，促进公司整体价值的不断提升，相信公司股价也会因此得到市场认可；目前A股次新股版块处于下跌趋势，个股普遍跌幅较大，请投资者注意风险，谨慎投资，谢谢。
14,公司现在负债总额是多少？每年负债的利息是多少？谢谢。,公司已按规定公开披露财务数据，请投资者查阅定期报告。
15,雄安新区的设立，对公司存在哪些机遇？,据相关媒体报道称，中国移动、联通、电信等通信运营商及中国铁塔等网络建设主体均明确表态将全力支持雄安新区的建设，将在新区提前部署5G移动通信网络，确保全光高速宽带基础网络一步到位。公司将紧抓机遇，密切跟踪客户需求，积极研发具有竞争力的产品，支持新区发展。
16,刘叔叔好，公司的主营业务和上市时间？公司的名字是怎么来的？,"您好。公司作为通信网络基础设施解决方案提供商，主要为通信运营商、ICT设备商和网络集成商提供FTTX接入网、无线接入网和传输网中通信网络物理连接设备、应用解决方案和技术服务。公司于2016年11月22日，公司顺利登陆A股创业板。公司的名字取自“科技为先，诚信为本”。谢谢。
"
17,公司在经营活动中主要对哪些环节进行质量控制？,"您好，公司的内部控制主要由财务报告和非财务报告两个部分组成，纳入评价范围的主要业务和事项包括：治理结构、发展战略、人力资源、社会责任、企业文化、资金活动、采购业务、资产管理、销售业务、担保业务、财务报告、全面预算、行政事务、内部信息传递、信息系统等；重点关注的高风险领域主要包括：关联交易、担保业务、重大投资及信息披露等事项。 
经公司审计部审核，立信会计师事务所（特殊普通合伙）鉴证，报告期内公司不存在财务报告内部控制重大缺陷，公司未发现非财务报告内部控制重大缺陷，谢谢。"
18,公司2017年一季度经营业绩如何？,"您好！公司2017年一季度实现营业收入125,328,940.67元，同比下降23.3%，归属于上市公司股东的净利润7,609,672.30元，同比下降62.31%。主要受中国联通、中国电信有线宽带投资下降，以及中国铁塔结算延迟等因素影响。详细业绩数据请查阅公司于2017年4月20日在巨潮资讯网披露的2017年一季度报告全文。谢谢！"
19,公司有没有哪些项目创新模式？,您好。公司是高新技术企业，每年都会依据行业发展、技术的发展的需要投入大量的研发资金。未来还会继续在行业、技术等方面不断进行创新。谢谢。
20,请问公司如何看待上市公司的并购和市值管理？,"您好。市值作为评价上市公司价值的核心指标，反映了上市公司的综合实力、盈利能力、经营绩效、股东的财富价值以及市场认可度等多方面信息。所谓市值管理，即上市公司基于公司市值信号，综合运用多种科学合规的价值经营方法，达到公司价值创造最大化、价值实现最优化的战略管理行为。并购是上市公司快速做大做强的一条重要途径，相对于内生性增长具有时间优势，因此在公司的不同发展阶段，运用并购工具可以实现公司战略发展。谢谢。
"
21,现在行业间的并购都比较频繁，你们今年有没有兼并收购计划？,您好，公司将根据发展战略，围绕公司核心业务，充分利用自身优势和资本市场平台，在时机、条件和对象等较为成熟的前提下，考虑采用兼并收购、资金投入、合作开发等多种形式向产业链内外做合理延伸和扩张。
22,近几年的固定资产，技术改造的投资效果如何，是否达到了预期的目标，不考虑市场因素，简单考虑毛利情况是否合理？,公司固定资产投资及技术改造均按照项目可行性分析及项目管理相关制度流程严格实施，公司近年经营业绩保持稳定，毛利情况也保持在合理水平，取得了比较符合预期的投资效果。公司募投项目正在积极稳妥、科学有序推进。
23,今年以来，原材料都迎来涨价潮，对公司会有什么影响？,您好，2016年度国内大宗商品等原材料普遍上涨，公司产品成本增加，毛利率因此下降。对此，公司积极进行研发投入，努力提高生产工艺和生产效率，以对冲成本增加的影响，谢谢。
24,公司所处行业有没有周期性？,您好！公司主要客户为中国移动、中国联通、中国电信三大通信运营商及铁塔公司，基于其自身业务发展需求，其资本支出存在一定的波动，其投资方向、投资结构及重点、投资方式等处于不断变化中，从而影响公司相关业务市场规模。
25,公司每次投资项目的可行性报告是否有详细说明公告？,公司做出重大投资决策都会依照公司章程履行相关的程序，依据深交所的要求履行相关的披露要求。谢谢。
26,:您好！截至到2016年12月31日，“国家队”即中金、证金、汇金的持股比例有多大？,您好！截至2016年12月30日，公司前100位股东名单中未出现中金、证金、汇金等机构。
