,Question,Answer
50,德州联化、盐城联化、台州联化在医药中间、功能化学品领域，什么时候可以产生正向利润，是否有核心产品会上市？大概会在什么时间上市？,您好，上述几个子公司根据公司的不同定位，对应不同的产品，我们相信随着越来越多的产品投入生产，公司的业绩会逐步提高。 谢谢！
51,公司提到，未来农药：医药：功能化学品=4：3：3，目前医药只有3亿多营收，农药有20多亿营收，目前，环保收紧，诸多项目不能投产，新建项目审批严格，公司如何保证医药、功能化学品营收超过20亿？距离当前营收还有七八倍的增长，可否讲讲主要营收产品、布局、规划？预计何时医药、功能化学品能达到20亿营收？,"您好，  公司未来会保持农药，医药，功能化学品领域的均衡发展。在医药研发领域，进一步建立质量合规能力和成功通过国外机构审计对我们来说至关重要。持续关注和改进客户群的拓宽、进一步加强创新研发能力和可靠的生产供应能力，从而保持竞争力并充分发掘市场机会。
在功能化学品领域，我们将继续加强原有产生良好现金流的产品组合，同时积极参与电池和电子化学品的市场竞争，这一市场被视为高速增长、利润可观的细分市场。随着这些新的业务的发展，我们需要加强在研发技术和市场营销方面的能力。谢谢！"
52,目前，环保一直在高压，公司募投的项目一直没有投产，是否会因为项目一直没能投产而影响订单，是否存在丢失大量订单的风险？公司如何应对因环保问题项目一直不能投产、且大量项目会延后审批甚至不能审批的风险？,您好，公司本次非公开增发募集募投项目，盐城联化和台州联化各有一个项目已经投产。我们对尚未投产的募集资金项目，正抓紧建设。力争早日投产。谢谢！
53,彭寅生总经公司组织人事调整当前主要负责哪部分的业务？公司目前营收较大的几家子公司（江苏联化、台州联化、盐城联化、德州联化、天予化工、郡泰等）的治理管理结构是怎样的，分别由哪个副总分管哪几家公司？某些子公司连续多年亏损，是否会对分管副总进行考核？彭总等原高层是否因亏损而被撤职？,您好，彭总从公司管理层转到董事会，任公司副董事长，不再具体负责经营层面的工作，侧重公司战略层面规划等。公司对各子公司经营层都有考核，但净利润指标只是考核的一个指标。谢谢！
54,公司目前危废处理池项目进展如何？是否有具体的开工、建设日期，具体什么时候可以投入使用？,您好，公司于4月10日对外披露了有关江苏联化拟投资响水危废填埋场项目的公告，目前还处于项目前期阶段，还没有具体的建设时间。公司将根据项目的实施进展情况，及时按规定进行信息披露。谢谢！
55,收购国外的英国子公司的定位？公司提到部分医药业务会转移到英国子公司，未来计划英国子公司会占到总营收的多少？,您好，Fine Industries Limited对于公司赢得客户的新产品和新项目具有重要的战略意义，其参与客户早期的新产品开发阶段，通过利用我们与客户之间的密切关系、强大的生产能力和可靠的供应信誉，后续该项目可以转移至我们位于中国的低成本生产基地，帮助客户实现提升产品生命周期管理的目的。谢谢！ 
56,目前，国际前几大农药企业已经完成整合，公司农药营收未来空间如何？与前几大客户目前业务如何？预计能达到多少营收？,您好，由于市场复苏，五大农化巨头补库存带来的采购量逐步回升，这一趋势将在2018年延续。在2017年客户合并的浪潮中，我们公司正处于这一增长机遇的优势地位，并预计在未来的几年工业业务收入保持一定比例的增长。谢谢！
57,公司股价从30元一直下跌到今天7块多，跌去70%多，公司高层却不断减持，给人一种公司要垮台倒闭的感觉，面对公司市值下跌70%以上、公司高层以减持应对下跌，请问公司是真的要破产了吗？,您好，最近几年受农药市场终端销售以及国家环保政策影响，公司业绩下降较多，这也是公司股价下降的因素之一。公司股价受多种因素影响，公司管理层将尽力做好主营，提升公司业绩，回报公司股东。谢谢！
58,公司在医药中间体、功能化学品的投入很大，且公司是这两个领域的新兵，目前这两个领域已经有形成一定规模的龙头企业，公司如何与这些领域的龙头企业竞争？另外，这两个领域目前是否已经有拳头产品会上市，大概何时会上市、主要应用领域？,您好，公司经过多年的努力，已经与国际上的几大医药巨头建立了战略合作关系。质量体系生产能力也获得了客户的认可。公司目前销售的产品，已经覆盖到了对原研药物中有GMP要求的高级中间体。公司已经成为数家国际医药大公司的战略供应商。在功能化学品领域，由于应用众多导致了细分行业繁多，现阶段我们在细分行业内进行合作和联盟，今后中长期不排除通过整合、自身发展和兼并来提升自己的价值链，目的是进军产业链的中后端，提高技术的含金量和难度，在此基础上形成一批有自己知识产权的创新，从而保护自己的市场。公司目前在造纸化学品、工业杀菌剂、电子化学品、个人/家用护理品等领域，同国际市场领先厂商形成战略合作，提供关键原料和中间体。谢谢！
59,公司当前股价已经跌破股权激励期权行权价格，会不会影响员工的工作热情？员工出现亏损，公司会采取何措施？,您好，公司推出股权激励的初衷是进一步完善公司激励机制，增强公司与管理层及核心骨干员工共同持续发展的理念，但是股权激励在实施过程中也会存在不同的风险，公司管理层及员工对公司未来长远发展充满信心。谢谢！
