,Question,Answer
0,王总，公司股价跌去70%，高管不断减持，目前几个工厂停产，公司原高层部分人员纷纷离职，请问，如何处理公司这样的各种不利因素？如何应对公司破产潜在风险？,您好，江苏联化和盐城联化将积极配合政府相关部门的统筹安排和检查，公司应客户的要求，一般都会备有一定周期的库存，短期来看对公司的影响有限。与此同时公司将积极采取措施，充分利用公司具有多区域生产基地的优势，尽最大可能减少本次停产对公司造成的损失。公司坚持“以人为本”的管理理念，推行有竞争力的薪酬政策和激励措施，核心管理及技术人员保持稳定。谢谢！
1,刚才的问题提到，江苏、盐城联化的复工时间表未定，如果一直不能复产，江苏联化占整个营收的50%以上，公司是否有存在破产风险？,您好，江苏联化和盐城联化将积极配合政府相关部门的统筹安排和检查，公司应客户的要求，一般都会备有一定周期的库存，短期来看对公司的影响有限。与此同时公司将积极采取措施，充分利用公司具有多区域生产基地的优势，尽最大可能减少本次停产对公司造成的损失。谢谢！
2,您好王总！在现阶段大环境下，农化市场持续复苏向好，公司如何把握这个大好机会，摆脱环保停产，新产品建设延期，管理费用增长等这些不利影响，实现增收增利同步进行，分享大环境向好的带来的益处？,您好，公司积极开展与国外核心大客户的战略合作，全方位拓展并深化合作关系，持续不断地提供创新服务，已和多家核心客户建立紧密的农药业务合作联盟，在核心大客户的全球供应体系中占据重要地位，成为了各大农化客户的首选合作伙伴。凭借公司建立的优势地位，将确保公司在精细化工行业的国际市场产业转移中获得更多的市场机会。谢谢！ 
3,公司一季报毛利率在30%水平，同行业其他公司的平均毛利率水平也达到30以上，请问公司投入大量研发费用，定位在中高端的产品技术水平，和国际大公司业务绑定，但我们从毛利率上看并没有显示出强于同行业平均水平，如果说是原材料成本上升造成的，同行业其他公司也会遇到，请问这是什么原因造成的，公司在下游客户端有区别与其他同行公司的议价能力吗？？,您好，公司一季度利润变动原因在于去年收购的英国子公司尚处于整合阶段，原材料及汇率的波动对公司的净利润产生了一定的负面影响，股权激励成本相比去年同期有所增加。谢谢！
4,公司募投的几个项目一直因环保问题未投产，是否会因为不能满足客户订单时间要求，而被撤销？,您好，目前盐城联化的募投项目中，客户定制的LH-1项目本身就因客户需求及市场原因往后推迟了项目建设，预计短期不会产生影响。谢谢！
5,老产品要降价，新产品开发的少了，也就是毛利高的产品少了，公司应该反思如何走出新路，提升竞争力,您好，公司与核心客户保持长期稳定紧密的合作关系，积极跟进客户的新产品研发过程，开发新产品，提升公司竞争力。谢谢！
6,据说公司农药研发的负责人等人最近辞职了，核心研发人员对公司的重要性不言而喻，请问公司如何稳定人才，引进人才？,您好，公司坚持“以人为本”的管理理念，推行有竞争力的薪酬政策和激励措施，核心管理及技术人员保持稳定。谢谢！
7,公司目前的在手订单有多大金额，消化现有订单需要多长时间？今年，定位内销的农药企业和农药中间体企业明显业绩更好，公司是否有加大内销产品建设的考虑？,您好，公司目前订单情况正常，内外销情况根据客户需求而定。谢谢！
8,目前，环保督察趋严、暂时环评，公司预计募投项目会于18年底前投产，暂停环评，公司募投的项目的投产时间是否会进一步延后？,"您好，公司高度重视污染治理和环境保护工作，自成立以来一直严格按照国家环保法律法规、环保标准等处理生产过程中产生的三废，并采取积极的环境保护措施，通过源头工艺设计、加强回收、综合利用、推行清洁生产，减少污染物的产生和排放。新项目的暂停审批可能会对投产时间产生一定的影响。谢谢！
"
9,请问英国公司何时能发挥良好的效益？公司花了那么多钱收购现在整合的有些什么成效？,您好，英国公司的整合正在进行，进展顺利。谢谢！
10,王总，请问公司未来三到五年的发展战略？目标？,您好，公司将继续保持“专注，前瞻，联盟”战略发展思路，专注于做好农药、医药和功能化学品行业的核心部分，深入研究主要客户的发展战略，制定公司产品和技术发展计划。发挥公司有机合成以及工艺与工程相结合的项目转化的核心能力，深入拓展与现有农药、医药和功能化学品客户非竞争性自有产品市场，以联盟方式推动企业健康发展。谢谢！
11,"董秘您好！公司股价跌倒了今天最低7.82元，跌去2015年以来的70%，在沪深两个市场3000多只股票中已为数不多，作为公司管理层面对这样的形势是否有稳定股价的措施，比如高管增持，股票回购等行为？另外对彭副懂事长在股票迭创新低时候还进行减持（尽管减持是个人行为），作为公司核心人物,高管，他的这一行为不简单的是个人资金需要这么简单，请问公司对他这一做法如何评价？不要误导市场，让股东对公司也失去信心。",您好，公司股价受多种因素影响，公司管理层将尽力做好主业，回报股东。您的建议我们会慎重考虑。彭总由于个人资金需求减持公司股票。公司对未来发展充满信心。谢谢！ 
12,王总，今年医药中间体是否有新产品会投产？大概数量？谢谢。,您好，公司经过多年的努力，已经与国际上的几大医药巨头建立了战略合作关系。质量体系生产能力也获得了客户的认可。公司将进一步加强研发创新工作、丰富储备产品，并根据市场评估、客户要求、项目建设及审批进展进行陆续投产。谢谢！
13,王总，公司功能化学品主要生产低价产品，今年是否有新的高端产品会投产？大概数量？谢谢。,您好，公司功能化学品事业部会大力发展和保护我们的成熟产品，保证其较好的利润率；其次，我们停止了一些毛利率低且对环境有较大影响的业务。谢谢！
14,请问公司主要工业产品从接到客户订单，到原材料采购生产，再到成品出货销售完成的周期是多久？谢谢！,您好，不同的产品，不同工艺，周期是不同的。谢谢！
15,公司会不会有抓不住这一波农药行业强劲复苏的机会的风险？,您好，公司积极开展与国外核心大客户的战略合作，全方位拓展并深化合作关系，持续不断地提供创新服务，已和多家核心客户建立紧密的农药业务合作联盟，在核心大客户的全球供应体系中占据重要地位，成为了各大农化客户的首选合作伙伴。凭借公司建立的优势地位，将确保公司在精细化工行业的国际市场产业转移中获得更多的市场机会。谢谢！
16,盐城分公司从建设至今已经多年，目前仍未盈利，其一直在生产低价功能化学品，其产品方向是否有问题？何时能产生正向利润？,您好，盐城基地目前还在建设期，随着在建项目的逐渐投产，公司的利润会逐渐体现。谢谢！
17,辉丰事件对联化的影响？巴斯夫是你们两家共同的大客户，公司是否应该抓住机遇扩大与巴斯夫的合作？,您好，巴斯夫是公司重要的客户，公司一直以来，同包括巴斯夫在内的全球农药巨头保持紧密合作。谢谢！ 
18,1.上一次股权激励，最后一期因利润未达标，导致股份没能解锁；2.这一次把激励机制从利润改成工业收入，正好赶上农化复苏，看起来收入达标的概率非常大，但讽刺的是，公司股价跌破了期权执行价格。在这个问题上，公司管理层是不是的反省下，自己的视野太狭窄、太短视了，只为考虑自己，而不考虑全体股东的利益？这样子搞股权激励，真的能激励员工吗？不如直接多发点工资。,您好，公司推出股权激励的初衷是进一步完善公司激励机制，增强公司与管理层及核心骨干员工共同持续发展的理念，但股权激励方案在实施过程中也可能会存在一些风险，公司管理层及员工对公司未来长远发展充满信心，并将努力提升公司业绩，为股东创造价值。谢谢！
19,公司提到医药已与两大知名医药公司形成战略合作伙伴，2017年医药中间体营收部门，这两大客户占医药中间体总营收的比例为多少？,您好，两大战略合作伙伴对公司医药事业部发展有着重要意义，基于联化科技领先的技术能力、创新能力、高水平的生产、工程能力，以及多年来与客户建立的长期、稳定、相互信赖的战略关系，我们参与到了这些顶级药企核心的研发活动，并作为重要的创新服务、上市药物关键中间体的稳定、高质量的供应商。谢谢！ 
20,公司高管未来会不会以实际行动来表示对公司的信心？,您好，股价受多种因素影响，公司将会按照实际情况确定具体方案，并按规定予以披露。谢谢！ 
21,记得在联化科技的招股说明书中曾提到过华海药业，该公司也从中间体慢慢做到原药、仿制药，到现在也开弄创新药，资本市场近年来对其也比较认可。不知道联化科技在医药板块未来的规划是怎样的？会往原药、仿制药方向发展吗？三块业务会分拆成独立公司运营吗？,您好，公司在医药领域，主要从事化学药物的CDMO业务，我们认为化药创新还会不断持续，不断出现新的业务机会。CMO业务转移到中国的趋势还在持续，存量转移也会创造很多机会。有关其他的发展机会，公司也会紧密跟踪行业发展。同时，公司是两家全球前10的医药公司的战略供应商，与2/3的全球前15大药企有紧密或者项目的合作。基于联化科技领先的技术能力、创新能力、高水平的生产、工程能力，以及多年来与客户建立的长期、稳定、相互信赖的战略关系，我们参与到了这些顶级药企核心的研发活动，并作为重要的创新服务、上市药物关键中间体的稳定、高质量的供应商。我们相信，我们未来在医药方面会有较大的发展空间。谢谢！
22,江苏联化和盐城联化的污水排放是否完全达标？有暗管排放吗？这次排查是否经的起考验？,您好，公司高度重视污染治理和环境保护工作，自成立以来一直严格按照国家环保法律法规、环保标准等处理生产过程中产生的三废，并采取积极的环境保护措施，通过源头工艺设计、加强回收、综合利用、推行清洁生产，减少污染物的产生和排放。谢谢！
23,目前，医药中间体、功能化学品是否有单品营收过亿的品种？,您好，医药中间体、功能化学品2017年收入分别为3.24亿元和5.55亿元，公司具体品种较多。谢谢！
24,响水当地被限批半年，这会对江苏联化和盐城联化产生什么样的影响？,"您好，江苏联化主要以已有产品为主，新产品的限批对盐城联化会有一定影响，但公司会积极采取措施，充分利用公司具有多区域生产基地的优势，尽最大可能减少对公司造成的影响。谢谢！
"
25,财务总您好！一季报所得税费用增长很多，已经到了税前利润的27%，报告中解释为股权激励费用纳税所致，请问这个股权激励纳税是哪个时间段的？按照多少税率纳税？,您好，一季报所得税费用增加主要原因系本报告期股权激励费用纳税调增所致，对应期间时一季度，税率15%。谢谢！
26,您好，江苏联化和盐城联化是从哪一天开始暂时停产的？此次检查的内容包括哪些？有没有可以预期的复产时间表？,您好，江苏联化和盐城联化于近期根据政府相关部门对园区及园区内所有化工企业全面停产排查整治环保问题的要求而临时停产，并将积极配合政府相关部门的统筹安排和检查，目前暂无明确复产时间表。公司将按照相关要求，根据实际情况及时做好信息披露工作，谢谢！
27,您好，江苏联化和盐城联化暂时停产的具体是什么时候开始的？此次当地政府的检查属于什么性质？,您好，江苏联化和盐城联化于近期根据政府相关部门对园区及园区内所有化工企业全面停产排查整治环保问题的要求而临时停产，并将积极配合政府相关部门的统筹安排和检查，目前暂无明确复产时间表。公司将按照相关要求，根据实际情况及时做好信息披露工作，谢谢！
28,你好！公司股价自2015年下半年以来跌跌不休，从30多跌倒今天最低不足8元，跌破了定向增发价15.96元，更跌破了员工激励价7.97元，请问公司是否有市值管理？如何保护股东投资贵公司的利益？不要简单就一句话“股价由多种因素影响”来搪塞用真金白银投资贵公司但却亏损的一塌糊涂股东。我是2015年以19.98元买入公司股票5万5千股的小股东，一直持有到今天，爱恨交加，亏损累累！！！,您好，近2年，由于全球农药市场变化以及中国环保政策的影响和公司2016年度山东德州安全事故等因素，导致公司业绩与2015年相比，有较大幅度下降。这也是公司股价较大下跌的原因之一，公司管理层对未来发展部分高管由于其自身资金需求进行减持，但公司对未来发展充满信心。谢谢！
29,请问江苏联化和盐城联化的复产时间？,您好，江苏联化和盐城联化于近期根据政府相关部门对园区及园区内所有化工企业全面停产排查整治环保问题的要求而临时停产，并将积极配合政府相关部门的统筹安排和检查，目前暂无明确复产时间表。公司将按照相关要求，根据实际情况及时做好信息披露工作，谢谢！
30,5178点以来，公司股价连创新低，造成3万投资者的真金白银灰飞烟灭;公司利润连年下滑，而股权激励还符合条件，这样的激励还有何意义?公司高层领导落井下石，不断减持，这样的管理者是不是和公司同心同德?如此，公司还谈什么社会责任?面对公司当前状况，王总对广大投资者如何解释?如何给投资者以信心?,"您好，公司近两年业绩受外部市场因素及管理费用上升等影响，公司业绩有所下降。但在各业务领域，利用公司多年来创建的坚实基础，进一步吸收整合产业内的先进技术和资源，深度参与全球最优秀农药公司新型高效低毒农药的开发，进一步建立质量合规能力，为今后新业务的增长提供强劲后力。公司管理层对未来发展充满信心。谢谢！
"
31,你好，请问王总，如何看待公司彭总不断减持公司股票，且当前公司股价已较15年跌去70%，另外，当前股价已经跌破股权激励期权行权价格，是否有大量员工离职，是否影响员工的工作热情？谢谢王总。,您好，彭总由于个人资金需求减持公司股票。公司对未来发展充满信心，公司员工总体稳定，公司为员工发展提供各种平台。谢谢！
32,董秘您好！1，2017年股权激励费用为7000多万，2018年预计有多少？2，这次临时停产的时间有多长？3，公司贸易业务利润率非常低，严重影响总的利润率水平，公司出于什么考虑，一直保有这块业务？4，18年1季度投资收益亏损近3000万，报告说明中提到是结算远期交易，这个能解释一下是什么意思？预计18年这项投资收益会是多少？谢谢！,您好，1）2018 年股权激励费用预计6000多万；2）见前面已回答过；3）公司贸易部分主要是包括公司经营相关的化工以及非化工原材料贸易，对公司了解原材料市场有好处，同时这部分业务也会对冲公司部分汇兑损益；4）投资收益亏损提到的远期结算交易主要是对冲英国子公司外汇借款，体现在报表的不同会计科目，母公司体现在投资收益亏损、英国公司的收益体现在财务费用中汇兑收益。谢谢！
33,公司对稳定股价有何措施? 在当前股价接近净资产情况下，建议公司采取回购、增持等措施,您好，公司股价受多种因素影响，公司管理层将尽力做好主业，回报股东。你的建议我们会慎重考虑。谢谢。
34,公司一直定位自己为国际化大公司，但是公司股价从2015年开始一路下跌至今，跌去70%以上，期间公司管理层期间不断减持，公司管理层是对公司发展没有信心吗？公司如何进行公司的市值管理的？,您好，近2年，由于全球农药市场变化以及中国环保政策的影响和公司2016年度山东德州安全事故等因素，导致公司业绩与2015年相比，有较大幅度下降。部分高管由于其自身资金需求进行减持，但公司对未来发展充满信心。谢谢！
35,按分公司来看盈利情况，江苏联化营收超过16年，净利却只有16年的一半，盐城联化营收4个亿，净利却亏损2千万，德州联化营收5.7个亿，净利却亏损300多万，公司营收几个亿、净利却亏损，每年每个分公司的营收、净利变动幅度巨大，这其中的原因是什么，除了环保、成本这些常见原因，是因为各分公司产品差异化很大？公司营收基本达到15年水平，净利相差这么大，针对这些原因公司做出什么策略了吗？,您好，因各子公司的产品结构、客户群有所不同，利润水平也有差异。因外部市场因素，以及近两年的各项费用包括股权激励费用、并购英国公司的费用、工资费用增加，对公司的业绩有所影响。公司正在积极开拓各业务的市场，并尽力控制各项费用，尽早恢复到较好的利润水平。谢谢！ 
36,王总，公司的人员工资成本上涨远超销售和利润的增长，远超同类型公司，如何扭转这个局面？,您好，根据公司年报，公司职工工资增长低于主营业务增长水平，长远来说公司会进一步提高劳动生产效率。谢谢！
37,2017年农药市场需求回暖价格上涨，新安股份、利尔化学等公司利润大幅增长，而贵公司利润不增反跌，让人失望。2018年农药市场继续回暖势头，请问2018年贵公司业务订单是否增加？订单价格是否上涨？能否消化成本的上涨？还请问公司目前产能利用情况？,您好，公司2017年度与2016年度比较，净利润下降的主要原因，2016年度有土地补贴收入7000万左右而2017年度没有，2017年管理费用中股权激励成本7000万元以及并购成本2000万左右，扣除这些因素影响，同口径相比，2017年净利润比2016年是增长的。2018年工业业务收入比2017年增长不低于10%，（上述经营目标并不代表公司对2018年度的盈利预测，能否实现取决于宏观经济环境和市场状况变化等多种因素，存在较大的不确定性，请投资者特别注意）。谢谢！
38,王总好，请介绍一下停产的有关情况，排查何时结束?何时申请复产？,您好，江苏联化和盐城联化于近期根据政府相关部门对园区及园区内所有化工企业全面停产排查整治环保问题的要求而临时停产，并将积极配合政府相关部门的统筹安排和检查，目前暂无明确复产时间表。谢谢！
39,一个充满悖论的股权激励，公司及保荐机构到底怎么考虑的？,您好，股权激励方案经上市公司股东大会批准并实施后，方案、程序合法合规。谢谢您的关注！
40,请王总展望一下公司下半年的经营情况，净利润和上半年相比如何？,您好，公司对2018年的业绩目标是：工业业务收入增长率不低于10%。（上述经营目标并不代表公司对2018年度的盈利预测，能否实现取决于宏观经济环境和市场状况变化等多种因素，存在较大的不确定性，请投资者特别注意），公司在推进业务增长的同时，也在严格加强成本管理，提高经济效益，提升净利润。谢谢！
41,目前，公司盐城、江苏联化公司已停产，预计何时会恢复生产？这期间公司产品不能生产供应给客户，公司如何应对因停产不能按时供货而带来的风险？是否会丢失许多订单？且目前许多项目因环保不能审批建设，未来客户订单可能进一步丢失，公司如何应对？,您好，江苏联化和盐城联化于近期根据政府相关部门对园区及园区内所有化工企业全面停产排查整治环保问题的要求而临时停产，并将积极配合政府相关部门的统筹安排和检查，目前暂无明确复产时间表。公司应客户的要求，一般都会备有一定周期的库存，短期来看对公司的影响有限。与此同时公司将积极采取措施，充分利用公司具有多区域生产基地的优势，尽最大可能减少本次停产对公司造成的损失。谢谢！ 
42,公司2018年的业绩预计整体如何？分版块来说，相比2017年，且公司管理费用、成本等费用增长较大，消耗了大量净利润，公司如何管控成本，创造更多净利？,您好，关于公司业绩，2018年工业业务收入增长率不低于10%。（上述经营目标并不代表公司对2018年度的盈利预测，能否实现取决于宏观经济环境和市场状况变化等多种因素，存在较大的不确定性，请投资者特别注意） ，公司在推进业务增长的同时，也在严格加强成本管理，提高经济效益，谢谢！
43,目前，国际前几大农药企业的整合使得公司产品的议价能力受较大影响，未来取得超额收益的可能较小；未来公司取得较大收益的版块、及规划？,您好，公司与国际主要农药巨头是长期合作客户，定价原则相对头透明，由于公司主要从事定制加工模式，因此总体上毛利率相对稳定。公司的农药、医药和功能化学品业务，未来都有很大的发展空间。谢谢。
44,公司重金聘请了两外国外管理层，每年光薪资就600多万，目前重点在发展医药和功能化学品版块，那么，这两位高管进入管理后，对公司业绩产生了正向收益吗？哪些产品是这两外高管进入公司后主导的？预计什么时候，这两块会有新产品上市，目前这两块是否有单品营收超过亿元？,您好，公司聘请的两位外籍高管具有国际化视野和丰富的跨国企业运营和管理工作经验，在公司战略发展、国际化专业运营和管理团队的建设方面发挥积极作用，相信会对公司的长远发展产生积极和深远的影响。谢谢！
45,公司股权激励的行权价是7.98元，5月3日盘中股价一度跌至7.82元，当前的股价水平还能起到激励作用吗？公司对此会不会有所调整？,您好，股权激励方案经公司股东大会批准并实施后，对于价格不会调整。公司股价受各种因素影响，公司管理层对公司未来发展充满信心。谢谢。
46,您好，江苏联化和盐城联化是从哪一天开始暂时停产的？此次检查的内容包括哪些？有没有可以预期的复产时间表？,您好，江苏联化和盐城联化于近期根据政府相关部门对园区及园区内所有化工企业全面停产排查整治环保问题的要求而临时停产，并将积极配合政府相关部门的统筹安排和检查，目前暂无明确复产时间表。与此同时公司将积极采取措施，充分利用公司具有多区域生产基地的优势，尽最大可能减少本次停产对公司造成的损失。谢谢！
47,公司研发投入如此大，但是公司产品毛利率相比其它同类型公司并不高、且低于其它公司，且毛利率不断下滑，除了成本原因，详细的原因是什么？,您好，公司为了未来的长远发展，研发方面在持续投入，由于公司主要从事定制生产，因此工业业务毛利率总体保持稳定。谢谢！ 
48,公司目前总股本9亿多股，流通股本7亿多，还有1千多万股股权激励未解禁，另外1亿多股未解禁是哪部分？,您好，有限售条件的股份主要包括高管锁定股、股权激励限售股等。谢谢！
49,公司贸易利润率很低，占营收比例很大，对总的毛利率影响很大，贸易主要是什么业务？公司为何一直保有贸易业务？,您好，公司贸易部分主要是包括公司经营相关的化工以及非化工原材料贸易，对公司了解原材料市场有好处，同时这部分业务也会对冲公司部分汇兑损益。谢谢！ 
