,Question,Answer
0,请问公司今年营收的增长能超过行业的平均水平吗？,您好，公司将积极拓展各项业务，保持营业收入的逐年增长。谢谢！
1,您认为目前公司面临的最大问题是什么、,您好，2017年公司将围绕打造“全球领先的科技服务型企业集团”的企业愿景，重点做好人力资源、内部控制、财务管理和信息化建设等工作，持续加大研发投入，全力支持核心业务的发展，优化公司各资源和资产配置，维持科技和服务双领先优势，谢谢！
2,公司今年有确定的订单吗？金额有多大？净利润怎样？,您好，公司2017年一季度报已披露，营业收入达34亿元，归属于上市公司股东的净利润为1.42亿，对2017年1-6月净利润预计为3.4亿元至4.2亿元，谢谢！
3,你好董事长，贵公司的主打产品是什么，市场占有率如何。你们公司靠什么来不断提高自己的产值，发展前景如何。,"您好，公司主打传统制造、智能制造及新能源相关产品。近年来，坚持“内生式成长与外延式并购”齐举的发展战略，在国内行业中处于领先水平。公司对未来发展充满信心。谢谢！
"
4,贵公司是否会考虑实施股票期权等规范股权激励方式，惠及更多员工？,您好，公司将持续完善人力资源管理，提高公司软实力，包括加强团队建设、健全激励约束机制等，充分调动员工的积极性和创造性，谢谢！
5,您是否认为公司有核心竞争力？公司的核心竞争力是什么呢？,您好，公司通过多年内生外延并举的努力积累，在成本、技术、服务三方面形成的差异化竞争战略铸成了公司的核心竞争力，谢谢！
6,请问总经理你对你们公司现在的股价满意吗？,您好，公司通过多年来的内生外延式成长，已顺利完成了产品和业务的升级转型，形成了传统制造、智能制造和新能源行业三大业务，公司管理层对未来的发展充满信心，谢谢！
7,"国家要求实行经济节约型政策,公司具体是怎么做的?",您好，公司响应国家经济节约型政策，切入新能源领域，加大锂电池隔膜产品的研发和生产投入，实现各业务板块协同发展。谢谢！
8,请问公司是品牌为先还是品质为先？谢谢！,您好，公司秉承“快速的为客户创造新价值”的服务理念，为实现可持续的快速成长与发展而不懈努力，谢谢！
9,请问公司在财务结构上有什么不足，打算采取哪些举措。,您好！财务结构不足的地方为短期借款比例偏大，后续将调整加大长期借款的比例，来调整财务结构。谢谢！
10,请问公司1季度预计的收入是多少，同比，环比增减多少？,您好!公司一季度的公告已于2017年4月20日已披露，详情请查阅公告。谢谢！
11,请问公司以后每年会用什么形式回馈股东？,您好，公司将围绕打造“全球领先的科技服务型企业集团”的发展愿景，为创造股东利益最大化而持续努力，谢谢！
12,独立董事对公司的内部控制有怎样的意见呢？,您好，根据内控制度的要求，本人对公司重大事项均进行了事前调查，并对其发表了独立意见，谢谢！
13,公司有没有计划在适当的时侯推出激励计划来聚集和挽留人才，保持公司的竞争力？,您好，公司将持续完善人力资源管理，提高公司软实力，包括健全激励约束机制，充分调动员工的积极性和创造性，谢谢！
14,公司去年有没有新产品，请问新产品的推出是什么原因？2017将会实现多少的销售收入？,您好，公司每年都有研发生产新产品，以满足客户的需求，2016年公司已实现营业收入134.77亿元，谢谢！
15,2017年公司准备采取哪些行之有效的措施来扩大销售业绩和产品的全国覆盖率，提高业绩？希望公司早点抢占市场。,"您好，公司2017年主要通过提高传统制造业、智能制造业及新能源制造三个板块的产品研发、设计制造和服务能力，进一步提升公司产品在市场的占有率和经济效率。谢谢！
"
16,你们把哪些公司做为竞争对手？据你们自己了解有哪些公司把你们做为目标对手？,您好，目前公司的主要业务包括：传统制造、智能制造和新能源业务三大业务板块，均处于行业领先水平，谢谢！
17,贵公司与竞争对手相比较，有何明显优势？今后可以哪些方面进行改进和提高？,您好，公司的核心竞争力主要体现在成本领先优势、技术创新优势和客户深度服务优势，谢谢！
18,请问毛利率维持在什么水平比较理想，目前的水平是否还有提升空间？,您好！由于公司各行业不同，毛利率也不一致，综合毛利率一般维持在10%-20%，公司目前的水平还有提升空间，公司将力致于降低成本、提高效率来提升毛利率。谢谢！
19,管理方面是否有不到位的地方？,您好，公司将重点优化人力资源、内部控制、财务和信息化管理等方面工作，谢谢！
20,公司如何规避各种风险，如产品质量、资金、管理等，减少各种负面事件？,您好，公司将围绕打造“全球领先的科技服务型企业集团”的发展愿景，重点优化人力资源、内部控制、财务和信息化管理等方面工作，持续加大研发投入，全力支持核心业务发展，谢谢！
21,今年公司有新的融资计划？,您好，公司将管理使用好募集资金，发挥其资金效用，促进公司战略布局的深化发展与先发优势，谢谢！
22,公司的前5大客户是哪些？,您好，公司在2016年报中，披露了前5大客户的销售业绩情况，敬请查阅公司2016年年报。谢谢！
23,行业有没有周期性？,您好，每个行业都有其周期性，谢谢！
24,请问今年的营销额，公司给的任务是多少？去年的有没有完成？,您好，公司2016年度实现营业收入134.77亿元，同比增长129.96%，谢谢！
25,公司现阶段发展过程中有何不足？面临的最大挑战是什么？公司有何应对措施？,您好，公司将围绕产业链持续深化整合，以传统制造为基石，智能制造和新能源业务为驱动，成长为一家全球领先的、科技服务型企业集团。
26,公司属于什么行业？在行业内的地位如何？,您好，公司属于消费电子制造服务行业，目前处于国内该行业领先水平。谢谢！
27,请问公司公司的核心竞争力是什么？,"您好，公司核心竞争力主要表现在以下三个方面：
1. 成本领先优势，形成了强于竞争对手的议价盈利能力。
2. 技术创新优势，形成了高壁垒、可持续的行业领先影响力。
3. 深度服务优势，形成了高粘度、差异化的客户服务实力。
谢谢！"
28,请问独立董事，您的履职情况如何，是否能真正保护了中小股东利益？,您好，2016年度本人对提交董事会的议案均认真查阅相关文件资料、及时进行调查、向相关部门和人员进行询问等，利用自身专业知识独立、客观、公正地行使表决权，在工作中保持充分的独立性，谨慎、忠实、勤勉地服务于全体股东，谢谢。
29,现在行业间的并购都比较频繁，你们今年有没有兼并收购计划？,您好，公司将结合生产经营与企业发展战略酌情考虑，谢谢！
30,公司在税收方面有没有相关的优惠政策？具体税率是多少？,您好！公司税收优惠方面主要有高新技术企业享受15%的优惠企业所得税税率，开发新技术、新产品、新工艺发生的研发费用加计扣除，安置残疾人员及国家鼓励安置的其他就业人员所支付的工资加计扣除。谢谢！
