,Question,Answer
0,您好，今年公司的计划是什么？,你好，在2016年年度报告中关于公司未来发展展望部分有关于2017年度经营计划，请关注。谢谢。
1,您好，董事长是出去办事了吗？今天参与说明会的投资者不少，请问公司为什么会选择显示屏？是因为照明灯具销售情况不佳吗？,你好，公司自成立以来就是LED显示屏研发、生产、销售解决方案的提供商，公司2010年至2015年涉足LED照明业务，2015年下半年已经砍掉了照明业务。感谢对艾比森的关注。
2,张叔叔帅，哈哈，公司的显示屏指的是什么？我喜欢你,你好，谢谢，显示屏指的是LED显示屏，我也喜欢广大投资者。
3,独立董事对公司的内部控制有怎样的意见呢？,你好，艾比森2016年度及2017年1月全面梳理完善了内部控制制度30多份，为艾比森发展提供了强有力的制度支持。艾比森已经建立了与业务相匹配的相对完善的内控体系，2016年度艾比森未出现内部控制重大缺陷。谢谢。
4,请问独立董事，您的履职情况如何，是否能真正保护了中小股东利益？,你好，作为艾比森独立董事，根据《独立董事工作制度》及《艾比森公司章程》等规定，本人认真履行独立董事职责，会前认真审阅议案，并与管理层认真沟通，会中提出相关建议，会后督促管理层执行相关决议。2016年度，本人及其他独立董事就相关事项发表了一致同意的独立意见，现场检查了艾比森相关事项，有效保护了中小股东的合法权益。
5,管理方面是否有不到位的地方？,你好，公司经营管理随着时间的推移总会出现不完善的地方，公司一直在加强内部管理，推进内部风险制度建设，提高管理水平。
6,公司的前5大客户是哪些？,你好，公司在2016年年度报告已经披露了前五大客户的销售情况，具体客户名称因保密协议不方便透露，谢谢。
7,李叔叔好，公司是2014年8月1日上市的，目前led灯板块包括？,你好，公司2015年已经砍掉了LED照明业务。目前，公司专注于LED显示屏研发、生产、销售及LED显示屏酒店运营服务业务。
8,你好董事长，贵公司的主打产品是什么，市场占有率如何。你们公司靠什么来不断提高自己的产值，发展前景如何。,你好，公司LED显示屏涵盖户外屏、户内屏、租赁屏、球场屏、舞台演绎屏等，公司营业收入约80%来自海外收入；目前，公司LED显示屏酒店运营服务已经向国内区域中心城市及重点旅游城市的五星级及四星级酒店提供服务，未来公司将继续推进该业务。公司将继续加大研发、品牌、营销、市场开拓等投入，我们看好LED显示屏小间距产品在商业显示领域的应用，公司管理层对未来充满信心。谢谢。
9,回答投资者时，对投资者的称谓最好用“您”，因为我们是贵公司的股东，得到被投资公司的认可是重要的，这也体现了您的个人素质！谢谢！,你好，你这有点上纲上线了，我对投资者一直保持尊重和认可。
10,东方财富问董秘的回答人是您本人吗,你的问题我没看懂。
11,请问今年的营销额，公司给的任务是多少？去年的有没有完成？,你好，公司2017年销售任务具有一定挑战性，需要全体员工努力达成。2016年公司业绩相比2015年实现了恢复，但是我们相信未来公司业绩会更好。谢谢。
12,公司去年有没有新产品，请问新产品的推出是什么原因？2015将会实现多少的销售收入？,你好，为满足消费者需求和市场发展方向，公司在2016年共推出3个产品平台，完成15款新产品上市。
13,请问总经理你对你们公司现在的股价满意吗？,你好，公司股价是市场正常交易的结果，管理层对公司充满信心，希望你也一样。谢谢。
14,请问公司是品牌为先还是品质为先？谢谢！,你好，公司对品牌和品质都十分重视，谢谢。
15,2017年公司准备采取哪些行之有效的措施来扩大销售业绩和产品的全国覆盖率，提高业绩？希望公司早点抢占市场。,你好，公司将加大国内市场开拓力度，重视品牌建设，提高“艾比森”在国内品牌知名度，积极抢占市场份额。谢谢。
16,请问公司1季度预计的收入是多少，同比，环比增减多少？,您好，公司第一季度业绩情况请见2017年第一季度报告，具体公告时间为4月27日。谢谢！
17,您是否认为公司有核心竞争力？公司的核心竞争力是什么呢？,你好，公司具有以下5点核心竞争力：1、产品创新优势2、团队文化优势3、国际销售及服务优势4、品牌优势5、先进制造优势。
18,公司现阶段发展过程中有何不足？面临的最大挑战是什么？公司有何应对措施？,你好，公司现阶段面临最大的问题就是LED显示屏行业竞争加剧。艾比森将综合发挥技术优势、生产制造优势、成本优势、营销网络和售后服务优势、品牌优势、管理优势，迅速扩大市场份额，巩固行业地位。谢谢。
19,公司属于什么行业？在行业内的地位如何？,你好，公司在LED显示屏行业中属于龙头企业之一。
20,李总好，公司有小间距产品吗，占收入比多少？公司未来的增长点在哪里？,你好，公司2016年度点间距3以下（含3）的显示屏累计签单约4.19亿元，比上年同期增长约72%，约占公司2016年全部显示屏订单的36%。未来公司将积极拓展国内和国外市场，快速推进LED显示屏酒店运营服务业务，努力为股东创造更大投资回报。谢谢。
21,行业有没有周期性？,一般来说，LED显示屏行业下半年较上半年是旺季。
22,您认为目前公司面临的最大问题是什么、,你好，整个LED显示屏行业竞争在加剧，导致行业毛利率呈下降趋势。公司致力于通过整合供应链体系，优化产品设计，加强内部管理等措施提高公司竞争力。谢谢。
23,公司有没有计划在适当的时侯推出激励计划来聚集和挽留人才，保持公司的竞争力？,你好，公司制定了完善的人才激励措施，完善内部人才建设，不断保持和增加公司人才方面的竞争力。
24,贵公司与竞争对手相比较，有何明显优势？今后可以哪些方面进行改进和提高？,你好，公司在LED显示屏行业属于龙头企业之一。公司主要有以下方面的优势：1、管理优势，2、技术优势，3、生产制造优势，4、成本优势，5、营销网络和售后服务优势，6、品牌优势，7、信息化优势。公司将在研发、营销、品牌建设、信息化建设等领域加大投入，力争为所有股东创造更好的投资回报。谢谢。
25,公司今年有确定的订单吗？金额有多大？净利润怎样？,你好，今年的销售情况请见公司后续披露的定期报告。
26,你们把哪些公司做为竞争对手？据你们自己了解有哪些公司把你们做为目标对手？,你好，公司主要竞争对手为利亚德、联建光电、洲明科技、雷曼股份、奥拓电子等LED显示屏同行公司。据我们初步了解，以上同行也把艾比森列为竞争对手。
27,张叔叔好，哇，叔叔老了，公司的LED产品销售额是多少？,"你好，公司2016年营业总收入为1,165,998,433.50元。"
28,李叔叔好，公司的主营业务是什么？,你好，公司主营业务为LED显示屏研发、生产、销售及LED显示屏酒店运营服务业务。谢谢。
29,公司如何规避各种风险，如产品质量、资金、管理等，减少各种负面事件？,你好，公司已经建立了相对完善的风险控制体系，在2016年度引进了多名中高端管理人才，强化公司经营管理，产品质量、经营质量、风险控制水平等均在稳步提升。谢谢。
30,今年公司有新的融资计划？,你好，具体请见公告。谢谢。
31,请问毛利率维持在什么水平比较理想，目前的水平是否还有提升空间？,目前，公司毛利率在制造业领域属于比较好的水平，公司仍然致力于提升。
32,公司在税收方面有没有相关的优惠政策？具体税率是多少？,我们是高新技术企业，享受15%的所得税税率。
