,Question,Answer
0,请问公司近两年重点推进的“中大尺寸超薄导光板”和“柔性透明导电膜”两个产品去年营收分别是多少？毛利率分别是多少？,子公司维业达的营业收入即为中大尺寸触控产品收入，子公司维旺科技的营业收入包括中大尺寸导光膜、超薄导光板收入。
1,VISION BOARD目前的销售模式是怎样？还是亏损的原因是什么？目前visionboard的销售困难是什么？,"中大尺寸触控产品领域，公司针对客户不同需求，采取灵活多变的产品形式和销售模式:面向笔记本、PC等触控屏整机生产企业，可提供不同规格和型号的柔性透明导电膜或触控SENSOR;而对55吋、110吋的交互式“大终端”，则采取“先体验，后销售”“走出去、请进来”等多种方式，逐步增强客户的体验度和接受能力，同时，开通线上和线下销售渠道，通过网络、微信等加强产品宣传力度，提升VisionBoard自主品牌的影响力。
目前维业达的发展还是加强市场推广力度，增加产品市场占有率。"
2,公司对新疆、内蒙、宁夏等西部同行竞争对手怎样的考量？你们的成本、管理、市场等优势体现在哪些方面？,"新型光学印材领域，公司能根据客户需求定制高技术含量、高性能的微纳结构产品，并能提供独创性产品整体解决方案，为客户提供高质量的服务，将在坚守原有市场基础上，加强非定制化产品市场推广，在地域上，坚持立足华东，重点维护华南和西南市场，稳步推进全国其他地区市场的营销
策略。"
3,您认为目前公司面临的最大问题是什么？,您好，任何企业在其发展历程中必然经历发展的高峰和低谷，我们持续进行新产品新技术的研发和产业化，保证企业的稳定可持续发展，新产品产业化成功，企业的发展将上一个新台阶，谢谢！
4,新投资的项目今年能否为公司贡献利润？如有利润贡献，公司预计能实现多少利润？,公司2017年新建项目目前仅有子公司华日升的“微棱镜型反光材料产业化项目”，该项目建设期两年。目前尚处于建设期。
5,请问截至到目前公司的营销有没有什么新进展，有看点吗？,"2017年一季度公司预计净利润为1,165 万元—1,300 万元，具体经营情况及数据请关注公司2017年4月27日披露的第一季度报告。
"
6,公司目前有哪些在建项目？建设进度如何？还需要多少资金？,公司目前在建项目仅有子公司华日升“微棱镜型反光材料产业化项目”，该项目建设期两年，项目总投资2.87亿，使用募集资金1.26亿。
7,您或公司其他股东近期是否会增持？,近期没有相关计划，2016年末公司非公开发行股份，公司董事长、总经理、部分高管及部分核心人员已通过东吴苏大维格1号资管计划认购了份额。
8,说的好，不如做得好，恳请公司高管，拿出切实的行动，做大公司，做大市场！,好的，感谢您的建议。
9,公司2017年的量化经营目标是多少？,2017年，公司将继续以市场为导向，以技术创新为依托，加强内部控制，规范运作，加强新产品推广，扩大产品市场份额，努力打造一个创新型、高技术、规模化的企业。
10,今年是否有与国际厂商进行合资合作开发技术的计划？,公司2017年经营计划是会继续加大资本、市场、技术等行业资源的整合力度，具体实施和进展请关注公司公告。
11,公司的网站都没更新，太不重视对外的窗口文化建设,公司网站的产品中心、研究中心有较多的更新内容，今后将根据公司实际情况逐步完善，加大相关内容的维护和更新力度。
12,投资者担心的心情更多，请问贵公司对此怎样给予更好的鼓励，加油,您好，公司目前整体经营状况逐步向好，并购常州华日升之后，经营业绩也将有较大幅度提升，虽然股价有多重影响因素，相信公司实力增强，业绩基础夯实之后，股价发展也就有了较好的根基。谢谢！
13,公司的销售管理有多大的提升幅度？,公司在微纳光学产品技术研发与制造领域位居国内领先地位，且主营业务突出，成长性良好。
14,公司去年财务费用和管理费用怎样？同财务费用相比呢？今年有没有折旧？请问管理费用今年会能稳定吗？,公司2016年度相关财务数据，已对外公告，投资者可以上网进行相关查询。
15,苏州维旺科技有限公司、苏州维业达触控科技有限公司、江苏维格新材料科技有限公司净利润为负，有扭转业绩的计划？,子公司苏州维旺科技有限公司、苏州维业达触控科技有限公司、江苏维格新材料科技有限公司经营逐步向好的方向发展，具体经营情况届时请关注公司定期报告，谢谢！
16,公司要多为股东的利益考虑，励精图治,感谢您的建议。
17,看到虞某大股东，股价到高位时就减仓套现，是对公司的未来发展前景的担忧吗？,大股东减持股份只要是遵守相关规定，公司无权干涉，请理性看待大股东的合规减持。
18,"3D显示,OLED镂空掩模板项目进展如何？",您好，AR镜片目前已研制出样品，正在寻求合作方；AMOLED镂空掩模板目前也在积极向各厂商送样测试，谢谢！
19,请问公司今年营收的增长能超过行业增速20%吗？,2016年公司业务以公共安全防伪、光学印材为主体，新型显示与照明、中大尺寸高性能电容触控业务为两翼，各类产品的发展阶段不同，各具特点，公共安全防伪、光学印材保持稳定增长，新型显示与照明、中大尺寸高性能电容触控业务产品有较大幅度增长。
20,公司领导怎么看现在公司的股价，对我们这些看好公司的小散有什么忠告。谢谢,感谢您对公司的支持，公司管理层致力于提升公司实力和业绩，希望以业绩回报投资者。影响股价因素很多，提醒广大投资者理性投资。
21,请问公司明年净利润能做到多少？,根据相关信息披露规则的规定，不便预计，业绩数据会定期发布业绩预告和定期报告。
22,公司历次新增产能均能及时消化，公司一直保持了较高的产能利用率与产销率   这是过去，将来还会是这样吗？,公司目前整体各项工作良好，相信在公司管理层的领导下，一定会取得更好的成果。
23,投资互动平台，没安排专人回复？,有，经查看，均有定期回复。
24,我对贵公司是长期投资的，请问预计今年上半年会盈利多少？,"公司2017年第一季度预计盈利1,165 万元—1,300 万元，2017年上半年的经营情况会在7月初做业绩预告，按照相关信息披露规则，目前不便对2017年半年度做预计。"
25,裸眼3d项目进展如何？,您好，公司2016年已成功研制出用于AR的光场波导镜片，目前正在寻找相关合作方，共同推进项目进一步研发及产业链上下游资源整合，谢谢！
26,请问公司股票上市时期价格多少，现在多少，还具有投资价值吗？,您复权看一下，如果您是公司上市时就持有的股东，且一直持有到现在，您肯定没有亏损，但您一直持有到现在未变动的概率应该很小，所以说二级市场股价波动受多因素影响，请投资者理性投资。
27,公司有没有股权激励计划？,您好，公司之前的期权激励计划因业绩未达标而注销，未来时机合适时公司仍考虑推出新的激励计划，以留住人才、吸引人才。
28,公司威视宝销售量怎么样？,虽然子公司维业达2016年亏损，但产品销量，营业收入是增长的。
29,大爱苏大维格，不知道公司是否会欢迎股东去贵司进行参观调研？,您好，感谢您对公司的支持，公司欢迎股东在除定期报告及重大事项公布前的窗口期外的时间段，到公司实地调研，加深对公司的了解，谢谢！
30,请问公司近两年重点推进的“中大尺寸超薄导光板”和“柔性透明导电膜”两个产品去年营收分别是多少？未来有望做到多少？,子公司维业达的营业收入即为中大尺寸触控产品收入，子公司维旺科技的营业收入包括中大尺寸导光膜、超薄导光板收入。
31,请问公司以后每年都会用现金分红的形式回馈股东吗？,您好，根据公司章程约定，公司将优先以现金分红方式回馈股东，谢谢！
32,请问公司今年是否有对外扩张的打算？在环渤海地区是否有意向？今年公司在市场开拓方面有什么计划？能否详细谈谈？谢谢,"会继续密切关注行业并购机会，根据实际情况，继续加大资本、市场、技术等行业资源的整合力度。相关事项以公司公告为准。
在市场开拓方面，目前还是加大“中大尺寸触控产品领域”、“中大尺寸导光膜、超薄导光板”两块新品的推广。中大尺寸触控产品领域，针对客户不同需求，采取灵活多变的产品形式和销售模式，同时，开通线上和线下销售渠道，通过网络、微信等加强产品宣传力度；中大尺寸导光膜、超薄导光板会继续切入部分品牌厂商供应链。"
33,除华东以外，其他地区的业务拓展能力也太差了吧,公司地处经济比较发达的华东地区，因此公司市场开拓工作一开始就定位于立足华东，开拓全国市场，放眼全球市场。目前除华东外，华南、西南、华北市场拓展进展顺利，国外市场开发也在进行中，谢谢！
34,对公司未来有前景吗？,公司目前整体各项工作在向好的方向发展，管理层对公司前景充满信心，也一直在努力做好公司的经营管理。希望投资者对公司的未来也充满信心！
35,建议公司加强销售管理，特别是在除华东地区外的区域销售力度。股价跌跌不休，是管理层不作为的最好体现？,感谢您的建议。二级市场股价波动受多因素影响，请投资者理性投资。
36,看履历，您并不是一个光电技术的专才。能否介绍一下您在公司的定位和作用吗？,负责公司的总体运营管理。
37,公司目前面临的最大问题是什么？,公司目前面临的问题是新产品的市场开拓问题，公司产品的应用领域较广，在某些领域，我们进入的时间比较短，积累的市场经验和资源不够，在这方面我们需要进一步加强，同时也希望同市场和渠道资源比较丰富的企业或者团队开展合作，谢谢！
38,将来公司下属会有上市公司吗?,公司目前暂无此考虑。
39,请问净利润的增长率和销售收入增长同步吗？,公司2016年度业绩与同期相比，销售收入与净利润都有合理增长。
40,你觉得一个什么样的企业才是一个好的公司？公司的定位是否需要陈董好好思量一下？,陈董事长的主要精力用于思考公司未来发展方向，明确相关发展战略。
41,在做项目之前是否对项目进行严谨的可行性研究？,公司以往进行的项目均进行了严谨的可行性分析，并出具了项目可行性研究报告，相关信息披露请查询巨潮资讯网。
42,股价跌个不休，是否有未披露的信息,您好，公司目前没有应披露而未披露信息，谢谢！
43,公司现在负债总额是多少？每年负债的利息是多少？谢谢。,截止2016年12月31日止，公司的合并负债为11487万元，此项数据年报上已有披露。
44,公司预计未来哪些产品会成为拉动业绩增长的主要力量？,公司目前重点推进现有子公司项目成功走向市场，即加快推进触控产品、新型显示材料类（导光膜、导光板）产品的市场化进程，未来还有掩膜、NPSS衬底、照明用导光产品、微纳设备等相关储备。
45,今天公司股价破了2016年以来的新低，你们有什么看法？是资本市场错误了吗？,您好，公司一直致力于加强经营管理，提升公司业绩，用业绩回报广大投资者，2016年实现归属于母公司的净利润较上年同期有较大幅度提高。股价影响因素很多，请投资者客观看待，谢谢！
46,请问今年的营销额，公司给的任务是多少？去年的有没有完成？,"2016年度公司营业收入41,572.34万元，同比增长13.85%。"
47,截至目前公司的同比销售额有增长吗？,"2017年一季度业绩预告净利润为1,165 万元—1,300 万元
，同比增长。销售额具体数据会在一季度报告中详细披露，一季报将于2017年4月27日披露，请您关注。"
48,公司是少有的院士企业，希望公司可以充当创新企业的排头兵，成为一个真正的可以叫响全球的中国创新型企业，向华为等优秀企业学习！并不仅仅是一个创新的研究机构！！,非常感谢您的建议，公司将继续努力，做好经营管理，提升业绩，做大做强，提升公司的内在价值，回报广大投资者。
49,电子技术日新月异，公司依托苏大等高校的研究机构研发这块还是很强，但转化为生产力这块就很慢且好像没什么头绪。未来你们是希望通过转让技术去回收成本及收益还是其他方法去实现经济效益？,"近两年公司重点推进的“中大尺寸超薄导光板”和“柔性透明导电膜”产业化项目已实现了从实验室样品到产品的批量化生产及市场推广，其他创新技术的产业化也正在推进当中。今后，公司将继续通过对内技术创新、模式创新、管理提升以及对外产业整合、外延并购等方式努力推进公司发展，提升公司业绩，实现公司市值的稳步增长，从而实现公司与广大投资者共赢发展，谢谢！
"
50,公司之前的股权激励计划已经被迫结束，今年是否有下一步的员工股权激励的计划，分享公司发展的成果！,人才是公司持续发展的源泉，公司今后仍将采取合适的员工激励措施，留住人才，吸引人才！
51,你觉得公司的强项和弱项是什么？我们应该怎样去强化强项，改善弱项？,公司在技术技术研发、应用创新、完整工艺链、客户市场等方面具有明显核心竞争优势。如何强化优势、改善经营发展中的问题正是公司管理层在公司日常经营管理中天天在思考、日日在努力的事情。
52,今年公司董事会是否会改选？,您好，公司本届董事会将于今年下半年任期届满三年，届时公司将进行换届选举，谢谢！
53,公司今年是否还有对外并购的计划？并购的方向是什么？,您好，公司未来将根据发展战略，适时选择合适标的，继续开展并购工作，扩大公司规模，增强盈利能力。谢谢！
54,公司新项目何时能对公司贡献利润？预计每年可实现净利润多少？,不清楚您所指的新项目是哪个。
55,公司参与的国家重大科学仪器设备项目“纳米图形化直写与成像检测仪器的开发与应用“是否应该在近期交付？””,该项目将在2017年根据相关部门的安排进行项目验收。
56,一季度业绩怎么样？有没有机构来调查？,公司已于2017年4月8日发布了一季度业绩预告，预计比上年同期上升157.67%—187.53%。近期未接待机构调研。
57,公司专利和技术储备很多，但是一直没有有效转化为生产力，造成业绩一直无法很很好的提升。未来或者是2017年，在这方面公司有什么计划去改善业绩，回报股东？,"您好，如您所言，公司是技术创新型企业，技术储备和专利很多，自公司上市以来，公司研发实力不断增强，创新技术产业化也在不断升级，近两年重点推进的“中大尺寸超薄导光板”和“柔性透明导电膜”产业化项目正是公司实现了从实验室样品到产品的批量化生产及市场推广的成果，未来公司其他创新技术的产业化也会持续推进。
"
