,Question,Answer
0,公司目前在市场开拓方便进展如何？,公司持续加大市场开拓的深度与广度，产品及服务相继在全国24家省级广电网络公司入围，结算客户1000余家，确立了较为显著的市场优势；同时，公司基于丰富的智慧物联应用解决方案，积极布局与政企客户展开合作，探索智慧城市总包商合作模式。公司与贵州铜仁、毕节、黄平等当地政府或旅游发展机构共同推进了智慧社区、智慧旅游、农村电商项目，视频监控和雪亮工程项目拓展至江苏、四川、湖北等地，应急广播项目在广西、山东、江苏、湖南、重庆等多个县市全面上线运行，智慧党建项目在山东、湖北等地落地实施。感谢您的关注！
1,公司目前主要盈利业务是什么？,"您好！公司三大业务：网络传输建设（“传输”）、智能融合终端（“终端”）、智慧物联应用（“应用”）健康发展，均为公司盈利业务，并且综合实力持续增强。
    公司将继续努力为股东带来回报，感谢投资者对公司的关心！"
2,公司今年研发投入新产品有哪些？研发费用占比是多少？,您好！公司正在进行中的研发项目进展详见2017年年度报告、2018年一季度报告中的相关内容，2017年度研发投入总额占营业收入比例为5.10%，感谢您的关注！
3,今年预计公司建设完成高清视频监控数量是多少？,"您好！截至17年末，公司已在四川、湖北、江苏等地建设完成约9,000路高清视频监控，雪亮工程平台接入约7,000路，今年将在上述规模基础上持续扩大，感谢您的关注！"
4,目前公司业绩受哪方面影响较大？,您好，公司业绩主要受行业及其竞争因素和企业内部经营管理能力的综合影响，感谢您的关注！
5,公司今后发展重点放在哪里？,您好，公司坚持产业经营+资本运营 “双轮驱动”发展战略，一方面，做大做强主业，以市场需求为导向，以产品技术创新、组织与机制创新、企业文化创新为动力，不断提升公司核心竞争力，开发适应市场需要的产品及服务，以智能连接和智慧物联应用为抓手，开拓智慧城市、智慧行业的相关业务；同时，借助上市公司资本平台，通过兼并、收购、重组等方式拓展公司的成长空间，打造公司新的增长极。感谢您的关注！
6,公司农村电商解决方案在哪些地区有所拓展？运营情况如何？,"您好！公司与铜仁市碧江区人民政府于2018年1月16日在铜仁市签署了《框架协议》，双方拟共同投资建设和运营碧江区大数据+智慧社区+农业电商+物流平台项目，项目拟总投资额约人民币6,400万元，相关情况详见公司发布的相关公告，感谢您的关注！"
7,碧江区大数据+智慧社区+农业电商+物流平台项目运营情况如何？,您好，碧江区大数据+智慧社区+农业电商+物流平台项目目前进展正常，公司正在与碧江区人民政府进一步商议和约定具体的合作细节，相关情况请关注公司的持续公告。
8,预计公司自行研发的智能融合终端全年销售量是多少？,您好！公司已与广西省网、中信国安广视等客户签订了智能融合终端的供货框架协议，具体销售数量视客户下达的具体订单而定，感谢您的关注！
9,公司近期是否有签订重大项目？,"您好！根据《创业板规范运作指引》及公司《信息披露管理制度》的相关规定，超过3,000万元的合同属于需披露的重大合同项目，相关情况请留意公司相关公告，谢谢！"
10,公司高管持股详细情况如何？,您好！公司高管持股情况详见公司2017年年报第八节“董事、监事和高级管理人员持股变动”中披露的相关内容，董监高持股变动也可关注公司披露的临时公告，感谢您的关注！
11,公司主营业务没什么发展前途？公司有无考虑转型或者重组？,您好，公司是宽带网络智能连接和智慧应用整体解决方案提供商，业务涵盖通信设备研发制造和智慧物联应用服务。公司目前业务以通信设备研发制造为主，客户涵盖全国24家省级广电网络公司及下属1000多家结算客户，确立了较为显著的市场优势，传统业务稳步发展；同时，公司确立了物联网的转型升级发展方向，开发了以物联网技术为基础，为政企客户提供智慧城市建设、公用事业管理以及基于行业智慧应用的智慧物联解决方案，应用前景广阔，谢谢！
12,公司目前利润如何?,"您好!  2017年度，公司实现归属于上市公司股东的净利润4493.50万元；2018年第一季度，公司实现归属于上市公司股东的净利润535.59万元。
    基于行业运营、管理的特点，公司业务继续呈现一定的季节性波动特征，第一季度营业收入占全年营业收入比重稍小，投资者不宜以季度的净利润情况推测公司全年净利润情况。
    感谢对公司的关注！"
13,公司智慧社区系统产品目前的拓展情况如何？在哪些新的城市开发应用？,您好，公司致力于打造以“智能连接+智慧应用”为特点的智慧社区平台，在2017年度控股收购了江苏路通物联科技有限公司（原名江苏智天下网络科技有限公司）51%股权，智天下作为智慧社区及智慧行业应用综合解决方案提供商，已有较为成熟的智慧社区系统产品并在贵州、江苏、内蒙古、广东等全国20多个城市落地实施，极大增强了公司在智慧社区相关业务方面的服务和研发能力，目前智慧社区业务拓展情况良好，感谢您的关注！
14,目前智慧旅游解决方案在哪些城市新景区有所应用？,您好，公司智慧旅游解决方案目前已在湖北、四川、贵州、江苏等多地拥有成功案例，感谢您的关注！
15,今年公司研发投入了哪些新的网络传输系统解决方案？运用情况如何？,您好！2017年度公司加大了对智能融合终端、智慧社区、农村电商等智慧物联应用业务的研发投入，研发投入总额占营业收入比例为5.10%，全年新增专利4项，新增软件著作权23项。公司研发项目的具体情况及进展，详见年度报告第四节”经营情况讨论与分析”之“ 二、主营业务分析”部分，感谢您的关注！
16,公司一季度业绩为何大幅下滑？今年全年业绩是否也会大幅下滑？,"您好！2018年第一季度，公司实现营业收入7,012.80万元，较上年同期下降5.84%；实现利润总额587.67万元，较上年同期下降41.45%；实现归属于母公司所有者的净利润535.59万元，较上年同期下降37.93%。
（1）公司网络传输建设、智能融合终端、智慧物联应用三大业务发展势头良好。网络传输类设备先后在江苏、湖北、广西、重庆、福建、山西、浙江、河南、辽宁等地中标入围；智能融合终端持续开拓江苏、河北、云南、福建、台湾等地市场；智慧物联应用解决方案积极布局与政企客户在智慧社区、智慧旅游、农村电商、雪亮工程、应急广播、智慧党建等项目展开合作。
    但由于部分规划设计及智慧物联应用业务受项目工期、客户验收进度等影响，未能在本报告期内确认收入，影响了收入的实现。
（2）由于部分毛利率较高的规划设计及智慧物联应用业务未能在本季度内确认收入，且部分原材料价格、社会人工成本较上年同期有所上升，均对毛利率构成不利影响，毛利率较上年同期下降1.07个百分点。
（3）本季度财务费用、管理费用较上年同期分别增加145.76万元、119.63万元。一方面，为加快资金回笼速度，公司办理了应收账款无追索权保理业务，财务费用上升；另一方面，公司胡埭厂区自2017年第一季度末转固并开始投入运营，报告期内胡埭厂区固定资产折旧费用增加，且新园区配套的职工福利支出增长，均造成管理费用上升。
    基于行业运营、管理的特点，公司业务继续呈现一定的季节性波动特征，第一季度营业收入占全年营业收入比重稍小，投资者不宜以报告期内的净利润情况推测公司全年净利润情况。
"
17,目前公司有哪些并购项目？进展情况如何？,您好！公司坚持产业经营+资本运营 “双轮驱动”发展战略，一方面，做大做强主业，以市场需求为导向，以产品技术创新、组织与机制创新、企业文化创新为动力，不断提升公司核心竞争力，开发适应市场需要的产品及服务，以智能连接和智慧物联应用为抓手，开拓智慧城市、智慧行业的相关业务；同时，借助上市公司资本平台，通过兼并、收购、重组等方式拓展公司的成长空间，打造公司新的增长极。公司会根据发展战略进行布局，具体情况及进展请关注公司披露的相关公告，感谢您的关注！
18,预计公司第二季度经营业绩情况如何？,您好！公司经营业绩保持良好，各项任务均按目标进度进行，我们会继续努力为股东带来回报，感谢投资者对公司的关心！
19,最近有无机构到公司调研？,您好！最近暂无机构调研，公司接待机构调研的相关情况将及时在互动易上进行披露，感谢您的关注！
