,Question,Answer
0,能简单的介绍下新项目的情况吗？,可否请您明确下您关注的新项目是哪一个，谢谢。
1,公司未来五年的目标是多少？能够实现吗？,请关注上市公司公告，我们非常有信心实现公司制定的发展目标。
2,请问开完股东会后，如果送股通过几日内会送股？,"您好，公司第三届董事会第二十一次会议已审议通过《2016年度利润分配预案》，公司2016年度利润分配预案为：以截止2016年12月31日公司总股本165,100,000.00股为基数，按股东持有公司股份比例向全体股东派发现金红利，每10股派发现金股利0.10元人民币（含税），不转增，不送股。待股东大会审议通过后，将实施权益分派，请关注公司后续公告，谢谢！"
3,公司的发展战略是什么， 和公司现有的主营业态一致吗？  能否详细讲解一下？ 谢谢！,公司正在筹划重大资产重组，如重组实施成功则主营业务会发生显著的变化，但如果不成功，则会继续发展现有主营业务，谢谢
4,2017年公司是否考虑对高管实行股权激励，如果有的话大概什么时候实行？,暂无股权激励计划，谢谢！
5,请问公司今年营收的增长能超过行业的平均水平吗？,您好，公司会积极努力的，谢谢！
6,请问老总， 2016年存货是多少，存货增加的内容是哪些？,2016年公司的存货总金额为1.77亿元，同比2015年，存货金额下降了17%，详细情况请查阅公司于2017年4月25日披露的2016年度报告，谢谢！
7,公司今年有新投资的项目吗？如果有，当年能否为公司贡献利润？如有利润贡献，公司预计能实现多少利润？,除正在筹划的重大资产重组之外，公司目前无新的投资项目
8,公司截止目前的股东总人数是多少？,根据公司一季度报告，截至2017年3月31日，公司股东总数是16295
9,您好，公司为什么没有宣传片？,您好，我也很爱杭州。公司有宣传册，欢迎取阅。
10,请问：公司产品的技术含量如何？专利多吗？行业垄断地位如何？ 那些项目能给公司带来利润增长点？预计是否能保持3年的增长？,公司拥有经验丰富的研发设计团队，并积极与科研院所合作，从模具设计、工装、模具、检具设计及生产制造等诸多环节融入各行业客户的经营链条，拥有多项国家专利，在电机定转子行业处于技术领先地位。公司注重将最新的创新型技术成果在生产一线进行运用、推广和普及，在生产实践中解决问题，总结积累技术成果，提高了劳动生产率、降低了生产成本、保证了产品质量、增加了产品的附加值，也提升了项目承接能力、市场影响力、客户的认可度，保证了公司在行业内持续的技术优势和竞争优势。
11,在企业文化方面，公司有什么特色吗？,公司坚持“以人为本，敬畏客户，求实创新，持续成长”的企业文化。公司一直强调企业文化建设，良好的企业文化已经深入人心，成为公司领导与员工的自觉行为，为公司的健康发展提供了持续的精神动力。
12,"公司采取了具体怎样的应对措施,在同业中不断做大做强?",不断提升产品质量、技术水平、研发能力和客户服务质量，保证交货周期，谢谢。
13,公司未来3年发展前景如何?,公司主营业务稳定适度增长，并努力争取通过收购优质资产做大做强，但重大资产重组存在不确定性，请投资者注意风险。
14,"同行业内有哪些主要竞争对手？公司采取了什么样的应对措施,在保持稳定增长的前提下不断做大做强?",公司的竞争对手包括腾普等国际知名公司在国内的生产厂、神力等国内公司以及电机企业的自主配套车间，但公司的产品质量稳定性、技术水平、交货周期、客户服务等方面存在竞争力。
15,你好，请问贵司目前产品的销售趋势如何？今年的销售目标是多少？公司有没有一个具体可行的持续增长计划？,2017年1季度同比2016年一季度，销售收入增长了40%，目前增长势头良好。全年销售目标是10.8亿元，公司将不断加大市场开拓力度，研发新产品，提高产品质量，实现公司可持续稳定发展，谢谢！
16,做大、做好市值管理是每个公司成长的必然追求，公司是如何进行市值管理的？,你若盛开，清风自来。
17,在给用户提供增值服务方面，公司做了哪些工作以增强对原有客户的锁定、新客户的拓展？,辅助客户研发、确保交货周期及提升服务质量等多种方式保证客户粘性，同时加大新产品研发能力，加大力度拓展电动汽车等新客户，谢谢
18,行业有没有周期性？,周期性不是很强，一般一季度后期和二季度相对较好，但并不明显，谢谢
19,请问公司公司的核心竞争力是什么？,公司是国内电机定转子行业龙头企业，产品质量、研发实力、客户服务水平等为公司奠定了长期的竞争力，谢谢
20,希望公司在本专业领域专注于做强做大做实，提升公司的行业地位，给投资者以回报！,公司一直争取在本专业做大做强，通过扩大市场、降本增效等多种方式从未放弃努力，但也要认识到传统产业竞争压力的与日俱增。因此，公司也在积极争取收购盈利能力更强的优质资产，为股东创造更好的回报，谢谢
21,公司生产经营的季节性如何?哪个季节是旺季?,有一定的季节性，一般一季度后期和二季度是全年的高峰，但季节性因素不是那么明显，谢谢。
22,请问公司会进入新的细分领域吗？这一领域与公司现有业务的相关性？,公司不排除在未来收购盈利情况较好且满足监管需求的优质资产，进入新的领域，从而提升上市公司的盈利能力
23,您好，公司的主营业务是什么？什么时候上市的？,主营业务是电机定转子和铁芯制造业务，为大中型电机制造企业提供配套产品服务，2011年上市，谢谢
24,请问独立董事，您的履职情况如何，是否能真正保护了中小股东利益？,三位独立董事16年度从未缺席董事会，对董事会审议议案进行严格把关和监督，对公司的主要经营事项、重大决策保持关注和监督，关注投资者热点关注问题并与公司管理层保持沟通，履职情况良好，能够起到保护中小投资者利益的作用。
25,请问公司目前的研发机构有哪些？公司未来产品的研发与创新将如何进行？,首先公司有自己的研发部门，负责新产品研发和自动化改造，同时也与苏州大学等科研院所合作，提升公司产品技术水平，谢谢。
26,请问公司的分配预案达到承诺的分红比例吗？,公司16年分配预案完全符合相关规定及公司所做承诺，但利润水平较低导致现金分配较少，在此向投资者表示歉意！
27,请问公司以后每年会用什么形式回馈股东？,回馈股东是上市公司的基本责任，我们会尽最大努力做大做强上市公司，提升盈利水平并执行合理的分红比例。
28,请问2017年全年预计销售目标是多少？实现净利润的目标是多少？,2017年公司全年预计销售收入10.8亿元，预计全年净利润2040万元，公司年报已经披露，详细请查阅巨潮资讯网（http://www.cninfo.com.cn），谢谢
29,"请问董事长,关于公司最新项目进展如何？达到预期了吗？",公司的日常生产经营和正在筹划的重大重组事项均在预期范围内顺利开展，请关注后续公告，谢谢
30,新三板的扩容，带来了新的投资机会，你们公司在这方面有什么打算吗？,公司目前正在筹划重大资产重组，暂无新三板的投资计划，但未来不排除包括新三板在内的所有投资方式，谢谢
31,公司在税收方面有没有相关的优惠政策？具体税率是多少？,公司是高新技术企业，享受高新技术企业的相关税收优惠政策，具体的所得税税率是15%，谢谢。
32,公司有没有股权激励计划？,公司近一年内没有执行股权激励，近期也无实施股权激励的计划，谢谢！
