,Question,Answer
0,鸿图三期工程及研发中心等投资项目的进一步介绍,"尊敬的投资者您好，感谢您关注金冠电气。
1、9000万平方米/年锂离子电池隔膜三期工程：
辽源鸿图锂电隔膜科技股份有限公司9000万平方米/年锂离子电池隔膜三期工程项目，建设地点位于辽源经济开发区连昌工业园，鸿图隔膜二期工程项目西侧，总投资3.15亿，新增土地33555平方米，该块土地已经签署完成土地转让合同，正在办理土地证阶段。该项目主要建设两条年产4500平方米锂离子电池隔膜生产线，及8条涂覆隔膜生产线，该项目建成后公司将形成2亿平方米/年的高端湿法隔膜生产能力，公司并根据行业及客户未来发展的方向，将适时的以自有资金增加涂覆隔膜生产线，并开发出新的、能适应客户发展的涂覆技术，形成涂覆隔膜全覆盖的生产局面，就公司目前的研发、生产、销售情况来看，公司现有二期产品已经得到了市场上高端客户的认可，公司对于三期未来产品及销售具有一定的信心。
2、研发中心项目：
辽源鸿图锂电隔膜科技股份有限公司研发中心项目，建设地点位于辽源经济开发区连昌工业园甲一路西侧，乙二路北侧，公司现有二期工程厂区内。该项目总投资5000万元，主要建设研发中心大楼，并配套购置研发设备，主要包括隔膜试验设备、隔膜测试设备、电池测试设备及涂覆浆料研发设备等。通过本项目的实施，鸿图隔膜可以进一步提升锂离子电池隔膜生产工艺的技术水平，在现有研发和技术基础上，进一步提高标的公司现有产品的产品性能和技术含量，并为公司开发出更多规格的产品提供技术支持，促进公司业务的可持续发展。"
1,公司将如何应对充电桩市场发展不及预期的风险？,答：尊敬的投资者您好，感谢您关注金冠电气。未来三年，公司将继续发挥大功率快速充电优势，通过智能化制造规模效应及从制造到安装以及运营与云平台管理等相关全产业链布局来增加产能和市场份额；通过快充加柔性的模式，为大型公交车辆及物流车辆提供安全快捷的充电服务，将充电桩制造和充电服务的利润占企业全部利润的比重提升至行业平均水平以上；实现从传统制造向新能源设备制造与运维的业务模式转变，进而向一流的新能源充电服务商转型。
2,请介绍一下公司智能环网柜业务的发展情况。,答：尊敬的投资者您好，感谢您关注金冠电气。公司为东北地区少数具备中压气体绝缘开关制造能力的企业，以客户面临的挑战为驱动力，凭借卓越的工程技术与创新能力，以领先的电气化、自动化和数字化产品及解决方案，保持着公司在行业内领先的技术研发水平。同时，公司以技术能力、制造水平和营销模式为核心竞争力的企业综合实力强劲，与区域内同类企业相比，具有明显的竞争优势，且在全国范围内的智能型电气开关制造型企业中排名靠前，新研发的40.5kV气体绝缘开关设备在产品技术参数、制造工艺、可靠性等方面，可完全替代进口产品。在电网升级改造、轨道交通建设和公共基础设施方面，公司在东北区域内，具有极大的技术优势和区位优势，在全国范围，公司目前已经在江浙地区建设新的产业基地，在技术、生产、营销等方面实现协同，进一步扩大技术优势，减小区位因素的影响。
3,公司几块新能源业务的毛利率是多少？在同行业中处于什么水平,"尊敬的投资者您好，感谢您关注金冠电气。
公司充电桩业务在2017年度的毛利率为35.76%，在同行业中处于中等略偏上的水平。
公司锂电隔膜业务在2017年度并未纳入合并报表，未对公司2017年度业绩产生影响。
"
4,请介绍一下公司的充电桩业务。,"答：尊敬的投资者您好，感谢您关注金冠电气。公司的充电桩业务，是新能源汽车配套设施之一。公司充电桩产品具备大功率快充技术、柔性智能充电技术、双向整流技术、充电桩自主诊断技术等核心技术体系。公司在2017年度完成了智能快速非车载直流充电机、智能交流充电桩等产品型式试验及省级新产品新技术鉴定，多项技术达到国内领先水平。
公司充电桩业务，除了提供给国家电网和相关车企外，公司还在公交场站投资建设大型充电站，为新能源公交车辆提供充电服务并收取服务费。截止2017年末，公司的充电桩覆盖北京、天津、山东、山西、浙江、江苏、河北等省市的多个城市，累计投建充电桩4500多个，其中公交大功率充电桩600多个，充电网格局初步形成。近三年，在国家电网组织的充电桩统一招标中，公司充电桩产品中标金额占国家电网招标总金额比例约为4.51%，中标排名在前10名以内，中标能力在行业中位居第一方阵。其中标产品广泛应用保证大型国际会议会场如APEC及G20峰会等新能源汽车充电站建设上，受到用户好评。
未来三年，公司将继续发挥大功率快速充电优势，通过智能化制造规模效应及从制造到安装以及运营与云平台管理等相关全产业链布局来增加产能和市场份额；通过快充加柔性的模式，为大型公交车辆及物流车辆提供安全快捷的充电服务，将充电桩制造和充电服务的利润占企业全部利润的比重提升至行业平均水平以上；实现从传统制造向新能源设备制造与运维的业务模式转变，进而向一流的新能源充电服务商转型。"
5,公司如何看待轨道交通全国布局不及预期的风险？,答：尊敬的投资者您好，感谢您关注金冠电气。公司拟在全国设立东西南北中五个营销大区，以北京作为营销指挥中心，联动其他四个大区，共同展开全国的营销布局。公司针对轨道交通成立了专门的项目组，组成人员基本都是公司领导和营销精英。公司会持续扩大业务规模，持续加强产品研能力，增强公司产品核心竞争力，持续提高公司盈利能力。
6,请问今年内公司有并购重组或者资产注入计划吗？有没有投资新建厂等计划？,尊敬的投资者您好，感谢您关注金冠电气。2018年是公司产业转型升级阶段的关键之年，公司继续推动智能电气设备稳定增长，大力发展新能源领域业务。一是稳步推动C-GIS智能环网开关、40.5地铁专用GIS智能开关柜、中置式开关柜等产品的产业规模化发展工作，全面提高公司在智能电气设备的整体竞争实力。二是不断提高公司大型直流充电桩的生产销售规模，以创新方式在全国主要城市布局充电桩集中式运营站，进一步扩大公司在充电桩制造和运营领域的竞争优势。三是完成鸿图隔膜9000万平方米/年锂离子电池隔膜三期工程项目的建设，实现其2亿平方米的锂离子电池隔膜生产能力，为配套大型动力电池生产商打下良好的基础，继续扩大涂覆隔膜的生产能力实现涂覆隔膜全覆盖的局面，全力研发新的涂覆隔膜生产工艺技术，适应新的动力电池发展需求，努力实现国内最大最高端的锂离子电池隔膜生产基地。四是加快推进湖州金冠项目建设，力争在2018年末投入生产，巩固公司在湿法隔膜领域的优势地位和市场占有率。具体信息请您关注公司于巨潮资讯网发布的相关公告。
7,公司如何看待充电桩市场的发展？,答：尊敬的投资者您好，感谢您关注金冠电气。新能源汽车产业是国家战略性新兴产业，中央及地方均有明确的的配套支持政策。根据工信部的数据显示，2017年，我国新能源汽车产销均接近80万辆，产量达到79.4万辆，销售达77.7万辆，同比分别增长53.8%和53.3%，产量占比达到了汽车总产量的2.7%，连续三年居世界首位。截至2017年末，我国新能源汽车保有量接近175万辆。根据工信部、国泰君安研究所对中国新能源汽车的统计与预测，2017年至2020年我国新能源汽车销量将持续保持较快速度的增长，预计2018年新能源汽车销量将超过100万辆。预计到2020年，新能源汽车保有量将超过500万辆，到2025年我国新能源车占比将会超过20%。新能源汽车的快速增长，必然带来产业链上各个领域的高速增长，无论是整车、电机、锂电池，还是充电桩领域都蕴藏巨大投资机会。其中，充电环节对新能源汽车的推广使用起至关重要的作用。新能源汽车产业的快速发展将带动新能源汽车消费者对充电设施需求的快速增加。 
8,公司进军新能源领域的想法能否说一下？未来是否还会有外延式并购,"尊敬的投资者您好，感谢您关注金冠电气。公司将继续坚持“智能电网+新能源”的总体发展战略，以开拓电力产品新格局、专注新能源产业发展、服务绿色城市生活为指导思想。坚持以市场为导向从实际出发，建立科学、高效、富有弹性的经营体系，全面实施“销售、生产、质量、服务、信息、创新”六位一体的经营管理目标。通过不断创新和完善，推进标准化管理，推动促进公司持续、稳定、快速、健康发展。
并购南京能瑞、鸿图隔膜有利于增强上市公司新能源业务板块，深化上市公司“智能电网+新能源”的战略布局，丰富上市公司的技术资源、客户资源和渠道资源，有助于上市公司的产业融合、技术互补和优势共享。上市公司将通过企业文化与管理团队的融合与合作，结合两家子公司业务特点，形成有效的业务管理、财务管理、人员管理体系，与上市公司建立有效衔接，并推动优化资源配置等制度建设；同时设立完善的激励措施，作为推进整合及促进两家子公司进一步发展的有益补充。力争通过有效整合，进一步提升上市公司的竞争优势，加强优势互补，充分发挥并购的协同效应，为股东创造持续稳定的业绩回报。具体信息请您关注公司于巨潮资讯网发布的相关公告。"
9,年报说公司并购南京能瑞，布局新能源行业，公司是如何战略规划的？,"尊敬的投资者您好，感谢您关注金冠电气。
上市公司并购南京能瑞、鸿图隔膜有利于增强上市公司新能源业务板块，深化上市公司“智能电网+新能源”的战略布局，丰富上市公司的技术资源、客户资源和渠道资源，有助于上市公司的产业融合、技术互补和优势共享。上市公司将通过企业文化与管理团队的融合与合作，结合两家子公司业务特点，形成有效的业务管理、财务管理、人员管理体系，与上市公司建立有效衔接，并推动优化资源配置等制度建设；同时设立完善的激励措施，作为推进整合及促进两家子公司进一步发展的有益补充。力争通过有效整合，进一步提升上市公司的竞争优势，加强优势互补，充分发挥并购的协同效应，为股东创造持续稳定的业绩回报。上市公司详细的战略规划请您详见上市公司于2018年4月20日于巨潮资讯网发布的《2017年年度报告》。"
10,轨道交通领域的订单占公司总销售订单的比例是多少？,尊敬的投资者您好，感谢您关注金冠电气。上市公司母公司的轨道交通领域的订单占其总销售订单的比例约为四分之一。
11,三块业务公司在战略上的研发投入和业务增速方面，公司怎么想的？,"尊敬的投资者您好，感谢您关注金冠电气。
在配电环网柜方面，公司会一直保持一个平稳偏上升的趋势，因为国网招标体制的原因，公司不太可能在这个领域有较大的爆发性的增长，但是公司在东北地区有绝对性的竞争优势，近年来也在往轨道交通领域转型，轨道交通领域的拓展使得公司在这一业务板块势头强劲，长春地铁一共中标2个多亿，未来还会不断走进其他城市的轨交项目，所以在C-GIS环网柜这一业务板块，公司保持住平稳增长的势头是没问题的。
在能瑞充电桩领域，南京能瑞国网中标率我们一直保持民企中前列的地位，不仅是国网，普天还有其他地方性充电桩的招投标业务我们也都在参与和拓展。就新能源汽车的发展来看，目前市场上车桩比的严重失衡是制约新能源汽车发展的关键，所以未来桩的大量配套一定是必然的。南京能瑞是国内少数做智能电表、充电桩运营赚钱的企业，在运营方面我们也会继续积极开拓。
隔膜业务领域，鸿图隔膜三期工程如期进行，至2018年底产能会达到2亿平，2018年的80%的订单已预定完成。湖州项目总投资约12.17亿，6条产线全部进口，隔膜质量标准要对标国际高端膜市场，利用区位优势，湖州地处环太湖经济圈，湖州又是国家著名的新能源产业试点城市，湖州金冠周围分布有微宏、天能、超能等大的电池厂商，客户资源丰富。同时集团要求湖州隔膜的质量、指标达到国际领先水平，所以国外的高端客户例如住友化学等我们也会积极拓展。"
12,公司的隔膜主要应用于哪些领域？,尊敬的投资者您好，鸿图湿法隔膜主要应用于动力电池和3C类电池，感谢您的关注。
13,鸿图的整合对上市公司未来发展的影响,"尊敬的投资者您好，感谢您关注金冠电气。
   1、主营业务构成：本次交易完成后，上市公司新增锂电池隔膜业务，新增业务对上市公司收入贡献在2017年1-8月为25.71%，对应的毛利贡献为35.11%。
    2、未来经营发展模式：本次并购有利于增强上市公司新能源业务板块，深化上市公司“智能电网+新能源”的战略布局，丰富上市公司的技术资源、客户资源和渠道资源，有助于上市公司的产业融合、技术互补和优势共享。
上市公司将通过企业文化与管理团队的融合与合作，结合标的公司业务特点，形成有效的业务管理、财务管理、人员管理体系，与上市公司建立有效衔接，并推动优化资源配置等制度建设；同时设立完善的激励措施，作为推进整合及促进标的公司进一步发展的有益补充。力争通过有效整合，进一步提升上市公司和标的公司的竞争优势，加强优势互补，充分发挥本次并购的协同效应，为股东创造持续稳定的业绩回报。
    3、业务管理模式
本次交易完成后，上市公司将在保持鸿图隔膜独立运营、核心团队稳定的基础上将其纳入上市公司经营管理体系。上市公司将以规范的管理经验尽快提高标的公司的公司治理水平。同时，上市公司将在本次交易后将标的公司的财务管理纳入统一财务管理体系，并通过派驻财务人员、进行财务岗位培训和加强沟通汇报等形式，进一步规范鸿图隔膜的内部控制体系，实现内部资源的统一管理和优化配置。"
14,公司2018年是否有进一步新业务拓展规划？,"      尊敬的投资者您好，感谢您关注金冠电气。2018年公司将紧密围绕“智能电网+新能源”的战略布局，继续提升认知、强化管理、把控风险，保障公司转型升级、驶入新能源轨道。
    １、公司将推动智能电气设备稳定增长，大力发展新能源领域业务。一是稳步推动C-GIS智能环网开关、40.5地铁专用GIS智能开关柜、中置式开关柜等产品的产业规模化发展工作，全面提高公司在智能电气设备的整体竞争实力。二是不断提高公司大型直流充电桩的生产销售规模，以创新方式在全国主要城市布局充电桩集中式运营站，进一步扩大公司在充电桩制造和运营领域的竞争优势。三是完成鸿图隔膜9000万平方米/年锂离子电池隔膜三期工程项目的建设，实现其2亿平方米的锂离子电池隔膜生产能力，为配套大型动力电池生产商打下良好的基础，继续扩大涂覆隔膜的生产能力实现涂覆隔膜全覆盖的局面，全力研发新的涂覆隔膜生产工艺技术，适应新的动力电池发展需求，努力实现国内最大最高端的锂离子电池隔膜生产基地。四是加快推进湖州金冠项目建设，力争在2018年末投入生产，巩固公司在湿法隔膜领域的优势地位和市场占有率。 
    2、深耕市场，实现集团协同作战。公司将整合集团化的内外部营销资源，通过对并购子公司的积极整合，共享客户资源，共同加强客户关系管理，发挥协同效应，实现上市公司在新能源行业的快速发展，并加强应收账款管理，通过风险控制、应收账款管理和营销政策强关联，实现各业务板块营销体系精细化管理。
    3、优化管理体系，规范管理流程。公司将依据以客户为中心的价值观，重视团队合作，依据科学的分类管理方法实现高度聚焦，用以目标为导向的高效管理体系来完善供应链管理，加强绩效管理，优化风控管理。公司将持续优化现有流程，并梳理新业务管理流程，借助信息化工具等实现高效管理目标。"
15,公司如何应对鸿图隔膜扩产、 下游大客户开拓不及预期的风险？,答：尊敬的投资者您好，感谢您关注金冠电气。目前新能源锂电隔膜市场发展势头良好，公司的扩产计划是根据市场的供需情况以及主要客户的扩产情况同步进行的，不会盲目扩产。
16,请问三个产业的协同性？,"尊敬的投资者您好，感谢您关注金冠电气。
三个产业的合作可以实现优势互补，充分发挥协同效应。
1、产业链的协同
上市公司子公司能瑞自动化从事充电桩设备的制造，鸿图隔膜主要从事锂电池隔膜的制造，两者均为新能源产业链上的重要环节，能瑞自动化充电桩业务主要运用于新能源汽车后端，鸿图隔膜主要产品隔膜主要运用于前端，双方在产业链上有较强的互补性，具有产业协同性。
通过本次重组，上市公司将拓展新能源行业版图，相关业务板块得以进一步整合，形成更为完善的产业链布局，标的公司的经营优势、客户优势、技术优势、集成优势将成为上市公司夯实新能源汽车板块业务、强化产业链布局的重要支持。
2、财务方面的协同
鸿图隔膜所处的锂电池隔膜制造行业系资本和技术密集型行业。目前，鸿图隔膜的产能已接近满负荷生产，面对持续增长的市场需求，鸿图隔膜急需拓展资金渠道，以解决厂房建设、设备及原材料采购的资金来源以提升生产能力，满足客户的订单需求。本次交易完成后，鸿图隔膜可充分利用金冠电气的上市公司融资平台功能，为其进一步扩大产能，增强其在锂电池隔膜行业的市场地位提供资金保障。同时，随着鸿图隔膜业务的不断扩大以及盈利能力的持续增强，上市公司新能源汽车业务板块的竞争实力和综合盈利能力将得到进一步提升。
3、管理协同
上市公司在公司治理、内部控制、人力资源、规范管理等方面具备一定优势，鸿图隔膜可以借助上市公司在管理上的先进经验，提升企业管理绩效；上市公司也可以借助鸿图隔膜管理团队扎根其所在细分行业的经验，最大限度发挥其在相关业务领域的行业竞争优势，为上市公司拓展新能源汽车领域相关业务提供有力的技术支持与品质保障。"
17,公司隔膜产业核心的产品竞争力是什么？公司有哪些竞争对手,"尊敬的投资者您好，感谢您关注金冠电气。           （一）鸿图隔膜的主要竞争对手 
标的公司主要从事湿法生产锂电池隔膜行业，行业内的企业主要包括：星源材质、苏州捷力、上海恩捷、义腾新能源、沧州明珠、天津东皋以及中锂新材等，生产线。目前客户主要包括中航锂电（洛阳）有限公司、哈尔滨光宇电源股份有限公司、深圳市卓能新能源科技有限公司、远东福斯特新能源有限公司等国内主流锂离子电池生产商。  
（二）竞争优势
1、研发与技术优势 
相比于干法工艺，湿法工艺下的锂电池隔膜产品在机械强度等方面更具优势，湿法工艺逐渐成为锂电池隔膜生产技术发展的主流方向。在此基础上，涂覆技术能够针对性地改善湿法隔膜的各项性能，更好地匹配动力电池的性能要求。自成立以来，鸿图隔膜依靠管理团队对市场的准确判断，将隔膜产品定位于中高端市场，同时大力引进和培养相关人才，增强自身的研发实力与技术水平。目前，鸿图隔膜已同时具备先进的湿法工艺技术和涂覆技术，覆盖生产线设计、生产线组装、工艺技术改良以及新产品研发的整套流程，产品的各项性能指标良好，有望形成进口替代。 鸿图隔膜的上述工艺路线是由一批具备务实精神的企业家和实干家共同研发形成，其中包括具有海外背景的核心技术人员。上述工艺路线使得生产设备有效发挥出生产性能，实现了相关技术成果的商业化，使鸿图隔膜可以高效稳定地生产出具有较高一致性的锂电池隔膜产品。鸿图隔膜一方面对工艺路线进行持续的优化，以实现在更快生产速度下产品的高度一致性，另一方面在湿膜涂覆领域进行研究开发，从而不断提升企业的技术水平与竞争力。 
2、设备优势 
根据自主研发设计的生产工序，鸿图隔膜向设备厂商提供对生产设备的规格要求，并进行购置安装。其中，标的公司年产 2,000 万平方米锂离子电池隔膜生产线是引进国外一流设备制造商和电气生产商的设备并根据自有技术、工艺路线整合而成，设备精密性高，专业性强，在设备安装调试期间培养了一批专业设备维护人员实现引进设备技术自有消化吸收；另外一条年产 4,500 万平方米的锂离子电池隔膜生产线的主要工序采用进口设备，其他辅助工序则采用国产制造设备，在一定程度上降低了生产线的制造成本，产能提高的同时实现对设备成本的控制。 
 3、产品优势 
截至本报告书签署日，鸿图隔膜已制备出 20 余种规格产品，覆盖 5 至 25 微米厚度、不同孔隙率的基膜产品以及在基膜的基础上涂覆 2 至 4 微米的单、双面涂覆膜产品，丰富的产品规格能够满足客户的多样化需求。在产品质量方面，经过多年对工艺的探索与经验积累，鸿图隔膜通过自主研发形成了独特的制造方式和设备改造方法，有效优化了湿法隔膜的各项性能指标，在均匀性、热收缩性、穿刺强度等性能指标上表现优异。丰富的产品规格与优良的产品质量形成了鸿图隔膜主要产品的技术壁垒，使其在业界赢得较好的口碑，获得了广大客户的认可，为鸿图隔膜带来了良好的品牌效应和经济效应。 
4、客户优势 
报告期内，鸿图隔膜最主要的客户为天津力神电池股份有限公司。天津力神是国内动力电池龙头厂商之一，其已进入工信部第一批《锂离子电池行业规范条件》企业名单。鸿图隔膜连续三年被天津力神评为优秀供应商，并与之签订战略合作协议。此外，鸿图隔膜还与天津力神共同承担国家科技部课题，通过上下游互动的研发模式，更有效地改善锂电池隔膜的性能，开发出符合国家新能源行业需求的产业化产品。依托优质的客户资源，鸿图隔膜的业绩增长具备一定的保障。此外，鸿图隔膜亦积极开拓和储备下游客户。为更好地服务客户，标的公司专设华东、华北、华南片区销售团队，以实现快速响应客户需求。截至本报告书签署日，标的公司已与比克电池、力信能源、智航新能源等公司签订战略合作协议，未来将在供需关系上进一步开展合作。 
5、质量控制优势 
鸿图隔膜高度重视自身产品质量，下设品质部专门负责标的公司全面质量管理、质量标准体系的建立以及日常运行工作。标的公司拥有完善的质量管理体系和严格的质量管理制度，近年来通过 ISO9001 质量管理体系认证和 ISO14001 环境管理体系认证，目前正在进行 ISO/TS16949 质量管理体系的建设工作。鸿图隔膜的产品质量得到了行业内客户的广泛认可，报告期内未发生重大质量事故和纠纷。"
