,Question,Answer
18,请问独立董事，您的履职情况如何，是否能真正保护了中小股东利益？,"尊敬的投资者您好，感谢您关注金冠电气。
作为公司的独立董事，我们严格按照《公司法》、《证券法》、《上市公司治理准则》等法律、法规以及《公司章程》、《独立董事工作细则》等规定和要求，忠实、勤勉、尽责的履行职责。认真审议董事会各项议案，发挥独立董事的独立性和专业性作用，对公司相关事项发表独立意见，保证了董事会决策的科学性和公司运作的规范性。"
19,请介绍一下湖州隔膜项目的进展情况。,"尊敬的投资者您好，感谢您关注金冠电气。湖州金冠鸿图隔膜科技有限公司（下称湖州金冠）注册于2017年9月27日，位于浙江省湖州市吴兴区康山街道，由公司与吉林省金冠投资有限公司（下称金冠投资）共同出资成立，注册资金5000万，占地250.199亩。其中金冠电气占51%份额，金冠投资占49%份额。湖州金冠主要从事业务包括锂离子电池隔膜的研发、生产、销售。 
湖州金冠锂电池隔膜项目规划总投资12.17亿元人民币，其中2018年计划投资约5亿元人民币，包含部分基础建设，2条隔膜设备产线以及多条涂覆设备产线；2019年-2020年计划投资约7亿元人民币，包含部分基础建设，4条隔膜设备产线以及多条涂覆设备产线；到2020年，共建设6条锂电池隔膜生产线，每条生产线生产能力4500万平米/年，达产后释放产能2.7亿平方米；同时引进国际先进锂电池隔膜涂覆生产线，实现多材料、多工艺的隔膜涂覆加工。湖州金冠达产后年销售额不低于20 亿元人民币，利税超过2亿元人民币。 "
20,公司高管最近有没有增持计划？,答：尊敬的投资者您好，具体信息请您关注公司于巨潮资讯网发布的相关公告。
21,一季度业绩大增，主要是哪块业务的贡献？原因是什么,尊敬的投资者您好，感谢您关注金冠电气。公司2018年第一季度的业绩增长幅度较大，主要是由于公司智能电气设备收入稳定增长以及将南京能瑞自动化设备股份有限公司和辽源鸿图锂电隔膜科技股份有限公司纳入合并报表范围而对公司业绩产生积极影响，而同比的2017年第一季度业绩并未包含南京能瑞和辽源鸿图的业绩所致。
22,收购鸿图隔膜为公司2017年的业绩带来多少增长,"尊敬的投资者您好，感谢您关注金冠电气。 由于上市公司收购辽源鸿图的工作于2018年1月24日收到证监会《关于核准吉林省金冠电气股份有限公司向张汉鸿等发行股份购买资产及支付现金并募集配套资金的批复》（证监许可〔2018〕177号），核准本公司向张汉鸿等发行股份35,979,217股，核准本公司非公开发行股份募集配套资金不超过70,800万元。本次发行股份及支付现金购买资产并募集配套资金暨关联交易之标的资产（辽源鸿图）于2018年2月5日完成股东变更的工商登记手续。基于此，上市公司应于2018年2月开始才将辽源鸿图纳入合并报表范围，所以辽源鸿图并不会对上市公司2017年度的业绩产生影响。"
23,金冠电气、南京能瑞、辽源鸿图如何实现管理和业务协同？,"金冠电气、南京能瑞、辽源鸿图如何实现管理和业务协同？
答：尊敬的投资者您好，感谢您关注金冠电气。
     金冠电气、南京能瑞与辽源鸿图之间优势互补，充分发挥协同效应。金冠电气、南京能瑞及鸿图隔膜在生产、研发、管理、销售等方面的经验相通，三者间的合作可以实现优势互补，充分发挥协同效应。
1、产业链的协同
上市公司子公司能瑞自动化从事充电桩设备的制造，金冠电气和子公司南京能瑞主要客户均为国家电网，可共享销售客户资源和渠道。鸿图隔膜主要从事锂电池隔膜的制造，两者均为新能源产业链上的重要环节，能瑞自动化充电桩业务主要运用于新能源汽车后端，鸿图隔膜主要产品隔膜主要运用于前端，双方在产业链上有较强的互补性，具有产业协同性。
通过本次重组，上市公司将拓展新能源行业版图，相关业务板块得以进一步整合，形成更为完善的产业链布局，标的公司的经营优势、客户优势、技术优势、集成优势将成为上市公司夯实新能源汽车板块业务、强化产业链布局的重要支持。
2、财务方面的协同
鸿图隔膜所处的锂电池隔膜制造行业系资本和技术密集型行业。目前，鸿图隔膜的产能已接近满负荷生产，面对持续增长的市场需求，鸿图隔膜急需拓展资金渠道，以解决厂房建设、设备及原材料采购的资金来源以提升生产能力，满足客户的订单需求。本次交易完成后，鸿图隔膜可充分利用金冠电气的上市公司融资平台功能，为其进一步扩大产能，增强其在锂电池隔膜行业的市场地位提供资金保障。同时，随着鸿图隔膜业务的不断扩大以及盈利能力的持续增强，上市公司新能源汽车业务板块的竞争实力和综合盈利能力将得到进一步提升。
3、管理协同
上市公司在公司治理、内部控制、人力资源、规范管理等方面具备一定优势，南京能瑞、鸿图隔膜可以借助上市公司在管理上的先进经验，提升企业管理绩效；上市公司也可以借助鸿图隔膜管理团队扎根其所在细分行业的经验，最大限度发挥其在相关业务领域的行业竞争优势，为上市公司拓展新能源汽车领域相关业务提供有力的技术支持与品质保障。"
