,Question,Answer
0,公司2016年末（包括2017年一季度）存货中的原材料以及为购买原材料支付的预付款都大幅增加，公司是预测原材料价格已处于底部吗，公司如此操作履行了怎么的内部控制流程？,目前来看公司库存中的原材料及预付锁定价格的原材料价格相对低位，同时为对夏秋季用肥提前采购，并严格遵守公司内部控制制度，履行相关审批流程。
1,请问公司最近库存情况如何？经销商的库存如何？,公司库存情况与年初相比略有增长，经销商库存情况与年初相比有所降低。
2,崔总您好！2016年公司通过农商一号销售的化肥产品金额有多少，双方如何结算，农商一号否实现了当初设立预期，2016年其实现收入和利润是多少，未来发展趋势如何？谢谢。,"公司与农商一号的产品销售通过市场化原则进行结算，2016年农商一号实现良性发展，收入和利润符合设立预期，未来发展前景广阔。
"
3,在肥料供给侧改革方面，公司预计今年会有突破性进展吗？,为推进肥料供给侧改革，我们力争搭建一个大联合、大协作的利益共享大平台，希望同行业能立足此平台，加大业务合作，发挥各自优势，淘汰落后产能变有效产能，促进肥料行业转型升级。
4,公司的规模优势具体会体现在哪些方面？公司的品牌如何管理？互相间的市场是否有重合以及竞争关系？如何增强各品牌间的凝聚力？,目前公司拥有业内规模最大的产能和最全的产品种类。公司不同品牌定位不同；在同一销售区域，公司不同品牌的产品由不同的、独立的终端经销商进行销售。公司通过这种多品牌操作的模式，提高了公司产品在同一区域的覆盖力。
5,公司现阶段发展过程中有何不足？面临的最大挑战是什么？如果新客户在磨合期放弃与公司合作，公司有无应对措施？,现阶段，公司处于快速发展期，人才引进跟不上公司的快速发展，通过国际并购，国内外员工对企业文化存在认知差异。
6,去年的市场行情并不好，物价又涨，今年公司在市场开拓方面有什么计划？能否详细谈谈？,公司定位2017年为营销转型年，公司要加快农化服务中心建设；要加大招聘引进和内部培训，打造一支专业服务队伍；要全面开展技术营销，做好作物营养管理方案的示范推广。
7,请问公司上一季生产经营状况如何？与去年同期相比如何呢？,营业收入57.13亿元，较上年同期增长23.12%；归属于母公司的净利润4.15亿元，较上年同期增长2.63%； 公司已于2017年4月27日披露一季度报告。
8,增值税率由13%调整为11%，对公司的效益影响有多大？,增值税率由13%调整为11%，对公司的利润影响较小，能略微降低公司增值税税负。
9,公司目前缺钱吗？短期内是否有筹资计划？,公司目前资金状况良好，具体融资根据经营需求进行。
10,"国家要求实行经济节约型政策,公司具体是怎么做的?",国家要建立环境友好、资源节约型社会，体现在肥料领域就是要加大科技投入，加大新品开发，提高肥料利用率。同时要利用先进的服务手段，提高服务水平。
11,自从微博出现后，对于舆情的关注和扩散在一定程度上都有所放大，关于舆情的监控，公司有些什么样的手段？而在应对负面舆情的时候，又有什么样的应急措施？,公司设立兼职舆情监测员，对网站、微博、论坛媒体等监控，做好监测记录。
12,"公司采取了具体怎样的应对措施,在同业中不断做大做强?",公司一方面会加大在种植业服务领域的投入，通过功能性产品和营养解决方案提高我们产品的差异化水平；通过专业培训，提高我们种植业的服务水平。另一方面，公司会加大与同行业企业合作，通过技术输出、品牌输出，带动整体肥料行业的转型升级，也实现公司轻资产扩张产能。
13,最近，有无机构去公司调研？,近期公司处在定期报告编制期，未接受机构调研，机构对公司的调研记录详见巨潮资讯网公司投资者关系信息
14,万总您好，公司是否有并购国内化肥企业的规划，您如何评价国内化肥行业（尤其复合肥行业）目前竞争状况和未来集中度变化趋势？,2016年，中国乃至世界肥料行业都感受到了一定的经营压力。复合肥企业由于自身原因，其竞争更多的是来自于市场的竞争，需要市场这个无形的手使复合肥企业优胜劣汰。2016年，我们判断有几百家复合肥企业已不能正常生产了。我们判断2017年及今后几年，是企业加速分、市场份额加速集中的阶段，公司希望能利用此机会实现更快发展。
15,公司哪项业务对利润贡献较大？,公司销售的产品主要有普通复合肥、控释复合肥、硝基复合肥、水溶肥等，其中普通复合肥的销售毛利占比较大。
16,公司有享受政府补贴或者税收优惠或者政府给的其他的一些优惠政策么？,公司享受的政府补贴、税收优惠等已披露，详见2017年4月25日披露的《2016年年度报告》。
17,公司管理层应该用实际行动树立诚信！股市，社会对责任诚信的渴望，远远胜过了任何广告效应！全国3000千万股民都会记得你们。我会继续持有公司股票，希望持有一家受人尊敬的上市公司！,谢谢您对公司评价，公司自建立之初一直秉承“诚信、创新、责任、共赢”理念，并将延续，我们希望通过我们的努力，做到一家受人尊敬的上市公司。
18,请问万总，您内心里有企业发展的国际国内对标企业吗？如果有，可否透露下？,我们认为，美国、加拿大两地上市的加阳公司是目前公司学习的标杆企业。
19,公司主要产品主要用于哪些方面?,公司的主导产品为复合肥、缓控释肥、硝基复合肥、水溶肥、微生物肥及其他新型肥料，主要用于大田作物、经济作物、花卉、草坪、家庭园艺等。
20,你如何看待同行业其他公司的经营情况？在同行业竞争中，公司排名第几？你认为公司业绩增长的主要优势或障碍在哪里？,公司优势主要体现在科技创新水平高、产品线丰富，功能性产品和营养解决方案在行业中代表了中国最先进的水平。劣势是在公司快速发展中，人才紧缺问题日益突出。行业排名是暂时的，核心竞争力是持久的，其他同行企业都有值得我们学习的地方。
21,请问公司在财务结构上有什么不足，打算采取哪些举措。,公司财务状况良好，财务结构较为合理，负债率较低。
22,万总您好！2016年，公司硝基复合肥和水溶肥销售收入较上年分别下降了32%和14%；毛利率方面除普通复合肥外，其他均有不同程度下降，是何原因？预计2017年公司不同品种肥料收入增长和毛利率变化趋势如何？多谢,2016年，农产品（包括经济作物）价格下跌，水溶肥等高端肥料价格及毛利率较高，因此公司适时调整价格策略，带来收入及毛利率下滑。2017年比去年经营形势有所好转，公司有信心改变这种局面。
23,"公司的持续良性发展是投资者投资信心的有力保证,愿公司的发展能为投资者带来良好的回报!请问公司领导对今年有信心吗？",公司管理层及员工对公司今年的发展充满信心，我们将尽最大努力实现公司长期、持续发展。
24,公司现有产品最近价格是否稳定，最近公司产品出货量怎样？上游的企业是否大量备货？,近期公司产品价格基本稳定。公司根据市场及经销商的备货需求，以销定产。
25,公司如何看待舆情管理工作？,答：公司非常重视舆情管理工作，重视与投资者的互动。
26,能否告知一下新年第一季度的情况怎么样?,公司已于2017年4月27日披露一季度报告。营业收入57.13亿元，较上年同期增长23.12%，归属于母公司的净利润4.15亿元，较上年同期增长2.63%。
27,高管有没有考虑过增持自家股票?,公司高管对公司的发展充满信心。
28,在企业文化方面，公司有什么特色吗？,"个人认为公司最具特色的企业文化是“创新为魂  和谐为本”。
金正大深知，农业现代化的进程中，创新思维的践行、创新行为的驱动才能真正为农业现代化增添力量，才能赢得未来。为此，金正大唯有坚持不懈地在技术、产品、管理、机制、文化、品牌、服务等各个方面进行全面创新，而这一切的创新，归根结底源自金正大自身发展理念的创新，孜孜以求地去钻研，自动自发地去创新。
金正大目标的实现，要靠和谐的理念来支撑。与股东、员工、用户、经销商、供应商、合作伙伴、相关利益者融合、沟通、协调、共享，形成企业内外、企业上下共生共荣的发展格局，实现人际和谐、人企和谐、内外和谐。通过打造内部创业平台，让员工和企业在和谐中实现人生价值；通过构建外部合作平台，让利益相关方与公司在和谐中共同发展，实现价值共创和价值共享。通过回报社会，以经济责任、行业责任、环境责任、员工责任的担当，实现社会责任下的企业价值。致力农民增收和施肥方式的科学转变，最终促进人与环境的和谐发展。
"
29,公司及管理层是否鼓励员工长期持股？会不会任由员工和大小非减持？,自上市以来，公司控股股东及实际控制人，主要经营管理团队未减持一股。但员工个人需求较复杂，公司鼓励员工持股。
30,"这几年社会道德严重滑坡,不讲诚信，为了个人利益突破道德底线的行为屡屡发生，你作为企业高管如何看待？",金正大一直秉承诚信、创新、责任、共赢的核心价值观，作为企业高管更应该以身作则，将诚信作为立身之本。
31,您好！公司同IFC的合作项目进展如何？对公司有何意义？,与IFC合作洽谈进展顺利，但尚需一定时间，公司将根据进展及时公告。与IFC的合作可以为公司提供专家资源，对接市场资源，对公司国际化发展意义重大。
32,公司今年预计在全国各地将新增产能多少？,2017年，公司已在辽宁、广东、新疆建成65万吨/年新型肥料。后续其他的在建项目，公司将根据进度及时披露。
33,股价升等于做免费广告，有助于公司产品销量升、业绩升，形成良性循环。建议公司配合将股价做上去。,谢谢您的建议，公司将通过提升产品销量及业绩，提高股东回报，做好公司基本面。
34,做大、做好市值管理是每个公司成长的必然追求，公司是如何进行市值管理的？,公司市值由业绩和估值两方面决定，但迎合市场、炒作概念不是公司选项。公司会与市场、与投资者良好沟通，以良好的业绩回报投资者。我们相信，时间会成为公司的朋友。
35,公司如何规避各种风险，如产品质量、资金、管理等，减少各种负面事件？,感谢您的关注，公司生产严格遵守国家标准和企业标准，有完善的质量管控体系，把袋袋是精品作为公司产品目标。同时公司建有完善的内控体系，资金、管理严格按照相关法律法规及规范性文件的规定。
36,一直指望公司会推出高送转方案，不知道今年是否有希望，什么时候能出预告？,"公司已经在2016年度报告中出具利润分配预案：拟以2017年4月21日公司总股本3,149,994,146为基数，按每10股派发现金红利1.00元（含税），本预案尚待公司股东大会审批。"
37,"去年有机构投资者去公司做调研吗,都是哪些？我们这些中小投资者在哪里能看到机构投资者的调研情况？",答：去年有机构到公司进行调研，公司在2016年度报告予以披露，您也可以到巨潮资讯网公司投资者关系信息栏目下查询具体的调研记录。
38,对于公司的国际化拓展，是不是太急了点？目前并没有看到效果，反而带来了亏损。,目前国内经济运行及行业发展中遇到了一些问题，这就更需要我们保持一定的战略定力。如同国家一带一路战略，国际化战略对公司意义及作用巨大。今年一季度，并购项目已有正效益，并带动了公司国际业务发展。
39,截止现在，公司的股东人数多少？,"公司2017年3月31日的股东人数为67,987人。"
40,希望公司在适当的时侯推出激励计划来聚集和挽留人才，保持公司的竞争力！,谢谢您的建议，公司将根据情况，适时推出激励计划。目前公司已经推出《核心员工持股计划》，尚待股东大会审批。
41,有没有参股其他上市公司？,答：截止目前，公司暂未参股其他上市公司。
42,公司目前销售情况最好的区域是哪个城市？,"答：
公司销售占比较高的区域为山东、河南、江苏、安徽等中东部地区。
"
43,公司未来发展前景如何?对目前这个行业的前途看好吗？,答：公司所处行业为化肥行业，肥料行业的发展方向是智能化、机械化、绿色有机等方向发展，公司在产品、技术、营销、品牌、资金、人才方面有领先的优势，通过技术与服务，推广作物营养管理方案，聚焦于为客户创造价值，公司目前已成为复合肥行业龙头企业。肥料行业是粮食的“粮食”，农业是国民经济的基础，我们非常看好我们的行业。谢谢。
44,公司产品在市场上占有率是多少？,公司产品市场占有率约10%，分品类有所区别，公司力争未来几年在经济作物的肥料市场份额有显著提升。
45,你好，请问贵司目前产品的销售趋势如何？今年的销售目标是多少？公司有没有一个具体可行的持续增长计划？,截止目前，公司产销正常，虽有压力但销售趋势向好，力争销量、利润均实现正增长。
46,希望公司在本专业领域专注于做强做大做实，提升公司的行业地位，给投资者以回报！,感谢您的鼓励，公司力争在肥料供给侧改革中做出应有的贡献，提升中国整体肥料生产及农业发展水平。
47,公司股价长期低迷，万总是否有公司回购股份或者增持的考虑？,公司股价受多种因素影响，不忘初心，立足主业，以良好的业绩回报投资者是企业负责任的体现。
48,公司募投项目现在有效益发吗？效益如何？,"答：
1、金正大诺泰尔化学有限公司年产60万吨硝基复合肥及40万吨水溶性肥料工程项目：2016年度受肥料市场长期低迷影响等影响，产能释放低于预期，效益未达到预期。2017年，公司将加大硝基复合肥及水溶肥的推广力度，提高产能利用率。
2、农化服务中心项目：因市场行情变化农化服务中心部分实施地点进行了变更，导致整体农化服务中心项目建设进度低于预期，公司将在 2017年度加快农化服务中心实施进度，积极推进本项目建设。谢谢！！！
"
49,"去年到现在,公司员工有没有加薪?",公司建立了有竞争力的薪酬体系，员工根据自身的劳动成果分享利益，总体薪酬呈增长趋势。
50,崔总您好，请问目前公司有多少名股东？,"答：公司2017年3月31日的股东人数为67,987人。"
51,公司近期有没有对外投资的考虑？,答：公司近期暂未有对外投资，如有我们将进行及时公告。
