,Question,Answer
0,吴叔叔和，公司的机顶盒销售情况如何？,您好，详见公司2016年年度报告中经营情况讨论与分析，谢谢。
1,公司的规模优势具体会体现在哪些方面？公司的品牌如何管理？互相间的市场是否有重合以及竞争关系？如何增强各品牌间的凝聚力？,您好，公司相关产品在数字电视行业、新能源汽车产业和军工行业中名列前茅，公司十分重视品牌建设。通过几年的努力，各业务单元在产品、技术、市场资源方面加强共享与整合，各单元间的协同效应正在逐步显现，在生产规模、市场资源、内部资源等方面的优势均会逐步显现。
2,吴叔叔好，公司是什么时候上市的？,您好，公司于2010年12月7日上市。
3,能介绍一下公司现在各大区域的销售和占有率等基本情况吗?,您好，请详见公司2016年年度报告中营业收入构成情况，谢谢。
4,小军叔叔好，是哪一家券商的？,您好，中信建投证券股份有限责任公司。
5,请问：公司产品的技术含量如何？专利多吗？行业垄断地位如何？ 那些项目能给公司带来利润增长点？预计是否能保持3年的增长？,您好，请查阅公司 2016年年度报告相关章节，如核心竞争力分析、经营情况讨论与分析、公司未来发展展望等。
6,去年公司经营遇到的最大困难是什么?今年有望改善吗？,2016年，公司主要原材料IC芯片、内存、PCB板、包装材料以及钢板等大宗商品交易价格大幅上涨，使得公司原材料采购成本有所上涨。2017年，公司将继续通过招投标方式采购原材料、积极与客户沟通适当提高产品价格、强化细节成本管理，精益生产以及不断加大研发，推出附加值较高的高端新产品等方式来缓解原材料波动带来的风险。
7,公司是否会进军新的细分市场和领域，以及扩大市场占有率？如果会，请问新的领域现在占公司营业收入比重是多少？未来打算提升到多少？多长时间能实现？,您好，公司在大力发展现有主营业务的同时，公司将积极关注和寻求在未来具有巨大发展空间和较长发展周期的新兴业务领域内的发展机会，谨慎选择，积极布局，促进公司业务向多元化转型。
8,去年的市场行情并不好，物价又涨，今年公司在市场开拓方面有什么计划？能否详细谈谈？,您好，目前市场竞争激烈，原材料价格波动较大，在新的一年，公司通过开拓新客户、推出新产品、做大新项目等方式来促使公司整体业务的增长。谢谢！
9,请预估一下未来十年公司的市场规模多大？谢谢！,你好，任何一家公司的生产经营都有一定的不确定性，但公司未来发展战略目标明确，措施具体。未来，公司将在计算机信息电子和智能自动化大行业范围内，同时大力发展军工和民用两大领域业务，积极通过内生外延多种方式，一方面持续加大军工和新能源电动汽车关键零部件业务的投入，迅速做大做强军工和新能源电动汽车关键零部件业务；另一方面，在稳健发展现有业务的同时，积极发展基于计算机信息电子和智能控制技术的智能化、自动化、信息化类产品业务，实现主营业务多元化，军工业务和民用业务同步快速发展的目标。
10,请问公司里是否有专人负责回答全景网投资者关系互动平台里股民的问题？股民的问题是否会传到公司的高层？,您好，公司证券部门工作人员负责互动平台的问题收集并定期将相关问题反馈给相应的高管人员，公司管理层始终关注和重视广大投资者的意见和问题。
11,做为高管你对公司的股价有何看法？股价的上扬能体现上市公司的潜质和气魄！希望管理层关心一下自己公司的股价！以提振二级市场的股东对公司的信心！！！谢谢,您好，非常感谢您的建议。
12,公司今年有没有新产品和新业务拓展？,您好，相关问题已经回复，谢谢。
13,请介绍一下公司所处行业和主要产品？,"您好，公司目前主要业务有：
（一）数字电视智能终端业务
主要业务范围是为全球各类电视运营商提供定制的数字电视智能终端硬件及系统，产品包括有线电视机顶盒、卫星电视机顶盒、无线电视机顶盒、互联网电视机顶盒等智能电视终端。
（二）智能机电业务
主要业务范围是为不同行业的特定客户提供各类集成了智能管理系统的机电设备和基于结构件行业工业机器人智能制造业务，现有主要产品是为满足我国国防建设所需特种车辆的军用智能电源系统、智能配电系统、智能车载电机设备的车载机电综合管理系统。
（三）新能源电动汽车关键部件业务
主要业务范围是为新能源电动汽车行业客户提供充电设备、车载电动空调系统和其他车载关键设备，主要产品包括电源模块、充电桩、车载充电机、移动充电机、DC/DC模块、车载电动空调系统等。"
14,做大、做好市值管理是每个公司成长的必然追求，公司是如何进行市值管理的？,您好，我们致力于通过技术进步、开拓创新来提高公司的价值。
15,除了在巨潮网上查看公司公告，还可以在哪里了解公司的日常经营情况？,您可以登录公司网站www.yinhe.com了解公司相关情况，谢谢。
16,在企业文化方面，公司有什么特色吗？,您好，公司企业愿景：蓝海领航 应用创新 服务制胜 企业使命：思远志恒 创新大成 企业精神：容汇力量 实创价值  企业核心价值观：为您的精彩闪亮提供可信赖的力量，自公司成立以来，管理层一贯致力于培育卓越的企业文化，不断发展、引进、吸收、整合、创新不同的管理智慧。
17,请问公司上一季生产经营状况如何？与去年同期相比如何呢？,"公司2016年第四季度实现营业收入515,343,398.18元，归属于上市公司股东的净利润79,850,763.43元，比上年同期增长7.4%。具体财务数据详见公司2016年度报告，谢谢。"
18,今年如何分红，是否高送转，有计划吗？,您好，公司2016年度权益分派方案已于2017年3月22日披露，具体方案为：公司拟以2016年度权益分配方案实施公告的股权登记日当日的总股本为基数，向全体股东每10股派发现金红利1.5元（含税），同时以资本公积金向全体股东每10股转增7股，本年度不送红股。
19,去年监管层要求现金分红，各交易所也发布了现金分红指引，公司怎么看，有这个打算吗？,您好，公司2016年度权益分派方案已于2017年3月22日披露，具体方案为：公司拟以2016年度权益分配方案实施公告的股权登记日当日的总股本为基数，向全体股东每10股派发现金红利1.5元（含税），同时以资本公积金向全体股东每10股转增7股，本年度不送红股。
20,公司今年有没有新产品和新业务拓展？对城镇一体化带来大发展机遇，公司有没有具体的发展计划？,您好，公司2017年在智能机电产品以及新能源电动汽车零部件产品方面做了充足的储备，后续将根据市场情况积极投放市场。公司相关发展战略规划详见公司2016年年度报告 第四节经营情况讨论与分析 第九点公司未来发展的展望。
21,"公司采取了具体怎样的应对措施,在同业中不断做大做强?","公司在进一步巩固发展数字电视智能终端业务的同时，积极探索电视互联网相关业务；重点发展以军工业务为主的智能机电产品业务，加大对军工业务的投入，扩大业务领域和销售规模；加快发展基于新能源电动汽车的充电设备、电动空调系统、车载充电机和其他车载关键部件业务，努力实现主营业务收入和利润持续快速发展。
"
22,今年公司人力成本的大幅度上升？对公司产品价格影响有多大？,您好，公司2016年度人力成本属正常幅度的略有增长，对产品价格影响不大。
23,公司生产经营的季节性如何?哪个季节是旺季?,"您好，受中国传统春节假期的影响，一般一季度收入会略低，其它季度收入季节性变化不明显。谢谢！
"
24,行业有没有周期性？,您好，公司相关行业没有明显的周期性。
25,请问公司公司的核心竞争力是什么？,关于公司核心竞争力具体请详见公司2016年年度报告第三节公司业务概要中的核心竞争力分析。
26,请介绍一下公司的行业地位？,公司相关产品在数字电视行业、新能源汽车产业和军工行业中名列前茅。
27,希望公司在适当的时侯推出激励计划来聚集和挽留人才，保持公司的竞争力！,感谢您对公司的关注，谢谢您的建议。
28,一直指望公司会推出高送转方案，不知道今年是否有希望，什么时候能出预告？,您好，公司2016年度权益分派方案已于2017年3月22日披露，具体方案为：公司拟以2016年度权益分配方案实施公告的股权登记日当日的总股本为基数，向全体股东每10股派发现金红利1.5元（含税），同时以资本公积金向全体股东每10股转增7股，本年度不送红股。
29,公司未来发展前景如何?对目前这个行业的前途看好吗？,公司目前所处的数字电视行业、新能源汽车产业和军工行业都是国家积极扶持发展的产业，有很好的行业发展前景。
30,"去年有机构投资者去公司做调研吗,都是哪些？我们这些中小投资者在哪里能看到机构投资者的调研情况？",机构投资者的调研情况请详见巨潮资讯网的投资者关系信息板块。
31,我是公司的一名小股东，请问我想现场参加股东大会，不知道应该怎么做？需要什么样的程序？,您好，参会流程详见公司于2017年3月22日披露在《证券时报》、《上海证券报》及巨潮资讯网（www.cninfo.com.cn）上的《关于召开2016年度股东大会的通知》。
32,希望公司在本专业领域专注于做强做大做实，提升公司的行业地位，给投资者以回报！,您好，谢谢您的祝愿和建议！
