,Question,Answer
0,去年现金流一直是负数，长亮的资金链绷的这么紧，不会有问题吧？,您好！公司经营现金流为负主要是人员增加且人力成本上升导致薪酬福利增加较多引起的。
1,"宇信今年会ipo,会对长亮形成冲击吗？",您好！金融信息化行业是一个充分竞争的领域，我们欢迎有实力的同行加入进来，也能促进我们自身和整个行业水平的提升。
2,长亮在这次增发中怎么只融到这么少的资金，润和和长亮是同业关系，他们怎么能融到8亿,您好！我们的融资额是根据募投项目的投资规模来设定的，募投项目越多、投资规模越大则融资需求也会越大。
3,润和软件购买了联创智融，号称国内银行核心系统老二，是这样吗？,您好，我们只能告诉你，在目前的国内核心业务系统市场竞标中，我们很难看到联创智融这个名字，我们对这家公司尚无清晰的认识，所以我们无法证实您的信息。国内目前尚无权威性的对核心业务系统软件的排名，虽然我们在核心业务系统领域的占有率与赢单率都非常高。
4,我注意到刚刚公布的一季度财报中 老股东招商致远资本投资有限公司 和 刚刚定向增发的金鹰基金-浦发银行-云南国际信托-云信智兴2016-250号单 均有不小减持，且金鹰是几乎没有利润在减持，在这么低位减持怎么这么没有持股信心？,您好，招商致远资本投资有限公司是公司在IPO期间引进的一个机构投资者。经过长达6年多的股票锁定与限售，其本身有兑现收益的想法，是可以理解的。至于金鹰基金的减持，由于这些基金公司均由内部的独立决策机制，我们不太清楚其决策流程，也不敢臆测。是否与目前的市场环境有关，我们也不得而知。谢谢！
5,请问贵司今后有新增多少产能？下游客户能吸收的完吗？,您好！公司现阶段处于高速发展期，客户量的增加也是逐步实现的。谢谢！
6,李叔叔好，公司的主营业务是什么？2012年8月上市的,您好！公司主营业务是为包括商业银行、证券公司、基金公司、保险公司、消费金融公司、财务公司、资产管理公司在内的金融或泛金融机构提供信息化整体解决方案与服务，包括但不限于计算机软、硬件的技术开发、技术服务及相应的系统集成。其中，软件开发是根据不同客户的业务需求，有针对性地开发各种定制软件；系统集成是指应客户的要求，代客户采购与软件相关的硬件设备或第三方软件，并提供相应的集成服务；技术服务主要是基于上述软件开发和系统集成业务为客户提供技术支持及售后维护等服务。
7,公司目前有哪些在建项目？建设进度如何？还需要多少资金？,您好！我们的在建项目较多，按计划进度在实施。谢谢！
8,请问公司今年营收的增长能超过行业增速20%吗？,您好！公司尚未发布盈利预测数据，请留意公司定期报告。
9,请问李总：在年报中 公司说明了行业特性时谈到没有明显的周期性特点，还请补充确认一下 2008年金融危机期间  ，是否也能保持比较稳定的经营状态？,您好，公司的确不存在比较明显的周期性特点。越是在金融危机期间，金融机构越是要通过信息化建设来提高生产效率，防范金融风险，创造更多的金融产品来抵消金融危机带来的冲击。这种时候，恰恰是金融信息化企业的机遇。谢谢！
10,请问李总，公司认为中小商业银行在发展中未来三年所面临最大困难和痛点有哪些？ 公司有规划或实现哪些针对性  的产品和服务 致力于解决他们的痛点？,您好！中小商业银行经过几年的发展，已经积累了一定的基础，抗风险能力增强，经营发展水平得到提高，其发展前景良好，但由于规模小，IT建设能力待提高，所以我们公司将创立并完善了一系列满足客户不同需求的解决方案和产品，去解决他们的痛点。
11,公司去年财务费用和管理费用怎样？同财务费用相比呢？今年有没有折旧？请问管理费用今年会能稳定吗？,您好！请您关注已披露的年报数据，有上年同期对比数据，谢谢！
12,请问截至到目前公司的营销有没有什么新进展，有看点吗？,您好，公司今年已经从2016年开始调整市场营销模式，从单一的区域销售模式，调整为区域销售加产品销售的网状销售模式。取得了很好的效果。并且，从2017年开始，公司将强化市场营销活动，树立公司在国内与国际两个领域的品牌形象。谢谢！
13,请问公司明年净利润能做到多少？,您好！公司的经营目标是实现持续盈利，请持续关注。谢谢！
14,请问李总：由于公司的主要客户是中小商业银行，作为他们的服务商，公司认为在未来三年，这些中小商业银行相  比较于国有大型商行，主要的发展机会、更有利的发展方向在哪里？他们有多大的发展空间？大致预估一下未来三年可  成长的数量级？,您好，我们认为中小商业银行的出路在于他们服务的特定群体的需求的发掘。比如中小企业，比如地方性的金融业务。还有就是发挥船小好调头的优点，及时调整业务模式，控制金融风险，为地方发展贡献力量。对于中小商业银行的未来发展，还需要再看，无法进行评估。谢谢！
15,请问具体联系证券代表的电话是多少？,0755-86168118-828
16,请问李总：由于公司的主要客户是中小商业银行，作为他们的服务商，公司认为在未来三年，这些中小商业银行相  比较于国有大型商行，主要的发展机会、更有利的发展方向在哪里？他们有多大的发展空间？大致预估一下未来三年可  成长的数量级？,您好，我们认为中小商业银行的出路在于他们服务的特定群体的需求的发掘。比如中小企业，比如地方性的金融业务。还有就是发挥船小好调头的优点，及时调整业务模式，控制金融风险，为地方发展贡献力量。对于中小商业银行的未来发展，还需要再看，无法进行评估。谢谢！
17,投资者担心的心情更多，请问贵公司对此怎样给予更好的鼓励，加油,您好！谢谢您的鼓励，我们会继续努力，对未来也充满了信心！谢谢！
18,请问公司股票上市时期价格多少，现在多少，还具有投资价值吗？,您好！公司IPO的发行价格是20元，目前的复权价格约100元。股票价格的变化体现了投资者对公司投资价值的客观判断。
19,请问李总，公司认为中小商业银行在发展中未来三年所面临最大困难和痛点有哪些？ 公司有规划或实现哪些针对性  的产品和服务 致力于解决他们的痛点？,中小商业银行经过几年的发展，已经积累了一定的基础，抗风险能力增强，经营发展水平得到提高，其发展前景良好，但由于规模小，IT建设能力待提高，所以我们公司将创立并完善了一系列满足客户不同需求的解决方案和产品，去解决他们的痛点。
20,我对贵公司是长期投资的，请问预计今年上半年会盈利多少？,您好！公司尚未发布盈利预测，敬请关注公司的定期报告。
21,请问公司今年是否有对外扩张的打算？在环渤海地区是否有意向？今年公司在市场开拓方面有什么计划？能否详细谈谈？谢谢,您好，公司一直在对外扩张，包括业务领域的扩展，客户数量的增长，以及海外客户的开拓。公司在环渤海地区已经有很多客户，并一直保存紧密合作。相信随着环渤海地区的快速腾飞，公司的相关业务也能取得较大进展。目前公司已经在北京建立了北方运营中心。谢谢!
22,公司领导怎么看现在公司的股价，对我们这些看好公司的小散有什么忠告。谢谢,您好！温馨提示：投资有风险，入市需谨慎。
23,"请问董事长,关于公司最新项目今年或以后有什么战略规划吗,如果有今年能进展到什么程度?",您好！公司最新项目将按照原项目规划进度开展实施。谢谢！
24,您认为目前公司面临的最大问题是什么？,您好，我们认为，国内快速增长的金融信息化需求与公司有限的满足客户需求的能力的矛盾是我们面临的最大问题。公司在不断丰富产品类型，提高实施效率，以满足客户的多样化需求。谢谢！
25,董事长，您好！作为股民，我支持公司尽量在不扩大股本的情况下做大做强！,您好，多谢您对公司的支持与关注。谢谢！
26,公司目前面临的最大问题是什么？,您好，我们认为，国内快速增长的金融信息化需求与公司有限的满足客户需求的能力的矛盾是我们面临的最大问题。公司在不断丰富产品类型，提高实施效率，以满足客户的多样化需求。谢谢！
27,公司历次新增产能均能及时消化，公司一直保持了较高的产能利用率与产销率   这是过去，将来还会是这样吗？,您好！将来还会更好！非常感谢您一如既往的关注与支持！
28,公司有没有股权激励计划？,有。
29,在做项目之前是否对项目进行严谨的可行性研究？,您好，公司的研发项目与投资项目均经过严格的可行性论证，经过多个部门与专业机构的评估以后，才进行实施的。谢谢！
30,请问公司目前产能多少？,您好！公司目前的产能尚未完全释放，未来增长情况我司较为乐观。谢谢！
31,公司现在负债总额是多少？每年负债的利息是多少？谢谢。,负债总额3.35亿元，每年负债利息在500万元左右
32,对公司未来有前景吗？,您好，公司股东、管理层以及公司员工都看好公司的未来发展，相信经过大家的共同努力，一定会有一个美好的未来。谢谢！
33,请问李总：公司的多数高管，包括您本人都是来自于各个不同的公司，有着不同的背景与经历，公司在这种人才组  合下相互的合作与认同有没有遇到过一些困难？ 公司如何保证 骨干团队的良好协作？,您好！公司管理层一直保持稳定，不存在协作方面的困难，请投资者放心。
34,公司新项目何时能对公司贡献利润？预计每年可实现净利润多少？,您好！公司新项目在达成后将尽快投入市场，对公司所贡献的利润，按目前的市场前景来预测较好，每年实现的净利润请您后期持续关注，谢谢！
35,公司对新疆、内蒙、宁夏等西部同行竞争对手怎样的考量？你们的成本、管理、市场等优势体现在哪些方面？,您好，对于竞争对手，我们的策略是一样的，尊重对手，在客户那里展示我们的技术与产品实力。我们非常重视西部地区客户的开拓，在新疆、内蒙古等地区已经有大型的银行客户。我们认为，我们的优势是拥有领先的金融信息化解决方案与技术实施团队，能够给客户带来市场价值，增加客户的竞争能力。谢谢！
36,请问今年的营销额，公司给的任务是多少？去年的有没有完成？,您好！公司2016年较好的完成了工作任务，目前没有进行2017年的相关盈利预测。
37,截至目前公司的同比销售额有增长吗？,您好，根据公司2017年第一季度报告的相关数据显示，公司营业收入同比增加52.39%。谢谢！
38,请问李总： 公司的很多客户都是中小银行，公司认为 相比较于 大型银行，他们的抗风险能力如何？ 目前，国家一  行三会总是在强调防止金融风险，坚守风险底线， 请问这对公司有什么潜在的影响？,您好！大型银行的风险防控能力一般会强于小型银行，监管层重视金融风险控制是好事，对金融业的长期稳定发展有益。商业银行自身也是重视风险控制的，在监管的引导下也会加强自身的IT建设，对公司而言就是潜在市场。
39,请问公司以后每年都会用现金分红的形式回馈股东吗？,您好，我们会根据公司章程以及中国证券监管机构的相关要求实施年度利润分配的方案。谢谢！
40,请问净利润的增长率和销售收入增长同步吗？,基本同步
41,请问李总： 公司有不少净利的情况下，经营活动现金净流入为负值，主要的原因点在哪里？,主要是人员增加且人力成本上升导致薪酬福利增加较多引起的
42,请问李总：无形资产 不做摊提，那如何确保后期价值？ 无形资产 资产化后，为股东在未来可带来的回报预期大致  成多少比例？,您好！1、无形资产有按规定摊销，在资产负债表里是以摊销后的净值填列的。2、无形资产主要是申请了著作权的研发项目，是公司未来三到五年的核心产品，为股东未来带来的回报是可观的。谢谢！
43,请问李总：公司目前在各个主要领域内的竞争对手都有哪些？ 公司相比较于他们 最主要的 优势 以及服务范围 是  什么？,您好！金融信息化领域是一个充分竞争的市场，竞争对手包括IBM、orcle、tata等国际知名厂商。相比竞争对手而言，我们在国内市场生根发展了15年，能深刻理解本土客户的需求，并自主开发了一系列适应客户需求的综合解决方案。我们是极少数能向商业银行提供全方位解决方案的中国厂商。
44,一季度业绩怎么样？有没有机构来调查？,您好，从目前公告的信息来看，公司2017年第一季度的营业收入增长较快，但由于成本增长较快等原因，我们的净利润增长情况并不好，相信后面会有所改观。目前已经有一些机构预约调研。谢谢！
45,将来公司下属会有上市公司吗?,您好，您说的这个问题很复杂，也需要经过一个过程，目前尚不能给与肯定或者否定的答复。我们希望我们的事业能够越做越大。谢谢！
46,公司每次投资项目的可行性报告是否有详细说明公告？,您好，公司的重要投资项目都有可行性研究报告，特别是募投项目，有详细的财务分析数据。请查阅相关公告。谢谢！
