,Question,Answer
0,周末了，再不出点实质性的利好，大家都将失去信心！请管理层拿出魄力来！！,"您好！
感谢您对公司的关心！
"
1,"比如说 到目前为止 预计今年的业绩是多少？ 大股东从现在开始有何增持计划？下半年有否并购标的 或者至少有没有方向了？
官腔回答只会被大家反感和笑话 我都怀疑是否董事长出席了","您好！
公司已经披露了制定的全年经营目标，我们有信心完成。董事长会在既定期限内履行增持承诺。公司参加业绩说明会的四位嘉宾都已到现场。
谢谢！"
2,董事长，请问您对完成17年全年利润8.6亿有信心吗？上半年按预告最多才3.5亿，对此您怎么看？,您好！我们对实现全年的经营目标充满信心，谢谢！ 
3,还有最后几分钟，董事长出来给大家一点信心吧！！　同行龙盛天天涨，你们心里爽吗？　股价是公司未来和管理层能力、魅力和决心的体现！,您好！我们对实现全年的经营目标充满信心，谢谢！
4,"说明会即将结束 公司高层能不能说出一些能提振投资者信心的话语来 或者是有个期望或者展望的也好的 
今年的业绩 大股东的增持 外延式并购 回答的都是之前我们看到过的公告内容 
那大家的询问还有什么意义？",您好！公司会严格按照上市公司信息披露的规范要求履行信息披露义务，目前没有应披露而未披露的信息。谢谢！
5,你好，我是闰土股份的投资者，还想买入一些，最近股票表现不好，我觉得长期来看有价值，想一直持有，请问你们怎么看？,"您好！
感谢您对公司价值的认可。公司在二级市场的股价受多种因素的影响。
股市有风险，请您谨慎投资！
"
6,请问财务周总：为何预告的上半年业绩仅增３０%以内？上半年已差不多快过去了，会向上修改业绩吗？　　若上半仅增30%，是远低于大家的预期哦！！！　二季的增幅相比一季，完全不值一提哦！请完整回答！,您好，若2017年上半年公司业绩有修正，公司会及时披露！
7,老总们：整场说明会，你们都说了些什么哦，没有半点料！太失望！！完全没有料也没行动或实际措施，这个会还有什么意思？？？　　其它公司说明会都能爆出让大家期待或看好的，有些公司高管的愿景，大家都为之点赞甚至在媒体报道 其管理层有远光，重发展！,您好！谢谢您对公司的关心！
8,染料价格与公司盈利能力密切相关，请问公司战略发展部对染料价格未来走势如何研判，价格波动时公司采取哪些措施规避价格波动风险对业绩的影响。,"您好！
染料产品价格受多种因素的影响，涨跌都正常。一般来说，市场供求关系决定了产品价格。
谢谢！"
9,董事长：总是说适时并购，切入医药或新材料，＂适时＂是什么概念？　上半年有没希望？　马上并购的是医药行业的公司？,您好！公司将秉着稳健发展的原则，以谨慎的姿态寻找合适的标的，不是为了并购而并购。谢谢！
10,董事长是增持了137万股 随即又卖出了2万股 造成交易违规 这样6个月内就不买不卖了 等于无法完成之前的增持总股本2%的计划了吧,您好！公司董事长阮静波女士会履行相关承诺，将根据市场情况，在未来9个月内（2017 年2月10日起算），以本人名义在二级市场增持本公司股份，累计增持比例不超过本公司总股本的2%，并承诺累积增持量不少于200万股。谢谢！
11,请问财务周总：既然刚才都说今年上半年大增，为何预告的上半年业绩仅增３０%以内？会马上向上修改业绩吗？　　何时能回能２０１４年净利１２亿的水平？,你好，2017年第一季度，公司实现归属于上市公司股东的净利润同比增长175.49%，同比大幅增加；预计2017年上半年归属于上市公司股东的净利润3亿元-3.5亿元，变动幅度为同比增长13.63%-32.56%。
12,增持说最少200万股，现在已增持了137万了，也就意味着可能未来仅增６０几万股了，公司７亿的股本哦！　能不能像其它公司的董事长大气或直接一点？？　如：有些公司直接公告：未来三个月，或未来一个月，将增持多少万股或增持不少于1%，２%等,"您好！
公司已经公告，阮静波女士将根据市场情况，拟在未来9个月内（2017 年2月10日起算），以本人名义在二级市场增持本公司股份，累计增持比例不超过本公司总股本的2%，并承诺累积增持量不少于200万股。谢谢！"
13,请问董事长，独董：请不要总是打着官腔或绕开话题！股票天天跌，公司近期会有哪些值得大家期待的地方或将采取哪些措施？？　总是说＂经营正常，会努力＂，这些话没有半点意义，大家来提问总希望有些点收获或明白管理层的决心和能力！,"您好！
公司控股股东、董事长阮静波女士2017年2月10日通过深圳证券交易所集中竞价交易系统以16.49元/股的平均价格增持了本公司无限售条件股份1,372,018股，是真金白银拟买入的。在未来9个月内（2017 年2月10日起算），拟以本人名义在二级市场增持本公司股份累计增持比例不超过本公司总股本的2%，并承诺累积增持量不少于200万股（含本数）（包含本次增持数量）。这些都是实打实的动作。
谢谢！"
14,请问贵公司董事长以外的其他高管是否有计划在当前价位增持以稳定股价？公司股价从2015年高位下来以后一直萎靡不振，公司如何看待回馈投资者，如何看待董秘办的市值管理工作？,"您好！
基于对公司未来持续稳定发展的信心，公司控股股东阮静波女士于2017年2月10日通过深圳证券交易所集中竞价交易系统增持了本公司无限售条件股份1,372,018股，占本公司总股本的0.18。阮静波女士将根据市场情况，拟在未来9个月内（2017 年2月10日起算），以本人名义在二级市场增持本公司股份，累计增持比例不超过本公司总股本的2%，并承诺累积增持量不少于200万股（含本数）（包含本次增持数量）。
其他高管目前暂无增持计划。
公司十分重视对投资者的合理回报，在业绩增长的同时，公司每年均通过现金分红实现对股东投资的回报。
谢谢！
"
15,虽然说公司的股价由二级市场决定，但股价是公司经营的一个表象，请问管理层对回报投资者持有怎样的态度？,您好！公司将继续做好主业，适时进行外延式发展，努力实现更好的业绩来回报投资者。谢谢！
16,已经5月过半 今年是否能实现年初8.6亿的盈利目标？看半年报预告最好也就3.5亿啊,你好，公司经营情况一切正常，与去年同期相比有较大的增长，公司将加强管理，拓展市场，开发新产品，努力完成经营目标。
17,公司对同行竞争对手有怎样的考量？你们的成本、管理、市场等优势体现在哪些方面？,您好！公司主要优势有品牌优势、规模化优势和市场渠道优势、产业链完整优势、科技研发优势、循环经济优势。我们将不断发挥长处，弥补短处，努力使公司不断发展壮大。具体内容可参考公司2016年年度报告。谢谢！
18,公司目前有哪些在建项目？建设进度如何？还需要多少资金？,您好，请您关注公司2016年度报告相关章节。
19,公司高管今年有无减持、增持计划？,"您好！基于对公司未来持续稳定发展的信心，公司控股股东、董事长阮静波女士已于2017年2月10日通过深圳证券交易所集中竞价交易系统以16.49元/股的平均价格增持了本公司无限售条件股份1,372,018股，占本公司总股本的0.18%。阮静波女士将根据市场情况，拟在未来9个月内（2017 年2月10日起算），以本人名义在二级市场增持本公司股份，累计增持比例不超过本公司总股本的2%，并承诺累积增持量不少于200万股（含本数）（包含本次增持数量），同时承诺在后续增持计划实施期间及法定期限内不减持或转让所持有的本公司股份。谢谢！"
20,江苏远征对今年的业绩能有多大的提升,你好，收购江苏远征，整合公司上下游的产业链，会对公司今后业绩的提升带来积极的影响。
21,公司有何措施管理市值，今年公司业绩能否保持增长？幅度有多少？,"您好！我们更多的是专注主业，竭尽全力把我们的产品和市场做好，保证闰土股份的企业价值稳步提升，努力实现公司股东价值的最大化，回报投资者对我们的支持。
2017年，公司制订的经营目标为：2017年实现营业总收入不低于50亿元，营业利润不低于8.6亿元。(上述经营计划并不代表公司对2017年度的盈利预测，能否实现取决于市场状况变化、经营团队的努力程度等多种因素，存在很大的不确定性，请投资者特别注意）。"
22,贵公司是否会考虑实施股票期权等规范股权激励方式，惠及更多员工？,"您好！
公司目前暂未考虑股票期权等激励方式，未来不排除。
谢谢！"
23,目前公司享有的国家优惠政策有哪些？,你好，公司属于国家高新技术企业，享受国家税收优惠政策。
24,公司募集资金投向项目进展如何，是否顺利?预计多久可以收回投资?,您好！募投资金使用情况具体请参看企业2016年年报。谢谢！
25,公司领导怎么看现在公司的股价，对我们小散有什么忠告？谢谢,您好！股票二级市场有其自身的规律，我们无法对股民给予任何承诺。但是我们保证：公司会把全部精力集中到主业上，不断提高管理水平和运营效率，严格控制经营风险，夯实公司基本面。努力实现更好的业绩来回报股东的支持。谢谢！
26,请问公司股票上市时期价格多少，现在多少，还具有投资价值吗？,"您好！
公司有信心不断增强公司的盈利能力，同时股价除了受公司基本面影响外，还受资本市场大环境影响。股票市场是一个开放的市场，希望投资者能提高风险意识，谨慎运作资本。感谢您对公司的关注！"
27,业绩不错，股价为啥老是下跌，公司有何管理措施,您好！股票二级市场有其自身的规律，我们无法对股民给予任何承诺。但是我们保证：公司会把全部精力集中到主业上，不断提高管理水平和运营效率，严格控制经营风险，夯实公司基本面。努力实现更好的业绩来回报股东的支持。谢谢！
28,最近二级市场天天跌，今天大盘大涨了， 公司还是跌！ 你们不重视吗？ 同行业的其它公司都是上涨（龙盛连涨多日了），连跌多日都不重视，大家都认为你们这是能力不行或完全不作为，你们怎么考虑的或接下来会怎么做？ 要实际一点回答，会马上采取什么措施？？,您好！股票二级市场有其自身的规律，我们无法对股民给予任何承诺。但是我们保证：公司会把全部精力集中到主业上，不断提高管理水平和运营效率，严格控制经营风险，夯实公司基本面。努力实现更好的业绩来回报股东的支持。谢谢！
29,公司股票天天跌，今天大盘大涨了， 公司还是跌！ 你们不重视吗？ 同行业的其它公司都是上涨（龙盛连涨多日了），连跌多日都不重视，大家都认为你们这是能力不行或完全不作为，你们怎么考虑的或接下来会怎么做？ 要实际一点回答，会马上采取什么措施？？,您好！股票二级市场有其自身的规律，我们无法对股民给予任何承诺。但是我们保证：公司会把全部精力集中到主业上，不断提高管理水平和运营效率，严格控制经营风险，夯实公司基本面。努力实现更好的业绩来回报股东的支持。谢谢！
30,"请问董事长,关于公司最新项目进展如何？达到预期了吗？","您好！
项目进展情况，请您关注公司后续的信息披露。
谢谢您的关心！"
31,"江苏远征截至2017年1月31日止，其合并报表总资产为47,974.60万元，负债为31,133.76万元，净资产为16,840.84万元，截止2017年1月31日，营业收入为27,45.15万元，净利润为848.94万元。上述内容是贵公司在互动易平台上回答投资者的问题，请问2017年1季度，江苏远征的营业收入和净利润分别为多少？其主要产品是什么",您好！江苏远征主要生产分散染料中间体，该公司2017年一季度经营正常。谢谢！
32,公司是否具备长期投资的价值？你是怎么看的？ 如果有机会，你会增持吗？,您好！公司发展稳健，公司会继续做好主业，夯实公司基本面，努力实现更好的业绩回报投资者。谢谢！
33,请问具体联系证券代表的电话是多少？,你好，联系电话0575-82519278，谢谢！
34,近几年的固定资产，技术改造的投资效果如何，是否达到了预期的目标，不考虑市场因素，简单考虑毛利情况是否合理呀。,你好，公司近几年来一直致力于项目投资和项目技改，投产项目基本达到预期目标。
35,请问公司以后每年会用什么形式回馈股东？,您好！公司现阶段执行的现金分红政策一直是持续的、一贯的本着重视投资者合理投资回报兼顾公司可持续发展的原则，并考虑公司发展所处阶段、经营状况、盈利规模、项目投资资金需求，而制定持续、稳定、科学的分配政策；并通过采取现金分红、资本公积转增股本方式分配股利，给予投资者合理的投资回报，为投资者提供分享经济增长的机会，使投资者形成了稳定的回报预期。谢谢！
36,公司未来3年发展前景如何?,"您好！公司在完善产业链的同时，一方面加大科技创新和研发投入，进行新产品的研发及老产品的技改，另一方面加大环保技改和环保投入，改进生产工艺，提高染料整体装备水平和自动化控制水平，继续巩固公司的综合竞争力，确保公司的稳健发展。
考虑到公司充足的现金流和较低的资产负债率，依托并购母基金平台，及时把握机遇，积极寻找有投资前景、成长性好的项目，重点关注化工新材料、医药医疗健康和环保产业领域。谢谢！
"
37,公司的负债比率有多少？,你好，公司2016年的资产负债率为17.1%。
38,请问公司今年是否有对外扩张的打算？今年公司在市场开拓方面有什么计划？能否详细谈谈？谢谢,您好！公司将继续做精做强染料及染料中间体主业，适时外延式扩张发展。市场拓展方面，公司将全方位做好内销和外销市场拓展，并根据生产优势，以市场为中心，坚持实施“以销定产、产销结合”的策略，防止库存产品积压。谢谢！
39,能否请董事长结合公司今年正在发展的电子平台或其他业务，谈谈对未来闰土商业模式的构想？,"您好！公司继续完善完善产业链，做强做精主业，巩固公司的综合竞争力，确保公司的稳健发展。
考虑到公司充足的现金流和较低的资产负债率，依托并购母基金平台，及时把握机遇，积极寻找有投资前景、成长性好的项目，给公司创造效益。
谢谢！"
40,2017年已过去5个月 有无并购的标的和计划？在染料价格大幅上涨一季报业绩增幅150%以上的前提下 股价跌去20%是否正常？,您好！公司已经设立了并购母基金，将继续做好投资方面的工作。二级市场有其自身的运行规律，公司将继续做好主业，夯实公司基本面，努力实现更好的业绩来回报投资者。谢谢！
41,公司是否在考虑开拓新的领域？取得初步进展没有？,您好！公司将继续做精做强染料及染料中间体主业，同时拓展化工新材料领域，适时外延式扩张发展。
42,请站在独立董事的角度 评价一下这家公司。您的专业态度对我很重要！,你好，谢谢信任！闰土股份一直专注于染料主业的发展，始终保持着行业龙头之一的地位；公司董事会及管理层勤勉尽职，保持着良好的公司治理架构，运作规范。谢谢！
43,将来公司的下属公司会有上市的打算吗?,你好，暂时没有子公司上市的打算。
44,作为一家上市公司，为了更有利于与投资者交流，能不能在公司网站上设置交流互动功能？,您好！公司注重与投资者沟通交流，开通了投资者电话专线、专用电子信箱，认真接受各种咨询，公司将积极采纳与接受投资者的宝贵意见和建议。公司还通过网上交流会、互动易、接待投资者来访等方式，加强与投资者的沟通。谢谢！
45,请问公司目前是否有拟并购公司的标的池,你好，公司暂时没有。
46,公司股价连续下跌23日 是否公司经营出现了什么问题？比同行业浙江龙盛跌的幅度大比整体大盘跌的幅度也深,您好！公司生产经营一切正常，股票二级市场有其自身的规律，公司会继续发展主业，不断提高管理水平和运营效率，严格控制经营风险，夯实公司基本面。努力实现更好的业绩来回报股东的支持。谢谢！
47,最近公司财务状况如何？,你好，公司目前财务状况很好，请详见公司公告。
48,新三板的扩容，带来了新的投资机会，你们公司在这方面有什么打算吗？,你好，如果有合适的标的，公司会考虑。
49,请描述一下公司未来的发展前景，谢谢！,"您好！2017年，公司在完善产业链的同时，一方面加大科技创新和研发投入，进行新产品的研发及老产品的技改，淘汰重污染高能耗的产品，另一方面加大环保技改和环保投入，改进生产工艺，提高染料整体装备水平和自动化控制水平，做好环保“减量化、资源化、无害化”工作，实现绿色安全的生产目标，继续巩固公司的综合竞争力，确保公司的稳健发展。
销售方面，认清趋势，全方位做好内销和外销市场拓展。根据生产优势，以市场为中心，坚持实施“以销定产、产销结合”的策略，防止库存产品增加、积压。
考虑到公司充足的现金流和较低的资产负债率，依托并购母基金平台，及时把握机遇，积极寻找有投资前景、成长性好的项目，重点关注化工新材料、医药医疗健康和环保产业领域。谢谢！
"
50,请问染料业务方面，与浙江龙盛相比，公司的优劣势在哪里,您好！公司将继续做精做强染料及染料中间体主业，适时外延式扩张发展。谢谢！
51,请问独立董事，您的履职情况如何，是否能真正保护了中小股东利益？,你好，本人严格按照独立董事相关法律法律和履职声明履行独立董事职责，勤勉尽职，将在保护中小股东利益方面发挥应有的作用。谢谢！
52,业绩说明会本来应该是恳谈会，将企业目前的处境，面临的困难，预计的风险和相应应措施清晰告诉股东。,你好，公司目前经营一切正常，生产经营中会遇到很多问题，公司有能力有办法及时解决。
53,公司现在负债总额是多少？每年负债的利息是多少？谢谢。,你好，公司2016年负债总额为13.4亿，具体数据请参考2016年财务报告。
54,公司每次投资项目的可行性报告是否有详细说明公告？,您好！公司对外投资一般根据交易所法律法规相关要求进行信息披露。谢谢！
55,请问公司目前产能多少？,"您好！2016年公司染料年总产能在16万吨以上，其中分散染料产能11万吨，活性染
料产能4万吨，其他染料1万吨。谢谢！
"
56,请问不考虑房地产及其他非染料业务，相比浙江龙盛，公司的优劣势在哪里,你好，公司目前强调以主业为主，在上下游发展，把主营业务做大做强，目前不会考虑房地产业务。
57,近一年来，贵公司高管考虑增持吗？,"您好！基于对公司未来持续稳定发展的信心，公司控股股东、董事长阮静波女士已于2017年2月10日通过深圳证券交易所集中竞价交易系统以16.49元/股的平均价格增持了本公司无限售条件股份1,372,018股，占本公司总股本的0.18%。阮静波女士将根据市场情况，拟在未来9个月内（2017 年2月10日起算），以本人名义在二级市场增持本公司股份，累计增持比例不超过本公司总股本的2%，并承诺累积增持量不少于200万股（含本数）（包含本次增持数量），同时承诺在后续增持计划实施期间及法定期限内不减持或转让所持有的本公司股份。谢谢！"
58,现在行业间的并购都比较频繁，你们今年有没有兼并收购计划？,你好，如果有对公司发展有利的标的，公司会基于考虑。
59,请问公司有无通过发行公司债券等形式进行募资的计划？有无设立并购基金收购标的的计划？,你好，目前暂无债券融资计划，公司已经设立了并购母基金，后期会推动相关工作，暂无收购标的计划。
