,Question,Answer
0,请问高总，2017年大数据行业在全国范围都得到了快速的发展，是什么原因导致飞利信当年的大数据业务增长却非常缓慢？2018年有无大数据业务的发展规划和发展目标？谢谢,"您好。
公司除了发展大数据自身业务，同时在大数据、人工智能等前沿技术驱动下支撑智能会议、智慧城市、在线教育业务的创新发展。
2018年，大数据/人工智能主要在视频分析、数据资产管理、大数据分析三个已有技术积累、占有一定市场份额的三个细分方向展开。"
1,每年投入研发方面的费用大概是多少？,您好，感谢关注。近两年，公司研发投入金额均在1亿元以上，详见公司2017年年报。
2,公司属于电子政务板块的龙头股吗？,"您好！谢谢您的提问和对我们的关注。
公司一直是电子政务板块的龙头企业，在公司以大数据为核心技术的战略支撑和提升下，我们在电子政务版块的竞争力会更加强劲。特别是在政府大数据的治理和实际场景的应用方面（如溯源，信用平台建设和运营）
再次表示对您的感谢"
3,请问杨总，飞利信过去几年的成长性良好，一定程度上得益于收购公司的业绩贡献。2018年收购标的的业绩对赌已经结束。从去年和今年前4个月的订单和运作情况分析，2018年哪些公司将维持增长？哪些公司存在业绩下降或亏损的风险？谢谢。,"您好。自18年开始，所有标的公司的对赌期已经结束，完全纳入飞利信的管理体系，飞利信集团管理制度更好的贯穿执行到下属公司，上下一盘棋，降低内部沟通成本，齐心协力谋发展。
我们对公司2018年及未来的发展充满信心。"
4,目前产能利用率情况如何？,公司工厂生产的自产品利用率95%以上。
5,请问高总，公司曾表示要做中国的Palantir以及中国大数据领域的领头羊，不知公司目前已经具备了哪些达成这个目标所必须的基础？公司是否具有成为Palantir的基因和外部环境？谢谢,"您好！谢谢您的关注和提问。
公司主要在数据服务能力的数据治理、数据源使用权获得和资源整合能力、跨行业数据关联建模能力和工业互联网底层通信协议等方面打下了良好的基础，并且在金融数据服务、对知名互联网平台的数据服务和政务大数据服务能力（例如溯源等）有重大的收获和突破。外部环境来讲公司有良好的客户基础和服务能力，有丰富的合作资源和资源关联能力；从内部来看，公司有研发团队千余人，而且在持续增大对研发的投入，持续聚焦前沿科技。所以我认为公司是拥有实现的良好的内外环境的。再次表示对您的感谢。"
6,请问杨总，对上市公司以后的市值目标有何想法或者规划？谢谢,"您好。感谢关注。做大做强是公司自身的发展目标，也是公司对广大投资者的承诺。
公司将继续围绕主营业务深耕细作，加强与市场的积极沟通和投资者关系管理。我们对公司未来发展很有信心，也相信市场会肯定飞利信的价值。"
7,请问杨总，您如何看待市场给予飞利信的关注程度和估值水平？2018年您本人和公司其他高管在改善投资者关系方面是否有具体的计划或目标？,"您好。感谢关注。公司自上市以来保持业绩的持续增长，以更好的成绩回报广大投资者。
公司将继续围绕主营业务做大加强，同时积极应对市场需求，加强投资者沟通，处理好投资者关系，也相信市场能够看到飞利信的价值。"
8,公司在互联网教育这块发展如何，搜索最近的新闻都是2015年的了，是不是没动静了？,"您好。互联网业务板块在公司整个体系中体量较小，但是自身发展属于增长的状态。2017年，公司互联网教育业务营业收入同比增长36%。
互联网教育属于远程教育行业。远程教育行业发展成熟，市场潜力大，是一个长青行业。公司核心产品和技术均为自主研发，具有完全的自主知识产权，是行业技术应用的领导者。产品无论从性能还是价格方面均具有很强的竞争优势。"
9,公司相关技术是否有输出国外，业务主要集中在国内还是？,您好。目前公司的业务主要集中在国内。
10,智慧城市、智能会议、大数据和互联网教育四大业务版块，这四大板块业务是否已经实现了打通，还是每个板块各自为战？,您好。公司以大数据、人工智能等前沿技术为驱动，支撑公司大数据、智能会议、智慧城市、互联网教育等业务的发展。大数据业务除了实现内生增长，还助力其他三大板块业务实现创新发展。目前，各板块已经实现了积极联动。
11,公司是否涉足芯片的制造和研发？公司使用芯片吗？,公司是芯片研发，目前芯片处于流片阶段，后续会进行进一步部署。
12,国家大力推行无纸化办公，这是否会对公司业绩有增长帮助？,您好。公司属于智能会议上市第一股，智能会议业务属于公司稳健发展的业务。随着公司的发展壮大，公司的业务目前已经遍及大数据、智慧城市、互联网教育，公司同时属于国家高新技术企业，在推动国家无纸化进程中起到积极推进作用。
13,我国增加军费开支对公司经营影响几何？,您好。我司正在积极参与军民融合业务。国家增加军费开支或对公司业务发展产生一定积极影响。
14,公司目前拥有多少项发明专利？,您好。截止2018年一季度末公司及下属全资公司累计获得发明专利40余项。
15,在海南、雄安这些地区是否有业务布局?,"您好。公司以大数据、人工智能等前沿技术为支撑，大力发展大数据业务，同时支撑智能会议、智慧城市、互联网教育业务的创新发展。
公司早在海口设立有分公司，在海南也开展了相关的项目。雄安属于千年大计，公司无论从智能会议、智慧城市、大数据、互联网教育方面均能在雄安建设中发挥到作用，公司也会积极关注雄安发展政策和项目情况，积极投身雄安建设中。"
16,一直不太理解智慧城市这一概念，公司在智慧城市领域的主要盈利方式是？,"智慧城市是随着城镇化加速发展和部分城市“城市病”等问题的出现而衍生出的概念，继智能城市、数字城市发展而来，公司逐步由智慧城市向新型智慧城市过渡，目前盈利方式是以政府购买服务的形式为主。
"
17,公司在进行大数据业务的时候，如何保障隐私安全？,您好。飞利信提供自主创新的数据安全加密防护系统，保护用户的数据隐私安全。
18,大数据最近也是热门话题，公司的经营大数据业务，那么大数据的数据来源主要是？,您好。公司的数据源：政务及行业数据、运营商数据、视频数据等。主要以运营商数据为核心，在与运营商合作的过程中及在对互联网行业服务的过程中产生新的数据。
19,公司现在四大板块的进展如何，是齐头并进还是有所侧重？,公司目前以大数据、人工智能等前沿技术作为公司长期发展战略的核心，并以此为支撑促进智能会议、智慧城市和互联网教育的创新发展。
20,今年以来参加了哪些展会？,公司及下属公司自2018年以来参加第五届GIO企业家年度峰会、第二届中国城市综合管廊规划建设与管理大会、首届数字中国建设成果展览会等。
21,现在除了这四大板块，还有没有继续进军其他板块的意向？,自2015年公司一直在做物联网及工业制造应用相关方面的 业务，目前这些业务根据其特征分别归属到大数据和智慧城市分类中。未来是否独立为业务版块，会根据规模、需求发展情况再行确定。
22,请问至4月末，股东户数多少？？谢谢,截止4月末，公司股票的持有人数为55690（合并普通账户和融资融券信用账户）。
23,海外市场拓展情况如何？,在一带一路相关国家进行商贸知识的学习。
24,在线教育领域最近厮杀激烈，公司的发展优势是？,公司具备在线教育的品牌优势。
25,中美贸易摩擦对公司经营影响几何？,无影响
26,请问飞利信公司的军用芯片到那一步了？,  流片过程中，因需要等MPW其他厂家及磨片，样片完成需要在七月初。
