,Question,Answer
0,您觉得鼎汉技术目前经营存在哪些短板？,您好，感谢关注！随着公司规模的不断扩大，尤其是并购了大量的企业，我们认识到集团内部整合能力，协同效应方面需要提高。在国际化战略上，我们刚刚起步，还需要时间去探索和积累经验。目前公司面临快速扩张后的整合转型期，相信我们通过一两年的努力，一定能克服眼前的困难，迎来再一次的快速发展。谢谢！
1,公司如何在激烈的行业竞争中突围，有哪些举措？,您好，感谢关注！我国轨道交通行业正处于快速发展、产业升级、全球化扩张的时期。公司一直以来聚焦轨道交通领域，以“打造轨道交通行业最值得信赖的国际一流企业”为愿景，以“地面到车辆”“增量到存量”“走向国际化”为战略发展方向，专注于轨道交通地面、车辆高端装备和信息化、智能化装备的研发、生产、销售、服务，以及为客户提供定制化配套与综合解决方案。公司将紧抓行业发展与变革机遇，以技术为根基，以用户需求为创新源动力，继续推进产品与解决方案面向智能化、信息化、网络化的创新应用升级；加大后服务市场与智能运维的投入；对新技术、新产品进行吸收、引进、消化与再创新，面向国际市场构筑更卓越综合技术服务能力；同时，优化公司产品与组织结构，实现产品间集群协同效应，提升公司的综合竞争力。 谢谢！
2,随着国家“一带一路”战略的深入布局，公司除了在轨道交通上游供应的方式参与其中，海外业务的开拓还会有其他方式吗？,"您好，谢谢您的关注。海外业务的布局，是我们公司最近推出“走向国际化”的重要战略方向。大体战略布局分三方面：一是通过收购德国SMA RT，获得国际上先进的技术，并本土化推向中国轨道交通市场。二是在国外建立一个市场平台并利用现有的SMA RT 的市场平台，将集团多元化的产品推向国际市场，包括一带一路沿线国家，均可以推广包括SMA RT 产品在内的集团所有产品。三是通过SMA RT做为欧洲的平台进一步了解欧洲轨道交通市场，发掘新技术和前沿科技，接触更多合作或并购机会，促进公司国际化的战略发展。谢谢！
"
3,公司会否进一步参与智能技术的升级进程来提升生产制造效率？目前取得了什么突破？,"您好，感谢关注！公司的生产制造采用先进的管理理念，以打造敏捷、高效、经济、灵活的供应链为愿景，推行精益生产，应用S&OP流程工具和ERP系统等IT工具，倡导和追求零缺陷管理与持续改进的质量文化。2017年，公司选定传统自研类电源产品组合作为标杆项目，在鼎汉技术本部通过精益推行和S&OP的落地实施，在运营管理水平上进步显著，比如：交付方面，及时齐套交付率大幅度提升，2017年同比2016年提升7.6%，而相比2015年来说，则提升了50%以上；生产效率方面，2016年提升33%，2017年同比上年再次提升12% ；生产基地的直接作业人员人均生产产值2017年同比上年提升32%。库存方面，公司采用了基于需求的拉动生产模式，制定并严格实施系统化的库存管理制度，使得产成品库存大幅度下降；同时通过不断缩短制造周期，提升模块化、标准化设计方式，半成品和原材料库存也持续改善。2017年库存周转率同比提升38%。谢谢！
"
4,2017年扣非后净利润较少，这是什么原因？,"您好，感谢您的关注！
2017年公司的扣非后净利润较少，一方面是由于公司规模扩大导致费用增长；另一方面是受行业投产新线里程持续下降、动车招标采购数量波动影响，公司产品收入结构发生变化，毛利较高产品在整体收入中占比降低，导致毛利率降低。
截止2017年末，公司在手待执行订单20.56亿，创历史新高。未来随着行业周期回暖、公司新产品的持续拓展、现有产品布局的协同效应以及公司国际化战略的持续推进，同时公司内部管理效率不断优化、成本费用进一步有效控制，公司盈利水平将得到改善和提升。
"
5,请介绍下公司海外业务的战略布局。,您好，谢谢您的关注。海外业务的布局，是我们公司最近推出“走向国际化”的重要战略方向。大体战略布局分三方面：一是通过收购德国SMA RT，获得国际上先进的技术，并本土化推向中国轨道交通市场。二是在国外建立一个市场平台并利用现有的SMA RT 的市场平台，将集团多元化的产品推向国际市场，比如同国际知名的车辆厂西门子，庞巴迪，阿尔斯通等建立合作关系。三是通过SMA RT做为欧洲的平台进一步了解欧洲轨道交通市场，发掘新技术和前沿科技，接触更多合作或并购机会，促进公司国际化的战略发展。谢谢！
6,对于未来的发展，公司是否会有进一步收购扩张的战略？,您好，感谢关注！“内生+外延”是公司的主要战略发展方式，因此外延式发展一直是公司持续关注的，公司对符合公司发展战略方向、与公司实现跨界整合具有协同效应、在产品细分领域排名前三的优质企业都会持续关注。谢谢！
7,请介绍下德国公司SMA RT目前的经营情况，今年的经营形势是怎样一个局面。,"您好，感谢您的关注！
SMA RT是全球领先的轨道交通中频辅助电源供应商，拥有超过30年的行业经验，其核心客户包括阿尔斯通、庞巴迪、西门子、德铁、西班牙CAF等。2017年，SMA RT 营业收入12,360.10万元，净利润-3,322.73万元，亏损主要原因是过渡整合期的开支及主机厂项目延期导致部分订单延期交付。
2018年，鼎汉集团国内外研发人员将携手，共同为中国市场定制开发轻量化中频技术辅助电源产品，实现产品的本地化落地与产业化应用；通过销售、供应链与售后服务的协同更灵活地服务于不同地域的客户群体。通过以上努力，公司将努力争取在2018年实现SMA RT获得盈利及实现经营性净现金流转正。谢谢！"
8,公司股价长期低迷，请介绍一下公司管理层或实控人在未来增持公司股份或回购股份的可能性。,您好，感谢关注！公司实控人和管理层不排除未来增持公司股份或回购股份的可能，未来会结合财务情况和二级市场情况综合考虑。如有会按照相关规定进行公告，请您关注公司公告。谢谢！
9,公司如何应对行业投产新线里程持续下降、动车组招标减少的风险？,您好，感谢关注！一方面，公司将进一步围绕战略发展目标，在内生与外延式发展方面双轨发力，加速公司从地面到车辆、从增量到存量、走向国际化的战略布局，促进公司市场空间进一步打开，更好的促进公司未来跨界和可持续发展；另一方面，轨道交通行业本身可细分为：由全国各地区政府分别投资的地铁、轻轨、有轨电车等城轨市场，铁路总公司投资的客专（高铁）市场、普通铁路市场以及地方铁路建设市场。由于固定资产投资计划归属不同，城轨市场建设与国家铁路建设相互独立，关联影响不大，公司已在城轨、铁路两个独立的市场同步拓展，并已形成订单量、收入来源均衡分布的局面。因此，公司总体业务构成均衡，城市轨道交通的发展可以一定程度上减小对国家铁路投产新线里程下降，动车组招标减少的周期性波动影响。谢谢！
10,公司在轨道交通设备业务有哪些主要的竞争对手？,您好，感谢关注！轨道交通行业由多种不同的专业技术领域和应用细分领域交叉组成，每个领域又由电力电子、机械、计算机软件、信息通信技术等较多的技术单元构成；行业内大部分产品是轨道交通行业专用产品，每个产品市场的空间相对细分，因此存在众多的企业和细分领域。公司不同产品虽然都属于轨道交通行业，但由于业务领域和专业领域不同，存在不同的竞争对手，发展至今，公司产品已覆盖轨道交通车辆、电务、工务、供电、运营等专业领域，成为全球轨道交通综合解决方案提供商。谢谢！
11,在技术创新上，公司的想法是什么，今年预计可以取得哪些技术新成果？,您好，谢谢您的关注！在技术创新上，公司始终高度重视，公司的想法是实现每一个产品在行业里都是技术领先者。因此，我们在研发投入上每年都是不遗余力，我们每年大约销售收入的10%用于研发投入。今年，我们预计会推出研发新成果包括：新型信号电源，动车机车空调，中频轻量化地铁城轨车辆电源等。谢谢！
12,主要业务区域上，公司未来的开发重点在哪里？,"您好，感谢您的关注！公司目前业务主要集中在轨道交通地面电气装备解决方案、信息化与安全检测解决方案、车辆电气装备解决方案、售后维修及运营维护解决方案等四大核心业务。对应的，未来开发的重点也将集中在地面和车辆高端装备、轨道交通信息化、智能化、智能检测、智慧交通等领域，同时在售后业务、运维业务等方面积极寻找机会。谢谢！
"
13,请介绍公司轨道交通业务产品布局情况？,您好，感谢您的关注！作为轨道交通行业跨专业领域最为全面的民营上市企业，公司积极跟随行业变革趋势，充分利用平台优势，紧跟前沿技术，不断突破创新，通过“内生+外延”并驱发展方式，产品布局由轨道交通车辆设备和轨道交通地面设备两大类（八大细分业务板块）全面升级为轨道交通地面电气装备解决方案、信息化与安全检测解决方案、车辆电气装备解决方案、售后维修及运营维护解决方案等四大核心业务。谢谢！
14,公司在核心技术自主方面目前的情况是什么样的？是否仍然存在部分技术或上游产品受制于国外供应商的情况？,您好，感谢您的关注！公司目前涉及产品的核心技术均为自主知识产权，并申请了相关专利。公司的供应商不存在技术或产品受限制情况，每种产品的上游供应商均有备份，不会存在受制于单一供应商或技术的情况。谢谢！
15,公司对于自身业绩的连续两年下降并出现亏损的局面是否有出台新的规划来扭转颓势？,您好，谢谢关注！业绩这两年的下滑主要两方面原因，一是产品结构的销量变化导致整体毛利下滑，二是最近几年集中并购的企业处在内部整合期费用有所上升。针对目前的现状我们的确做了规划来扭转下滑的局面，主要从三个方面做了规划：一是成立了集团市场部七个分公司，重点突破新产品和保证高毛利产品的销售，确保销售收入完成预算目标。二是全流程降低成本，从研发，采购，供应链等全力挖掘潜力，提高毛利率。三是控制销售费用，严控人头数量提高人均效率，同时成立集团回款小组，降低财务费用和坏账计提等。相信通过这三方面的持续改善，我们一定能扭转局面。谢谢！
16,能否简要介绍一下本轮中美贸易摩擦中公司是否收到影响？,"你好，感谢你的关注。
公司2017年度海外市场业务占比约10.91%，暂时并没有在美国开展销售。本轮中美贸易摩擦不会对我公司业务产生影响。"
17,公司在轨交装备行业内如今处于何种竞争地位？能否简要讲述一下近年的行业竞争格局对公司业绩造成的影响？,"您好，感谢您的关注！
公司依托十余年在轨道交通领域的耕耘，不断创新与实践，探索出符合行业发展趋势、有利于公司稳定可持续发展的战略之路，目前已初步完成了支撑公司3-5年安全健康发展的中短期业务布局，产品和解决方案广泛深入到轨道交通车辆、电务、工务、供电、运营等各专业业务领域，即可以提供单项设备交付，也能够规划整体系统集成，横向覆盖装备市场及信息化领域，纵向贯通新建线路和既有线路，有效保障公司在行业周期性波动及变革中保持持续竞争能力。
公司是轨道交通地面电源市场的领导者，车辆高端装备主流供应商，新产品、新技术、新业务的积极创新者，并积极向最值得信赖的国际一流企业迈进。
目前公司各产品竞争格局相对稳定，竞争格局不会对公司业绩产生重大影响！
谢谢！"
18,请透露下今年至今共持有多少在手订单？其中多少为新增订单？,您好，感谢您对公司的关注！2018年一季度，公司一方面继续保持及提升即有市场占有率及竞争能力，另一方面重点发力新产品的市场突破，公司各业务子公司市场拓展团队持续发力，实现新接订单3.7亿元，较去年同期增加80.92%；截止2018年3月31日，公司合计待执行订单为20.54亿元，较去年同期增加46.82%。谢谢！
19,收购SMA RT公司之后，公司将如何整合两家的技术和业务优势？,您好，感谢关注！公司一方面是引入国际先进技术进行国产化，将其技术和产品应用到中国市场；另一方面会在业务方面实现国际国内的渠道、、项目、客户的共享，促进业务发展；其次在研发、生产、内部管理等方面进行协同，相互促进，提升基础能力和核心竞争力。谢谢！
